"","X","CAD.CDW.ID","CAD.Event.Number","General.Offense.Number","Event.Clearance.Code","Event.Clearance.Description","Event.Clearance.SubGroup","Event.Clearance.Group","Event.Clearance.Date","Hundred.Block.Location","District.Sector","Zone.Beat","Census.Tract","Longitude","Latitude","Incident.Location","Initial.Type.Description","Initial.Type.Subgroup","Initial.Type.Group","At.Scene.Time","dist","clearance_date_ts","clearance_date_date"
"1",507,1658147,16000028360,201628360,"220","CRISIS COMPLAINT - GENERAL","CRISIS CALL","BEHAVIORAL HEALTH","01/24/2016 03:35:33 PM","NE 43 ST / UNIVERSITY WY NE","U","U2","5301.3008",-122.31317,47.659794,"(47.659794, -122.31317)","SUSPICIOUS STOP - OFFICER INITIATED ONVIEW","SUSPICIOUS CIRCUMSTANCES","SUSPICIOUS CIRCUMSTANCES","",503.925729388642,2016-01-24 15:35:33,2016-01-24
"2",1605,1658383,16000028612,201628612,"242","FIGHT DISTURBANCE","DISTURBANCES","DISTURBANCES","01/24/2016 10:37:10 PM","NE 43 ST / UNIVERSITY WY NE","U","U2","5301.3008",-122.31317,47.659794,"(47.659794, -122.31317)","ASLT - IP/JO - WITH OR W/O WPNS (NO SHOOTINGS)","ASSAULTS","ASSAULTS","01/24/2016 08:34:51 PM",503.925729388642,2016-01-24 22:37:10,2016-01-25
"3",2130,1660609,16000032489,201632489,"350","HAZARDS","HAZARDS","HAZARDS","01/28/2016 03:42:55 AM","NE CAMPUS PY / 12 AV NE","U","U2","5302.1002",-122.315575,47.656235,"(47.656235, -122.315575)","TRAFFIC - BO SIGNALS AND DOWN SIGNS","TRAFFIC RELATED CALLS","TRAFFIC RELATED CALLS","",457.100959844805,2016-01-28 03:42:55,2016-01-28
"4",2136,1658573,16000028964,201628964,"031","STRONG ARM ROBBERY","ROBBERY","ROBBERY","01/25/2016 09:12:29 AM","NE 50 ST / UNIVERSITY WY NE","U","U1","4400.4009",-122.31307,47.664898,"(47.664898, -122.31307)","PURSE SNATCH - IP/JO - ROBBERY","ROBBERY","ROBBERY","01/25/2016 08:05:20 AM",1025.0108407033,2016-01-25 09:12:29,2016-01-25
"5",3076,1658905,16000029429,201629429,"041","HARASSMENT, THREATS","THREATS, HARASSMENT","THREATS, HARASSMENT","01/25/2016 07:15:10 PM","14XX BLOCK OF NE 66 ST","U","U1","2600.3009",-122.31254,47.676514,"(47.676514, -122.31254)","THREATS (INCLS IN-PERSON/BY PHONE/IN WRITING)","THREATS, HARASSMENT","THREATS, HARASSMENT","01/25/2016 03:03:36 PM",2292.22446639512,2016-01-25 19:15:10,2016-01-26
"6",4430,1659341,16000030421,201630421,"220","CRISIS COMPLAINT - GENERAL","CRISIS CALL","BEHAVIORAL HEALTH","01/26/2016 12:20:16 PM","15 AV NE / NE 62 ST","U","U1","4400.2007",-122.31192,47.673977,"(47.673977, -122.31192)","SUSPICIOUS PERSON, VEHICLE OR INCIDENT","SUSPICIOUS CIRCUMSTANCES","SUSPICIOUS CIRCUMSTANCES","",2006.99848378529,2016-01-26 12:20:16,2016-01-26
"7",6941,1659896,16000031201,201631201,"220","CRISIS COMPLAINT - GENERAL","CRISIS CALL","BEHAVIORAL HEALTH","01/27/2016 04:49:24 AM","47XX BLOCK OF 12 AV NE","U","U2","5301.2004",-122.315254,47.664013,"(47.664013, -122.315254)","FRAUD - FORGERY,BUNCO, SCAMS, ID THEFT, ETC","FRAUD CALLS","FRAUD CALLS","01/27/2016 03:56:49 AM",990.218839131712,2016-01-27 04:49:24,2016-01-27
"8",7593,1660276,16000031949,201631949,"350","HAZARDS","HAZARDS","HAZARDS","01/27/2016 04:58:10 PM","ROOSEVELT WY NE / NE 70 ST","U","U1","3600.1012",-122.31741,47.679466,"(47.679466, -122.31741)","HAZ - POTENTIAL THRT TO PHYS SAFETY (NO HAZMAT)","HAZARDS","HAZARDS","01/27/2016 02:59:06 PM",2675.81894800423,2016-01-27 16:58:10,2016-01-28
"9",7735,1671298,16000050827,201650827,"220","CRISIS COMPLAINT - GENERAL","CRISIS CALL","BEHAVIORAL HEALTH","02/11/2016 10:12:35 PM","NE 47 ST / 16 AV NE","U","U2","5301.1005",-122.31083,47.663074,"(47.663074, -122.31083)","DOWN - CHECK FOR PERSON DOWN","PERSON DOWN/INJURY","CASUALTIES","02/11/2016 04:43:48 PM",792.832921032722,2016-02-11 22:12:35,2016-02-12
"10",7930,1660983,16000033189,201633189,"350","HAZARDS","HAZARDS","HAZARDS","01/28/2016 04:07:00 PM","MONTLAKE BV NE / NE PACIFIC ST","U","U3","5302.2018",-122.30459,47.648994,"(47.648994, -122.30459)","TRAFFIC - BO SIGNALS AND DOWN SIGNS","TRAFFIC RELATED CALLS","TRAFFIC RELATED CALLS","",861.874216742478,2016-01-28 16:07:00,2016-01-29
"11",7989,1661116,16000033511,201633511,"350","HAZARDS","HAZARDS","HAZARDS","01/28/2016 07:15:06 PM","42XX BLOCK OF UNIVERSITY WY NE","U","U2","5301.3008",-122.31319,47.659054,"(47.659054, -122.31319)","HAZ - POTENTIAL THRT TO PHYS SAFETY (NO HAZMAT)","HAZARDS","HAZARDS","01/28/2016 06:18:52 PM",438.325335850633,2016-01-28 19:15:06,2016-01-29
"12",8023,1661181,16000033695,201633695,"242","FIGHT DISTURBANCE","DISTURBANCES","DISTURBANCES","01/28/2016 09:05:18 PM","40 AV NE / NE 55 ST","U","U3","4200.2019",-122.28483,47.66851,"(47.66851, -122.28483)","FIGHT - VERBAL/ORAL (NO WEAPONS)","DISTURBANCES","DISTURBANCES","",2316.93866952268,2016-01-28 21:05:18,2016-01-29
"13",8335,1661749,16000034611,201634611,"350","HAZARDS","HAZARDS","HAZARDS","01/29/2016 03:22:21 PM","NE 72 ST / ROOSEVELT WY NE","U","U1","2600.2021",-122.317444,47.680862,"(47.680862, -122.317444)","HAZ - POTENTIAL THRT TO PHYS SAFETY (NO HAZMAT)","HAZARDS","HAZARDS","",2827.90435178432,2016-01-29 15:22:21,2016-01-29
"14",8732,1671521,16000051489,201651489,"242","FIGHT DISTURBANCE","DISTURBANCES","DISTURBANCES","02/12/2016 09:05:43 AM","45XX BLOCK OF UNIVERSITY WY NE","U","U2","5301.2010",-122.31312,47.66218,"(47.66218, -122.31312)","FIGHT - IP - PHYSICAL (NO WEAPONS)","DISTURBANCES","DISTURBANCES","",738.963514898043,2016-02-12 09:05:43,2016-02-12
"15",8743,1664225,16000038772,201638772,"220","CRISIS COMPLAINT - GENERAL","CRISIS CALL","BEHAVIORAL HEALTH","02/02/2016 06:42:56 AM","42XX BLOCK OF BROOKLYN AV NE","U","U2","5301.3007",-122.31435,47.65907,"(47.65907, -122.31435)","CRISIS - PERSON IN BEHAVIORAL/EMOTIONAL CRISIS","BEHAVIORAL HEALTH","CRISIS CALL","02/02/2016 05:52:35 AM",499.238589913424,2016-02-02 06:42:56,2016-02-02
"16",8881,1664619,16000038993,201638993,"041","HARASSMENT, THREATS","THREATS, HARASSMENT","THREATS, HARASSMENT","02/02/2016 07:03:09 PM","17XX BLOCK OF NE NAOMI PL","U","U1","4400.1007",-122.308754,47.674282,"(47.674282, -122.308754)","THREATS (INCLS IN-PERSON/BY PHONE/IN WRITING)","THREATS, HARASSMENT","THREATS, HARASSMENT","02/02/2016 11:55:37 AM",2033.43440582576,2016-02-02 19:03:09,2016-02-03
"17",8885,1664618,16000039344,201639344,"041","HARASSMENT, THREATS","THREATS, HARASSMENT","THREATS, HARASSMENT","02/02/2016 07:04:32 PM","73XX BLOCK OF SAND POINT WY NE","U","U3","4000.1027",-122.26365,47.680744,"(47.680744, -122.26365)","THREATS (INCLS IN-PERSON/BY PHONE/IN WRITING)","THREATS, HARASSMENT","THREATS, HARASSMENT","02/02/2016 04:21:57 PM",4407.49759113064,2016-02-02 19:04:32,2016-02-03
"18",9356,1665668,16000041454,201641454,"350","HAZARDS","HAZARDS","HAZARDS","02/04/2016 05:39:22 AM","ROOSEVELT WY NE / NE 56 ST","U","U1","4400.2027",-122.31737,47.669376,"(47.669376, -122.31737)","HAZ - POTENTIAL THRT TO PHYS SAFETY (NO HAZMAT)","HAZARDS","HAZARDS","",1600.36505920045,2016-02-04 05:39:22,2016-02-04
"19",9450,1665969,16000041904,201641904,"220","CRISIS COMPLAINT - GENERAL","CRISIS CALL","BEHAVIORAL HEALTH","02/04/2016 03:07:27 PM","73XX BLOCK OF 35 AV NE","U","U3","3800.1000",-122.29045,47.68214,"(47.68214, -122.29045)","CRISIS - PERSON IN BEHAVIORAL/EMOTIONAL CRISIS","BEHAVIORAL HEALTH","CRISIS CALL","",3239.39784239943,2016-02-04 15:07:27,2016-02-04
"20",9492,1665985,16000041913,201641913,"041","HARASSMENT, THREATS","THREATS, HARASSMENT","THREATS, HARASSMENT","02/04/2016 03:24:42 PM","6XX BLOCK OF NE 42 ST","U","U2","5200.1003",-122.321365,47.65752,"(47.65752, -122.321365)","ASLT - WITH OR W/O WEAPONS (NO SHOOTINGS)","ASSAULTS","ASSAULTS","02/04/2016 01:15:18 PM",907.167773933737,2016-02-04 15:24:42,2016-02-04
"21",9532,1671641,16000051747,201651747,"220","CRISIS COMPLAINT - GENERAL","CRISIS CALL","BEHAVIORAL HEALTH","02/12/2016 12:56:22 PM","13XX BLOCK OF NE 45 ST","U","U2","5301.3001",-122.313705,47.661274,"(47.661274, -122.313705)","CRISIS - PERSON IN BEHAVIORAL/EMOTIONAL CRISIS","BEHAVIORAL HEALTH","CRISIS CALL","",666.044174195878,2016-02-12 12:56:22,2016-02-12
"22",9580,1666173,16000041830,201641830,"041","HARASSMENT, THREATS","THREATS, HARASSMENT","THREATS, HARASSMENT","02/04/2016 07:21:52 PM","13XX BLOCK OF NE 43 ST","U","U2","5301.3001",-122.31374,47.6598,"(47.6598, -122.31374)","HARAS - NO BIAS, THREATS OR MALICIOUSNESS","THREATS, HARASSMENT","THREATS, HARASSMENT","02/04/2016 12:42:14 PM",529.098542862453,2016-02-04 19:21:52,2016-02-05
"23",9968,1669186,16000047446,201647446,"031","STRONG ARM ROBBERY","ROBBERY","ROBBERY","02/09/2016 02:12:34 AM","NE 47 ST / 16 AV NE","U","U2","5301.1005",-122.31083,47.663074,"(47.663074, -122.31083)","ROBBERY (INCLUDES STRONG ARM)","ROBBERY","ROBBERY","02/09/2016 01:23:39 AM",792.832921032722,2016-02-09 02:12:34,2016-02-09
"24",10015,1899133,16000452092,2016452092,"220","CRISIS COMPLAINT - GENERAL","CRISIS CALL","BEHAVIORAL HEALTH","12/17/2016 03:33:55 AM","NE 50 ST / ROOSEVELT WY NE","U","U1","5200.5000",-122.317406,47.664936,"(47.664936, -122.317406)","MOTOR VEHICLE COLLISION WITH INJURIES - PRIORITY 1","MOTOR VEHICLE COLLISION INVESTIGATION","TRAFFIC RELATED CALLS","",1157.48588512645,2016-12-17 03:33:55,2016-12-17
"25",10334,1669753,16000048516,201648516,"242","FIGHT DISTURBANCE","DISTURBANCES","DISTURBANCES","02/09/2016 08:24:26 PM","NE 47 ST / UNIVERSITY WY NE","U","U2","5301.2010",-122.3131,47.66309,"(47.66309, -122.3131)","FIGHT - IP - PHYSICAL (NO WEAPONS)","DISTURBANCES","DISTURBANCES","",833.383876029379,2016-02-09 20:24:26,2016-02-10
"26",10354,1669780,16000048500,201648500,"242","FIGHT DISTURBANCE","DISTURBANCES","DISTURBANCES","02/09/2016 08:59:35 PM","NE 47 ST / UNIVERSITY WY NE","U","U2","5301.2010",-122.3131,47.66309,"(47.66309, -122.3131)","FIGHT - IP - PHYSICAL (NO WEAPONS)","DISTURBANCES","DISTURBANCES","02/09/2016 07:54:20 PM",833.383876029379,2016-02-09 20:59:35,2016-02-10
"27",10586,1670017,16000048838,201648838,"220","CRISIS COMPLAINT - GENERAL","CRISIS CALL","BEHAVIORAL HEALTH","02/10/2016 08:36:05 AM","73XX BLOCK OF 35 AV NE","U","U3","3900.1004",-122.29045,47.68214,"(47.68214, -122.29045)","CRISIS - PERSON IN BEHAVIORAL/EMOTIONAL CRISIS","BEHAVIORAL HEALTH","CRISIS CALL","02/10/2016 06:44:52 AM",3239.39784239943,2016-02-10 08:36:05,2016-02-10
"28",10870,1670380,16000049667,201649667,"220","CRISIS COMPLAINT - GENERAL","CRISIS CALL","BEHAVIORAL HEALTH","02/10/2016 05:58:46 PM","47XX BLOCK OF 15 AV NE","U","U2","5301.2000",-122.31195,47.66399,"(47.66399, -122.31195)","SUSPICIOUS STOP - OFFICER INITIATED ONVIEW","SUSPICIOUS CIRCUMSTANCES","SUSPICIOUS CIRCUMSTANCES","",907.219216291856,2016-02-10 17:58:46,2016-02-11
"29",10894,1670422,16000049653,201649653,"030","ARMED ROBBERY","GUN CALLS","ROBBERY","02/10/2016 06:48:38 PM","47XX BLOCK OF UNIVERSITY WY NE","U","U2","5301.2001",-122.31309,47.663998,"(47.663998, -122.31309)","ROBBERY - IP/JO (INCLUDES STRONG ARM)","ROBBERY","ROBBERY","02/10/2016 05:38:53 PM",929.234922041086,2016-02-10 18:48:38,2016-02-11
"30",10938,1670483,16000049681,201649681,"220","CRISIS COMPLAINT - GENERAL","CRISIS CALL","BEHAVIORAL HEALTH","02/10/2016 08:12:38 PM","45XX BLOCK OF UNIVERSITY WY NE","U","U2","5301.2008",-122.31312,47.66218,"(47.66218, -122.31312)","SUSPICIOUS STOP - OFFICER INITIATED ONVIEW","SUSPICIOUS CIRCUMSTANCES","SUSPICIOUS CIRCUMSTANCES","02/10/2016 06:02:06 PM",738.963514898043,2016-02-10 20:12:38,2016-02-11
"31",11094,1670680,16000050046,201650046,"242","FIGHT DISTURBANCE","DISTURBANCES","DISTURBANCES","02/11/2016 02:53:28 AM","42XX BLOCK OF 7 AV NE","U","U2","5200.1003",-122.32084,47.65849,"(47.65849, -122.32084)","FIGHT - VERBAL/ORAL (NO WEAPONS)","DISTURBANCES","DISTURBANCES","",895.700131218965,2016-02-11 02:53:28,2016-02-11
"32",11702,1671986,16000052205,201652205,"220","CRISIS COMPLAINT - GENERAL","CRISIS CALL","BEHAVIORAL HEALTH","02/12/2016 07:42:39 PM","47XX BLOCK OF UNIVERSITY WY NE","U","U2","5301.2002",-122.31309,47.663998,"(47.663998, -122.31309)","PROPERTY - DAMAGE","PROPERTY DAMAGE","PROPERTY DAMAGE","02/12/2016 05:59:06 PM",929.234922041086,2016-02-12 19:42:39,2016-02-13
"33",11778,1672055,16000052348,201652348,"220","CRISIS COMPLAINT - GENERAL","CRISIS CALL","BEHAVIORAL HEALTH","02/12/2016 08:52:28 PM","43XX BLOCK OF ROOSEVELT WY NE","U","U2","5301.3004",-122.317726,47.66058,"(47.66058, -122.317726)","UNKNOWN - COMPLAINT OF UNKNOWN NATURE","SUSPICIOUS CIRCUMSTANCES","SUSPICIOUS CIRCUMSTANCES","02/12/2016 08:03:30 PM",800.699807898046,2016-02-12 20:52:28,2016-02-13
"34",11803,1672072,16000052371,201652371,"220","CRISIS COMPLAINT - GENERAL","CRISIS CALL","BEHAVIORAL HEALTH","02/12/2016 09:17:10 PM","14XX BLOCK OF NE 43 ST","U","U2","5301.3009",-122.3126,47.65979,"(47.65979, -122.3126)","CRISIS - PERSON IN BEHAVIORAL/EMOTIONAL CRISIS","BEHAVIORAL HEALTH","CRISIS CALL","",481.44763654886,2016-02-12 21:17:10,2016-02-13
"35",11854,1672133,16000052399,201652399,"220","CRISIS COMPLAINT - GENERAL","CRISIS CALL","BEHAVIORAL HEALTH","02/12/2016 10:57:10 PM","56XX BLOCK OF UNIVERSITY WY NE","U","U1","4400.2029",-122.31303,47.670216,"(47.670216, -122.31303)","DISTURBANCE, MISCELLANEOUS/OTHER","DISTURBANCES","DISTURBANCES","02/12/2016 09:11:24 PM",1602.67210487326,2016-02-12 22:57:10,2016-02-13
"36",11936,1672201,16000052572,201652572,"031","STRONG ARM ROBBERY","ROBBERY","ROBBERY","02/13/2016 12:32:05 AM","NE 47 ST / 15 AV NE","U","U2","5301.2011",-122.311966,47.663082,"(47.663082, -122.311966)","ROBBERY (INCLUDES STRONG ARM)","ROBBERY","ROBBERY","02/12/2016 11:50:12 PM",808.897329309375,2016-02-13 00:32:05,2016-02-13
"37",11992,1672251,16000052677,201652677,"220","CRISIS COMPLAINT - GENERAL","CRISIS CALL","BEHAVIORAL HEALTH","02/13/2016 02:07:40 AM","NE PACIFIC PL / NE PACIFIC ST","U","U2","5302.2019",-122.30762,47.65054,"(47.65054, -122.30762)","THEFT (DOES NOT INCLUDE SHOPLIFT OR SVCS)","OTHER PROPERTY","THEFT","",623.274785117061,2016-02-13 02:07:40,2016-02-13
"38",12208,1672514,16000053175,201653175,"220","CRISIS COMPLAINT - GENERAL","CRISIS CALL","BEHAVIORAL HEALTH","02/13/2016 01:39:47 PM","NE 56 ST / UNIVERSITY WY NE","U","U1","4400.2028",-122.31303,47.66944,"(47.66944, -122.31303)","CRISIS - PERSON IN BEHAVIORAL/EMOTIONAL CRISIS","BEHAVIORAL HEALTH","CRISIS CALL","",1517.64972687433,2016-02-13 13:39:47,2016-02-13
"39",12424,1672715,16000053431,201653431,"030","ARMED ROBBERY","GUN CALLS","ROBBERY","02/13/2016 08:14:20 PM","10XX BLOCK OF NE 65 ST","U","U1","4400.2003",-122.31651,47.675823,"(47.675823, -122.31651)","ROBBERY - IP/JO (INCLUDES STRONG ARM)","ROBBERY","ROBBERY","02/13/2016 05:59:22 PM",2266.0088898335,2016-02-13 20:14:20,2016-02-14
"40",12443,1672764,16000053388,201653388,"041","HARASSMENT, THREATS","THREATS, HARASSMENT","THREATS, HARASSMENT","02/13/2016 09:08:11 PM","47XX BLOCK OF 12 AV NE","U","U2","5301.2004",-122.315254,47.664013,"(47.664013, -122.315254)","THREATS (INCLS IN-PERSON/BY PHONE/IN WRITING)","THREATS, HARASSMENT","THREATS, HARASSMENT","02/13/2016 07:43:35 PM",990.218839131712,2016-02-13 21:08:11,2016-02-14
"41",12663,1672997,16000053977,201653977,"220","CRISIS COMPLAINT - GENERAL","CRISIS CALL","BEHAVIORAL HEALTH","02/14/2016 06:50:13 AM","40XX BLOCK OF 8 AV NE","U","U2","5200.2002",-122.31979,47.65669,"(47.65669, -122.31979)","UNKNOWN - COMPLAINT OF UNKNOWN NATURE","SUSPICIOUS CIRCUMSTANCES","SUSPICIOUS CIRCUMSTANCES","02/14/2016 05:19:14 AM",776.778419025715,2016-02-14 06:50:13,2016-02-14
"42",12925,1673331,16000054360,201654360,"041","HARASSMENT, THREATS","THREATS, HARASSMENT","THREATS, HARASSMENT","02/14/2016 07:15:30 PM","42XX BLOCK OF UNIVERSITY WY NE","U","U2","5301.3009",-122.31319,47.659054,"(47.659054, -122.31319)","THREATS (INCLS IN-PERSON/BY PHONE/IN WRITING)","THREATS, HARASSMENT","THREATS, HARASSMENT","02/14/2016 02:43:34 PM",438.325335850633,2016-02-14 19:15:30,2016-02-15
"43",13219,1673647,16000055031,201655031,"041","HARASSMENT, THREATS","THREATS, HARASSMENT","THREATS, HARASSMENT","02/15/2016 10:19:21 AM","52XX BLOCK OF 12 AV NE","U","U1","4400.4002",-122.3152,47.667503,"(47.667503, -122.3152)","HARAS - NO BIAS, THREATS OR MALICIOUSNESS","THREATS, HARASSMENT","THREATS, HARASSMENT","02/15/2016 08:52:58 AM",1348.7053255018,2016-02-15 10:19:21,2016-02-15
"44",13668,1674119,16000055838,201655838,"220","CRISIS COMPLAINT - GENERAL","CRISIS CALL","BEHAVIORAL HEALTH","02/16/2016 12:41:35 AM","47XX BLOCK OF BROOKLYN AV NE","U","U2","5301.2002",-122.314224,47.664005,"(47.664005, -122.314224)","CRISIS - PERSON IN BEHAVIORAL/EMOTIONAL CRISIS","BEHAVIORAL HEALTH","CRISIS CALL","",958.152960945758,2016-02-16 00:41:35,2016-02-16
"45",13970,1674633,16000056794,201656794,"350","HAZARDS","HAZARDS","HAZARDS","02/16/2016 06:34:56 PM","NE 50 ST / 15 AV NE","U","U1","4400.4009",-122.311935,47.66489,"(47.66489, -122.311935)","HAZ - POTENTIAL THRT TO PHYS SAFETY (NO HAZMAT)","HAZARDS","HAZARDS","",1005.20324732383,2016-02-16 18:34:56,2016-02-17
"46",14225,1674900,16000057066,201657066,"220","CRISIS COMPLAINT - GENERAL","CRISIS CALL","BEHAVIORAL HEALTH","02/17/2016 01:13:13 AM","15 AV NE / NE 47 ST","U","U2","5301.2011",-122.311966,47.663082,"(47.663082, -122.311966)","HAZ - POTENTIAL THRT TO PHYS SAFETY (NO HAZMAT)","HAZARDS","HAZARDS","02/16/2016 11:39:32 PM",808.897329309375,2016-02-17 01:13:13,2016-02-17
"47",14626,1675453,16000058069,201658069,"041","HARASSMENT, THREATS","THREATS, HARASSMENT","THREATS, HARASSMENT","02/17/2016 08:50:45 PM","45XX BLOCK OF UNIVERSITY WY NE","U","U2","5301.2009",-122.31312,47.66218,"(47.66218, -122.31312)","THREATS (INCLS IN-PERSON/BY PHONE/IN WRITING)","THREATS, HARASSMENT","THREATS, HARASSMENT","02/17/2016 07:57:56 PM",738.963514898043,2016-02-17 20:50:45,2016-02-18
"48",14661,1675529,16000058200,201658200,"041","HARASSMENT, THREATS","THREATS, HARASSMENT","THREATS, HARASSMENT","02/17/2016 11:02:26 PM","45XX BLOCK OF UNIVERSITY WY NE","U","U2","5301.2009",-122.31312,47.66218,"(47.66218, -122.31312)","THREATS (INCLS IN-PERSON/BY PHONE/IN WRITING)","THREATS, HARASSMENT","THREATS, HARASSMENT","02/17/2016 09:43:24 PM",738.963514898043,2016-02-17 23:02:26,2016-02-18
"49",15551,1676591,16000060065,201660065,"350","HAZARDS","HAZARDS","HAZARDS","02/19/2016 01:54:01 PM","NE 50 ST / ROOSEVELT WY NE","U","U1","5200.5000",-122.317406,47.664936,"(47.664936, -122.317406)","HAZ - POTENTIAL THRT TO PHYS SAFETY (NO HAZMAT)","HAZARDS","HAZARDS","",1157.48588512645,2016-02-19 13:54:01,2016-02-19
"50",15841,1676874,16000060596,201660596,"220","CRISIS COMPLAINT - GENERAL","CRISIS CALL","BEHAVIORAL HEALTH","02/19/2016 09:12:40 PM","43XX BLOCK OF UNIVERSITY WY NE","U","U2","5301.3000",-122.31315,47.660534,"(47.660534, -122.31315)","CRISIS - PERSON IN BEHAVIORAL/EMOTIONAL CRISIS","BEHAVIORAL HEALTH","CRISIS CALL","",573.843522369168,2016-02-19 21:12:40,2016-02-20
"51",15857,1676889,16000060572,201660572,"242","FIGHT DISTURBANCE","DISTURBANCES","DISTURBANCES","02/19/2016 09:32:11 PM","42XX BLOCK OF PASADENA PL NE","U","U2","5200.1003",-122.321884,47.657818,"(47.657818, -122.321884)","FIGHT - VERBAL/ORAL (NO WEAPONS)","DISTURBANCES","DISTURBANCES","",951.977836740862,2016-02-19 21:32:11,2016-02-20
"52",16198,1680104,16000066283,201666283,"220","CRISIS COMPLAINT - GENERAL","CRISIS CALL","BEHAVIORAL HEALTH","02/24/2016 12:35:30 PM","NE 45 ST / 19 AV NE","U","U1","5302.3013",-122.30725,47.661255,"(47.661255, -122.30725)","HAZ - POTENTIAL THRT TO PHYS SAFETY (NO HAZMAT)","HAZARDS","HAZARDS","",608.224197228362,2016-02-24 12:35:30,2016-02-24
"53",16213,1677714,16000062046,201662046,"350","HAZARDS","HAZARDS","HAZARDS","02/20/2016 11:26:29 PM","NE 60 ST / 50 AV NE","U","U3","4200.1005",-122.27379,47.67213,"(47.67213, -122.27379)","HAZ - POTENTIAL THRT TO PHYS SAFETY (NO HAZMAT)","HAZARDS","HAZARDS","",3226.46275942103,2016-02-20 23:26:29,2016-02-21
"54",16243,1832262,16000332158,2016332158,"220","CRISIS COMPLAINT - GENERAL","CRISIS CALL","BEHAVIORAL HEALTH","09/13/2016 05:32:18 PM","65XX BLOCK OF 62 AV NE","U","U3","4000.1014",-122.26124,47.676567,"(47.676567, -122.26124)","CRISIS - PERSON IN BEHAVIORAL/EMOTIONAL CRISIS","BEHAVIORAL HEALTH","CRISIS CALL","09/13/2016 12:54:23 PM",4285.63746585464,2016-09-13 17:32:18,2016-09-14
"55",16687,1678289,16000062632,201662632,"041","HARASSMENT, THREATS","THREATS, HARASSMENT","THREATS, HARASSMENT","02/21/2016 08:43:27 PM","42XX BLOCK OF UNIVERSITY WY NE","U","U2","5301.3009",-122.31319,47.659054,"(47.659054, -122.31319)","HARAS - NO BIAS, THREATS OR MALICIOUSNESS","THREATS, HARASSMENT","THREATS, HARASSMENT","02/21/2016 03:15:18 PM",438.325335850633,2016-02-21 20:43:27,2016-02-22
"56",16774,1678412,16000063085,201663085,"242","FIGHT DISTURBANCE","DISTURBANCES","DISTURBANCES","02/22/2016 01:06:43 AM","50XX BLOCK OF BROOKLYN AV NE","U","U1","4400.4007",-122.3142,47.665676,"(47.665676, -122.3142)","THREATS (INCLS IN-PERSON/BY PHONE/IN WRITING)","THREATS, HARASSMENT","THREATS, HARASSMENT","",1132.25729952174,2016-02-22 01:06:43,2016-02-22
"57",16796,1678434,16000063102,201663102,"041","HARASSMENT, THREATS","THREATS, HARASSMENT","THREATS, HARASSMENT","02/22/2016 02:10:04 AM","NE 63 ST / 8 AV NE","U","U1","3600.1025",-122.32006,47.674168,"(47.674168, -122.32006)","THREATS (INCLS IN-PERSON/BY PHONE/IN WRITING)","THREATS, HARASSMENT","THREATS, HARASSMENT","",2170.11639677716,2016-02-22 02:10:04,2016-02-22
"58",16841,1678500,16000063256,201663256,"350","HAZARDS","HAZARDS","HAZARDS","02/22/2016 08:12:43 AM","43XX BLOCK OF ROOSEVELT WY NE","U","U2","5200.5008",-122.31775,47.659653,"(47.659653, -122.31775)","HAZ - POTENTIAL THRT TO PHYS SAFETY (NO HAZMAT)","HAZARDS","HAZARDS","",740.954069962209,2016-02-22 08:12:43,2016-02-22
"59",16961,1679007,16000064209,201664209,"242","FIGHT DISTURBANCE","DISTURBANCES","DISTURBANCES","02/22/2016 09:58:51 PM","35XX BLOCK OF NE 52 ST","U","U3","4200.4024",-122.28962,47.666687,"(47.666687, -122.28962)","FIGHT - IP - PHYSICAL (NO WEAPONS)","DISTURBANCES","DISTURBANCES","",1908.30280422676,2016-02-22 21:58:51,2016-02-23
"60",17922,1679646,16000065056,201665056,"031","STRONG ARM ROBBERY","ROBBERY","ROBBERY","02/23/2016 07:20:16 PM","11 AV NE / NE 45 ST","U","U2","5301.2006",-122.31658,47.661293,"(47.661293, -122.31658)","ROBBERY (INCLUDES STRONG ARM)","ROBBERY","ROBBERY","02/23/2016 01:39:31 PM",793.197829416394,2016-02-23 19:20:16,2016-02-24
"61",18004,1681300,16000068301,201668301,"220","CRISIS COMPLAINT - GENERAL","CRISIS CALL","BEHAVIORAL HEALTH","02/26/2016 02:29:24 AM","22XX BLOCK OF NE 88 ST","U","U1","2100.3008",-122.305016,47.69211,"(47.69211, -122.305016)","CRISIS - PERSON IN BEHAVIORAL/EMOTIONAL CRISIS","BEHAVIORAL HEALTH","CRISIS CALL","02/26/2016 01:16:11 AM",4028.94904527722,2016-02-26 02:29:24,2016-02-26
"62",18055,1681231,16000068099,201668099,"041","HARASSMENT, THREATS","THREATS, HARASSMENT","THREATS, HARASSMENT","02/25/2016 11:05:37 PM","11XX BLOCK OF NE 42 ST","U","U2","5301.4003",-122.316086,47.658348,"(47.658348, -122.316086)","PROWLER - IP/JO","PROWLER","PROWLER","02/25/2016 08:33:25 PM",559.383223116979,2016-02-25 23:05:37,2016-02-26
"63",18114,1681697,16000068888,201668888,"220","CRISIS COMPLAINT - GENERAL","CRISIS CALL","BEHAVIORAL HEALTH","02/26/2016 03:57:35 PM","61XX BLOCK OF BROOKLYN AV NE","U","U1","4400.2008",-122.314255,47.672745,"(47.672745, -122.314255)","WEAPN - GUN,DEADLY WPN (NO THRTS/ASLT/DIST)","WEAPONS CALLS","WEAPONS CALLS","02/26/2016 12:44:20 PM",1895.71763445181,2016-02-26 15:57:35,2016-02-26
"64",18134,1682702,16000070757,201670757,"350","HAZARDS","HAZARDS","HAZARDS","02/27/2016 11:16:57 PM","40 AV NE / NE 70 ST","U","U3","3900.1013",-122.28501,47.679413,"(47.679413, -122.28501)","HAZ - POTENTIAL THRT TO PHYS SAFETY (NO HAZMAT)","HAZARDS","HAZARDS","",3187.3701434862,2016-02-27 23:16:57,2016-02-28
"65",18139,1681827,16000069132,201669132,"041","HARASSMENT, THREATS","THREATS, HARASSMENT","THREATS, HARASSMENT","02/26/2016 07:03:54 PM","55XX BLOCK OF RAVENNA AV NE","U","U1","4301.3012",-122.30385,47.66905,"(47.66905, -122.30385)","THREATS (INCLS IN-PERSON/BY PHONE/IN WRITING)","THREATS, HARASSMENT","THREATS, HARASSMENT","02/26/2016 04:47:26 PM",1511.73569592103,2016-02-26 19:03:54,2016-02-27
"66",18158,1682001,16000069598,201669598,"350","HAZARDS","HAZARDS","HAZARDS","02/26/2016 11:30:42 PM","ROOSEVELT WY NE / NE 70 ST","U","U1","3600.1012",-122.31741,47.679466,"(47.679466, -122.31741)","HAZ - POTENTIAL THRT TO PHYS SAFETY (NO HAZMAT)","HAZARDS","HAZARDS","",2675.81894800423,2016-02-26 23:30:42,2016-02-27
"67",18170,1681944,16000069277,201669277,"041","HARASSMENT, THREATS","THREATS, HARASSMENT","THREATS, HARASSMENT","02/26/2016 09:53:44 PM","42XX BLOCK OF 8 AV NE","U","U2","5200.2001",-122.319786,47.65849,"(47.65849, -122.319786)","PHONE - OBSCENE OR NUISANCE PHONE CALLS","THREATS, HARASSMENT","THREATS, HARASSMENT","",820.767156641322,2016-02-26 21:53:44,2016-02-27
"68",18276,1682672,16000070509,201670509,"031","STRONG ARM ROBBERY","ROBBERY","ROBBERY","02/27/2016 09:36:38 PM","NE 64 ST / 12 AV NE","U","U1","4400.2003",-122.31566,47.674976,"(47.674976, -122.31566)","ROBBERY (INCLUDES STRONG ARM)","ROBBERY","ROBBERY","02/27/2016 08:08:32 PM",2159.95554340267,2016-02-27 21:36:38,2016-02-28
"69",18372,1683250,16000071461,201671461,"350","HAZARDS","HAZARDS","HAZARDS","02/28/2016 04:07:45 PM","NE 67 ST / 8 AV NE","U","U1","3600.1013",-122.3201,47.677307,"(47.677307, -122.3201)","HAZ - POTENTIAL THRT TO PHYS SAFETY (NO HAZMAT)","HAZARDS","HAZARDS","02/28/2016 04:01:02 PM",2499.18492201223,2016-02-28 16:07:45,2016-02-29
"70",18431,1683291,16000071329,201671329,"041","HARASSMENT, THREATS","THREATS, HARASSMENT","THREATS, HARASSMENT","02/28/2016 08:06:22 PM","42XX BLOCK OF UNIVERSITY WY NE","U","U2","5301.3009",-122.31319,47.659054,"(47.659054, -122.31319)","HARAS - NO BIAS, THREATS OR MALICIOUSNESS","THREATS, HARASSMENT","THREATS, HARASSMENT","02/28/2016 07:31:21 PM",438.325335850633,2016-02-28 20:06:22,2016-02-29
"71",18497,1683815,16000072633,201672633,"350","HAZARDS","HAZARDS","HAZARDS","02/29/2016 04:34:26 PM","NE 66 ST / ROOSEVELT WY NE","U","U1","3600.1021",-122.317375,47.676556,"(47.676556, -122.317375)","HAZ - POTENTIAL THRT TO PHYS SAFETY (NO HAZMAT)","HAZARDS","HAZARDS","",2360.7848144977,2016-02-29 16:34:26,2016-03-01
"72",18500,1683886,16000072548,201672548,"220","CRISIS COMPLAINT - GENERAL","CRISIS CALL","BEHAVIORAL HEALTH","02/29/2016 06:23:51 PM","77XX BLOCK OF 30 AV NE","U","U3","2400.3017",-122.29597,47.68577,"(47.68577, -122.29597)","LEWD - (EXPOSING, FLASHING, URINATING IN PUB)","LEWD CONDUCT","SUSPICIOUS CIRCUMSTANCES","02/29/2016 03:25:00 PM",3462.3934166114,2016-02-29 18:23:51,2016-03-01
"73",18533,1684460,16000073597,201673597,"220","CRISIS COMPLAINT - GENERAL","CRISIS CALL","BEHAVIORAL HEALTH","03/01/2016 02:16:11 PM","11XX BLOCK OF NE 43 ST","U","U2","5301.3003",-122.31605,47.65983,"(47.65983, -122.31605)","CRISIS - PERSON IN BEHAVIORAL/EMOTIONAL CRISIS","BEHAVIORAL HEALTH","CRISIS CALL","03/01/2016 12:41:27 PM",650.704615297222,2016-03-01 14:16:11,2016-03-01
"74",18542,1684511,16000073633,201673633,"041","HARASSMENT, THREATS","THREATS, HARASSMENT","THREATS, HARASSMENT","03/01/2016 03:38:11 PM","53XX BLOCK OF RAVENNA PL NE","U","U1","4302.2001",-122.30247,47.6676,"(47.6676, -122.30247)","THREATS (INCLS IN-PERSON/BY PHONE/IN WRITING)","THREATS, HARASSMENT","THREATS, HARASSMENT","03/01/2016 01:59:45 PM",1393.63872333537,2016-03-01 15:38:11,2016-03-01
"75",18834,2015186,17000200855,2017200855,"220","CRISIS COMPLAINT - GENERAL","CRISIS CALL","BEHAVIORAL HEALTH","06/05/2017 05:13:23 PM","47XX BLOCK OF BROOKLYN AV NE","U","U2","5301.2003",-122.314224,47.664005,"(47.664005, -122.314224)","ASLT - WITH OR W/O WEAPONS (NO SHOOTINGS)","ASSAULTS","ASSAULTS","",958.152960945758,2017-06-05 17:13:23,2017-06-06
"76",18852,1685905,16000076144,201676144,"242","FIGHT DISTURBANCE","DISTURBANCES","DISTURBANCES","03/03/2016 12:02:17 PM","NE 55 ST / 36 AV NE","U","U3","4200.4025",-122.28908,47.66851,"(47.66851, -122.28908)","FIGHT - VERBAL/ORAL (NO WEAPONS)","DISTURBANCES","DISTURBANCES","",2070.52534593896,2016-03-03 12:02:17,2016-03-03
"77",18871,1686320,16000076961,201676961,"242","FIGHT DISTURBANCE","DISTURBANCES","DISTURBANCES","03/03/2016 10:55:52 PM","42XX BLOCK OF BROOKLYN AV NE","U","U2","5301.3008",-122.31435,47.65907,"(47.65907, -122.31435)","FIGHT - IP - PHYSICAL (NO WEAPONS)","DISTURBANCES","DISTURBANCES","",499.238589913424,2016-03-03 22:55:52,2016-03-04
"78",18873,1686349,16000076999,201676999,"242","FIGHT DISTURBANCE","DISTURBANCES","DISTURBANCES","03/03/2016 11:49:24 PM","42XX BLOCK OF UNIVERSITY WY NE","U","U2","5301.3008",-122.31319,47.659054,"(47.659054, -122.31319)","THREATS (INCLS IN-PERSON/BY PHONE/IN WRITING)","THREATS, HARASSMENT","THREATS, HARASSMENT","",438.325335850633,2016-03-03 23:49:24,2016-03-04
"79",19068,1686953,16000078073,201678073,"242","FIGHT DISTURBANCE","DISTURBANCES","DISTURBANCES","03/04/2016 07:49:57 PM","47XX BLOCK OF BROOKLYN AV NE","U","U2","5301.2002",-122.314224,47.664005,"(47.664005, -122.314224)","FIGHT - IP - PHYSICAL (NO WEAPONS)","DISTURBANCES","DISTURBANCES","",958.152960945758,2016-03-04 19:49:57,2016-03-05
"80",19109,2125717,17000402097,2017402097,"041","HARASSMENT, THREATS","THREATS, HARASSMENT","THREATS, HARASSMENT","10/29/2017 09:09:36 PM","47XX BLOCK OF 12 AV NE","U","U2","5301.2004",-122.315254,47.664013,"(47.664013, -122.315254)","THREATS (INCLS IN-PERSON/BY PHONE/IN WRITING)","THREATS, HARASSMENT","THREATS, HARASSMENT","10/29/2017 08:17:52 PM",990.218839131712,2017-10-29 21:09:36,2017-10-30
"81",19111,1805711,16000287214,2016287214,"350","HAZARDS","HAZARDS","HAZARDS","08/09/2016 05:29:05 PM","NE 47 ST / 12 AV NE","U","U2","5301.2008",-122.31526,47.663105,"(47.663105, -122.31526)","HAZ - IMMINENT THRT TO PHYS SAFETY (NO HAZ MAT)","HAZARDS","HAZARDS","",900.685209550702,2016-08-09 17:29:05,2016-08-10
"82",19153,1783631,16000248703,2016248703,"350","HAZARDS","HAZARDS","HAZARDS","07/11/2016 10:18:09 PM","21 AV NE / NE 50 ST","U","U1","4302.1004",-122.305565,47.66491,"(47.66491, -122.305565)","SHOTS - IP/JO - INCLUDES HEARD/NO ASSAULT","WEAPONS CALLS","GUN CALLS","",1033.80092040155,2016-07-11 22:18:09,2016-07-12
"83",19195,1832516,16000326156,2016326156,"031","STRONG ARM ROBBERY","ROBBERY","ROBBERY","09/08/2016 06:36:56 PM","47XX BLOCK OF BROOKLYN AV NE","U","U2","5301.2003",-122.31451,47.664776,"(47.664776, -122.31451)","ROBBERY - IP/JO (INCLUDES STRONG ARM)","ROBBERY","ROBBERY","09/08/2016 04:50:02 PM",1045.8018698156,2016-09-08 18:36:56,2016-09-09
"84",19204,1750328,16000191630,2016191630,"350","HAZARDS","HAZARDS","HAZARDS","05/31/2016 03:08:53 PM","SAND POINT WY NE / NE 45 ST","U","U3","4100.5019",-122.28722,47.66137,"(47.66137, -122.28722)","HAZ - POTENTIAL THRT TO PHYS SAFETY (NO HAZMAT)","HAZARDS","HAZARDS","",1776.90181166702,2016-05-31 15:08:53,2016-05-31
"85",20255,1783698,16000248610,2016248610,"350","HAZARDS","HAZARDS","HAZARDS","07/11/2016 11:32:50 PM","I5 NB / LAKE CITY WY NE","U","U1","3600.1003",-122.320625,47.68123,"(47.68123, -122.320625)","HAZ - POTENTIAL THRT TO PHYS SAFETY (NO HAZMAT)","HAZARDS","HAZARDS","",2926.95240640659,2016-07-11 23:32:50,2016-07-12
"86",20297,1691827,16000086427,201686427,"041","HARASSMENT, THREATS","THREATS, HARASSMENT","THREATS, HARASSMENT","03/11/2016 07:17:48 PM","NE 62 ST / BROOKLYN AV NE","U","U1","4400.2009",-122.31433,47.673332,"(47.673332, -122.31433)","MOTOR VEHICLE COLLISION, HIT AND RUN","MOTOR VEHICLE COLLISION INVESTIGATION","TRAFFIC RELATED CALLS","03/11/2016 05:57:31 PM",1960.88649387326,2016-03-11 19:17:48,2016-03-12
"87",20438,2088479,17000333507,2017333507,"031","STRONG ARM ROBBERY","ROBBERY","ROBBERY","09/07/2017 10:20:27 PM","26XX BLOCK OF NE UNIVERSITY VILLAGE ST","U","U3","4301.1014",-122.29841,47.663322,"(47.663322, -122.29841)","ROBBERY - IP/JO (INCLUDES STRONG ARM)","ROBBERY","ROBBERY","09/07/2017 06:42:38 PM",1164.76014484058,2017-09-07 22:20:27,2017-09-08
"88",20494,1979986,17000136348,2017136348,"350","HAZARDS","HAZARDS","HAZARDS","04/19/2017 11:24:16 AM","15 AV NE / NE 41 ST","U","U2","5301.4",-122.31211,47.65682,"(47.65682, -122.31211)","HAZ - POTENTIAL THRT TO PHYS SAFETY (NO HAZMAT)","HAZARDS","HAZARDS","04/19/2017 08:02:27 AM",216.222931905124,2017-04-19 11:24:16,2017-04-19
"89",20542,1865962,16000391728,2016391728,"041","HARASSMENT, THREATS","THREATS, HARASSMENT","THREATS, HARASSMENT","10/29/2016 12:03:30 PM","88XX BLOCK OF 23 AV NE","U","U1","2100.3007",-122.30446,47.692245,"(47.692245, -122.30446)","DISTURBANCE, MISCELLANEOUS/OTHER","DISTURBANCES","DISTURBANCES","10/29/2016 10:58:28 AM",4047.59700202509,2016-10-29 12:03:30,2016-10-29
"90",20927,1783701,16000248363,2016248363,"350","HAZARDS","HAZARDS","HAZARDS","07/11/2016 11:32:44 PM","NE 92 ST / 30 AV NE","U","U3","2100.1011",-122.29598,47.695683,"(47.695683, -122.29598)","WIRES DOWN (PHONE, ELECTRICAL,ETC.)","HAZARDS","HAZARDS","",4527.41324006499,2016-07-11 23:32:44,2016-07-12
"91",21108,1692935,16000088746,201688746,"350","HAZARDS","HAZARDS","HAZARDS","03/13/2016 02:13:52 PM","70XX BLOCK OF 19 AV NE","U","U1","2600.201",-122.30774,47.680347,"(47.680347, -122.30774)","WIRES DOWN (PHONE, ELECTRICAL,ETC.)","HAZARDS","HAZARDS","",2710.21876954714,2016-03-13 14:13:52,2016-03-13
"92",21140,2015267,17000201011,2017201011,"041","HARASSMENT, THREATS","THREATS, HARASSMENT","THREATS, HARASSMENT","06/05/2017 07:16:22 PM","48XX BLOCK OF SAND POINT WY NE","U","U3","4100.4008",-122.28316,47.66458,"(47.66458, -122.28316)","THREATS (INCLS IN-PERSON/BY PHONE/IN WRITING)","THREATS, HARASSMENT","THREATS, HARASSMENT","06/05/2017 05:57:34 PM",2196.47452707793,2017-06-05 19:16:22,2017-06-06
"93",21184,1693013,16000088832,201688832,"350","HAZARDS","HAZARDS","HAZARDS","03/13/2016 04:25:08 PM","MONTLAKE BR / SB","U","U3","5302.3057",-122.304596,47.647484,"(47.647484, -122.304596)","HAZ - POTENTIAL THRT TO PHYS SAFETY (NO HAZMAT)","HAZARDS","HAZARDS","",1015.99051207712,2016-03-13 16:25:08,2016-03-13
"94",21701,1991619,17000157841,2017157841,"220","CRISIS COMPLAINT - GENERAL","CRISIS CALL","BEHAVIORAL HEALTH","05/05/2017 10:15:53 PM","42XX BLOCK OF 7 AV NE","U","U2","5200.1003",-122.32084,47.65849,"(47.65849, -122.32084)","OVERDOSE - DRUG RELATED CASUALTY","PERSON DOWN/INJURY","CASUALTIES","05/05/2017 08:59:45 PM",895.700131218965,2017-05-05 22:15:53,2017-05-06
"95",21733,1693785,16000090241,201690241,"220","CRISIS COMPLAINT - GENERAL","CRISIS CALL","BEHAVIORAL HEALTH","03/14/2016 06:54:04 PM","NE 50 ST / UNIVERSITY WY NE","U","U1","4400.4009",-122.31307,47.664898,"(47.664898, -122.31307)","CRISIS - PERSON IN BEHAVIORAL/EMOTIONAL CRISIS","BEHAVIORAL HEALTH","CRISIS CALL","",1025.0108407033,2016-03-14 18:54:04,2016-03-15
"96",22716,1697294,16000096151,201696151,"220","CRISIS COMPLAINT - GENERAL","CRISIS CALL","BEHAVIORAL HEALTH","03/19/2016 11:35:15 AM","56XX BLOCK OF BROOKLYN AV NE","U","U1","4400.2020",-122.31416,47.670345,"(47.670345, -122.31416)","CRISIS - PERSON IN BEHAVIORAL/EMOTIONAL CRISIS","BEHAVIORAL HEALTH","CRISIS CALL","03/19/2016 09:21:41 AM",1632.88503740822,2016-03-19 11:35:15,2016-03-19
"97",22934,1728659,16000153102,2016153102,"041","HARASSMENT, THREATS","THREATS, HARASSMENT","THREATS, HARASSMENT","05/03/2016 06:08:54 PM","42XX BLOCK OF UNIVERSITY WY NE","U","U2","5301.3008",-122.31319,47.659054,"(47.659054, -122.31319)","THREATS (INCLS IN-PERSON/BY PHONE/IN WRITING)","THREATS, HARASSMENT","THREATS, HARASSMENT","05/03/2016 02:53:28 PM",438.325335850633,2016-05-03 18:08:54,2016-05-04
"98",23449,1783643,16000248511,2016248511,"220","CRISIS COMPLAINT - GENERAL","CRISIS CALL","BEHAVIORAL HEALTH","07/11/2016 10:19:16 PM","48XX BLOCK OF SAND POINT WY NE","U","U3","4100.4008",-122.28316,47.66458,"(47.66458, -122.28316)","DISTURBANCE, MISCELLANEOUS/OTHER","DISTURBANCES","DISTURBANCES","07/11/2016 07:46:33 PM",2196.47452707793,2016-07-11 22:19:16,2016-07-12
"99",23462,1728628,16000153384,2016153384,"220","CRISIS COMPLAINT - GENERAL","CRISIS CALL","BEHAVIORAL HEALTH","05/03/2016 04:37:36 PM","82XX BLOCK OF 22 PL NE","U","U1","2500.1006",-122.30365,47.689213,"(47.689213, -122.30365)","SUSPICIOUS PERSON, VEHICLE OR INCIDENT","SUSPICIOUS CIRCUMSTANCES","SUSPICIOUS CIRCUMSTANCES","05/03/2016 02:01:40 PM",3718.79248251363,2016-05-03 16:37:36,2016-05-03
"100",23698,1945693,17000071223,201771223,"220","CRISIS COMPLAINT - GENERAL","CRISIS CALL","BEHAVIORAL HEALTH","02/27/2017 04:46:01 PM","75XX BLOCK OF 39 AV NE","U","U3","2400.2009",-122.286285,47.683937,"(47.683937, -122.286285)","BURG - RES (INCL UNOCC STRUCTURES ON PROP)","BURGLARY","RESIDENTIAL BURGLARIES","02/27/2017 01:08:19 PM",3561.98610106541,2017-02-27 16:46:01,2017-02-28
"101",23936,1991736,17000158146,2017158146,"220","CRISIS COMPLAINT - GENERAL","CRISIS CALL","BEHAVIORAL HEALTH","05/06/2017 01:01:27 AM","42XX BLOCK OF 9 AV NE","U","U2","5200.2001",-122.318794,47.658485,"(47.658485, -122.318794)","CRISIS - PERSON IN BEHAVIORAL/EMOTIONAL CRISIS","BEHAVIORAL HEALTH","CRISIS CALL","",750.832793594975,2017-05-06 01:01:27,2017-05-06
"102",24755,2101279,17000357282,2017357282,"242","FIGHT DISTURBANCE","DISTURBANCES","DISTURBANCES","09/25/2017 03:57:12 PM","NE 48 ST / 8 AV NE","U","U2","5200.5001",-122.31955,47.664013,"(47.664013, -122.31955)","FIGHT - IP - PHYSICAL (NO WEAPONS)","DISTURBANCES","DISTURBANCES","",1167.73391900116,2017-09-25 15:57:12,2017-09-25
"103",24784,1704404,16000108684,2016108684,"242","FIGHT DISTURBANCE","DISTURBANCES","DISTURBANCES","03/29/2016 10:11:38 PM","42XX BLOCK OF 7 AV NE","U","U2","5200.1004",-122.32084,47.65849,"(47.65849, -122.32084)","FIGHT - VERBAL/ORAL (NO WEAPONS)","DISTURBANCES","DISTURBANCES","03/29/2016 10:00:12 PM",895.700131218965,2016-03-29 22:11:38,2016-03-30
"104",25402,2015399,17000201449,2017201449,"041","HARASSMENT, THREATS","THREATS, HARASSMENT","THREATS, HARASSMENT","06/05/2017 10:18:41 PM","32XX BLOCK OF NE 75 ST","U","U3","2400.302",-122.29317,47.68305,"(47.68305, -122.29317)","THREATS (INCLS IN-PERSON/BY PHONE/IN WRITING)","THREATS, HARASSMENT","THREATS, HARASSMENT","06/05/2017 08:45:06 PM",3247.96017926635,2017-06-05 22:18:41,2017-06-06
"105",25672,1760904,16000210153,2016210153,"220","CRISIS COMPLAINT - GENERAL","CRISIS CALL","BEHAVIORAL HEALTH","06/13/2016 05:03:10 PM","42XX BLOCK OF PASADENA PL NE","U","U2","5200.1003",-122.321884,47.657818,"(47.657818, -122.321884)","DISTURBANCE, MISCELLANEOUS/OTHER","DISTURBANCES","DISTURBANCES","06/13/2016 02:26:10 PM",951.977836740862,2016-06-13 17:03:10,2016-06-14
"106",25686,2003508,17000179653,2017179653,"220","CRISIS COMPLAINT - GENERAL","CRISIS CALL","BEHAVIORAL HEALTH","05/21/2017 11:18:48 PM","NE 50 ST / UNIVERSITY WY NE","U","U1","5301.2001",-122.31307,47.664898,"(47.664898, -122.31307)","CRISIS - PERSON IN BEHAVIORAL/EMOTIONAL CRISIS","BEHAVIORAL HEALTH","CRISIS CALL","05/21/2017 07:38:51 PM",1025.0108407033,2017-05-21 23:18:48,2017-05-22
"107",26155,1855062,16000372305,2016372305,"350","HAZARDS","HAZARDS","HAZARDS","10/14/2016 09:52:55 AM","NE RAVENNA BV / UNIVERSITY WY NE","U","U1","4400.2022",-122.313034,47.670986,"(47.670986, -122.313034)","HAZ - POTENTIAL THRT TO PHYS SAFETY (NO HAZMAT)","HAZARDS","HAZARDS","",1687.21043073578,2016-10-14 09:52:55,2016-10-14
"108",26259,1922580,17000027421,201727421,"350","HAZARDS","HAZARDS","HAZARDS","01/23/2017 12:47:14 PM","NE 75 ST / 55 AV NE","U","U3","4000.1019",-122.26902,47.68302,"(47.68302, -122.26902)","HAZ - POTENTIAL THRT TO PHYS SAFETY (NO HAZMAT)","HAZARDS","HAZARDS","",4274.01670826982,2017-01-23 12:47:14,2017-01-23
"109",26415,1956926,17000093625,201793625,"041","HARASSMENT, THREATS","THREATS, HARASSMENT","THREATS, HARASSMENT","03/16/2017 07:25:17 PM","55XX BLOCK OF 15 AV NE","U","U1","4400.2028",-122.31188,47.66899,"(47.66899, -122.31188)","THREATS (INCLS IN-PERSON/BY PHONE/IN WRITING)","THREATS, HARASSMENT","THREATS, HARASSMENT","03/16/2017 05:13:55 PM",1455.29804228053,2017-03-16 19:25:17,2017-03-17
"110",26495,1899406,16000452499,2016452499,"041","HARASSMENT, THREATS","THREATS, HARASSMENT","THREATS, HARASSMENT","12/17/2016 04:05:21 PM","45XX BLOCK OF 20 AV NE","U","U1","4302.1009",-122.306526,47.662167,"(47.662167, -122.306526)","HARAS - NO BIAS, THREATS OR MALICIOUSNESS","THREATS, HARASSMENT","THREATS, HARASSMENT","12/17/2016 12:48:07 PM",721.14351398363,2016-12-17 16:05:21,2016-12-18
"111",26956,1783817,16000248782,2016248782,"242","FIGHT DISTURBANCE","DISTURBANCES","DISTURBANCES","07/12/2016 03:15:30 AM","10XX BLOCK OF NE 64 ST","U","U1","4400.2003",-122.31651,47.67498,"(47.67498, -122.31651)","FIGHT - VERBAL/ORAL (NO WEAPONS)","DISTURBANCES","DISTURBANCES","07/12/2016 02:02:46 AM",2174.95580708281,2016-07-12 03:15:30,2016-07-12
"112",27127,1821874,16000313160,2016313160,"242","FIGHT DISTURBANCE","DISTURBANCES","DISTURBANCES","08/29/2016 07:57:12 PM","77XX BLOCK OF 25 AV NE","U","U3","2500.1015",-122.30083,47.685764,"(47.685764, -122.30083)","DISTURBANCE, MISCELLANEOUS/OTHER","DISTURBANCES","DISTURBANCES","",3372.7230615602,2016-08-29 19:57:12,2016-08-30
"113",27392,2076246,17000311584,2017311584,"242","FIGHT DISTURBANCE","DISTURBANCES","DISTURBANCES","08/23/2017 02:09:57 AM","43XX BLOCK OF UNIVERSITY WY NE","U","U2","5301.3",-122.31315,47.660534,"(47.660534, -122.31315)","FIGHT - IP - PHYSICAL (NO WEAPONS)","DISTURBANCES","DISTURBANCES","",573.843522369168,2017-08-23 02:09:57,2017-08-23
"114",27722,1794887,16000267801,2016267801,"350","HAZARDS","HAZARDS","HAZARDS","07/26/2016 05:29:39 PM","NE 50 ST / 17 AV NE","U","U1","4400.3009",-122.30948,47.664875,"(47.664875, -122.30948)","TRAFFIC - BO SIGNALS AND DOWN SIGNS","TRAFFIC RELATED CALLS","TRAFFIC RELATED CALLS","07/26/2016 01:45:10 PM",986.756602850085,2016-07-26 17:29:39,2016-07-27
"115",28293,1910913,17000005214,20175214,"350","HAZARDS","HAZARDS","HAZARDS","01/05/2017 09:37:35 AM","15 AV NE / NE 45 ST","U","U2","5301.2010",-122.312,47.66126,"(47.66126, -122.312)","TRAFFIC - BO SIGNALS AND DOWN SIGNS","TRAFFIC RELATED CALLS","TRAFFIC RELATED CALLS","",614.236940217108,2017-01-05 09:37:35,2017-01-05
"116",29005,1821868,16000313293,2016313293,"350","HAZARDS","HAZARDS","HAZARDS","08/29/2016 07:53:38 PM","NE 50 ST / ROOSEVELT WY NE","U","U1","5200.5000",-122.317406,47.664936,"(47.664936, -122.317406)","TRAFFIC - BLOCKING ROADWAY","TRAFFIC RELATED CALLS","TRAFFIC RELATED CALLS","",1157.48588512645,2016-08-29 19:53:38,2016-08-30
"117",29472,1728976,16000154125,2016154125,"031","STRONG ARM ROBBERY","ROBBERY","ROBBERY","05/04/2016 01:52:10 AM","9 AV NE / NE 42 ST","U","U2","5200.2002",-122.318794,47.657513,"(47.657513, -122.318794)","ROBBERY - IP/JO (INCLUDES STRONG ARM)","ROBBERY","ROBBERY","05/04/2016 12:00:19 AM",718.136659223066,2016-05-04 01:52:10,2016-05-04
"118",29752,1957268,17000094230,201794230,"350","HAZARDS","HAZARDS","HAZARDS","03/17/2017 05:43:24 AM","UNIVERSITY WY NE / NE 42 ST","U","U2","5301.3009",-122.31321,47.658314,"(47.658314, -122.31321)","HAZ - POTENTIAL THRT TO PHYS SAFETY (NO HAZMAT)","HAZARDS","HAZARDS","",379.289152249279,2017-03-17 05:43:24,2017-03-17
"119",29757,1773207,16000230880,2016230880,"350","HAZARDS","HAZARDS","HAZARDS","06/29/2016 02:07:48 PM","NE 64 ST / ROOSEVELT WY NE","U","U1","4400.2003",-122.31737,47.674976,"(47.674976, -122.31737)","TRAFFIC - BO SIGNALS AND DOWN SIGNS","TRAFFIC RELATED CALLS","TRAFFIC RELATED CALLS","",2191.05967844583,2016-06-29 14:07:48,2016-06-29
"120",29921,2051565,17000266454,2017266454,"041","HARASSMENT, THREATS","THREATS, HARASSMENT","THREATS, HARASSMENT","07/22/2017 01:58:27 AM","7 AV NE / NE 50 ST","U","U1","5200.5002",-122.3207,47.664955,"(47.664955, -122.3207)","ASLT - IP/JO - WITH OR W/O WPNS (NO SHOOTINGS)","ASSAULTS","ASSAULTS","07/21/2017 05:25:16 PM",1303.47990792526,2017-07-22 01:58:27,2017-07-22
"121",29981,1968246,17000114398,2017114398,"220","CRISIS COMPLAINT - GENERAL","CRISIS CALL","BEHAVIORAL HEALTH","04/01/2017 10:56:11 PM","51XX BLOCK OF 40 AV NE","U","U3","4200.2023",-122.284805,47.666725,"(47.666725, -122.284805)","CRISIS - PERSON IN BEHAVIORAL/EMOTIONAL CRISIS","BEHAVIORAL HEALTH","CRISIS CALL","04/01/2017 09:17:58 PM",2205.12674187758,2017-04-01 22:56:11,2017-04-02
"122",30303,1866469,16000392622,2016392622,"242","FIGHT DISTURBANCE","DISTURBANCES","DISTURBANCES","10/30/2016 02:16:10 AM","89XX BLOCK OF LAKE CITY WY NE","U","U1","2100.3006",-122.30518,47.69372,"(47.69372, -122.30518)","FIGHT - IP - PHYSICAL (NO WEAPONS)","DISTURBANCES","DISTURBANCES","10/30/2016 01:20:10 AM",4206.38807358236,2016-10-30 02:16:10,2016-10-30
"123",30396,1945955,17000072076,201772076,"220","CRISIS COMPLAINT - GENERAL","CRISIS CALL","BEHAVIORAL HEALTH","02/28/2017 01:56:57 AM","NE 50 ST / 16 AV NE","U","U2","4400.3006",-122.31081,47.664883,"(47.664883, -122.31081)","DISTURBANCE, MISCELLANEOUS/OTHER","DISTURBANCES","DISTURBANCES","02/27/2017 10:46:30 PM",992.534567701538,2017-02-28 01:56:57,2017-02-28
"124",30552,1729040,16000154092,2016154092,"031","STRONG ARM ROBBERY","ROBBERY","ROBBERY","05/04/2016 04:14:02 AM","52XX BLOCK OF 18 AV NE","U","U1","4400.3002",-122.30829,47.66747,"(47.66747, -122.30829)","ROBBERY - IP/JO (INCLUDES STRONG ARM)","ROBBERY","ROBBERY","05/03/2016 11:12:21 PM",1278.51195431124,2016-05-04 04:14:02,2016-05-04
"125",30583,1945985,17000071974,201771974,"220","CRISIS COMPLAINT - GENERAL","CRISIS CALL","BEHAVIORAL HEALTH","02/28/2017 03:24:59 AM","75XX BLOCK OF 39 AV NE","U","U3","2400.2009",-122.286285,47.683937,"(47.683937, -122.286285)","UNKNOWN - COMPLAINT OF UNKNOWN NATURE","SUSPICIOUS CIRCUMSTANCES","SUSPICIOUS CIRCUMSTANCES","02/27/2017 08:23:32 PM",3561.98610106541,2017-02-28 03:24:59,2017-02-28
"126",30627,1946008,17000072139,201772139,"030","ARMED ROBBERY","GUN CALLS","ROBBERY","02/28/2017 04:25:12 AM","52XX BLOCK OF 19 AV NE","U","U1","4400.3001",-122.30715,47.667465,"(47.667465, -122.30715)","ROBBERY - IP/JO (INCLUDES STRONG ARM)","ROBBERY","ROBBERY","02/28/2017 12:28:31 AM",1286.88456481832,2017-02-28 04:25:12,2017-02-28
"127",30632,1888356,16000431888,2016431888,"220","CRISIS COMPLAINT - GENERAL","CRISIS CALL","BEHAVIORAL HEALTH","12/01/2016 02:40:37 AM","45XX BLOCK OF 12 AV NE","U","U2","5301.2007",-122.31539,47.662197,"(47.662197, -122.31539)","CRISIS - PERSON IN BEHAVIORAL/EMOTIONAL CRISIS","BEHAVIORAL HEALTH","CRISIS CALL","12/01/2016 01:57:37 AM",818.824590825285,2016-12-01 02:40:37,2016-12-01
"128",30665,1888375,16000431926,2016431926,"242","FIGHT DISTURBANCE","DISTURBANCES","DISTURBANCES","12/01/2016 03:54:22 AM","NE 55 ST / UNIVERSITY WY NE","U","U1","4400.2028",-122.31302,47.668545,"(47.668545, -122.31302)","FIGHT - IP - PHYSICAL (NO WEAPONS)","DISTURBANCES","DISTURBANCES","",1419.63730229997,2016-12-01 03:54:22,2016-12-01
"129",30672,1706922,16000113076,2016113076,"242","FIGHT DISTURBANCE","DISTURBANCES","DISTURBANCES","04/02/2016 12:34:11 AM","52XX BLOCK OF 16 AV NE","U","U1","4400.3004",-122.31076,47.66748,"(47.66748, -122.31076)","FIGHT - IP - PHYSICAL (NO WEAPONS)","DISTURBANCES","DISTURBANCES","",1279.893205925,2016-04-02 00:34:11,2016-04-02
"130",30849,1712299,16000122839,2016122839,"030","ARMED ROBBERY","GUN CALLS","ROBBERY","04/09/2016 07:26:15 PM","NE 63 ST / 22 AV NE","U","U1","4301.3007",-122.30442,47.67479,"(47.67479, -122.30442)","ROBBERY - IP/JO (INCLUDES STRONG ARM)","ROBBERY","ROBBERY","04/09/2016 05:05:08 PM",2123.69862027333,2016-04-09 19:26:15,2016-04-10
"131",30860,1750772,16000192338,2016192338,"220","CRISIS COMPLAINT - GENERAL","CRISIS CALL","BEHAVIORAL HEALTH","06/01/2016 01:45:07 AM","UNIVERSITY WY NE / NE 50 ST","U","U1","4400.4009",-122.31307,47.664898,"(47.664898, -122.31307)","CRISIS - PERSON IN BEHAVIORAL/EMOTIONAL CRISIS","BEHAVIORAL HEALTH","CRISIS CALL","",1025.0108407033,2016-06-01 01:45:07,2016-06-01
"132",30904,1705269,16000109981,2016109981,"242","FIGHT DISTURBANCE","DISTURBANCES","DISTURBANCES","03/30/2016 11:31:34 PM","55XX BLOCK OF 33 AV NE","U","U3","4200.5021",-122.29264,47.66942,"(47.66942, -122.29264)","ASLT - WITH OR W/O WEAPONS (NO SHOOTINGS)","ASSAULTS","ASSAULTS","03/30/2016 10:04:55 PM",1957.03732332951,2016-03-30 23:31:34,2016-03-31
"133",31047,1888305,16000431778,2016431778,"041","HARASSMENT, THREATS","THREATS, HARASSMENT","THREATS, HARASSMENT","12/01/2016 12:50:52 AM","69XX BLOCK OF 62 AV NE","U","U3","4000.1014",-122.26223,47.67889,"(47.67889, -122.26223)","THREATS (INCLS IN-PERSON/BY PHONE/IN WRITING)","THREATS, HARASSMENT","THREATS, HARASSMENT","11/30/2016 11:45:33 PM",4368.13337390337,2016-12-01 00:50:52,2016-12-01
"134",31057,2076293,17000311607,2017311607,"242","FIGHT DISTURBANCE","DISTURBANCES","DISTURBANCES","08/23/2017 04:25:56 AM","NE 47 ST / BROOKLYN AV NE","U","U2","5301.2009",-122.31424,47.663097,"(47.663097, -122.31424)","FIGHT - IP - PHYSICAL (NO WEAPONS)","DISTURBANCES","DISTURBANCES","08/23/2017 02:37:16 AM",865.679337340903,2017-08-23 04:25:56,2017-08-23
"135",31071,1751080,16000192680,2016192680,"041","HARASSMENT, THREATS","THREATS, HARASSMENT","THREATS, HARASSMENT","06/01/2016 01:17:37 PM","73XX BLOCK OF 23 AV NE","U","U1","2500.2002",-122.30289,47.682137,"(47.682137, -122.30289)","HARAS - NO BIAS, THREATS OR MALICIOUSNESS","THREATS, HARASSMENT","THREATS, HARASSMENT","06/01/2016 09:37:13 AM",2948.10871741999,2016-06-01 13:17:37,2016-06-01
"136",31079,1888409,16000431982,2016431982,"350","HAZARDS","HAZARDS","HAZARDS","12/01/2016 06:30:19 AM","NE 50 ST / I5 NB","U","U2","5200.5003",-122.321724,47.664963,"(47.664963, -122.321724)","HAZ - POTENTIAL THRT TO PHYS SAFETY (NO HAZMAT)","HAZARDS","HAZARDS","",1355.05103119415,2016-12-01 06:30:19,2016-12-01
"137",31088,1910961,17000005187,20175187,"220","CRISIS COMPLAINT - GENERAL","CRISIS CALL","BEHAVIORAL HEALTH","01/05/2017 11:21:34 AM","30XX BLOCK OF NE 57 ST","U","U3","4200.5017",-122.29446,47.670326,"(47.670326, -122.29446)","CRISIS - PERSON IN BEHAVIORAL/EMOTIONAL CRISIS","BEHAVIORAL HEALTH","CRISIS CALL","01/05/2017 09:17:36 AM",1952.73767387943,2017-01-05 11:21:34,2017-01-05
"138",31115,1844330,16000353074,2016353074,"220","CRISIS COMPLAINT - GENERAL","CRISIS CALL","BEHAVIORAL HEALTH","09/29/2016 06:31:52 AM","14XX BLOCK OF NE RAVENNA BV","U","U1","4400.2029",-122.31239,47.67069,"(47.67069, -122.31239)","CRISIS - PERSON IN BEHAVIORAL/EMOTIONAL CRISIS","BEHAVIORAL HEALTH","CRISIS CALL","",1647.65069166263,2016-09-29 06:31:52,2016-09-29
"139",31124,1773232,16000231474,2016231474,"350","HAZARDS","HAZARDS","HAZARDS","06/29/2016 03:13:39 PM","NE 45 ST VI / WB","U","U1","5302.3013",-122.302505,47.66125,"(47.66125, -122.302505)","HAZ - POTENTIAL THRT TO PHYS SAFETY (NO HAZMAT)","HAZARDS","HAZARDS","",785.371446415686,2016-06-29 15:13:39,2016-06-29
"140",31153,1773358,16000231376,2016231376,"220","CRISIS COMPLAINT - GENERAL","CRISIS CALL","BEHAVIORAL HEALTH","06/29/2016 06:25:59 PM","8 AV NE / NE NORTHLAKE WY","U","U2","5200.2019",-122.31981,47.654537,"(47.654537, -122.31981)","CRISIS - PERSON IN BEHAVIORAL/EMOTIONAL CRISIS","BEHAVIORAL HEALTH","CRISIS CALL","06/29/2016 01:38:19 PM",791.395993505035,2016-06-29 18:25:59,2016-06-30
"141",31195,2125853,17000402265,2017402265,"220","CRISIS COMPLAINT - GENERAL","CRISIS CALL","BEHAVIORAL HEALTH","10/30/2017 12:46:33 AM","47XX BLOCK OF UNIVERSITY WY NE","U","U2","5301.2002",-122.31309,47.663998,"(47.663998, -122.31309)","DISTURBANCE, MISCELLANEOUS/OTHER","DISTURBANCES","DISTURBANCES","10/29/2017 10:05:26 PM",929.234922041086,2017-10-30 00:46:33,2017-10-30
"142",31204,1773352,16000231665,2016231665,"220","CRISIS COMPLAINT - GENERAL","CRISIS CALL","BEHAVIORAL HEALTH","06/29/2016 06:24:05 PM","47XX BLOCK OF 12 AV NE","U","U2","5301.2004",-122.315254,47.664013,"(47.664013, -122.315254)","CRISIS - PERSON IN BEHAVIORAL/EMOTIONAL CRISIS","BEHAVIORAL HEALTH","CRISIS CALL","06/29/2016 05:04:40 PM",990.218839131712,2016-06-29 18:24:05,2016-06-30
"143",31222,1822175,16000313858,2016313858,"030","ARMED ROBBERY","GUN CALLS","ROBBERY","08/30/2016 05:29:35 AM","15 AV NE / NE 50 ST","U","U1","4400.4009",-122.311935,47.66489,"(47.66489, -122.311935)","ROBBERY - IP/JO (INCLUDES STRONG ARM)","ROBBERY","ROBBERY","",1005.20324732383,2016-08-30 05:29:35,2016-08-30
"144",31250,1957287,17000094291,201794291,"350","HAZARDS","HAZARDS","HAZARDS","03/17/2017 07:34:35 AM","15 AV NE / NE 42 ST","U","U2","5301.4",-122.31207,47.658302,"(47.658302, -122.31207)","HAZ - POTENTIAL THRT TO PHYS SAFETY (NO HAZMAT)","HAZARDS","HAZARDS","",320.589660408362,2017-03-17 07:34:35,2017-03-17
"145",31284,1761345,16000210988,2016210988,"220","CRISIS COMPLAINT - GENERAL","CRISIS CALL","BEHAVIORAL HEALTH","06/14/2016 07:06:15 AM","52XX BLOCK OF 19 AV NE","U","U1","4400.3001",-122.30715,47.667465,"(47.667465, -122.30715)","CRISIS - PERSON IN BEHAVIORAL/EMOTIONAL CRISIS","BEHAVIORAL HEALTH","CRISIS CALL","06/14/2016 04:43:59 AM",1286.88456481832,2016-06-14 07:06:15,2016-06-14
"146",31292,1855334,16000372801,2016372801,"350","HAZARDS","HAZARDS","HAZARDS","10/14/2016 05:33:46 PM","NE 80 ST / 15 AV NE","U","U1","2600.1017",-122.31216,47.686672,"(47.686672, -122.31216)","WIRES DOWN (PHONE, ELECTRICAL,ETC.)","HAZARDS","HAZARDS","",3416.07905620599,2016-10-14 17:33:46,2016-10-15
"147",31308,1761442,16000211148,2016211148,"041","HARASSMENT, THREATS","THREATS, HARASSMENT","THREATS, HARASSMENT","06/14/2016 10:31:32 AM","NE 43 ST / 7 AV NE","U","U2","5200.1003",-122.32084,47.659462,"(47.659462, -122.32084)","BIAS -RACIAL, POLITICAL, SEXUAL MOTIVATION","SUSPICIOUS CIRCUMSTANCES","SUSPICIOUS CIRCUMSTANCES","06/14/2016 09:45:59 AM",934.76337828761,2016-06-14 10:31:32,2016-06-14
"148",31361,1866540,16000392721,2016392721,"242","FIGHT DISTURBANCE","DISTURBANCES","DISTURBANCES","10/30/2016 04:14:20 AM","52XX BLOCK OF 18 AV NE","U","U1","4400.3002",-122.30859,47.667255,"(47.667255, -122.30859)","FIGHT - IP - PHYSICAL (NO WEAPONS)","DISTURBANCES","DISTURBANCES","",1253.23831359613,2016-10-30 04:14:20,2016-10-30
"149",31375,1957273,17000094224,201794224,"220","CRISIS COMPLAINT - GENERAL","CRISIS CALL","BEHAVIORAL HEALTH","03/17/2017 06:01:54 AM","45XX BLOCK OF BROOKLYN AV NE","U","U2","5301.2008",-122.31426,47.66219,"(47.66219, -122.31426)","CRISIS - PERSON IN BEHAVIORAL/EMOTIONAL CRISIS","BEHAVIORAL HEALTH","CRISIS CALL","03/17/2017 05:07:51 AM",775.56356285686,2017-03-17 06:01:54,2017-03-17
"150",31423,1729502,16000155100,2016155100,"030","ARMED ROBBERY","GUN CALLS","ROBBERY","05/04/2016 07:29:45 PM","UNIVERSITY WY NE / NE 42 ST","U","U2","5301.3008",-122.31321,47.658314,"(47.658314, -122.31321)","ROBBERY - IP/JO (INCLUDES STRONG ARM)","ROBBERY","ROBBERY","05/04/2016 05:34:51 PM",379.289152249279,2016-05-04 19:29:45,2016-05-05
"151",31456,1729312,16000154698,2016154698,"220","CRISIS COMPLAINT - GENERAL","CRISIS CALL","BEHAVIORAL HEALTH","05/04/2016 01:38:46 PM","47XX BLOCK OF 21 AV NE","U","U1","4302.1007",-122.30545,47.663994,"(47.663994, -122.30545)","MISSING - (ALZHEIMER, ENDANGERED, ELDERLY)","PERSONS - LOST, FOUND, MISSING","PERSONS - LOST, FOUND, MISSING","05/04/2016 12:46:21 PM",939.423025875514,2016-05-04 13:38:46,2016-05-04
"152",31485,1740482,16000174460,2016174460,"041","HARASSMENT, THREATS","THREATS, HARASSMENT","THREATS, HARASSMENT","05/19/2016 12:25:34 AM","NE 42 ST / 7 AV NE","U","U2","5200.1003",-122.32085,47.657516,"(47.657516, -122.32085)","THREATS (INCLS IN-PERSON/BY PHONE/IN WRITING)","THREATS, HARASSMENT","THREATS, HARASSMENT","05/18/2016 11:23:37 PM",869.102266490978,2016-05-19 00:25:34,2016-05-19
"153",31502,1773488,16000231510,2016231510,"350","HAZARDS","HAZARDS","HAZARDS","06/29/2016 09:03:51 PM","NE 45 ST / 19 AV NE","U","U1","5302.3013",-122.30725,47.661255,"(47.661255, -122.30725)","HAZ - POTENTIAL THRT TO PHYS SAFETY (NO HAZMAT)","HAZARDS","HAZARDS","06/29/2016 03:04:48 PM",608.224197228362,2016-06-29 21:03:51,2016-06-30
"154",31519,1957286,17000092916,201792916,"350","HAZARDS","HAZARDS","HAZARDS","03/16/2017 11:37:26 AM","NE 55 ST / 25 AV NE","U","U1","4302.2",-122.30062,47.66852,"(47.66852, -122.30062)","TRAFFIC - BO SIGNALS AND DOWN SIGNS","TRAFFIC RELATED CALLS","TRAFFIC RELATED CALLS","",1543.56487920368,2017-03-16 11:37:26,2017-03-16
"155",31527,1773493,16000231948,2016231948,"220","CRISIS COMPLAINT - GENERAL","CRISIS CALL","BEHAVIORAL HEALTH","06/29/2016 09:39:04 PM","42XX BLOCK OF UNIVERSITY WY NE","U","U2","5301.3008",-122.31319,47.659054,"(47.659054, -122.31319)","THREATS (INCLS IN-PERSON/BY PHONE/IN WRITING)","THREATS, HARASSMENT","THREATS, HARASSMENT","",438.325335850633,2016-06-29 21:39:04,2016-06-30
"156",31592,1692115,16000086816,201686816,"030","ARMED ROBBERY","GUN CALLS","ROBBERY","03/12/2016 04:18:21 AM","NE 47 ST / 21 AV NE","U","U1","4302.1008",-122.305466,47.66307,"(47.66307, -122.305466)","ROBBERY - IP/JO (INCLUDES STRONG ARM)","ROBBERY","ROBBERY","03/12/2016 12:15:23 AM",842.449736750376,2016-03-12 04:18:21,2016-03-12
"157",31630,1692352,16000085047,201685047,"030","ARMED ROBBERY","GUN CALLS","ROBBERY","03/10/2016 07:25:02 PM","41XX BLOCK OF UNIVERSITY WY NE","U","U2","5301.4000",-122.313225,47.657574,"(47.657574, -122.313225)","ROBBERY - IP/JO (INCLUDES STRONG ARM)","ROBBERY","ROBBERY","03/10/2016 03:51:26 PM",330.036787270645,2016-03-10 19:25:02,2016-03-11
"158",31645,1687517,16000078848,201678848,"220","CRISIS COMPLAINT - GENERAL","CRISIS CALL","BEHAVIORAL HEALTH","03/05/2016 02:09:33 PM","NE RAVENNA BV / I5 NB","U","U1","3600.1031",-122.32065,47.67457,"(47.67457, -122.32065)","SUSPICIOUS STOP - OFFICER INITIATED ONVIEW","SUSPICIOUS CIRCUMSTANCES","SUSPICIOUS CIRCUMSTANCES","03/05/2016 12:57:59 PM",2228.05386012094,2016-03-05 14:09:33,2016-03-05
"159",31667,1692523,16000087562,201687562,"242","FIGHT DISTURBANCE","DISTURBANCES","DISTURBANCES","03/12/2016 07:31:05 PM","43XX BLOCK OF UNIVERSITY WY NE","U","U2","5301.3001",-122.31315,47.660534,"(47.660534, -122.31315)","FIGHT - VERBAL/ORAL (NO WEAPONS)","DISTURBANCES","DISTURBANCES","",573.843522369168,2016-03-12 19:31:05,2016-03-13
"160",31672,1687662,16000079176,201679176,"030","ARMED ROBBERY","GUN CALLS","ROBBERY","03/05/2016 06:20:13 PM","47XX BLOCK OF UNIVERSITY WY NE","U","U2","5301.2002",-122.31309,47.663998,"(47.663998, -122.31309)","ROBBERY (INCLUDES STRONG ARM)","ROBBERY","ROBBERY","",929.234922041086,2016-03-05 18:20:13,2016-03-06
"161",31777,1699100,16000099249,201699249,"220","CRISIS COMPLAINT - GENERAL","CRISIS CALL","BEHAVIORAL HEALTH","03/22/2016 01:05:38 AM","56XX BLOCK OF UNIVERSITY WY NE","U","U1","4400.2020",-122.31303,47.670216,"(47.670216, -122.31303)","CRISIS - PERSON IN BEHAVIORAL/EMOTIONAL CRISIS","BEHAVIORAL HEALTH","CRISIS CALL","",1602.67210487326,2016-03-22 01:05:38,2016-03-22
"162",31785,1692745,16000087959,201687959,"242","FIGHT DISTURBANCE","DISTURBANCES","DISTURBANCES","03/13/2016 03:33:16 AM","82XX BLOCK OF 20 AV NE","U","U1","2600.1000",-122.30683,47.689396,"(47.689396, -122.30683)","FIGHT - IP - PHYSICAL (NO WEAPONS)","DISTURBANCES","DISTURBANCES","",3718.50899923879,2016-03-13 03:33:16,2016-03-13
"163",31871,1705827,16000111074,2016111074,"220","CRISIS COMPLAINT - GENERAL","CRISIS CALL","BEHAVIORAL HEALTH","03/31/2016 06:37:53 PM","47XX BLOCK OF 12 AV NE","U","U2","5301.2003",-122.315254,47.664013,"(47.664013, -122.315254)","BURG - RES (INCL UNOCC STRUCTURES ON PROP)","BURGLARY","RESIDENTIAL BURGLARIES","03/31/2016 05:28:52 PM",990.218839131712,2016-03-31 18:37:53,2016-04-01
"164",31930,1692933,16000088797,201688797,"350","HAZARDS","HAZARDS","HAZARDS","03/13/2016 02:24:03 PM","52XX BLOCK OF BROOKLYN AV NE","U","U1","4400.4002",-122.31417,47.6675,"(47.6675, -122.31417)","WIRES DOWN (PHONE, ELECTRICAL,ETC.)","HAZARDS","HAZARDS","",1325.85536809536,2016-03-13 14:24:03,2016-03-13
"165",31969,1692946,16000088714,201688714,"350","HAZARDS","HAZARDS","HAZARDS","03/13/2016 02:31:22 PM","50XX BLOCK OF UNIVERSITY WY NE","U","U1","4400.4008",-122.313065,47.66567,"(47.66567, -122.313065)","WIRES DOWN (PHONE, ELECTRICAL,ETC.)","HAZARDS","HAZARDS","",1107.99164074666,2016-03-13 14:31:22,2016-03-13
"166",31983,1692961,16000088587,201688587,"220","CRISIS COMPLAINT - GENERAL","CRISIS CALL","BEHAVIORAL HEALTH","03/13/2016 02:57:21 PM","51XX BLOCK OF 26 AV NE","U","U3","4301.1004",-122.29955,47.66719,"(47.66719, -122.29955)","CRISIS - PERSON IN BEHAVIORAL/EMOTIONAL CRISIS","BEHAVIORAL HEALTH","CRISIS CALL","03/13/2016 12:00:57 PM",1451.36280097751,2016-03-13 14:57:21,2016-03-13
"167",31984,1692966,16000088840,201688840,"350","HAZARDS","HAZARDS","HAZARDS","03/13/2016 03:12:50 PM","12 AV NE / NE RAVENNA BV","U","U1","4400.2014",-122.31519,47.671505,"(47.671505, -122.31519)","TREES DOWN, OBSTRUCTING PUBLIC PROP (NO HAZ)","TREES DOWN","TREES DOWN","",1776.08892527698,2016-03-13 15:12:50,2016-03-13
"168",31985,1692967,16000088836,201688836,"341","HARBOR - DEBRIS, NAVIGATIONAL HAZARDS","HARBOR CALLS","HARBOR CALLS","03/13/2016 03:19:34 PM","66XX BLOCK OF NE WINDERMERE RD","U","U3","4100.2003",-122.25485,47.673523,"(47.673523, -122.25485)","HARBOR - WATER EMERGENCIES","HARBOR CALLS","HARBOR CALLS","",4543.53721109474,2016-03-13 15:19:34,2016-03-13
"169",31986,1692969,16000088751,201688751,"350","HAZARDS","HAZARDS","HAZARDS","03/13/2016 03:11:21 PM","NE 50 ST / ROOSEVELT WY NE","U","U1","5200.5000",-122.317406,47.664936,"(47.664936, -122.317406)","HAZ - POTENTIAL THRT TO PHYS SAFETY (NO HAZMAT)","HAZARDS","HAZARDS","",1157.48588512645,2016-03-13 15:11:21,2016-03-13
"170",31993,1699441,16000099742,201699742,"350","HAZARDS","HAZARDS","HAZARDS","03/22/2016 03:09:15 PM","16XX BLOCK OF NE 50 ST","U","U1","4400.3007",-122.31024,47.66488,"(47.66488, -122.31024)","NUISANCE - MISCHIEF","MISCELLANEOUS MISDEMEANORS","MISCELLANEOUS MISDEMEANORS","03/22/2016 12:58:24 PM",988.874793332643,2016-03-22 15:09:15,2016-03-22
"171",31995,1705942,16000111350,2016111350,"350","HAZARDS","HAZARDS","HAZARDS","03/31/2016 09:25:01 PM","NE 43 ST / UNIVERSITY WY NE","U","U2","5301.3008",-122.31317,47.659794,"(47.659794, -122.31317)","HAZ - POTENTIAL THRT TO PHYS SAFETY (NO HAZMAT)","HAZARDS","HAZARDS","",503.925729388642,2016-03-31 21:25:01,2016-04-01
"172",32039,1693022,16000088736,201688736,"350","HAZARDS","HAZARDS","HAZARDS","03/13/2016 04:53:29 PM","18XX BLOCK OF NE 58 ST","U","U1","4400.1025",-122.307495,47.67091,"(47.67091, -122.307495)","WIRES DOWN (PHONE, ELECTRICAL,ETC.)","HAZARDS","HAZARDS","03/13/2016 02:55:52 PM",1664.57618725043,2016-03-13 16:53:29,2016-03-13
"173",32048,1699532,16000099925,201699925,"220","CRISIS COMPLAINT - GENERAL","CRISIS CALL","BEHAVIORAL HEALTH","03/22/2016 06:03:20 PM","43XX BLOCK OF UNIVERSITY WY NE","U","U2","5301.3000",-122.31315,47.660534,"(47.660534, -122.31315)","DISTURBANCE, MISCELLANEOUS/OTHER","DISTURBANCES","DISTURBANCES","03/22/2016 03:06:16 PM",573.843522369168,2016-03-22 18:03:20,2016-03-23
"174",32058,1693025,16000088903,201688903,"350","HAZARDS","HAZARDS","HAZARDS","03/13/2016 05:07:42 PM","22 AV NE / NE 45 ST","U","U1","4302.1010",-122.30492,47.661327,"(47.661327, -122.30492)","TREES DOWN, OBSTRUCTING PUBLIC PROP (NO HAZ)","TREES DOWN","TREES DOWN","",684.944253184987,2016-03-13 17:07:42,2016-03-14
"175",32062,1693043,16000088928,201688928,"350","HAZARDS","HAZARDS","HAZARDS","03/13/2016 05:49:15 PM","MONTLAKE BV NE / NE PACIFIC PL","U","U2","5302.3054",-122.30391,47.65108,"(47.65108, -122.30391)","TRAFFIC - BO SIGNALS AND DOWN SIGNS","TRAFFIC RELATED CALLS","TRAFFIC RELATED CALLS","",689.626649964796,2016-03-13 17:49:15,2016-03-14
"176",32063,1693045,16000088880,201688880,"350","HAZARDS","HAZARDS","HAZARDS","03/13/2016 05:50:45 PM","40 AV NE / NE 50 ST","U","U3","4200.3002",-122.28479,47.664886,"(47.664886, -122.28479)","WIRES DOWN (PHONE, ELECTRICAL,ETC.)","HAZARDS","HAZARDS","",2102.63195694637,2016-03-13 17:50:45,2016-03-14
"177",32064,1693046,16000088869,201688869,"350","HAZARDS","HAZARDS","HAZARDS","03/13/2016 05:47:44 PM","20 AV NE / NE 75 ST","U","U1","2500.2004",-122.306694,47.683044,"(47.683044, -122.306694)","TRAFFIC - BO SIGNALS AND DOWN SIGNS","TRAFFIC RELATED CALLS","TRAFFIC RELATED CALLS","",3014.23258320016,2016-03-13 17:47:44,2016-03-14
"178",32100,1693060,16000088966,201688966,"350","HAZARDS","HAZARDS","HAZARDS","03/13/2016 05:51:22 PM","NE 47 ST / 15 AV NE","U","U2","5301.2011",-122.311966,47.663082,"(47.663082, -122.311966)","TRAFFIC - BO SIGNALS AND DOWN SIGNS","TRAFFIC RELATED CALLS","TRAFFIC RELATED CALLS","",808.897329309375,2016-03-13 17:51:22,2016-03-14
"179",32101,1693063,16000088951,201688951,"350","HAZARDS","HAZARDS","HAZARDS","03/13/2016 05:50:46 PM","25 AV NE / NE BLAKELEY ST","U","U3","4302.2007",-122.300606,47.666267,"(47.666267, -122.300606)","TRAFFIC - BO SIGNALS AND DOWN SIGNS","TRAFFIC RELATED CALLS","TRAFFIC RELATED CALLS","",1322.63748539703,2016-03-13 17:50:46,2016-03-14
"180",32103,1693077,16000088779,201688779,"350","HAZARDS","HAZARDS","HAZARDS","03/13/2016 04:25:40 PM","60XX BLOCK OF 32 AV NE","U","U3","4200.5009",-122.29325,47.673065,"(47.673065, -122.29325)","TREES DOWN, OBSTRUCTING PUBLIC PROP (NO HAZ)","TREES DOWN","TREES DOWN","03/13/2016 04:18:56 PM",2256.00741928825,2016-03-13 16:25:40,2016-03-13
"181",32132,1693106,16000089027,201689027,"350","HAZARDS","HAZARDS","HAZARDS","03/13/2016 07:06:08 PM","75XX BLOCK OF 39 AV NE","U","U3","2400.2005",-122.286285,47.683937,"(47.683937, -122.286285)","WIRES DOWN (PHONE, ELECTRICAL,ETC.)","HAZARDS","HAZARDS","",3561.98610106541,2016-03-13 19:06:08,2016-03-14
"182",32134,1693107,16000089021,201689021,"350","HAZARDS","HAZARDS","HAZARDS","03/13/2016 06:56:00 PM","15XX BLOCK OF NE 62 ST","U","U1","4400.1005",-122.31081,47.674007,"(47.674007, -122.31081)","HAZ - POTENTIAL THRT TO PHYS SAFETY (NO HAZMAT)","HAZARDS","HAZARDS","",2004.50292203722,2016-03-13 18:56:00,2016-03-14
"183",32135,1693115,16000089049,201689049,"350","HAZARDS","HAZARDS","HAZARDS","03/13/2016 07:11:59 PM","15 AV NE / NE 50 ST","U","U1","4400.4009",-122.311935,47.66489,"(47.66489, -122.311935)","TRAFFIC - BO SIGNALS AND DOWN SIGNS","TRAFFIC RELATED CALLS","TRAFFIC RELATED CALLS","",1005.20324732383,2016-03-13 19:11:59,2016-03-14
"184",32137,1688206,16000079814,201679814,"350","HAZARDS","HAZARDS","HAZARDS","03/06/2016 01:30:09 PM","NE 45 ST / 25 AV NE","U","U2","5302.3010",-122.3009,47.66125,"(47.66125, -122.3009)","HAZ - POTENTIAL THRT TO PHYS SAFETY (NO HAZMAT)","HAZARDS","HAZARDS","03/06/2016 09:32:31 AM",870.654377405696,2016-03-06 13:30:09,2016-03-06
"185",32146,1693134,16000088896,201688896,"350","HAZARDS","HAZARDS","HAZARDS","03/13/2016 07:30:54 PM","27XX BLOCK OF NE 85 ST","U","U3","2100.3012",-122.29805,47.690247,"(47.690247, -122.29805)","TREES DOWN, OBSTRUCTING PUBLIC PROP (NO HAZ)","TREES DOWN","TREES DOWN","",3903.59334700305,2016-03-13 19:30:54,2016-03-14
"186",32171,1693161,16000088992,201688992,"350","HAZARDS","HAZARDS","HAZARDS","03/13/2016 08:08:13 PM","22XX BLOCK OF NE 68 ST","U","U1","2500.2014",-122.30332,47.67762,"(47.67762, -122.30332)","WIRES DOWN (PHONE, ELECTRICAL,ETC.)","HAZARDS","HAZARDS","",2448.19530016479,2016-03-13 20:08:13,2016-03-14
"187",32173,1693174,16000088804,201688804,"350","HAZARDS","HAZARDS","HAZARDS","03/13/2016 08:17:55 PM","60XX BLOCK OF 28 AV NE","U","U3","4301.2007",-122.29748,47.67306,"(47.67306, -122.29748)","POWER OUT - POLES AND TRANSFORMERS","HAZARDS","HAZARDS","",2100.68437375225,2016-03-13 20:17:55,2016-03-14
"188",32220,1693231,16000088730,201688730,"350","HAZARDS","HAZARDS","HAZARDS","03/13/2016 09:46:57 PM","NE 45 ST / 25 AV NE","U","U2","5302.3010",-122.3009,47.66125,"(47.66125, -122.3009)","TREES DOWN, OBSTRUCTING PUBLIC PROP (NO HAZ)","TREES DOWN","TREES DOWN","",870.654377405696,2016-03-13 21:46:57,2016-03-14
"189",32234,1699783,16000099783,201699783,"220","CRISIS COMPLAINT - GENERAL","CRISIS CALL","BEHAVIORAL HEALTH","03/23/2016 01:09:22 AM","46XX BLOCK OF 26 AV NE","U","U3","4301.1014",-122.29986,47.6628,"(47.6628, -122.29986)","SUSPICIOUS PERSON, VEHICLE OR INCIDENT","SUSPICIOUS CIRCUMSTANCES","SUSPICIOUS CIRCUMSTANCES","03/22/2016 09:21:14 PM",1046.87472030832,2016-03-23 01:09:22,2016-03-23
"190",32257,1688365,16000080288,201680288,"350","HAZARDS","HAZARDS","HAZARDS","03/06/2016 06:39:03 PM","NE 45 ST / UNIVERSITY WY NE","U","U2","5301.3001",-122.31313,47.661266,"(47.661266, -122.31313)","HAZ - POTENTIAL THRT TO PHYS SAFETY (NO HAZMAT)","HAZARDS","HAZARDS","",645.873447683438,2016-03-06 18:39:03,2016-03-07
"191",32263,1693248,16000088800,201688800,"350","HAZARDS","HAZARDS","HAZARDS","03/13/2016 10:10:39 PM","RAVENNA AV NE / NE 90 ST","U","U1","2100.3002",-122.30356,47.693916,"(47.693916, -122.30356)","TREES DOWN, OBSTRUCTING PUBLIC PROP (NO HAZ)","TREES DOWN","TREES DOWN","",4239.18476623441,2016-03-13 22:10:39,2016-03-14
"192",32389,1688485,16000080414,201680414,"220","CRISIS COMPLAINT - GENERAL","CRISIS CALL","BEHAVIORAL HEALTH","03/06/2016 10:00:34 PM","NE 41 ST / 15 AV NE","U","U2","5301.4000",-122.31211,47.65682,"(47.65682, -122.31211)","DOWN - CHECK FOR PERSON DOWN","PERSON DOWN/INJURY","CASUALTIES","03/06/2016 09:00:31 PM",216.222931905124,2016-03-06 22:00:34,2016-03-07
"193",32559,1693672,16000089963,201689963,"242","FIGHT DISTURBANCE","DISTURBANCES","DISTURBANCES","03/14/2016 03:28:22 PM","45XX BLOCK OF UNIVERSITY WY NE","U","U2","5301.2010",-122.31312,47.66218,"(47.66218, -122.31312)","FIGHT - JO - PHYSICAL (NO WEAPONS)","DISTURBANCES","DISTURBANCES","03/14/2016 02:36:10 PM",738.963514898043,2016-03-14 15:28:22,2016-03-14
"194",32580,1693684,16000089688,201689688,"350","HAZARDS","HAZARDS","HAZARDS","03/14/2016 03:38:35 PM","15 AV NE / NE 45 ST","U","U2","5301.2010",-122.312,47.66126,"(47.66126, -122.312)","TRAFFIC - BO SIGNALS AND DOWN SIGNS","TRAFFIC RELATED CALLS","TRAFFIC RELATED CALLS","03/14/2016 10:33:33 AM",614.236940217108,2016-03-14 15:38:35,2016-03-14
"195",32585,1688841,16000081095,201681095,"350","HAZARDS","HAZARDS","HAZARDS","03/07/2016 01:38:43 PM","NE 45 ST / MONTLAKE BV NE","U","U3","5302.3007",-122.29834,47.661087,"(47.661087, -122.29834)","HAZ - POTENTIAL THRT TO PHYS SAFETY (NO HAZMAT)","HAZARDS","HAZARDS","",1011.2565741436,2016-03-07 13:38:43,2016-03-07
"196",32587,1693699,16000089683,201689683,"220","CRISIS COMPLAINT - GENERAL","CRISIS CALL","BEHAVIORAL HEALTH","03/14/2016 03:50:12 PM","56XX BLOCK OF BROOKLYN AV NE","U","U1","4400.2020",-122.31416,47.670345,"(47.670345, -122.31416)","CRISIS - PERSON IN BEHAVIORAL/EMOTIONAL CRISIS","BEHAVIORAL HEALTH","CRISIS CALL","03/14/2016 11:56:29 AM",1632.88503740822,2016-03-14 15:50:12,2016-03-14
"197",32609,1693765,16000090187,201690187,"220","CRISIS COMPLAINT - GENERAL","CRISIS CALL","BEHAVIORAL HEALTH","03/14/2016 06:14:07 PM","74XX BLOCK OF 25 AV NE","U","U3","3800.2003",-122.30074,47.682537,"(47.682537, -122.30074)","CRISIS - PERSON IN BEHAVIORAL/EMOTIONAL CRISIS","BEHAVIORAL HEALTH","CRISIS CALL","",3022.94315748862,2016-03-14 18:14:07,2016-03-15
"198",32643,1707009,16000113159,2016113159,"242","FIGHT DISTURBANCE","DISTURBANCES","DISTURBANCES","04/02/2016 02:26:25 AM","NE 56 ST / 15 AV NE","U","U1","4400.2028",-122.31189,47.669445,"(47.669445, -122.31189)","ASLT - IP/JO - WITH OR W/O WPNS (NO SHOOTINGS)","ASSAULTS","ASSAULTS","",1505.60570035425,2016-04-02 02:26:25,2016-04-02
"199",32656,1693857,16000090173,201690173,"350","HAZARDS","HAZARDS","HAZARDS","03/14/2016 08:14:46 PM","NE 45 ST / I5","U","U2","5200.1001",-122.3219,47.661327,"(47.661327, -122.3219)","TRAFFIC - BO SIGNALS AND DOWN SIGNS","TRAFFIC RELATED CALLS","TRAFFIC RELATED CALLS","",1103.79990374045,2016-03-14 20:14:46,2016-03-15
"200",32735,1689047,16000081915,201681915,"220","CRISIS COMPLAINT - GENERAL","CRISIS CALL","BEHAVIORAL HEALTH","03/08/2016 06:48:28 AM","52XX BLOCK OF UNIVERSITY WY NE","U","U1","4400.4001",-122.313034,47.667492,"(47.667492, -122.313034)","SUSPICIOUS PERSON, VEHICLE OR INCIDENT","SUSPICIOUS CIRCUMSTANCES","SUSPICIOUS CIRCUMSTANCES","03/08/2016 06:26:14 AM",1305.00522461218,2016-03-08 06:48:28,2016-03-08
"201",32770,1689124,16000081752,201681752,"350","HAZARDS","HAZARDS","HAZARDS","03/07/2016 11:57:48 PM","47XX BLOCK OF 11 AV NE","U","U2","5301.2004",-122.316345,47.66402,"(47.66402, -122.316345)","SHOTS - IP/JO - INCLUDES HEARD/NO ASSAULT","WEAPONS CALLS","GUN CALLS","03/07/2016 11:56:09 PM",1029.30808958822,2016-03-07 23:57:48,2016-03-08
"202",32800,1689155,16000081702,201681702,"350","HAZARDS","HAZARDS","HAZARDS","03/07/2016 10:35:17 PM","20 AV NE / LAKE CITY WY NE","U","U1","2100.3009",-122.306854,47.691235,"(47.691235, -122.306854)","CRISIS - PERSON IN BEHAVIORAL/EMOTIONAL CRISIS","BEHAVIORAL HEALTH","CRISIS CALL","03/07/2016 10:20:04 PM",3922.60306253866,2016-03-07 22:35:17,2016-03-08
"203",32986,1700657,16000101653,2016101653,"242","FIGHT DISTURBANCE","DISTURBANCES","DISTURBANCES","03/24/2016 02:05:46 AM","UNIVERSITY WY NE / NE 43 ST","U","U2","5301.3008",-122.31317,47.659794,"(47.659794, -122.31317)","FIGHT - IP - PHYSICAL (NO WEAPONS)","DISTURBANCES","DISTURBANCES","03/24/2016 01:40:03 AM",503.925729388642,2016-03-24 02:05:46,2016-03-24
"204",32997,1700696,16000102275,2016102275,"350","HAZARDS","HAZARDS","HAZARDS","03/25/2016 12:07:26 AM","7 AV NE / NE 50 ST","U","U1","4500.1011",-122.3207,47.664955,"(47.664955, -122.3207)","TRAFFIC - BO SIGNALS AND DOWN SIGNS","TRAFFIC RELATED CALLS","TRAFFIC RELATED CALLS","",1303.47990792526,2016-03-25 00:07:26,2016-03-25
"205",33037,1700745,16000102762,2016102762,"220","CRISIS COMPLAINT - GENERAL","CRISIS CALL","BEHAVIORAL HEALTH","03/25/2016 12:33:24 AM","50XX BLOCK OF 25 AV NE","U","U1","4302.2007",-122.30071,47.665333,"(47.665333, -122.30071)","CRISIS - PERSON IN BEHAVIORAL/EMOTIONAL CRISIS","BEHAVIORAL HEALTH","CRISIS CALL","03/24/2016 11:10:00 PM",1229.91902543712,2016-03-25 00:33:24,2016-03-25
"206",33192,1689820,16000082837,201682837,"350","HAZARDS","HAZARDS","HAZARDS","03/08/2016 09:03:10 PM","45XX BLOCK OF UNIVERSITY WY NE","U","U2","5301.2010",-122.31312,47.66218,"(47.66218, -122.31312)","NUISANCE - MISCHIEF","MISCELLANEOUS MISDEMEANORS","MISCELLANEOUS MISDEMEANORS","03/08/2016 07:38:56 PM",738.963514898043,2016-03-08 21:03:10,2016-03-09
"207",33254,1689958,16000082917,201682917,"030","ARMED ROBBERY","GUN CALLS","ROBBERY","03/09/2016 02:16:09 AM","UNIVERSITY WY NE / NE RAVENNA BV","U","U1","4400.2022",-122.313034,47.670986,"(47.670986, -122.313034)","ROBBERY - IP/JO (INCLUDES STRONG ARM)","ROBBERY","ROBBERY","03/08/2016 09:09:37 PM",1687.21043073578,2016-03-09 02:16:09,2016-03-09
"208",33317,1694854,16000091907,201691907,"031","STRONG ARM ROBBERY","ROBBERY","ROBBERY","03/16/2016 03:24:47 AM","BROOKLYN AV NE / NE 47 ST","U","U2","5301.2008",-122.31424,47.663097,"(47.663097, -122.31424)","ROBBERY - IP/JO (INCLUDES STRONG ARM)","ROBBERY","ROBBERY","03/16/2016 01:53:29 AM",865.679337340903,2016-03-16 03:24:47,2016-03-16
"209",33361,1701215,16000100600,2016100600,"350","HAZARDS","HAZARDS","HAZARDS","03/23/2016 02:44:57 PM","NE 42 ST / BROOKLYN AV NE","U","U2","5301.3008",-122.31436,47.658325,"(47.658325, -122.31436)","WATER FLOODS (BROKEN MAINS/HYDRANTS, NO HAZ)","PUBLIC WATER","PUBLIC WATER","03/23/2016 05:30:43 AM",447.329259770333,2016-03-23 14:44:57,2016-03-23
"210",33545,1695282,16000092812,201692812,"350","HAZARDS","HAZARDS","HAZARDS","03/16/2016 05:35:51 PM","41XX BLOCK OF UNIVERSITY WY NE","U","U2","5301.4001",-122.313225,47.657574,"(47.657574, -122.313225)","HAZ - POTENTIAL THRT TO PHYS SAFETY (NO HAZMAT)","HAZARDS","HAZARDS","",330.036787270645,2016-03-16 17:35:51,2016-03-17
"211",33563,1695292,16000092601,201692601,"041","HARASSMENT, THREATS","THREATS, HARASSMENT","THREATS, HARASSMENT","03/16/2016 05:45:47 PM","52XX BLOCK OF 35 AV NE","U","U3","4200.4024",-122.290184,47.6676,"(47.6676, -122.290184)","HARAS - NO BIAS, THREATS OR MALICIOUSNESS","THREATS, HARASSMENT","THREATS, HARASSMENT","03/16/2016 04:31:07 PM",1941.23658051865,2016-03-16 17:45:47,2016-03-17
"212",33655,1708692,16000115833,2016115833,"041","HARASSMENT, THREATS","THREATS, HARASSMENT","THREATS, HARASSMENT","04/04/2016 02:46:26 PM","52XX BLOCK OF UNIVERSITY WY NE","U","U1","4400.4001",-122.313034,47.667492,"(47.667492, -122.313034)","THREATS (INCLS IN-PERSON/BY PHONE/IN WRITING)","THREATS, HARASSMENT","THREATS, HARASSMENT","04/04/2016 01:28:58 PM",1305.00522461218,2016-04-04 14:46:26,2016-04-04
"213",33678,1695457,16000092864,201692864,"041","HARASSMENT, THREATS","THREATS, HARASSMENT","THREATS, HARASSMENT","03/16/2016 09:10:10 PM","47XX BLOCK OF UNIVERSITY WY NE","U","U2","5301.2001",-122.31309,47.663998,"(47.663998, -122.31309)","DISTURBANCE, MISCELLANEOUS/OTHER","DISTURBANCES","DISTURBANCES","03/16/2016 06:04:05 PM",929.234922041086,2016-03-16 21:10:10,2016-03-17
"214",33801,1690851,16000084581,201684581,"350","HAZARDS","HAZARDS","HAZARDS","03/10/2016 12:47:00 PM","25 AV NE / NE 45 ST","U","U2","5302.3010",-122.3009,47.66125,"(47.66125, -122.3009)","TREES DOWN, OBSTRUCTING PUBLIC PROP (NO HAZ)","TREES DOWN","TREES DOWN","03/10/2016 09:20:21 AM",870.654377405696,2016-03-10 12:47:00,2016-03-10
"215",33867,1709054,16000116646,2016116646,"041","HARASSMENT, THREATS","THREATS, HARASSMENT","THREATS, HARASSMENT","04/05/2016 04:16:56 AM","73XX BLOCK OF ROOSEVELT WY NE","U","U1","2600.2018",-122.31747,47.681892,"(47.681892, -122.31747)","TRESPASS","TRESPASS","TRESPASS","04/05/2016 03:00:31 AM",2940.3413275696,2016-04-05 04:16:56,2016-04-05
"216",33875,1695810,16000090899,201690899,"041","HARASSMENT, THREATS","THREATS, HARASSMENT","THREATS, HARASSMENT","03/15/2016 11:27:13 AM","55XX BLOCK OF UNIVERSITY WY NE","U","U1","4400.2024",-122.31302,47.668995,"(47.668995, -122.31302)","THREATS (INCLS IN-PERSON/BY PHONE/IN WRITING)","THREATS, HARASSMENT","THREATS, HARASSMENT","03/15/2016 10:27:39 AM",1468.82405401477,2016-03-15 11:27:13,2016-03-15
"217",34016,1696025,16000094032,201694032,"220","CRISIS COMPLAINT - GENERAL","CRISIS CALL","BEHAVIORAL HEALTH","03/17/2016 05:01:47 PM","48XX BLOCK OF SAND POINT WY NE","U","U3","4100.4008",-122.28316,47.66458,"(47.66458, -122.28316)","AWOL - ADULT OR JUVENILE","PERSONS - LOST, FOUND, MISSING","PERSONS - LOST, FOUND, MISSING","",2196.47452707793,2016-03-17 17:01:47,2016-03-18
"218",34087,1702004,16000104256,2016104256,"031","STRONG ARM ROBBERY","ROBBERY","ROBBERY","03/26/2016 04:35:12 AM","UNIVERSITY WY NE / NE 43 ST","U","U2","5301.3008",-122.31317,47.659794,"(47.659794, -122.31317)","ROBBERY - IP/JO (INCLUDES STRONG ARM)","ROBBERY","ROBBERY","03/26/2016 02:14:04 AM",503.925729388642,2016-03-26 04:35:12,2016-03-26
"219",34199,1702256,16000104496,2016104496,"041","HARASSMENT, THREATS","THREATS, HARASSMENT","THREATS, HARASSMENT","03/26/2016 03:23:33 PM","22XX BLOCK OF NE 88 ST","U","U1","2100.3008",-122.305016,47.69211,"(47.69211, -122.305016)","THREATS (INCLS IN-PERSON/BY PHONE/IN WRITING)","THREATS, HARASSMENT","THREATS, HARASSMENT","03/26/2016 02:04:10 PM",4028.94904527722,2016-03-26 15:23:33,2016-03-26
"220",34327,1696273,16000094428,201694428,"220","CRISIS COMPLAINT - GENERAL","CRISIS CALL","BEHAVIORAL HEALTH","03/17/2016 11:24:15 PM","47XX BLOCK OF 12 AV NE","U","U2","5301.2004",-122.315254,47.664013,"(47.664013, -122.315254)","DISTURBANCE, MISCELLANEOUS/OTHER","DISTURBANCES","DISTURBANCES","03/17/2016 10:31:39 PM",990.218839131712,2016-03-17 23:24:15,2016-03-18
"221",34334,1702539,16000105172,2016105172,"041","HARASSMENT, THREATS","THREATS, HARASSMENT","THREATS, HARASSMENT","03/26/2016 11:01:32 PM","45XX BLOCK OF UNIVERSITY WY NE","U","U2","5301.2010",-122.31312,47.66218,"(47.66218, -122.31312)","THREATS (INCLS IN-PERSON/BY PHONE/IN WRITING)","THREATS, HARASSMENT","THREATS, HARASSMENT","03/26/2016 08:36:30 PM",738.963514898043,2016-03-26 23:01:32,2016-03-27
"222",34376,1691735,16000085978,201685978,"041","HARASSMENT, THREATS","THREATS, HARASSMENT","THREATS, HARASSMENT","03/11/2016 04:54:45 PM","55XX BLOCK OF 35 AV NE","U","U3","4200.5024",-122.2902,47.669415,"(47.669415, -122.2902)","HARAS - NO BIAS, THREATS OR MALICIOUSNESS","THREATS, HARASSMENT","THREATS, HARASSMENT","03/11/2016 01:00:58 PM",2079.92688073839,2016-03-11 16:54:45,2016-03-12
"223",34382,1709921,16000118207,2016118207,"220","CRISIS COMPLAINT - GENERAL","CRISIS CALL","BEHAVIORAL HEALTH","04/06/2016 01:22:41 PM","47XX BLOCK OF 12 AV NE","U","U2","5301.2004",-122.315254,47.664013,"(47.664013, -122.315254)","CRISIS - PERSON IN BEHAVIORAL/EMOTIONAL CRISIS","BEHAVIORAL HEALTH","CRISIS CALL","04/06/2016 12:27:49 PM",990.218839131712,2016-04-06 13:22:41,2016-04-06
"224",34597,1702791,16000105620,2016105620,"030","ARMED ROBBERY","GUN CALLS","ROBBERY","03/27/2016 10:04:38 AM","72XX BLOCK OF SAND POINT WY NE","U","U3","4000.1027",-122.26365,47.680744,"(47.680744, -122.26365)","ROBBERY - IP/JO (INCLUDES STRONG ARM)","ROBBERY","ROBBERY","03/27/2016 06:36:43 AM",4407.49759113064,2016-03-27 10:04:38,2016-03-27
"225",34600,1696407,16000094591,201694591,"031","STRONG ARM ROBBERY","ROBBERY","ROBBERY","03/18/2016 04:08:07 AM","45XX BLOCK OF 16 AV NE","U","U2","5301.1005",-122.310844,47.662167,"(47.662167, -122.310844)","DISTURBANCE, MISCELLANEOUS/OTHER","DISTURBANCES","DISTURBANCES","03/18/2016 02:47:42 AM",693.062105557224,2016-03-18 04:08:07,2016-03-18
"226",34726,1696544,16000094789,201694789,"041","HARASSMENT, THREATS","THREATS, HARASSMENT","THREATS, HARASSMENT","03/18/2016 10:57:45 AM","54XX BLOCK OF 26 AV NE","U","U3","4301.1002",-122.29956,47.66826,"(47.66826, -122.29956)","THREATS (INCLS IN-PERSON/BY PHONE/IN WRITING)","THREATS, HARASSMENT","THREATS, HARASSMENT","03/18/2016 08:59:36 AM",1554.18707515918,2016-03-18 10:57:45,2016-03-18
"227",34787,1710434,16000119078,2016119078,"220","CRISIS COMPLAINT - GENERAL","CRISIS CALL","BEHAVIORAL HEALTH","04/07/2016 04:22:12 AM","56XX BLOCK OF UNIVERSITY WY NE","U","U1","4400.2029",-122.31303,47.670216,"(47.670216, -122.31303)","CRISIS - PERSON IN BEHAVIORAL/EMOTIONAL CRISIS","BEHAVIORAL HEALTH","CRISIS CALL","",1602.67210487326,2016-04-07 04:22:12,2016-04-07
"228",34788,1710450,16000118241,2016118241,"220","CRISIS COMPLAINT - GENERAL","CRISIS CALL","BEHAVIORAL HEALTH","04/07/2016 05:33:08 AM","NE 65 ST / ROOSEVELT WY NE","U","U1","3600.1021",-122.31737,47.675827,"(47.675827, -122.31737)","CRISIS - PERSON IN BEHAVIORAL/EMOTIONAL CRISIS","BEHAVIORAL HEALTH","CRISIS CALL","04/06/2016 12:38:47 PM",2282.31072452365,2016-04-07 05:33:08,2016-04-07
"229",34797,1710457,16000118168,2016118168,"220","CRISIS COMPLAINT - GENERAL","CRISIS CALL","BEHAVIORAL HEALTH","04/07/2016 06:04:32 AM","NE 65 ST / ROOSEVELT WY NE","U","U1","3600.1021",-122.31737,47.675827,"(47.675827, -122.31737)","CRISIS - PERSON IN BEHAVIORAL/EMOTIONAL CRISIS","BEHAVIORAL HEALTH","CRISIS CALL","04/06/2016 11:30:33 AM",2282.31072452365,2016-04-07 06:04:32,2016-04-07
"230",34807,1703247,16000106414,2016106414,"220","CRISIS COMPLAINT - GENERAL","CRISIS CALL","BEHAVIORAL HEALTH","03/28/2016 05:05:48 AM","NE 50 ST / UNIVERSITY WY NE","U","U1","4400.4009",-122.31307,47.664898,"(47.664898, -122.31307)","DOWN - CHECK FOR PERSON DOWN","PERSON DOWN/INJURY","CASUALTIES","03/28/2016 03:38:38 AM",1025.0108407033,2016-03-28 05:05:48,2016-03-28
"231",34885,1696862,16000095380,201695380,"350","HAZARDS","HAZARDS","HAZARDS","03/18/2016 08:18:10 PM","70XX BLOCK OF 19 AV NE","U","U1","2600.201",-122.30774,47.680347,"(47.680347, -122.30774)","WIRES DOWN (PHONE, ELECTRICAL,ETC.)","HAZARDS","HAZARDS","",2710.21876954714,2016-03-18 20:18:10,2016-03-19
"232",35155,1711407,16000125021,2016125021,"041","HARASSMENT, THREATS","THREATS, HARASSMENT","THREATS, HARASSMENT","04/11/2016 05:31:47 PM","57XX BLOCK OF 28 AV NE","U","U3","4301.2009",-122.29727,47.67035,"(47.67035, -122.29727)","THREATS (INCLS IN-PERSON/BY PHONE/IN WRITING)","THREATS, HARASSMENT","THREATS, HARASSMENT","04/11/2016 04:10:30 PM",1841.03014811086,2016-04-11 17:31:47,2016-04-12
"233",35209,1711538,16000125181,2016125181,"220","CRISIS COMPLAINT - GENERAL","CRISIS CALL","BEHAVIORAL HEALTH","04/11/2016 07:53:10 PM","45XX BLOCK OF UNIVERSITY WY NE","U","U2","5301.2009",-122.31312,47.66218,"(47.66218, -122.31312)","SUSPICIOUS STOP - OFFICER INITIATED ONVIEW","SUSPICIOUS CIRCUMSTANCES","SUSPICIOUS CIRCUMSTANCES","04/11/2016 05:47:39 PM",738.963514898043,2016-04-11 19:53:10,2016-04-12
"234",35234,1697494,16000096099,201696099,"350","HAZARDS","HAZARDS","HAZARDS","03/19/2016 05:08:53 PM","12 AV NE / NE 70 ST","U","U1","2600.3005",-122.31567,47.67945,"(47.67945, -122.31567)","TRAFFIC - BO SIGNALS AND DOWN SIGNS","TRAFFIC RELATED CALLS","TRAFFIC RELATED CALLS","03/19/2016 08:04:25 AM",2648.12005497198,2016-03-19 17:08:53,2016-03-20
"235",35264,1711669,16000125299,2016125299,"220","CRISIS COMPLAINT - GENERAL","CRISIS CALL","BEHAVIORAL HEALTH","04/11/2016 10:02:52 PM","41XX BLOCK OF UNIVERSITY WY NE","U","U2","5301.4001",-122.313225,47.657574,"(47.657574, -122.313225)","TRESPASS","TRESPASS","TRESPASS","04/11/2016 08:02:52 PM",330.036787270645,2016-04-11 22:02:52,2016-04-12
"236",35364,1697609,16000096166,201696166,"041","HARASSMENT, THREATS","THREATS, HARASSMENT","THREATS, HARASSMENT","03/19/2016 04:33:27 PM","89XX BLOCK OF 25 AV NE","U","U3","2100.3010",-122.30149,47.691933,"(47.691933, -122.30149)","THREATS (INCLS IN-PERSON/BY PHONE/IN WRITING)","THREATS, HARASSMENT","THREATS, HARASSMENT","03/19/2016 03:57:50 PM",4040.20086333903,2016-03-19 16:33:27,2016-03-19
"237",35373,1704926,16000109254,2016109254,"031","STRONG ARM ROBBERY","ROBBERY","ROBBERY","03/30/2016 02:36:47 PM","45XX BLOCK OF UNIVERSITY WY NE","U","U2","5301.2009",-122.31312,47.66218,"(47.66218, -122.31312)","SHOPLIFT - THEFT","SHOPLIFTING","THEFT","03/30/2016 12:10:18 PM",738.963514898043,2016-03-30 14:36:47,2016-03-30
"238",35399,1712743,16000126106,2016126106,"041","HARASSMENT, THREATS","THREATS, HARASSMENT","THREATS, HARASSMENT","04/12/2016 03:13:27 PM","NE 65 ST / 9 AV NE","U","U1","3600.1020",-122.3187,47.67584,"(47.67584, -122.3187)","DISTURBANCE, MISCELLANEOUS/OTHER","DISTURBANCES","DISTURBANCES","04/12/2016 01:41:41 PM",2311.57577100386,2016-04-12 15:13:27,2016-04-12
"239",35402,1697941,16000097012,201697012,"030","ARMED ROBBERY","GUN CALLS","ROBBERY","03/20/2016 03:21:28 AM","72XX BLOCK OF SAND POINT WY NE","U","U3","4000.1027",-122.26365,47.680744,"(47.680744, -122.26365)","ROBBERY - IP/JO (INCLUDES STRONG ARM)","ROBBERY","ROBBERY","03/19/2016 10:38:12 PM",4407.49759113064,2016-03-20 03:21:28,2016-03-20
"240",35405,1697954,16000096132,201696132,"341","HARBOR - DEBRIS, NAVIGATIONAL HAZARDS","HARBOR CALLS","HARBOR CALLS","03/19/2016 01:09:46 PM","17XX BLOCK OF NE COLUMBIA RD","U","U2","5302.2018",-122.30977,47.649837,"(47.649837, -122.30977)","HARBOR - WATER DEBRIS, NAVIGATIONAL HAZARDS","HARBOR CALLS","HARBOR CALLS","03/19/2016 08:48:14 AM",685.524471662325,2016-03-19 13:09:46,2016-03-19
"241",35524,1698296,16000097684,201697684,"041","HARASSMENT, THREATS","THREATS, HARASSMENT","THREATS, HARASSMENT","03/20/2016 06:48:15 PM","NE 65 ST / SAND POINT WY NE","U","U3","4000.1028",-122.26355,47.67572,"(47.67572, -122.26355)","HARAS - NO BIAS, THREATS OR MALICIOUSNESS","THREATS, HARASSMENT","THREATS, HARASSMENT","03/20/2016 04:02:27 PM",4088.70072901588,2016-03-20 18:48:15,2016-03-21
"242",35646,1698678,16000098484,201698484,"220","CRISIS COMPLAINT - GENERAL","CRISIS CALL","BEHAVIORAL HEALTH","03/21/2016 02:59:06 PM","45XX BLOCK OF UNIVERSITY WY NE","U","U2","5301.2010",-122.31312,47.66218,"(47.66218, -122.31312)","ASLT - WITH OR W/O WEAPONS (NO SHOOTINGS)","ASSAULTS","ASSAULTS","03/21/2016 11:54:23 AM",738.963514898043,2016-03-21 14:59:06,2016-03-21
"243",35651,1713640,16000127566,2016127566,"220","CRISIS COMPLAINT - GENERAL","CRISIS CALL","BEHAVIORAL HEALTH","04/13/2016 08:03:57 PM","30XX BLOCK OF WEBSTER POINT RD NE","U","U3","4100.6020",-122.27754,47.64912,"(47.64912, -122.27754)","SUSPICIOUS PERSON, VEHICLE OR INCIDENT","SUSPICIOUS CIRCUMSTANCES","SUSPICIOUS CIRCUMSTANCES","04/13/2016 05:13:28 PM",2519.90478221886,2016-04-13 20:03:57,2016-04-14
"244",35674,1713712,16000127757,2016127757,"220","CRISIS COMPLAINT - GENERAL","CRISIS CALL","BEHAVIORAL HEALTH","04/13/2016 09:41:23 PM","45XX BLOCK OF 20 AV NE","U","U1","4302.1009",-122.306526,47.662167,"(47.662167, -122.306526)","FOUND - PERSON","PERSONS - LOST, FOUND, MISSING","PERSONS - LOST, FOUND, MISSING","04/13/2016 08:08:15 PM",721.14351398363,2016-04-13 21:41:23,2016-04-14
"245",35690,1713790,16000128002,2016128002,"350","HAZARDS","HAZARDS","HAZARDS","04/14/2016 01:04:28 AM","NE 45 ST / 7 AV NE","U","U2","5200.1000",-122.32073,47.661316,"(47.661316, -122.32073)","HAZ - POTENTIAL THRT TO PHYS SAFETY (NO HAZMAT)","HAZARDS","HAZARDS","",1030.01436970243,2016-04-14 01:04:28,2016-04-14
"246",35702,1713869,16000128057,2016128057,"350","HAZARDS","HAZARDS","HAZARDS","04/14/2016 03:42:32 AM","35 AV NE / NE 70 ST","U","U3","3900.1004",-122.290375,47.679413,"(47.679413, -122.290375)","HAZ - POTENTIAL THRT TO PHYS SAFETY (NO HAZMAT)","HAZARDS","HAZARDS","",2973.12646653377,2016-04-14 03:42:32,2016-04-14
"247",35706,1713874,16000128062,2016128062,"350","HAZARDS","HAZARDS","HAZARDS","04/14/2016 03:48:44 AM","NE 55 ST / 35 AV NE","U","U3","4200.4024",-122.29019,47.66851,"(47.66851, -122.29019)","SUSPICIOUS STOP - OFFICER INITIATED ONVIEW","SUSPICIOUS CIRCUMSTANCES","SUSPICIOUS CIRCUMSTANCES","",2009.54605492854,2016-04-14 03:48:44,2016-04-14
"248",35807,1714605,16000129332,2016129332,"242","FIGHT DISTURBANCE","DISTURBANCES","DISTURBANCES","04/15/2016 01:53:30 AM","45XX BLOCK OF 15 AV NE","U","U2","5301.2010",-122.31198,47.662174,"(47.662174, -122.31198)","FIGHT - VERBAL/ORAL (NO WEAPONS)","DISTURBANCES","DISTURBANCES","",711.276158808105,2016-04-15 01:53:30,2016-04-15
"249",35809,1714630,16000129356,2016129356,"030","ARMED ROBBERY","GUN CALLS","ROBBERY","04/15/2016 03:26:03 AM","47XX BLOCK OF BROOKLYN AV NE","U","U2","5301.2002",-122.314224,47.664005,"(47.664005, -122.314224)","ROBBERY - IP/JO (INCLUDES STRONG ARM)","ROBBERY","ROBBERY","04/15/2016 02:26:10 AM",958.152960945758,2016-04-15 03:26:03,2016-04-15
"250",35817,1714736,16000126631,2016126631,"350","HAZARDS","HAZARDS","HAZARDS","04/13/2016 05:33:55 AM","NE 70 ST / 12 AV NE","U","U1","2600.3005",-122.31567,47.67945,"(47.67945, -122.31567)","TRAFFIC - BO SIGNALS AND DOWN SIGNS","TRAFFIC RELATED CALLS","TRAFFIC RELATED CALLS","",2648.12005497198,2016-04-13 05:33:55,2016-04-13
"251",35825,1715073,16000130041,2016130041,"220","CRISIS COMPLAINT - GENERAL","CRISIS CALL","BEHAVIORAL HEALTH","04/15/2016 05:27:05 PM","38XX BLOCK OF NE 89 ST","U","U3","2200.2009",-122.28664,47.693085,"(47.693085, -122.28664)","PROPERTY - DAMAGE","PROPERTY DAMAGE","PROPERTY DAMAGE","04/15/2016 02:40:41 PM",4466.32982079948,2016-04-15 17:27:05,2016-04-16
"252",35837,1715277,16000130130,2016130130,"041","HARASSMENT, THREATS","THREATS, HARASSMENT","THREATS, HARASSMENT","04/15/2016 10:24:40 PM","45XX BLOCK OF UNIVERSITY WY NE","U","U2","5301.2009",-122.31312,47.66218,"(47.66218, -122.31312)","THREATS (INCLS IN-PERSON/BY PHONE/IN WRITING)","THREATS, HARASSMENT","THREATS, HARASSMENT","04/15/2016 05:34:19 PM",738.963514898043,2016-04-15 22:24:40,2016-04-16
"253",35838,1715283,16000130546,2016130546,"041","HARASSMENT, THREATS","THREATS, HARASSMENT","THREATS, HARASSMENT","04/15/2016 10:36:03 PM","NE 42 ST / 9 AV NE","U","U2","5200.2002",-122.318794,47.657513,"(47.657513, -122.318794)","THREATS (INCLS IN-PERSON/BY PHONE/IN WRITING)","THREATS, HARASSMENT","THREATS, HARASSMENT","04/15/2016 09:41:37 PM",718.136659223066,2016-04-15 22:36:03,2016-04-16
"254",35842,1715385,16000130720,2016130720,"220","CRISIS COMPLAINT - GENERAL","CRISIS CALL","BEHAVIORAL HEALTH","04/16/2016 12:35:48 AM","NE CAMPUS PY / UNIVERSITY WY NE","U","U2","5302.1009",-122.31326,47.656216,"(47.656216, -122.31326)","THREATS (INCLS IN-PERSON/BY PHONE/IN WRITING)","THREATS, HARASSMENT","THREATS, HARASSMENT","04/15/2016 11:20:31 PM",283.470141601472,2016-04-16 00:35:48,2016-04-16
"255",35869,1832651,16000334361,2016334361,"242","FIGHT DISTURBANCE","DISTURBANCES","DISTURBANCES","09/15/2016 01:23:03 AM","42XX BLOCK OF UNIVERSITY WY NE","U","U2","5301.3008",-122.31363,47.65902,"(47.65902, -122.31363)","FIGHT - IP - PHYSICAL (NO WEAPONS)","DISTURBANCES","DISTURBANCES","09/15/2016 01:19:37 AM",457.156052075125,2016-09-15 01:23:03,2016-09-15
"256",35904,1957328,17000094319,201794319,"220","CRISIS COMPLAINT - GENERAL","CRISIS CALL","BEHAVIORAL HEALTH","03/17/2017 09:12:34 AM","NE 43 ST / 15 AV NE","U","U2","5301.3",-122.312035,47.65978,"(47.65978, -122.312035)","HAZ - POTENTIAL THRT TO PHYS SAFETY (NO HAZMAT)","HAZARDS","HAZARDS","03/17/2017 07:39:18 AM",461.401351808126,2017-03-17 09:12:34,2017-03-17
"257",35905,1833035,16000334928,2016334928,"220","CRISIS COMPLAINT - GENERAL","CRISIS CALL","BEHAVIORAL HEALTH","09/15/2016 01:18:55 PM","54XX BLOCK OF SAND POINT WY NE","U","U3","4100.4000",-122.27433,47.66803,"(47.66803, -122.27433)","TRESPASS","TRESPASS","TRESPASS","",2960.98593055362,2016-09-15 13:18:55,2016-09-15
"258",35920,1761820,16000211566,2016211566,"220","CRISIS COMPLAINT - GENERAL","CRISIS CALL","BEHAVIORAL HEALTH","06/14/2016 08:13:51 PM","ROOSEVELT WY NE / NE 45 ST","U","U2","5301.2006",-122.31764,47.661297,"(47.661297, -122.31764)","HAZ - POTENTIAL THRT TO PHYS SAFETY (NO HAZMAT)","HAZARDS","HAZARDS","06/14/2016 03:54:14 PM",848.950730071322,2016-06-14 20:13:51,2016-06-15
"259",35936,1832906,16000334708,2016334708,"220","CRISIS COMPLAINT - GENERAL","CRISIS CALL","BEHAVIORAL HEALTH","09/15/2016 09:57:05 AM","42XX BLOCK OF ROOSEVELT WY NE","U","U2","5200.2000",-122.3183,47.65884,"(47.65884, -122.3183)","CRISIS - PERSON IN BEHAVIORAL/EMOTIONAL CRISIS","BEHAVIORAL HEALTH","CRISIS CALL","",732.583037354151,2016-09-15 09:57:05,2016-09-15
"260",35997,1832741,16000334207,2016334207,"041","HARASSMENT, THREATS","THREATS, HARASSMENT","THREATS, HARASSMENT","09/15/2016 12:01:44 AM","86XX BLOCK OF 35 AV NE","U","U3","2200.3018",-122.290375,47.691296,"(47.691296, -122.290375)","THREATS (INCLS IN-PERSON/BY PHONE/IN WRITING)","THREATS, HARASSMENT","THREATS, HARASSMENT","09/14/2016 09:22:58 PM",4178.89382773064,2016-09-15 00:01:44,2016-09-15
"261",36007,1773654,16000232152,2016232152,"350","HAZARDS","HAZARDS","HAZARDS","06/30/2016 01:30:53 AM","19XX BLOCK OF NE PACIFIC ST","U","U2","5302.2019",-122.30912,47.651302,"(47.651302, -122.30912)","HAZ - POTENTIAL THRT TO PHYS SAFETY (NO HAZMAT)","HAZARDS","HAZARDS","",523.119956824004,2016-06-30 01:30:53,2016-06-30
"262",36008,1773657,16000232179,2016232179,"350","HAZARDS","HAZARDS","HAZARDS","06/30/2016 01:53:46 AM","NE 43 ST / 12 AV NE","U","U2","5301.3002",-122.31548,47.65982,"(47.65982, -122.31548)","HAZ - POTENTIAL THRT TO PHYS SAFETY (NO HAZMAT)","HAZARDS","HAZARDS","",618.199579833197,2016-06-30 01:53:46,2016-06-30
"263",36024,1729833,16000155566,2016155566,"220","CRISIS COMPLAINT - GENERAL","CRISIS CALL","BEHAVIORAL HEALTH","05/05/2016 06:52:04 AM","10XX BLOCK OF NE 50 ST","U","U1","4400.4005",-122.31687,47.664932,"(47.664932, -122.31687)","DISTURBANCE, MISCELLANEOUS/OTHER","DISTURBANCES","DISTURBANCES","05/05/2016 04:10:13 AM",1136.96666175032,2016-05-05 06:52:04,2016-05-05
"264",36026,1729794,16000155521,2016155521,"030","ARMED ROBBERY","GUN CALLS","ROBBERY","05/05/2016 03:30:05 AM","15XX BLOCK OF NE 50 ST","U","U2","5301.2000",-122.31137,47.66489,"(47.66489, -122.31137)","ROBBERY - IP/JO (INCLUDES STRONG ARM)","ROBBERY","ROBBERY","05/05/2016 01:35:51 AM",998.353752852913,2016-05-05 03:30:05,2016-05-05
"265",36051,1773528,16000231858,2016231858,"041","HARASSMENT, THREATS","THREATS, HARASSMENT","THREATS, HARASSMENT","06/29/2016 10:20:38 PM","47XX BLOCK OF UNIVERSITY WY NE","U","U2","5301.2001",-122.31309,47.663998,"(47.663998, -122.31309)","THREATS (INCLS IN-PERSON/BY PHONE/IN WRITING)","THREATS, HARASSMENT","THREATS, HARASSMENT","06/29/2016 08:12:16 PM",929.234922041086,2016-06-29 22:20:38,2016-06-30
"266",36087,1715828,16000131584,2016131584,"350","HAZARDS","HAZARDS","HAZARDS","04/16/2016 05:44:02 PM","BROOKLYN AV NE / NE 62 ST","U","U1","4400.2009",-122.31433,47.673332,"(47.673332, -122.31433)","TRAFFIC - BO SIGNALS AND DOWN SIGNS","TRAFFIC RELATED CALLS","TRAFFIC RELATED CALLS","",1960.88649387326,2016-04-16 17:44:02,2016-04-17
"267",36095,1715871,16000131605,2016131605,"242","FIGHT DISTURBANCE","DISTURBANCES","DISTURBANCES","04/16/2016 06:24:39 PM","42XX BLOCK OF UNIVERSITY WY NE","U","U2","5301.3008",-122.31319,47.659054,"(47.659054, -122.31319)","FIGHT - IP - PHYSICAL (NO WEAPONS)","DISTURBANCES","DISTURBANCES","",438.325335850633,2016-04-16 18:24:39,2016-04-17
"268",36097,1715881,16000131647,2016131647,"350","HAZARDS","HAZARDS","HAZARDS","04/16/2016 06:41:50 PM","NE 70 ST / 42 AV NE","U","U3","3900.1012",-122.283875,47.679413,"(47.679413, -122.283875)","HAZ - POTENTIAL THRT TO PHYS SAFETY (NO HAZMAT)","HAZARDS","HAZARDS","",3237.3080518789,2016-04-16 18:41:50,2016-04-17
"269",36101,1716004,16000131782,2016131782,"350","HAZARDS","HAZARDS","HAZARDS","04/16/2016 09:33:30 PM","73XX BLOCK OF 39 AV NE","U","U3","3900.1002",-122.28643,47.682137,"(47.682137, -122.28643)","HAZ - POTENTIAL THRT TO PHYS SAFETY (NO HAZMAT)","HAZARDS","HAZARDS","",3383.30817796479,2016-04-16 21:33:30,2016-04-17
"270",36131,1716358,16000132367,2016132367,"220","CRISIS COMPLAINT - GENERAL","CRISIS CALL","BEHAVIORAL HEALTH","04/17/2016 11:54:39 AM","45XX BLOCK OF 15 AV NE","U","U2","5301.2011",-122.31198,47.662174,"(47.662174, -122.31198)","CRISIS - PERSON IN BEHAVIORAL/EMOTIONAL CRISIS","BEHAVIORAL HEALTH","CRISIS CALL","",711.276158808105,2016-04-17 11:54:39,2016-04-17
"271",36148,1716702,16000132919,2016132919,"220","CRISIS COMPLAINT - GENERAL","CRISIS CALL","BEHAVIORAL HEALTH","04/17/2016 10:39:33 PM","17 AV NE / NE 47 ST","U","U2","5301.1005",-122.309685,47.663055,"(47.663055, -122.309685)","HAZ - POTENTIAL THRT TO PHYS SAFETY (NO HAZMAT)","HAZARDS","HAZARDS","04/17/2016 09:56:44 PM",784.524057458698,2016-04-17 22:39:33,2016-04-18
"272",36157,1716807,16000133015,2016133015,"220","CRISIS COMPLAINT - GENERAL","CRISIS CALL","BEHAVIORAL HEALTH","04/18/2016 01:05:43 AM","47XX BLOCK OF 12 AV NE","U","U2","5301.2003",-122.315254,47.664013,"(47.664013, -122.315254)","CRISIS - PERSON IN BEHAVIORAL/EMOTIONAL CRISIS","BEHAVIORAL HEALTH","CRISIS CALL","04/18/2016 12:01:17 AM",990.218839131712,2016-04-18 01:05:43,2016-04-18
"273",36184,1717243,16000133852,2016133852,"031","STRONG ARM ROBBERY","ROBBERY","ROBBERY","04/18/2016 06:50:21 PM","45XX BLOCK OF UNIVERSITY WY NE","U","U2","5301.2009",-122.31312,47.66218,"(47.66218, -122.31312)","ROBBERY - IP/JO (INCLUDES STRONG ARM)","ROBBERY","ROBBERY","04/18/2016 04:02:39 PM",738.963514898043,2016-04-18 18:50:21,2016-04-19
"274",36185,1717258,16000134132,2016134132,"350","HAZARDS","HAZARDS","HAZARDS","04/18/2016 08:12:08 PM","NE RAVENNA BV / ROOSEVELT WY NE","U","U1","4500.1000",-122.31737,47.672012,"(47.672012, -122.31737)","TRAFFIC - BLOCKING ROADWAY","TRAFFIC RELATED CALLS","TRAFFIC RELATED CALLS","",1875.84195757599,2016-04-18 20:12:08,2016-04-19
"275",36191,1717294,16000133642,2016133642,"041","HARASSMENT, THREATS","THREATS, HARASSMENT","THREATS, HARASSMENT","04/18/2016 07:04:07 PM","46XX BLOCK OF 26 AV NE","U","U3","4301.1016",-122.299866,47.662052,"(47.662052, -122.299866)","HARAS - NO BIAS, THREATS OR MALICIOUSNESS","THREATS, HARASSMENT","THREATS, HARASSMENT","04/18/2016 04:48:04 PM",988.161843606159,2016-04-18 19:04:07,2016-04-19
"276",36193,1717317,16000133574,2016133574,"242","FIGHT DISTURBANCE","DISTURBANCES","DISTURBANCES","04/18/2016 06:15:07 PM","42XX BLOCK OF UNIVERSITY WY NE","U","U2","5301.3009",-122.31319,47.659054,"(47.659054, -122.31319)","FIGHT - IP - PHYSICAL (NO WEAPONS)","DISTURBANCES","DISTURBANCES","04/18/2016 12:29:56 PM",438.325335850633,2016-04-18 18:15:07,2016-04-19
"277",36208,1822809,16000314948,2016314948,"041","HARASSMENT, THREATS","THREATS, HARASSMENT","THREATS, HARASSMENT","08/31/2016 12:53:42 AM","52XX BLOCK OF MITHUN PL NE","U","U3","4200.2023",-122.28154,47.667786,"(47.667786, -122.28154)","THREATS (INCLS IN-PERSON/BY PHONE/IN WRITING)","THREATS, HARASSMENT","THREATS, HARASSMENT","08/30/2016 10:42:24 PM",2475.41708107211,2016-08-31 00:53:42,2016-08-31
"278",36210,1717705,16000134466,2016134466,"220","CRISIS COMPLAINT - GENERAL","CRISIS CALL","BEHAVIORAL HEALTH","04/19/2016 05:30:09 AM","42XX BLOCK OF UNIVERSITY WY NE","U","U2","5301.3009",-122.31319,47.659054,"(47.659054, -122.31319)","SUSPICIOUS PERSON, VEHICLE OR INCIDENT","SUSPICIOUS CIRCUMSTANCES","SUSPICIOUS CIRCUMSTANCES","04/19/2016 04:53:19 AM",438.325335850633,2016-04-19 05:30:09,2016-04-19
"279",36281,2088811,17000334059,2017334059,"350","HAZARDS","HAZARDS","HAZARDS","09/08/2017 12:02:41 PM","ROOSEVELT WY NE / NE 50 ST","U","U2","5200.5",-122.317406,47.664936,"(47.664936, -122.317406)","WATER FLOODS (BROKEN MAINS/HYDRANTS, NO HAZ)","PUBLIC WATER","PUBLIC WATER","",1157.48588512645,2017-09-08 12:02:41,2017-09-08
"280",36304,1784382,16000249853,2016249853,"220","CRISIS COMPLAINT - GENERAL","CRISIS CALL","BEHAVIORAL HEALTH","07/12/2016 07:37:19 PM","70XX BLOCK OF RAVENNA AV NE","U","U1","2500.2007",-122.303925,47.68032,"(47.68032, -122.303925)","SUSPICIOUS PERSON, VEHICLE OR INCIDENT","SUSPICIOUS CIRCUMSTANCES","SUSPICIOUS CIRCUMSTANCES","07/12/2016 06:10:15 PM",2736.21597822579,2016-07-12 19:37:19,2016-07-13
"281",36310,1832810,16000334090,2016334090,"220","CRISIS COMPLAINT - GENERAL","CRISIS CALL","BEHAVIORAL HEALTH","09/15/2016 02:59:44 AM","39XX BLOCK OF NE 45 ST","U","U3","4100.5002",-122.28577,47.660854,"(47.660854, -122.28577)","CRISIS - PERSON IN BEHAVIORAL/EMOTIONAL CRISIS","BEHAVIORAL HEALTH","CRISIS CALL","09/15/2016 12:17:31 AM",1862.42553352032,2016-09-15 02:59:44,2016-09-15
"282",36333,1761965,16000212033,2016212033,"030","ARMED ROBBERY","GUN CALLS","ROBBERY","06/14/2016 11:37:15 PM","NE 47 ST / UNIVERSITY WY NE","U","U2","5301.2010",-122.3131,47.66309,"(47.66309, -122.3131)","ROBBERY - IP/JO (INCLUDES STRONG ARM)","ROBBERY","ROBBERY","06/14/2016 09:55:21 PM",833.383876029379,2016-06-14 23:37:15,2016-06-15
"283",36350,1845000,16000354296,2016354296,"242","FIGHT DISTURBANCE","DISTURBANCES","DISTURBANCES","09/30/2016 04:50:44 AM","NE 50 ST / UNIVERSITY WY NE","U","U1","4400.4009",-122.31307,47.664898,"(47.664898, -122.31307)","ASLT - IP/JO - WITH OR W/O WPNS (NO SHOOTINGS)","ASSAULTS","ASSAULTS","09/30/2016 02:52:01 AM",1025.0108407033,2016-09-30 04:50:44,2016-09-30
"284",36351,1992308,17000159111,2017159111,"220","CRISIS COMPLAINT - GENERAL","CRISIS CALL","BEHAVIORAL HEALTH","05/06/2017 07:36:16 PM","74XX BLOCK OF 25 AV NE","U","U1","2500.2",-122.30074,47.682537,"(47.682537, -122.30074)","SUSPICIOUS PERSON, VEHICLE OR INCIDENT","SUSPICIOUS CIRCUMSTANCES","SUSPICIOUS CIRCUMSTANCES","05/06/2017 06:38:13 PM",3022.94315748862,2017-05-06 19:36:16,2017-05-07
"285",36370,1855899,16000373712,2016373712,"220","CRISIS COMPLAINT - GENERAL","CRISIS CALL","BEHAVIORAL HEALTH","10/15/2016 02:19:53 PM","21XX BLOCK OF NE PARK RD","U","U1","4301.3013",-122.30423,47.67002,"(47.67002, -122.30423)","BURG - IP/JO - RES (INCL UNOCC STRUCTURES)","BURGLARY","RESIDENTIAL BURGLARIES","",1608.26846826134,2016-10-15 14:19:53,2016-10-15
"286",36377,1922839,17000027955,201727955,"350","HAZARDS","HAZARDS","HAZARDS","01/23/2017 07:53:32 PM","45XX BLOCK OF UNIVERSITY WY NE","U","U2","5301.2010",-122.31312,47.66218,"(47.66218, -122.31312)","HAZ - POTENTIAL THRT TO PHYS SAFETY (NO HAZMAT)","HAZARDS","HAZARDS","",738.963514898043,2017-01-23 19:53:32,2017-01-24
"287",36378,2125932,17000402450,2017402450,"220","CRISIS COMPLAINT - GENERAL","CRISIS CALL","BEHAVIORAL HEALTH","10/30/2017 05:16:38 AM","15 AV NE / NE 50 ST","U","U1","5301.2",-122.311935,47.66489,"(47.66489, -122.311935)","DISTURBANCE, MISCELLANEOUS/OTHER","DISTURBANCES","DISTURBANCES","10/30/2017 04:02:03 AM",1005.20324732383,2017-10-30 05:16:38,2017-10-30
"288",36453,1761993,16000212040,2016212040,"031","STRONG ARM ROBBERY","ROBBERY","ROBBERY","06/15/2016 12:14:48 AM","52XX BLOCK OF 40 AV NE","U","U3","4200.2019",-122.28482,47.66799,"(47.66799, -122.28482)","ROBBERY - IP/JO (INCLUDES STRONG ARM)","ROBBERY","ROBBERY","06/14/2016 10:09:35 PM",2283.31628829376,2016-06-15 00:14:48,2016-06-15
"289",36464,1911600,17000006504,20176504,"041","HARASSMENT, THREATS","THREATS, HARASSMENT","THREATS, HARASSMENT","01/06/2017 11:19:27 AM","56XX BLOCK OF BROOKLYN AV NE","U","U1","4400.2019",-122.31416,47.670345,"(47.670345, -122.31416)","THREATS (INCLS IN-PERSON/BY PHONE/IN WRITING)","THREATS, HARASSMENT","THREATS, HARASSMENT","01/06/2017 09:48:55 AM",1632.88503740822,2017-01-06 11:19:27,2017-01-06
"290",36540,1845037,16000354383,2016354383,"220","CRISIS COMPLAINT - GENERAL","CRISIS CALL","BEHAVIORAL HEALTH","09/30/2016 07:39:49 AM","39XX BLOCK OF NE 45 ST","U","U3","4100.5002",-122.28577,47.660854,"(47.660854, -122.28577)","CRISIS - PERSON IN BEHAVIORAL/EMOTIONAL CRISIS","BEHAVIORAL HEALTH","CRISIS CALL","09/30/2016 06:38:55 AM",1862.42553352032,2016-09-30 07:39:49,2016-09-30
"291",36559,1784637,16000249783,2016249783,"041","HARASSMENT, THREATS","THREATS, HARASSMENT","THREATS, HARASSMENT","07/13/2016 01:31:38 AM","50XX BLOCK OF 39 AV NE","U","U3","4200.3002",-122.285805,47.665234,"(47.665234, -122.285805)","HARAS - NO BIAS, THREATS OR MALICIOUSNESS","THREATS, HARASSMENT","THREATS, HARASSMENT","07/12/2016 10:04:59 PM",2054.69942779376,2016-07-13 01:31:38,2016-07-13
"292",36603,1719102,16000137092,2016137092,"220","CRISIS COMPLAINT - GENERAL","CRISIS CALL","BEHAVIORAL HEALTH","04/21/2016 02:33:50 AM","47XX BLOCK OF 12 AV NE","U","U2","5301.2003",-122.315254,47.664013,"(47.664013, -122.315254)","CRISIS - PERSON IN BEHAVIORAL/EMOTIONAL CRISIS","BEHAVIORAL HEALTH","CRISIS CALL","04/21/2016 01:26:41 AM",990.218839131712,2016-04-21 02:33:50,2016-04-21
"293",36618,1822703,16000314800,2016314800,"341","HARBOR - DEBRIS, NAVIGATIONAL HAZARDS","HARBOR CALLS","HARBOR CALLS","08/30/2016 09:54:04 PM","UNIVERSITY BR / SB","U","U2","5200.2020",-122.319374,47.65404,"(47.65404, -122.319374)","HARBOR - WATER EMERGENCIES","HARBOR CALLS","HARBOR CALLS","08/30/2016 08:14:32 PM",773.098824199806,2016-08-30 21:54:04,2016-08-31
"294",36643,1922846,17000028004,201728004,"350","HAZARDS","HAZARDS","HAZARDS","01/23/2017 08:14:08 PM","NE 45 ST / 15 AV NE","U","U2","5301.2010",-122.312,47.66126,"(47.66126, -122.312)","HAZ - POTENTIAL THRT TO PHYS SAFETY (NO HAZMAT)","HAZARDS","HAZARDS","",614.236940217108,2017-01-23 20:14:08,2017-01-24
"295",36652,1762475,16000212884,2016212884,"242","FIGHT DISTURBANCE","DISTURBANCES","DISTURBANCES","06/15/2016 04:54:47 PM","43XX BLOCK OF UNIVERSITY WY NE","U","U2","5301.3000",-122.31315,47.660534,"(47.660534, -122.31315)","DISTURBANCE, MISCELLANEOUS/OTHER","DISTURBANCES","DISTURBANCES","06/15/2016 02:17:42 PM",573.843522369168,2016-06-15 16:54:47,2016-06-15
"296",36683,1795646,16000269146,2016269146,"041","HARASSMENT, THREATS","THREATS, HARASSMENT","THREATS, HARASSMENT","07/27/2016 04:32:33 PM","68XX BLOCK OF 62 AV NE","U","U3","4000.1028",-122.26223,47.67889,"(47.67889, -122.26223)","HARAS - NO BIAS, THREATS OR MALICIOUSNESS","THREATS, HARASSMENT","THREATS, HARASSMENT","07/27/2016 02:20:15 PM",4368.13337390337,2016-07-27 16:32:33,2016-07-27
"297",36721,1934263,17000053262,201753262,"220","CRISIS COMPLAINT - GENERAL","CRISIS CALL","BEHAVIORAL HEALTH","02/13/2017 05:14:02 AM","NE 45 ST / UNIVERSITY WY NE","U","U2","5301.3001",-122.31313,47.661266,"(47.661266, -122.31313)","DOWN - CHECK FOR PERSON DOWN","PERSON DOWN/INJURY","CASUALTIES","02/13/2017 04:06:08 AM",645.873447683438,2017-02-13 05:14:02,2017-02-13
"298",36727,1719439,16000137808,2016137808,"350","HAZARDS","HAZARDS","HAZARDS","04/21/2016 02:39:45 PM","NE 45 PL / NE 45 ST","U","U3","4301.1013",-122.29287,47.66124,"(47.66124, -122.29287)","TRAFFIC - BO SIGNALS AND DOWN SIGNS","TRAFFIC RELATED CALLS","TRAFFIC RELATED CALLS","",1378.36436997833,2016-04-21 14:39:45,2016-04-21
"299",36761,1878185,16000412949,2016412949,"350","HAZARDS","HAZARDS","HAZARDS","11/15/2016 02:17:18 PM","45XX BLOCK OF UNION BAY PL NE","U","U3","4200.3038",-122.29411,47.66255,"(47.66255, -122.29411)","HAZ - POTENTIAL THRT TO PHYS SAFETY (NO HAZMAT)","HAZARDS","HAZARDS","11/15/2016 09:28:00 AM",1366.29022837343,2016-11-15 14:17:18,2016-11-15
"300",36765,1968533,17000114953,2017114953,"220","CRISIS COMPLAINT - GENERAL","CRISIS CALL","BEHAVIORAL HEALTH","04/02/2017 12:05:59 PM","65XX BLOCK OF SAND POINT WY NE","U","U3","4000.1028",-122.26355,47.676197,"(47.676197, -122.26355)","UNKNOWN - COMPLAINT OF UNKNOWN NATURE","SUSPICIOUS CIRCUMSTANCES","SUSPICIOUS CIRCUMSTANCES","04/02/2017 10:19:47 AM",4117.37052735623,2017-04-02 12:05:59,2017-04-02
"301",36771,1730550,16000156909,2016156909,"350","HAZARDS","HAZARDS","HAZARDS","05/06/2016 03:00:21 AM","50XX BLOCK OF 22 AV NE","U","U1","4302.1006",-122.304535,47.665672,"(47.665672, -122.304535)","SUSPICIOUS PERSON, VEHICLE OR INCIDENT","SUSPICIOUS CIRCUMSTANCES","SUSPICIOUS CIRCUMSTANCES","",1138.20046341035,2016-05-06 03:00:21,2016-05-06
"302",36799,1866934,16000393208,2016393208,"031","STRONG ARM ROBBERY","ROBBERY","ROBBERY","10/30/2016 07:17:05 PM","17 AV NE / NE 50 ST","U","U1","5301.1004",-122.30968,47.664875,"(47.664875, -122.30968)","ROBBERY (INCLUDES STRONG ARM)","ROBBERY","ROBBERY","10/30/2016 04:36:00 PM",986.848083360278,2016-10-30 19:17:05,2016-10-31
"303",36801,1867187,16000393737,2016393737,"220","CRISIS COMPLAINT - GENERAL","CRISIS CALL","BEHAVIORAL HEALTH","10/31/2016 06:10:50 AM","NE 45 ST / 15 AV NE","U","U2","5301.2010",-122.312,47.66126,"(47.66126, -122.312)","UNKNOWN - COMPLAINT OF UNKNOWN NATURE","SUSPICIOUS CIRCUMSTANCES","SUSPICIOUS CIRCUMSTANCES","10/31/2016 05:04:33 AM",614.236940217108,2016-10-31 06:10:50,2016-10-31
"304",36809,1719575,16000138094,2016138094,"350","HAZARDS","HAZARDS","HAZARDS","04/21/2016 06:15:25 PM","77XX BLOCK OF 34 AV NE","U","U3","2400.3014",-122.29164,47.68577,"(47.68577, -122.29164)","WIRES DOWN (PHONE, ELECTRICAL,ETC.)","HAZARDS","HAZARDS","",3571.37584497229,2016-04-21 18:15:25,2016-04-22
"305",36814,1784720,16000250405,2016250405,"242","FIGHT DISTURBANCE","DISTURBANCES","DISTURBANCES","07/13/2016 06:22:21 AM","11 AV NE / NE 42 ST","U","U2","5301.3006",-122.31666,47.65835,"(47.65835, -122.31666)","FIGHT - IP - PHYSICAL (NO WEAPONS)","DISTURBANCES","DISTURBANCES","",597.953502334229,2016-07-13 06:22:21,2016-07-13
"306",36843,1878358,16000413552,2016413552,"031","STRONG ARM ROBBERY","ROBBERY","ROBBERY","11/15/2016 07:16:01 PM","47XX BLOCK OF UNIVERSITY WY NE","U","U2","5301.2001",-122.31309,47.663998,"(47.663998, -122.31309)","ROBBERY (INCLUDES STRONG ARM)","ROBBERY","ROBBERY","11/15/2016 04:46:11 PM",929.234922041086,2016-11-15 19:16:01,2016-11-16
"307",36853,1947013,17000074278,201774278,"031","STRONG ARM ROBBERY","ROBBERY","ROBBERY","03/01/2017 06:10:50 PM","75XX BLOCK OF 35 AV NE","U","U3","2400.3011",-122.29051,47.683952,"(47.683952, -122.29051)","ROBBERY - IP/JO (INCLUDES STRONG ARM)","ROBBERY","ROBBERY","03/01/2017 03:05:51 PM",3419.41536166086,2017-03-01 18:10:50,2017-03-02
"308",36859,1784752,16000250488,2016250488,"220","CRISIS COMPLAINT - GENERAL","CRISIS CALL","BEHAVIORAL HEALTH","07/13/2016 08:48:10 AM","17 AV NE / NE 50 ST","U","U2","5301.1004",-122.30968,47.664875,"(47.664875, -122.30968)","DISTURBANCE, MISCELLANEOUS/OTHER","DISTURBANCES","DISTURBANCES","",986.848083360278,2016-07-13 08:48:10,2016-07-13
"309",36873,1878457,16000413648,2016413648,"220","CRISIS COMPLAINT - GENERAL","CRISIS CALL","BEHAVIORAL HEALTH","11/15/2016 09:25:55 PM","46XX BLOCK OF 21 AV NE","U","U1","4302.1009",-122.305466,47.662167,"(47.662167, -122.305466)","CRISIS - PERSON IN BEHAVIORAL/EMOTIONAL CRISIS","BEHAVIORAL HEALTH","CRISIS CALL","11/15/2016 07:53:08 PM",749.641358093474,2016-11-15 21:25:55,2016-11-16
"310",36908,1846098,16000355943,2016355943,"031","STRONG ARM ROBBERY","ROBBERY","ROBBERY","10/01/2016 07:19:58 PM","NE 47 ST / 19 AV NE","U","U1","5301.1000",-122.30722,47.66305,"(47.66305, -122.30722)","ROBBERY (INCLUDES STRONG ARM)","ROBBERY","ROBBERY","",802.336494189875,2016-10-01 19:19:58,2016-10-02
"311",36919,1719740,16000138286,2016138286,"031","STRONG ARM ROBBERY","ROBBERY","ROBBERY","04/21/2016 09:40:45 PM","12XX BLOCK OF NE 50 ST","U","U2","5301.2003",-122.31473,47.664913,"(47.664913, -122.31473)","ROBBERY (INCLUDES STRONG ARM)","ROBBERY","ROBBERY","04/21/2016 08:32:17 PM",1066.00619189187,2016-04-21 21:40:45,2016-04-22
"312",36957,1934378,17000053063,201753063,"220","CRISIS COMPLAINT - GENERAL","CRISIS CALL","BEHAVIORAL HEALTH","02/12/2017 10:48:22 PM","47XX BLOCK OF 12 AV NE","U","U2","5301.2003",-122.315254,47.664013,"(47.664013, -122.315254)","CRISIS - PERSON IN BEHAVIORAL/EMOTIONAL CRISIS","BEHAVIORAL HEALTH","CRISIS CALL","02/12/2017 10:14:28 PM",990.218839131712,2017-02-12 22:48:22,2017-02-13
"313",36971,1911318,17000006043,20176043,"242","FIGHT DISTURBANCE","DISTURBANCES","DISTURBANCES","01/05/2017 10:15:03 PM","NE 50 ST / BROOKLYN AV NE","U","U1","5301.2002",-122.31421,47.664906,"(47.664906, -122.31421)","FIGHT - IP - PHYSICAL (NO WEAPONS)","DISTURBANCES","DISTURBANCES","",1051.50585422232,2017-01-05 22:15:03,2017-01-06
"314",36995,1957601,17000094965,201794965,"242","FIGHT DISTURBANCE","DISTURBANCES","DISTURBANCES","03/17/2017 06:02:43 PM","ROOSEVELT WY NE / NE 70 ST","U","U1","2600.202",-122.31741,47.679466,"(47.679466, -122.31741)","FIGHT - VERBAL/ORAL (NO WEAPONS)","DISTURBANCES","DISTURBANCES","",2675.81894800423,2017-03-17 18:02:43,2017-03-18
"315",37005,1980815,17000138235,2017138235,"350","HAZARDS","HAZARDS","HAZARDS","04/20/2017 06:36:12 PM","12 AV NE / NE 43 ST","U","U2","5301.3003",-122.31548,47.65982,"(47.65982, -122.31548)","HAZ - POTENTIAL THRT TO PHYS SAFETY (NO HAZMAT)","HAZARDS","HAZARDS","",618.199579833197,2017-04-20 18:36:12,2017-04-21
"316",37037,1822853,16000314946,2016314946,"041","HARASSMENT, THREATS","THREATS, HARASSMENT","THREATS, HARASSMENT","08/31/2016 02:01:57 AM","8XX BLOCK OF NE 43 ST","U","U2","5200.5010",-122.31928,47.65946,"(47.65946, -122.31928)","ASLT - WITH OR W/O WEAPONS (NO SHOOTINGS)","ASSAULTS","ASSAULTS","08/30/2016 10:37:22 PM",829.277827937954,2016-08-31 02:01:57,2016-08-31
"317",37067,2064024,17000289575,2017289575,"220","CRISIS COMPLAINT - GENERAL","CRISIS CALL","BEHAVIORAL HEALTH","08/06/2017 03:57:00 PM","58XX BLOCK OF NE 75 ST","U","U3","4000.1026",-122.264496,47.682926,"(47.682926, -122.264496)","CRISIS - PERSON IN BEHAVIORAL/EMOTIONAL CRISIS","BEHAVIORAL HEALTH","CRISIS CALL","08/06/2017 02:46:54 PM",4515.05855960865,2017-08-06 15:57:00,2017-08-06
"318",37070,2113426,17000379697,2017379697,"220","CRISIS COMPLAINT - GENERAL","CRISIS CALL","BEHAVIORAL HEALTH","10/12/2017 03:31:52 PM","45XX BLOCK OF UNIVERSITY WY NE","U","U2","5301.201",-122.31312,47.66218,"(47.66218, -122.31312)","CRISIS - PERSON IN BEHAVIORAL/EMOTIONAL CRISIS","BEHAVIORAL HEALTH","CRISIS CALL","10/12/2017 02:07:16 PM",738.963514898043,2017-10-12 15:31:52,2017-10-12
"319",37105,1741083,16000175536,2016175536,"350","HAZARDS","HAZARDS","HAZARDS","05/19/2016 07:20:11 PM","ROOSEVELT WY NE / NE 50 ST","U","U2","5200.5000",-122.317406,47.664936,"(47.664936, -122.317406)","TRAFFIC - BLOCKING ROADWAY","TRAFFIC RELATED CALLS","TRAFFIC RELATED CALLS","05/19/2016 06:15:03 PM",1157.48588512645,2016-05-19 19:20:11,2016-05-20
"320",37135,1785052,16000250882,2016250882,"041","HARASSMENT, THREATS","THREATS, HARASSMENT","THREATS, HARASSMENT","07/13/2016 04:38:24 PM","75XX BLOCK OF 31 AV NE","U","U3","2400.3018",-122.2948,47.683952,"(47.683952, -122.2948)","HARAS - NO BIAS, THREATS OR MALICIOUSNESS","THREATS, HARASSMENT","THREATS, HARASSMENT","07/13/2016 02:38:23 PM",3298.06747661298,2016-07-13 16:38:24,2016-07-13
"321",37155,2051726,17000267310,2017267310,"041","HARASSMENT, THREATS","THREATS, HARASSMENT","THREATS, HARASSMENT","07/22/2017 08:40:07 AM","45XX BLOCK OF UNIVERSITY WY NE","U","U2","5301.2009",-122.31312,47.66218,"(47.66218, -122.31312)","THREATS (INCLS IN-PERSON/BY PHONE/IN WRITING)","THREATS, HARASSMENT","THREATS, HARASSMENT","07/22/2017 07:30:10 AM",738.963514898043,2017-07-22 08:40:07,2017-07-22
"322",37198,1957684,17000095171,201795171,"031","STRONG ARM ROBBERY","ROBBERY","ROBBERY","03/17/2017 08:10:39 PM","43XX BLOCK OF UNIVERSITY WY NE","U","U2","5301.3",-122.31315,47.660534,"(47.660534, -122.31315)","ROBBERY (INCLUDES STRONG ARM)","ROBBERY","ROBBERY","",573.843522369168,2017-03-17 20:10:39,2017-03-18
"323",37214,1900123,16000454040,2016454040,"242","FIGHT DISTURBANCE","DISTURBANCES","DISTURBANCES","12/18/2016 07:42:11 PM","UNIVERSITY WY NE / NE 47 ST","U","U2","5301.2010",-122.3131,47.66309,"(47.66309, -122.3131)","FIGHT - IP - PHYSICAL (NO WEAPONS)","DISTURBANCES","DISTURBANCES","",833.383876029379,2016-12-18 19:42:11,2016-12-19
"324",37219,1731108,16000157765,2016157765,"220","CRISIS COMPLAINT - GENERAL","CRISIS CALL","BEHAVIORAL HEALTH","05/06/2016 07:47:34 PM","35XX BLOCK OF NE 87 ST","U","U3","2200.3018",-122.28934,47.691647,"(47.691647, -122.28934)","SUSPICIOUS PERSON, VEHICLE OR INCIDENT","SUSPICIOUS CIRCUMSTANCES","SUSPICIOUS CIRCUMSTANCES","",4242.67050120162,2016-05-06 19:47:34,2016-05-07
"325",37253,1866966,16000393421,2016393421,"220","CRISIS COMPLAINT - GENERAL","CRISIS CALL","BEHAVIORAL HEALTH","10/30/2016 08:31:54 PM","47XX BLOCK OF 25 AV NE","U","U1","4302.2009",-122.30153,47.664223,"(47.664223, -122.30153)","CRISIS - PERSON IN BEHAVIORAL/EMOTIONAL CRISIS","BEHAVIORAL HEALTH","CRISIS CALL","10/30/2016 07:46:24 PM",1092.82753850705,2016-10-30 20:31:54,2016-10-31
"326",37276,1856499,16000374683,2016374683,"220","CRISIS COMPLAINT - GENERAL","CRISIS CALL","BEHAVIORAL HEALTH","10/16/2016 01:47:47 PM","47XX BLOCK OF 12 AV NE","U","U2","5301.2003",-122.3149,47.66341,"(47.66341, -122.3149)","UNKNOWN - COMPLAINT OF UNKNOWN NATURE","SUSPICIOUS CIRCUMSTANCES","SUSPICIOUS CIRCUMSTANCES","10/16/2016 12:20:47 PM",918.30890396426,2016-10-16 13:47:47,2016-10-16
"327",37293,1720349,16000139467,2016139467,"220","CRISIS COMPLAINT - GENERAL","CRISIS CALL","BEHAVIORAL HEALTH","04/22/2016 05:08:16 PM","56XX BLOCK OF BROOKLYN AV NE","U","U1","4400.2020",-122.31416,47.670345,"(47.670345, -122.31416)","CRISIS - PERSON IN BEHAVIORAL/EMOTIONAL CRISIS","BEHAVIORAL HEALTH","CRISIS CALL","",1632.88503740822,2016-04-22 17:08:16,2016-04-23
"328",37310,1762813,16000213403,2016213403,"041","HARASSMENT, THREATS","THREATS, HARASSMENT","THREATS, HARASSMENT","06/16/2016 02:06:21 AM","45XX BLOCK OF 25 AV NE","U","U3","4301.1014",-122.3009,47.66189,"(47.66189, -122.3009)","DISTURBANCE, MISCELLANEOUS/OTHER","DISTURBANCES","DISTURBANCES","06/15/2016 11:15:46 PM",919.874315224969,2016-06-16 02:06:21,2016-06-16
"329",37315,1867107,16000393674,2016393674,"242","FIGHT DISTURBANCE","DISTURBANCES","DISTURBANCES","10/31/2016 02:21:33 AM","52XX BLOCK OF UNIVERSITY WY NE","U","U1","4400.4000",-122.31268,47.66707,"(47.66707, -122.31268)","FIGHT - VERBAL/ORAL (NO WEAPONS)","DISTURBANCES","DISTURBANCES","",1253.7666728242,2016-10-31 02:21:33,2016-10-31
"330",37333,2089425,17000335378,2017335378,"031","STRONG ARM ROBBERY","ROBBERY","ROBBERY","09/09/2017 04:50:32 AM","72XX BLOCK OF SAND POINT WY NE","U","U3","4000.1027",-122.26365,47.680744,"(47.680744, -122.26365)","ASLT - IP/JO - WITH OR W/O WPNS (NO SHOOTINGS)","ASSAULTS","ASSAULTS","09/09/2017 03:52:32 AM",4407.49759113064,2017-09-09 04:50:32,2017-09-09
"331",37351,1763003,16000213842,2016213842,"041","HARASSMENT, THREATS","THREATS, HARASSMENT","THREATS, HARASSMENT","06/16/2016 11:28:51 AM","65XX BLOCK OF 27 AV NE","U","U3","3800.2013",-122.29842,47.676685,"(47.676685, -122.29842)","THREATS (INCLS IN-PERSON/BY PHONE/IN WRITING)","THREATS, HARASSMENT","THREATS, HARASSMENT","06/16/2016 10:03:01 AM",2445.76232102599,2016-06-16 11:28:51,2016-06-16
"332",37366,1774230,16000232885,2016232885,"220","CRISIS COMPLAINT - GENERAL","CRISIS CALL","BEHAVIORAL HEALTH","06/30/2016 07:06:33 PM","NE CAMPUS PY / BROOKLYN AV NE","U","U2","5302.1002",-122.31442,47.656223,"(47.656223, -122.31442)","DOWN - CHECK FOR PERSON DOWN","PERSON DOWN/INJURY","CASUALTIES","06/30/2016 02:47:51 PM",370.420834762338,2016-06-30 19:06:33,2016-07-01
"333",37369,1845581,16000355361,2016355361,"220","CRISIS COMPLAINT - GENERAL","CRISIS CALL","BEHAVIORAL HEALTH","09/30/2016 11:13:10 PM","47XX BLOCK OF UNIVERSITY WY NE","U","U2","5301.2001",-122.31266,47.66321,"(47.66321, -122.31266)","SUSPICIOUS PERSON, VEHICLE OR INCIDENT","SUSPICIOUS CIRCUMSTANCES","SUSPICIOUS CIRCUMSTANCES","09/30/2016 08:13:15 PM",836.037730600097,2016-09-30 23:13:10,2016-10-01
"334",37410,2051905,17000267557,2017267557,"041","HARASSMENT, THREATS","THREATS, HARASSMENT","THREATS, HARASSMENT","07/22/2017 02:39:28 PM","47XX BLOCK OF UNIVERSITY WY NE","U","U2","5301.2002",-122.31309,47.663998,"(47.663998, -122.31309)","THREATS (INCLS IN-PERSON/BY PHONE/IN WRITING)","THREATS, HARASSMENT","THREATS, HARASSMENT","07/22/2017 01:34:34 PM",929.234922041086,2017-07-22 14:39:28,2017-07-22
"335",37433,1845779,16000355776,2016355776,"030","ARMED ROBBERY","GUN CALLS","ROBBERY","10/01/2016 07:21:24 AM","ROOSEVELT WY NE / NE 63 ST","U","U1","4400.2011",-122.31737,47.674156,"(47.674156, -122.31737)","UNKNOWN - COMPLAINT OF UNKNOWN NATURE","SUSPICIOUS CIRCUMSTANCES","SUSPICIOUS CIRCUMSTANCES","10/01/2016 04:23:23 AM",2103.41416017737,2016-10-01 07:21:24,2016-10-01
"336",37451,1822997,16000315218,2016315218,"220","CRISIS COMPLAINT - GENERAL","CRISIS CALL","BEHAVIORAL HEALTH","08/31/2016 09:06:09 AM","75XX BLOCK OF 26 AV NE","U","U3","2500.1015",-122.2997,47.6835,"(47.6835, -122.2997)","CRISIS - PERSON IN BEHAVIORAL/EMOTIONAL CRISIS","BEHAVIORAL HEALTH","CRISIS CALL","08/31/2016 07:29:37 AM",3144.88910582351,2016-08-31 09:06:09,2016-08-31
"337",37456,1900087,16000453427,2016453427,"350","HAZARDS","HAZARDS","HAZARDS","12/18/2016 06:20:22 PM","31 AV NE / NE 75 ST","U","U3","3800.1002",-122.29477,47.683044,"(47.683044, -122.29477)","TRAFFIC - BO SIGNALS AND DOWN SIGNS","TRAFFIC RELATED CALLS","TRAFFIC RELATED CALLS","12/18/2016 06:16:27 AM",3203.89483000576,2016-12-18 18:20:22,2016-12-19
"338",37463,2051907,17000267152,2017267152,"041","HARASSMENT, THREATS","THREATS, HARASSMENT","THREATS, HARASSMENT","07/22/2017 02:43:00 PM","52XX BLOCK OF UNIVERSITY WY NE","U","U1","4400.4",-122.313034,47.667492,"(47.667492, -122.313034)","ASLT - IP/JO - WITH OR W/O WPNS (NO SHOOTINGS)","ASSAULTS","ASSAULTS","07/22/2017 02:18:13 AM",1305.00522461218,2017-07-22 14:43:00,2017-07-22
"339",37497,1774486,16000233607,2016233607,"242","FIGHT DISTURBANCE","DISTURBANCES","DISTURBANCES","07/01/2016 12:48:02 AM","47XX BLOCK OF 11 AV NE","U","U2","5301.2004",-122.316345,47.66402,"(47.66402, -122.316345)","NOISE - DISTURBANCE (PARTY, ETC)","DISTURBANCES","DISTURBANCES","",1029.30808958822,2016-07-01 00:48:02,2016-07-01
"340",37513,1720677,16000139990,2016139990,"350","HAZARDS","HAZARDS","HAZARDS","04/23/2016 12:05:40 AM","12 AV NE / NE 70 ST","U","U1","2600.3005",-122.31567,47.67945,"(47.67945, -122.31567)","TRAFFIC - BO SIGNALS AND DOWN SIGNS","TRAFFIC RELATED CALLS","TRAFFIC RELATED CALLS","",2648.12005497198,2016-04-23 00:05:40,2016-04-23
"341",37541,1752757,16000195986,2016195986,"350","HAZARDS","HAZARDS","HAZARDS","06/03/2016 02:27:16 PM","55 AV NE / NE 43 ST","U","U3","4100.2013",-122.26909,47.659374,"(47.659374, -122.26909)","TRAFFIC - MOVING VIOLATION","TRAFFIC RELATED CALLS","PARKING VIOLATIONS","",3058.59757827915,2016-06-03 14:27:16,2016-06-03
"342",37601,1795904,16000269806,2016269806,"350","HAZARDS","HAZARDS","HAZARDS","07/27/2016 11:25:15 PM","23XX BLOCK OF NE 88 ST","U","U1","2100.3004",-122.303734,47.6921,"(47.6921, -122.303734)","WIRES DOWN (PHONE, ELECTRICAL,ETC.)","HAZARDS","HAZARDS","07/27/2016 10:30:24 PM",4037.02923008949,2016-07-27 23:25:15,2016-07-28
"343",37631,1731333,16000158342,2016158342,"350","HAZARDS","HAZARDS","HAZARDS","05/06/2016 11:46:07 PM","47XX BLOCK OF 9 AV NE","U","U2","5200.5007",-122.31839,47.663567,"(47.663567, -122.31839)","FIREWORKS - NUISANCE (NO HAZARD)","MISCELLANEOUS MISDEMEANORS","MISCELLANEOUS MISDEMEANORS","",1074.12629124566,2016-05-06 23:46:07,2016-05-07
"344",37632,1878796,16000414228,2016414228,"220","CRISIS COMPLAINT - GENERAL","CRISIS CALL","BEHAVIORAL HEALTH","11/16/2016 11:24:11 AM","39XX BLOCK OF NE 45 ST","U","U3","4100.5002",-122.28599,47.661263,"(47.661263, -122.28599)","CRISIS - PERSON IN BEHAVIORAL/EMOTIONAL CRISIS","BEHAVIORAL HEALTH","CRISIS CALL","11/16/2016 08:02:34 AM",1860.40706322282,2016-11-16 11:24:11,2016-11-16
"345",37658,1774483,16000233639,2016233639,"242","FIGHT DISTURBANCE","DISTURBANCES","DISTURBANCES","07/01/2016 12:53:26 AM","82XX BLOCK OF LAKE CITY WY NE","U","U1","2600.1009",-122.309525,47.68937,"(47.68937, -122.309525)","FIGHT - IP - PHYSICAL (NO WEAPONS)","DISTURBANCES","DISTURBANCES","",3710.20896037173,2016-07-01 00:53:26,2016-07-01
"346",37660,1856457,16000374636,2016374636,"041","HARASSMENT, THREATS","THREATS, HARASSMENT","THREATS, HARASSMENT","10/16/2016 12:32:34 PM","15 AV NE / NE 75 ST","U","U1","2600.2014",-122.31208,47.683044,"(47.683044, -122.31208)","PROPERTY - DAMAGE","PROPERTY DAMAGE","PROPERTY DAMAGE","10/16/2016 11:43:50 AM",3013.09354549119,2016-10-16 12:32:34,2016-10-16
"347",37710,1856526,16000374584,2016374584,"350","HAZARDS","HAZARDS","HAZARDS","10/16/2016 02:28:13 PM","RAVENNA AV NE / NE 54 ST","U","U1","4302.1000",-122.30339,47.668022,"(47.668022, -122.30339)","TRAFFIC - BO SIGNALS AND DOWN SIGNS","TRAFFIC RELATED CALLS","TRAFFIC RELATED CALLS","",1413.24223770552,2016-10-16 14:28:13,2016-10-16
"348",37731,2076459,17000311945,2017311945,"220","CRISIS COMPLAINT - GENERAL","CRISIS CALL","BEHAVIORAL HEALTH","08/23/2017 11:49:18 AM","10XX BLOCK OF NE 50 ST","U","U1","4400.4005",-122.31687,47.664932,"(47.664932, -122.31687)","CRISIS - PERSON IN BEHAVIORAL/EMOTIONAL CRISIS","BEHAVIORAL HEALTH","CRISIS CALL","",1136.96666175032,2017-08-23 11:49:18,2017-08-23
"349",37761,1741479,16000176115,2016176115,"350","HAZARDS","HAZARDS","HAZARDS","05/20/2016 09:25:33 AM","9 AV NE / NE 50 ST","U","U1","4500.1010",-122.31844,47.66494,"(47.66494, -122.31844)","WIRES DOWN (PHONE, ELECTRICAL,ETC.)","HAZARDS","HAZARDS","05/20/2016 07:55:48 AM",1199.55628995888,2016-05-20 09:25:33,2016-05-20
"350",37770,1856566,16000374800,2016374800,"350","HAZARDS","HAZARDS","HAZARDS","10/16/2016 04:10:19 PM","47XX BLOCK OF 35 AV NE","U","U3","4200.3020",-122.28989,47.66472,"(47.66472, -122.28989)","TREES DOWN, OBSTRUCTING PUBLIC PROP (NO HAZ)","TREES DOWN","TREES DOWN","10/16/2016 02:26:31 PM",1763.42011632211,2016-10-16 16:10:19,2016-10-16
"351",37793,1731790,16000158857,2016158857,"220","CRISIS COMPLAINT - GENERAL","CRISIS CALL","BEHAVIORAL HEALTH","05/07/2016 01:11:00 PM","73XX BLOCK OF ROOSEVELT WY NE","U","U1","2600.2018",-122.31747,47.681892,"(47.681892, -122.31747)","DISTURBANCE, MISCELLANEOUS/OTHER","DISTURBANCES","DISTURBANCES","05/07/2016 11:43:28 AM",2940.3413275696,2016-05-07 13:11:00,2016-05-07
"352",37801,1774441,16000233555,2016233555,"041","HARASSMENT, THREATS","THREATS, HARASSMENT","THREATS, HARASSMENT","06/30/2016 11:43:16 PM","69XX BLOCK OF 62 AV NE","U","U3","4000.1014",-122.26223,47.67889,"(47.67889, -122.26223)","HARAS - NO BIAS, THREATS OR MALICIOUSNESS","THREATS, HARASSMENT","THREATS, HARASSMENT","",4368.13337390337,2016-06-30 23:43:16,2016-07-01
"353",37817,1796007,16000269996,2016269996,"350","HAZARDS","HAZARDS","HAZARDS","07/28/2016 02:43:15 AM","NE 45 ST / 20 AV NE","U","U1","5302.3013",-122.306526,47.661255,"(47.661255, -122.306526)","HAZ - POTENTIAL THRT TO PHYS SAFETY (NO HAZMAT)","HAZARDS","HAZARDS","",625.521753811904,2016-07-28 02:43:15,2016-07-28
"354",37843,1796039,16000269761,2016269761,"220","CRISIS COMPLAINT - GENERAL","CRISIS CALL","BEHAVIORAL HEALTH","07/28/2016 03:28:57 AM","45XX BLOCK OF 7 AV NE","U","U2","5200.5005",-122.320724,47.661564,"(47.661564, -122.320724)","SUSPICIOUS PERSON, VEHICLE OR INCIDENT","SUSPICIOUS CIRCUMSTANCES","SUSPICIOUS CIRCUMSTANCES","07/28/2016 01:58:26 AM",1045.71564454053,2016-07-28 03:28:57,2016-07-28
"355",37859,1720957,16000140424,2016140424,"242","FIGHT DISTURBANCE","DISTURBANCES","DISTURBANCES","04/23/2016 11:37:54 AM","NE 45 ST / 7 AV NE","U","U2","5200.1000",-122.32073,47.661316,"(47.661316, -122.32073)","FIGHT - IP - PHYSICAL (NO WEAPONS)","DISTURBANCES","DISTURBANCES","",1030.01436970243,2016-04-23 11:37:54,2016-04-23
"356",37868,1796078,16000269994,2016269994,"041","HARASSMENT, THREATS","THREATS, HARASSMENT","THREATS, HARASSMENT","07/28/2016 06:09:40 AM","39XX BLOCK OF NE 45 ST","U","U3","4100.5002",-122.28599,47.661263,"(47.661263, -122.28599)","DISTURBANCE, MISCELLANEOUS/OTHER","DISTURBANCES","DISTURBANCES","07/28/2016 04:13:21 AM",1860.40706322282,2016-07-28 06:09:40,2016-07-28
"357",37896,1889552,16000434156,2016434156,"220","CRISIS COMPLAINT - GENERAL","CRISIS CALL","BEHAVIORAL HEALTH","12/02/2016 08:39:14 PM","12XX BLOCK OF NE 65 ST","U","U1","4400.2002",-122.315,47.675808,"(47.675808, -122.315)","CRISIS - PERSON IN BEHAVIORAL/EMOTIONAL CRISIS","BEHAVIORAL HEALTH","CRISIS CALL","",2240.73438738311,2016-12-02 20:39:14,2016-12-03
"358",37916,1845743,16000355757,2016355757,"031","STRONG ARM ROBBERY","ROBBERY","ROBBERY","10/01/2016 04:39:01 AM","19 AV NE / NE 47 ST","U","U1","5301.1000",-122.30722,47.66305,"(47.66305, -122.30722)","ROBBERY (INCLUDES STRONG ARM)","ROBBERY","ROBBERY","",802.336494189875,2016-10-01 04:39:01,2016-10-01
"359",37920,1980352,17000136372,2017136372,"341","HARBOR - DEBRIS, NAVIGATIONAL HAZARDS","HARBOR CALLS","HARBOR CALLS","04/19/2017 09:26:00 PM","65XX BLOCK OF SAND POINT WY NE","U","U3","4000.1028",-122.26355,47.676197,"(47.676197, -122.26355)","HARBOR - WATER DEBRIS, NAVIGATIONAL HAZARDS","HARBOR CALLS","HARBOR CALLS","04/19/2017 08:18:20 AM",4117.37052735623,2017-04-19 21:26:00,2017-04-20
"360",37971,1753149,16000196620,2016196620,"220","CRISIS COMPLAINT - GENERAL","CRISIS CALL","BEHAVIORAL HEALTH","06/03/2016 11:10:02 PM","61XX BLOCK OF BROOKLYN AV NE","U","U1","4400.2008",-122.314255,47.672745,"(47.672745, -122.314255)","CRISIS - PERSON IN BEHAVIORAL/EMOTIONAL CRISIS","BEHAVIORAL HEALTH","CRISIS CALL","",1895.71763445181,2016-06-03 23:10:02,2016-06-04
"361",37982,1845804,16000355812,2016355812,"350","HAZARDS","HAZARDS","HAZARDS","10/01/2016 09:13:59 AM","40 AV NE / NE 85 ST","U","U3","2400.1006",-122.28534,47.69018,"(47.69018, -122.28534)","TRAFFIC - BO SIGNALS AND DOWN SIGNS","TRAFFIC RELATED CALLS","TRAFFIC RELATED CALLS","10/01/2016 06:35:30 AM",4211.14629809079,2016-10-01 09:13:59,2016-10-01
"362",37991,1845914,16000356072,2016356072,"220","CRISIS COMPLAINT - GENERAL","CRISIS CALL","BEHAVIORAL HEALTH","10/01/2016 01:11:17 PM","47XX BLOCK OF 9 AV NE","U","U2","5200.5001",-122.318855,47.664433,"(47.664433, -122.318855)","FIGHT - IP - PHYSICAL (NO WEAPONS)","DISTURBANCES","DISTURBANCES","10/01/2016 11:41:26 AM",1171.70503737255,2016-10-01 13:11:17,2016-10-01
"363",37994,1796211,16000270181,2016270181,"220","CRISIS COMPLAINT - GENERAL","CRISIS CALL","BEHAVIORAL HEALTH","07/28/2016 11:24:12 AM","NE 41 ST / 15 AV NE","U","U2","5301.4000",-122.31211,47.65682,"(47.65682, -122.31211)","CRISIS - PERSON IN BEHAVIORAL/EMOTIONAL CRISIS","BEHAVIORAL HEALTH","CRISIS CALL","07/28/2016 08:30:27 AM",216.222931905124,2016-07-28 11:24:12,2016-07-28
"364",38058,1753046,16000196372,2016196372,"031","STRONG ARM ROBBERY","ROBBERY","ROBBERY","06/03/2016 08:39:22 PM","82XX BLOCK OF 35 AV NE","U","U3","2400.1009",-122.29067,47.68889,"(47.68889, -122.29067)","ROBBERY - IP/JO (INCLUDES STRONG ARM)","ROBBERY","ROBBERY","06/03/2016 05:57:09 PM",3920.72253854191,2016-06-03 20:39:22,2016-06-04
"365",38062,1722327,16000140791,2016140791,"350","HAZARDS","HAZARDS","HAZARDS","04/23/2016 08:05:57 PM","NE 45 ST / MARY GATES MEMORIAL DR NE","U","U3","4301.1013",-122.29287,47.66124,"(47.66124, -122.29287)","TRAFFIC - BO SIGNALS AND DOWN SIGNS","TRAFFIC RELATED CALLS","TRAFFIC RELATED CALLS","",1378.36436997833,2016-04-23 20:05:57,2016-04-24
"366",38083,1721627,16000141387,2016141387,"220","CRISIS COMPLAINT - GENERAL","CRISIS CALL","BEHAVIORAL HEALTH","04/24/2016 08:28:50 AM","39XX BLOCK OF NE 45 ST","U","U3","4100.5002",-122.28599,47.661263,"(47.661263, -122.28599)","CRISIS - PERSON IN BEHAVIORAL/EMOTIONAL CRISIS","BEHAVIORAL HEALTH","CRISIS CALL","04/24/2016 03:43:57 AM",1860.40706322282,2016-04-24 08:28:50,2016-04-24
"367",38087,1721633,16000141560,2016141560,"350","HAZARDS","HAZARDS","HAZARDS","04/24/2016 09:04:16 AM","BROOKLYN AV NE / NE 45 ST","U","U2","5301.2008",-122.314285,47.661274,"(47.661274, -122.314285)","TRAFFIC - BO SIGNALS AND DOWN SIGNS","TRAFFIC RELATED CALLS","TRAFFIC RELATED CALLS","",687.775955514295,2016-04-24 09:04:16,2016-04-24
"368",38088,1721636,16000141583,2016141583,"242","FIGHT DISTURBANCE","DISTURBANCES","DISTURBANCES","04/24/2016 09:40:14 AM","47XX BLOCK OF 12 AV NE","U","U2","5301.2003",-122.315254,47.664013,"(47.664013, -122.315254)","FIGHT - VERBAL/ORAL (NO WEAPONS)","DISTURBANCES","DISTURBANCES","",990.218839131712,2016-04-24 09:40:14,2016-04-24
"369",38105,1721299,16000140950,2016140950,"242","FIGHT DISTURBANCE","DISTURBANCES","DISTURBANCES","04/23/2016 09:08:43 PM","52XX BLOCK OF BROOKLYN AV NE","U","U1","4400.4002",-122.31417,47.6675,"(47.6675, -122.31417)","FIGHT - VERBAL/ORAL (NO WEAPONS)","DISTURBANCES","DISTURBANCES","04/23/2016 08:29:29 PM",1325.85536809536,2016-04-23 21:08:43,2016-04-24
"370",38107,1845973,16000356273,2016356273,"220","CRISIS COMPLAINT - GENERAL","CRISIS CALL","BEHAVIORAL HEALTH","10/01/2016 03:30:37 PM","BROOKLYN AV NE / NE 50 ST","U","U2","5301.2002",-122.31421,47.664906,"(47.664906, -122.31421)","INJURED - IP/JO - PERSON/INDUSTRIAL ACCIDENT","PERSON DOWN/INJURY","PERSON DOWN/INJURY","",1051.50585422232,2016-10-01 15:30:37,2016-10-01
"371",40821,1753209,16000196852,2016196852,"242","FIGHT DISTURBANCE","DISTURBANCES","DISTURBANCES","06/04/2016 12:42:32 AM","NE 45 ST / UNIVERSITY WY NE","U","U2","5301.3001",-122.31313,47.661266,"(47.661266, -122.31313)","FIGHT - IP/JO - WITH WEAPONS","DISTURBANCES","DISTURBANCES","",645.873447683438,2016-06-04 00:42:32,2016-06-04
"372",40822,1721836,16000141875,2016141875,"242","FIGHT DISTURBANCE","DISTURBANCES","DISTURBANCES","04/24/2016 04:25:35 PM","UNIVERSITY WY NE / NE 45 ST","U","U2","5301.3001",-122.31313,47.661266,"(47.661266, -122.31313)","FIGHT - IP - PHYSICAL (NO WEAPONS)","DISTURBANCES","DISTURBANCES","04/24/2016 03:34:11 PM",645.873447683438,2016-04-24 16:25:35,2016-04-24
"373",40831,1721749,16000141765,2016141765,"350","HAZARDS","HAZARDS","HAZARDS","04/24/2016 01:58:10 PM","20XX BLOCK OF NE 63 ST","U","U1","4301.3005",-122.306,47.67479,"(47.67479, -122.306)","HAZ - POTENTIAL THRT TO PHYS SAFETY (NO HAZMAT)","HAZARDS","HAZARDS","",2105.61727481497,2016-04-24 13:58:10,2016-04-24
"374",40838,1968869,17000115539,2017115539,"031","STRONG ARM ROBBERY","ROBBERY","ROBBERY","04/02/2017 10:05:37 PM","12XX BLOCK OF NE 50 ST","U","U2","5301.2003",-122.31473,47.664913,"(47.664913, -122.31473)","ROBBERY - IP/JO (INCLUDES STRONG ARM)","ROBBERY","ROBBERY","04/02/2017 08:25:03 PM",1066.00619189187,2017-04-02 22:05:37,2017-04-03
"375",40862,1721872,16000141995,2016141995,"350","HAZARDS","HAZARDS","HAZARDS","04/24/2016 06:05:43 PM","65XX BLOCK OF SAND POINT WY NE","U","U3","4000.1028",-122.26355,47.676197,"(47.676197, -122.26355)","TRAFFIC - MOVING VIOLATION","TRAFFIC RELATED CALLS","PARKING VIOLATIONS","",4117.37052735623,2016-04-24 18:05:43,2016-04-25
"376",40908,1856666,16000375053,2016375053,"220","CRISIS COMPLAINT - GENERAL","CRISIS CALL","BEHAVIORAL HEALTH","10/16/2016 07:24:09 PM","NE 45 ST / UNIVERSITY WY NE","U","U2","5301.3001",-122.31313,47.661266,"(47.661266, -122.31313)","CRISIS - PERSON IN BEHAVIORAL/EMOTIONAL CRISIS","BEHAVIORAL HEALTH","CRISIS CALL","",645.873447683438,2016-10-16 19:24:09,2016-10-17
"377",40909,1753312,16000196951,2016196951,"242","FIGHT DISTURBANCE","DISTURBANCES","DISTURBANCES","06/04/2016 02:59:21 AM","47XX BLOCK OF UNIVERSITY WY NE","U","U2","5301.2001",-122.31309,47.663998,"(47.663998, -122.31309)","FIGHT - JO - PHYSICAL (NO WEAPONS)","DISTURBANCES","DISTURBANCES","06/04/2016 02:04:09 AM",929.234922041086,2016-06-04 02:59:21,2016-06-04
"378",40927,1733381,16000161772,2016161772,"350","HAZARDS","HAZARDS","HAZARDS","05/09/2016 04:39:15 PM","47XX BLOCK OF ROOSEVELT WY NE","U","U2","5301.2004",-122.31741,47.66403,"(47.66403, -122.31741)","TRAFFIC - BO SIGNALS AND DOWN SIGNS","TRAFFIC RELATED CALLS","TRAFFIC RELATED CALLS","",1072.43674086523,2016-05-09 16:39:15,2016-05-09
"379",40935,1856626,16000374947,2016374947,"242","FIGHT DISTURBANCE","DISTURBANCES","DISTURBANCES","10/16/2016 06:02:39 PM","6XX BLOCK OF NE 42 ST","U","U2","5200.1003",-122.321655,47.657722,"(47.657722, -122.321655)","FIGHT - VERBAL/ORAL (NO WEAPONS)","DISTURBANCES","DISTURBANCES","",932.926995198837,2016-10-16 18:02:39,2016-10-17
"380",40940,1722075,16000142251,2016142251,"220","CRISIS COMPLAINT - GENERAL","CRISIS CALL","BEHAVIORAL HEALTH","04/24/2016 11:25:03 PM","NE CAMPUS PY / 12 AV NE","U","U2","5302.1012",-122.315575,47.65601,"(47.65601, -122.315575)","SUSPICIOUS PERSON, VEHICLE OR INCIDENT","SUSPICIOUS CIRCUMSTANCES","SUSPICIOUS CIRCUMSTANCES","04/24/2016 10:42:13 PM",456.355933412924,2016-04-24 23:25:03,2016-04-25
"381",40949,1753249,16000196767,2016196767,"220","CRISIS COMPLAINT - GENERAL","CRISIS CALL","BEHAVIORAL HEALTH","06/04/2016 01:20:03 AM","BROOKLYN AV NE / NE 45 ST","U","U2","5301.2008",-122.314285,47.661274,"(47.661274, -122.314285)","SUSPICIOUS PERSON, VEHICLE OR INCIDENT","SUSPICIOUS CIRCUMSTANCES","SUSPICIOUS CIRCUMSTANCES","",687.775955514295,2016-06-04 01:20:03,2016-06-04
"382",40952,1856718,16000375039,2016375039,"030","ARMED ROBBERY","GUN CALLS","ROBBERY","10/16/2016 08:03:09 PM","45XX BLOCK OF UNIVERSITY WY NE","U","U2","5301.2010",-122.3128,47.661716,"(47.661716, -122.3128)","ROBBERY - IP/JO (INCLUDES STRONG ARM)","ROBBERY","ROBBERY","10/16/2016 06:18:30 PM",682.157678017236,2016-10-16 20:03:09,2016-10-17
"383",40956,2064097,17000289661,2017289661,"220","CRISIS COMPLAINT - GENERAL","CRISIS CALL","BEHAVIORAL HEALTH","08/06/2017 06:11:35 PM","47XX BLOCK OF 11 AV NE","U","U2","5301.2004",-122.316345,47.66402,"(47.66402, -122.316345)","SUSPICIOUS STOP - OFFICER INITIATED ONVIEW","SUSPICIOUS CIRCUMSTANCES","SUSPICIOUS CIRCUMSTANCES","08/06/2017 03:46:35 PM",1029.30808958822,2017-08-06 18:11:35,2017-08-07
"384",40982,1722099,16000142278,2016142278,"220","CRISIS COMPLAINT - GENERAL","CRISIS CALL","BEHAVIORAL HEALTH","04/25/2016 12:08:43 AM","NE 47 ST / BROOKLYN AV NE","U","U2","5301.2008",-122.31424,47.663097,"(47.663097, -122.31424)","CRISIS - PERSON IN BEHAVIORAL/EMOTIONAL CRISIS","BEHAVIORAL HEALTH","CRISIS CALL","04/24/2016 11:13:36 PM",865.679337340903,2016-04-25 00:08:43,2016-04-25
"385",41045,1900313,16000454262,2016454262,"220","CRISIS COMPLAINT - GENERAL","CRISIS CALL","BEHAVIORAL HEALTH","12/19/2016 03:15:43 AM","43XX BLOCK OF 8 AV NE","U","U2","5200.1",-122.31978,47.660385,"(47.660385, -122.31978)","NUISANCE - MISCHIEF","MISCELLANEOUS MISDEMEANORS","MISCELLANEOUS MISDEMEANORS","12/19/2016 01:11:29 AM",913.231660313895,2016-12-19 03:15:43,2016-12-19
"386",41048,1744313,16000177657,2016177657,"030","ARMED ROBBERY","GUN CALLS","ROBBERY","05/21/2016 08:16:57 AM","19 AV NE / NE 52 ST","U","U1","4400.3001",-122.30717,47.666393,"(47.666393, -122.30717)","ROBBERY (INCLUDES STRONG ARM)","ROBBERY","ROBBERY","05/21/2016 06:47:57 AM",1168.71070041713,2016-05-21 08:16:57,2016-05-21
"387",41053,1785743,16000252148,2016252148,"220","CRISIS COMPLAINT - GENERAL","CRISIS CALL","BEHAVIORAL HEALTH","07/14/2016 03:02:13 PM","52XX BLOCK OF UNIVERSITY WY NE","U","U1","4400.4000",-122.313034,47.667492,"(47.667492, -122.313034)","DISTURBANCE, MISCELLANEOUS/OTHER","DISTURBANCES","DISTURBANCES","07/14/2016 12:16:03 PM",1305.00522461218,2016-07-14 15:02:13,2016-07-14
"388",41056,1764084,16000215725,2016215725,"041","HARASSMENT, THREATS","THREATS, HARASSMENT","THREATS, HARASSMENT","06/17/2016 05:55:49 PM","14XX BLOCK OF NE 66 ST","U","U1","2600.3009",-122.31254,47.676514,"(47.676514, -122.31254)","THREATS (INCLS IN-PERSON/BY PHONE/IN WRITING)","THREATS, HARASSMENT","THREATS, HARASSMENT","06/17/2016 03:49:43 PM",2292.22446639512,2016-06-17 17:55:49,2016-06-18
"389",41083,1722482,16000142984,2016142984,"350","HAZARDS","HAZARDS","HAZARDS","04/25/2016 02:05:35 PM","15 AV NE / NE 50 ST","U","U1","4400.4009",-122.311935,47.66489,"(47.66489, -122.311935)","HAZ - POTENTIAL THRT TO PHYS SAFETY (NO HAZMAT)","HAZARDS","HAZARDS","",1005.20324732383,2016-04-25 14:05:35,2016-04-25
"390",41093,1846384,16000356900,2016356900,"030","ARMED ROBBERY","GUN CALLS","ROBBERY","10/02/2016 02:58:12 AM","73XX BLOCK OF ROOSEVELT WY NE","U","U1","2600.2018",-122.31675,47.682167,"(47.682167, -122.31675)","ROBBERY - IP/JO (INCLUDES STRONG ARM)","ROBBERY","ROBBERY","10/02/2016 02:22:01 AM",2959.8603121526,2016-10-02 02:58:12,2016-10-02
"391",41098,1867425,16000394058,2016394058,"350","HAZARDS","HAZARDS","HAZARDS","10/31/2016 02:32:29 PM","MONTLAKE BV NE / NE PACIFIC PL","U","U2","5302.3054",-122.30391,47.65108,"(47.65108, -122.30391)","HAZ - POTENTIAL THRT TO PHYS SAFETY (NO HAZMAT)","HAZARDS","HAZARDS","10/31/2016 11:45:59 AM",689.626649964796,2016-10-31 14:32:29,2016-10-31
"392",41110,1733478,16000161985,2016161985,"220","CRISIS COMPLAINT - GENERAL","CRISIS CALL","BEHAVIORAL HEALTH","05/09/2016 08:25:18 PM","41XX BLOCK OF 11 AV NE","U","U2","5301.4004",-122.316666,47.657917,"(47.657917, -122.316666)","CRISIS - PERSON IN BEHAVIORAL/EMOTIONAL CRISIS","BEHAVIORAL HEALTH","CRISIS CALL","",578.961145985207,2016-05-09 20:25:18,2016-05-10
"393",41155,1733550,16000162120,2016162120,"242","FIGHT DISTURBANCE","DISTURBANCES","DISTURBANCES","05/09/2016 10:19:48 PM","47XX BLOCK OF UNIVERSITY WY NE","U","U2","5301.2001",-122.31309,47.663998,"(47.663998, -122.31309)","FIGHT - IP - PHYSICAL (NO WEAPONS)","DISTURBANCES","DISTURBANCES","",929.234922041086,2016-05-09 22:19:48,2016-05-10
"394",41158,1900318,16000454328,2016454328,"220","CRISIS COMPLAINT - GENERAL","CRISIS CALL","BEHAVIORAL HEALTH","12/19/2016 03:46:20 AM","72XX BLOCK OF SAND POINT WY NE","U","U3","4000.1027",-122.26365,47.680744,"(47.680744, -122.26365)","CRISIS - PERSON IN BEHAVIORAL/EMOTIONAL CRISIS","BEHAVIORAL HEALTH","CRISIS CALL","",4407.49759113064,2016-12-19 03:46:20,2016-12-19
"395",41196,1957974,17000095573,201795573,"220","CRISIS COMPLAINT - GENERAL","CRISIS CALL","BEHAVIORAL HEALTH","03/18/2017 04:35:15 AM","8XX BLOCK OF NE 69 ST","U","U1","3600.1012",-122.31873,47.678753,"(47.678753, -122.31873)","PROWLER - IP/JO","PROWLER","PROWLER","03/18/2017 02:40:22 AM",2623.02378672877,2017-03-18 04:35:15,2017-03-18
"396",41200,1879293,16000415368,2016415368,"242","FIGHT DISTURBANCE","DISTURBANCES","DISTURBANCES","11/17/2016 03:46:30 AM","42XX BLOCK OF UNIVERSITY WY NE","U","U2","5301.3009",-122.31319,47.659054,"(47.659054, -122.31319)","SUSPICIOUS STOP - OFFICER INITIATED ONVIEW","SUSPICIOUS CIRCUMSTANCES","SUSPICIOUS CIRCUMSTANCES","11/17/2016 02:25:47 AM",438.325335850633,2016-11-17 03:46:30,2016-11-17
"397",41208,1785954,16000252822,2016252822,"242","FIGHT DISTURBANCE","DISTURBANCES","DISTURBANCES","07/14/2016 08:46:25 PM","45XX BLOCK OF UNIVERSITY WY NE","U","U2","5301.2009",-122.31312,47.66218,"(47.66218, -122.31312)","ASLT - IP/JO - WITH OR W/O WPNS (NO SHOOTINGS)","ASSAULTS","ASSAULTS","",738.963514898043,2016-07-14 20:46:25,2016-07-15
"398",41209,1785956,16000252819,2016252819,"242","FIGHT DISTURBANCE","DISTURBANCES","DISTURBANCES","07/14/2016 08:57:29 PM","7 AV NE / NE 50 ST","U","U1","4500.1011",-122.3207,47.664955,"(47.664955, -122.3207)","ASLT - IP/JO - WITH OR W/O WPNS (NO SHOOTINGS)","ASSAULTS","ASSAULTS","",1303.47990792526,2016-07-14 20:57:29,2016-07-15
"399",41223,1879342,16000415350,2016415350,"031","STRONG ARM ROBBERY","ROBBERY","ROBBERY","11/17/2016 06:56:49 AM","UNIVERSITY WY NE / NE 42 ST","U","U2","5301.3008",-122.31321,47.658314,"(47.658314, -122.31321)","ASLT - IP/JO - WITH OR W/O WPNS (NO SHOOTINGS)","ASSAULTS","ASSAULTS","11/17/2016 01:50:09 AM",379.289152249279,2016-11-17 06:56:49,2016-11-17
"400",41238,1879322,16000415159,2016415159,"031","STRONG ARM ROBBERY","ROBBERY","ROBBERY","11/17/2016 05:20:18 AM","11 AV NE / NE 43 ST","U","U2","5301.3006",-122.31662,47.659836,"(47.659836, -122.31662)","ROBBERY - IP/JO (INCLUDES STRONG ARM)","ROBBERY","ROBBERY","11/16/2016 09:16:45 PM",684.070000729982,2016-11-17 05:20:18,2016-11-17
"401",41240,1848862,16000360860,2016360860,"220","CRISIS COMPLAINT - GENERAL","CRISIS CALL","BEHAVIORAL HEALTH","10/05/2016 12:15:48 PM","10XX BLOCK OF NE RAVENNA BV","U","U1","4400.2012",-122.31649,47.672245,"(47.672245, -122.31649)","CRISIS - PERSON IN BEHAVIORAL/EMOTIONAL CRISIS","BEHAVIORAL HEALTH","CRISIS CALL","10/05/2016 10:03:25 AM",1880.93642009444,2016-10-05 12:15:48,2016-10-05
"402",41245,1796603,16000270997,2016270997,"041","HARASSMENT, THREATS","THREATS, HARASSMENT","THREATS, HARASSMENT","07/28/2016 09:06:49 PM","45XX BLOCK OF BROOKLYN AV NE","U","U2","5301.2007",-122.31426,47.66219,"(47.66219, -122.31426)","THREATS (INCLS IN-PERSON/BY PHONE/IN WRITING)","THREATS, HARASSMENT","THREATS, HARASSMENT","07/28/2016 07:58:37 PM",775.56356285686,2016-07-28 21:06:49,2016-07-29
"403",41250,1775092,16000234747,2016234747,"041","HARASSMENT, THREATS","THREATS, HARASSMENT","THREATS, HARASSMENT","07/01/2016 08:46:44 PM","NE 45 ST / BROOKLYN AV NE","U","U2","5301.2008",-122.314285,47.661274,"(47.661274, -122.314285)","HARAS - NO BIAS, THREATS OR MALICIOUSNESS","THREATS, HARASSMENT","THREATS, HARASSMENT","",687.775955514295,2016-07-01 20:46:44,2016-07-02
"404",41252,1775096,16000234672,2016234672,"220","CRISIS COMPLAINT - GENERAL","CRISIS CALL","BEHAVIORAL HEALTH","07/01/2016 08:38:10 PM","8XX BLOCK OF NE NORTHLAKE PL","U","U2","5200.2015",-122.32032,47.65499,"(47.65499, -122.32032)","INJURED - IP/JO - PERSON/INDUSTRIAL ACCIDENT","PERSON DOWN/INJURY","PERSON DOWN/INJURY","07/01/2016 06:29:18 PM",820.527909007537,2016-07-01 20:38:10,2016-07-02
"405",41267,1823397,16000315980,2016315980,"220","CRISIS COMPLAINT - GENERAL","CRISIS CALL","BEHAVIORAL HEALTH","08/31/2016 08:18:19 PM","40 AV NE / NE 70 ST","U","U3","3900.1013",-122.28501,47.679413,"(47.679413, -122.28501)","CRISIS - PERSON IN BEHAVIORAL/EMOTIONAL CRISIS","BEHAVIORAL HEALTH","CRISIS CALL","",3187.3701434862,2016-08-31 20:18:19,2016-09-01
"406",41277,2064141,17000289883,2017289883,"242","FIGHT DISTURBANCE","DISTURBANCES","DISTURBANCES","08/06/2017 07:34:38 PM","42XX BLOCK OF UNIVERSITY WY NE","U","U2","5301.3009",-122.31319,47.659054,"(47.659054, -122.31319)","FIGHT - IP - PHYSICAL (NO WEAPONS)","DISTURBANCES","DISTURBANCES","",438.325335850633,2017-08-06 19:34:38,2017-08-07
"407",41300,1879353,16000415552,2016415552,"350","HAZARDS","HAZARDS","HAZARDS","11/17/2016 07:39:42 AM","15 AV NE / NE 75 ST","U","U1","2600.2014",-122.31208,47.683044,"(47.683044, -122.31208)","HAZ - POTENTIAL THRT TO PHYS SAFETY (NO HAZMAT)","HAZARDS","HAZARDS","",3013.09354549119,2016-11-17 07:39:42,2016-11-17
"408",41321,2052029,17000267797,2017267797,"031","STRONG ARM ROBBERY","ROBBERY","ROBBERY","07/22/2017 07:19:57 PM","65XX BLOCK OF SAND POINT WY NE","U","U3","4000.1028",-122.26355,47.676197,"(47.676197, -122.26355)","ROBBERY (INCLUDES STRONG ARM)","ROBBERY","ROBBERY","07/22/2017 03:49:30 PM",4117.37052735623,2017-07-22 19:19:57,2017-07-23
"409",41336,1753727,16000197592,2016197592,"220","CRISIS COMPLAINT - GENERAL","CRISIS CALL","BEHAVIORAL HEALTH","06/04/2016 05:21:42 PM","40XX BLOCK OF 8 AV NE","U","U2","5200.2002",-122.31979,47.65669,"(47.65669, -122.31979)","DOWN - CHECK FOR PERSON DOWN","PERSON DOWN/INJURY","CASUALTIES","06/04/2016 03:32:16 PM",776.778419025715,2016-06-04 17:21:42,2016-06-05
"410",41368,1785950,16000252607,2016252607,"220","CRISIS COMPLAINT - GENERAL","CRISIS CALL","BEHAVIORAL HEALTH","07/14/2016 08:22:20 PM","73XX BLOCK OF 34 AV NE","U","U3","3800.1000",-122.29153,47.68214,"(47.68214, -122.29153)","CRISIS - PERSON IN BEHAVIORAL/EMOTIONAL CRISIS","BEHAVIORAL HEALTH","CRISIS CALL","",3204.40222833168,2016-07-14 20:22:20,2016-07-15
"411",41383,1733916,16000162745,2016162745,"350","HAZARDS","HAZARDS","HAZARDS","05/10/2016 12:33:53 PM","65XX BLOCK OF SAND POINT WY NE","U","U3","4000.1028",-122.26355,47.676197,"(47.676197, -122.26355)","HAZ - POTENTIAL THRT TO PHYS SAFETY (NO HAZMAT)","HAZARDS","HAZARDS","",4117.37052735623,2016-05-10 12:33:53,2016-05-10
"412",41408,1823790,16000316818,2016316818,"041","HARASSMENT, THREATS","THREATS, HARASSMENT","THREATS, HARASSMENT","09/01/2016 01:12:28 PM","42XX BLOCK OF 9 AV NE","U","U2","5200.2001",-122.318794,47.658485,"(47.658485, -122.318794)","THREATS (INCLS IN-PERSON/BY PHONE/IN WRITING)","THREATS, HARASSMENT","THREATS, HARASSMENT","09/01/2016 11:55:25 AM",750.832793594975,2016-09-01 13:12:28,2016-09-01
"413",41409,1823733,16000316702,2016316702,"041","HARASSMENT, THREATS","THREATS, HARASSMENT","THREATS, HARASSMENT","09/01/2016 10:53:27 AM","65XX BLOCK OF 42 AV NE","U","U3","3900.1025",-122.283585,47.676693,"(47.676693, -122.283585)","HARAS - NO BIAS, THREATS OR MALICIOUSNESS","THREATS, HARASSMENT","THREATS, HARASSMENT","09/01/2016 09:57:42 AM",3013.57492436639,2016-09-01 10:53:27,2016-09-01
"414",41419,1879477,16000415789,2016415789,"350","HAZARDS","HAZARDS","HAZARDS","11/17/2016 11:54:35 AM","NE 45 ST / UNIVERSITY WY NE","U","U2","5301.3001",-122.31313,47.661266,"(47.661266, -122.31313)","HAZ - POTENTIAL THRT TO PHYS SAFETY (NO HAZMAT)","HAZARDS","HAZARDS","",645.873447683438,2016-11-17 11:54:35,2016-11-17
"415",41425,1867766,16000394787,2016394787,"220","CRISIS COMPLAINT - GENERAL","CRISIS CALL","BEHAVIORAL HEALTH","10/31/2016 11:47:56 PM","12 AV NE / NE 45 ST","U","U2","5301.2008",-122.315445,47.661285,"(47.661285, -122.315445)","HAZ - POTENTIAL THRT TO PHYS SAFETY (NO HAZMAT)","HAZARDS","HAZARDS","10/31/2016 09:50:01 PM",738.039379745135,2016-10-31 23:47:56,2016-11-01
"416",41436,1900417,16000454475,2016454475,"350","HAZARDS","HAZARDS","HAZARDS","12/19/2016 09:32:10 AM","NE PACIFIC PL / MONTLAKE BV NE","U","U2","5302.3054",-122.30391,47.65108,"(47.65108, -122.30391)","HAZ - POTENTIAL THRT TO PHYS SAFETY (NO HAZMAT)","HAZARDS","HAZARDS","",689.626649964796,2016-12-19 09:32:10,2016-12-19
"417",41463,1823829,16000316917,2016316917,"220","CRISIS COMPLAINT - GENERAL","CRISIS CALL","BEHAVIORAL HEALTH","09/01/2016 02:21:35 PM","50XX BLOCK OF 12 AV NE","U","U1","4400.4006",-122.31523,47.66568,"(47.66568, -122.31523)","SUSPICIOUS PERSON, VEHICLE OR INCIDENT","SUSPICIOUS CIRCUMSTANCES","SUSPICIOUS CIRCUMSTANCES","",1159.12682011732,2016-09-01 14:21:35,2016-09-01
"418",41466,1753710,16000197596,2016197596,"350","HAZARDS","HAZARDS","HAZARDS","06/04/2016 05:02:56 PM","NE 92 ST / LAKE CITY WY NE","U","U1","2100.2002",-122.305695,47.695747,"(47.695747, -122.305695)","TREES DOWN, OBSTRUCTING PUBLIC PROP (NO HAZ)","TREES DOWN","TREES DOWN","",4428.45804861896,2016-06-04 17:02:56,2016-06-05
"419",41473,1753711,16000197544,2016197544,"350","HAZARDS","HAZARDS","HAZARDS","06/04/2016 04:51:30 PM","SAND POINT WY NE / NE 70 ST","U","U3","4000.1029",-122.26362,47.679363,"(47.679363, -122.26362)","TRAFFIC - BLOCKING ROADWAY","TRAFFIC RELATED CALLS","TRAFFIC RELATED CALLS","06/04/2016 02:22:50 PM",4315.15923550807,2016-06-04 16:51:30,2016-06-04
"420",41475,1856952,16000375447,2016375447,"350","HAZARDS","HAZARDS","HAZARDS","10/17/2016 06:03:59 AM","30XX BLOCK OF NE 45 ST","U","U3","4301.1013",-122.29545,47.66205,"(47.66205, -122.29545)","HAZ - POTENTIAL THRT TO PHYS SAFETY (NO HAZMAT)","HAZARDS","HAZARDS","",1251.51617431619,2016-10-17 06:03:59,2016-10-17
"421",41496,1786152,16000252835,2016252835,"041","HARASSMENT, THREATS","THREATS, HARASSMENT","THREATS, HARASSMENT","07/15/2016 01:32:09 AM","31XX BLOCK OF E LAURELHURST DR NE","U","U3","4100.6016",-122.27714,47.65114,"(47.65114, -122.27714)","HARAS - NO BIAS, THREATS OR MALICIOUSNESS","THREATS, HARASSMENT","THREATS, HARASSMENT","07/14/2016 10:31:31 PM",2490.32889893636,2016-07-15 01:32:09,2016-07-15
"422",41554,1857129,16000375627,2016375627,"030","ARMED ROBBERY","GUN CALLS","ROBBERY","10/17/2016 01:15:24 PM","47XX BLOCK OF 25 AV NE","U","U1","4302.2009",-122.30123,47.66355,"(47.66355, -122.30123)","ALARM - BANK (HOLD-UP)","ALACAD","SUSPICIOUS CIRCUMSTANCES","10/17/2016 09:23:28 AM",1044.29014836682,2016-10-17 13:15:24,2016-10-17
"423",41560,1789481,16000258848,2016258848,"220","CRISIS COMPLAINT - GENERAL","CRISIS CALL","BEHAVIORAL HEALTH","07/19/2016 10:51:21 PM","10XX BLOCK OF NE 45 ST","U","U2","5301.3004",-122.31711,47.661297,"(47.661297, -122.31711)","CRISIS - PERSON IN BEHAVIORAL/EMOTIONAL CRISIS","BEHAVIORAL HEALTH","CRISIS CALL","",820.741685950805,2016-07-19 22:51:21,2016-07-20
"424",41584,1764662,16000216869,2016216869,"220","CRISIS COMPLAINT - GENERAL","CRISIS CALL","BEHAVIORAL HEALTH","06/18/2016 01:36:13 PM","NE 64 ST / 8 AV NE","U","U1","3600.1020",-122.32005,47.67499,"(47.67499, -122.32005)","CRISIS - PERSON IN BEHAVIORAL/EMOTIONAL CRISIS","BEHAVIORAL HEALTH","CRISIS CALL","06/18/2016 12:35:38 PM",2255.16819424474,2016-06-18 13:36:13,2016-06-18
"425",41620,1723109,16000143947,2016143947,"041","HARASSMENT, THREATS","THREATS, HARASSMENT","THREATS, HARASSMENT","04/26/2016 09:43:15 AM","73XX BLOCK OF 40 AV NE","U","U3","3900.1002",-122.28507,47.681458,"(47.681458, -122.28507)","THREATS (INCLS IN-PERSON/BY PHONE/IN WRITING)","THREATS, HARASSMENT","THREATS, HARASSMENT","04/26/2016 08:09:17 AM",3373.14419782655,2016-04-26 09:43:15,2016-04-26
"426",41628,1846864,16000357662,2016357662,"220","CRISIS COMPLAINT - GENERAL","CRISIS CALL","BEHAVIORAL HEALTH","10/02/2016 09:28:30 PM","NE 47 ST / 12 AV NE","U","U2","5301.2008",-122.31526,47.663105,"(47.663105, -122.31526)","DISTURBANCE, MISCELLANEOUS/OTHER","DISTURBANCES","DISTURBANCES","10/02/2016 08:02:04 PM",900.685209550702,2016-10-02 21:28:30,2016-10-03
"427",41632,1723162,16000144109,2016144109,"350","HAZARDS","HAZARDS","HAZARDS","04/26/2016 11:33:14 AM","RAVENNA AV NE / NE 75 ST","U","U1","2500.1026",-122.30399,47.683044,"(47.683044, -122.30399)","WIRES DOWN (PHONE, ELECTRICAL,ETC.)","HAZARDS","HAZARDS","04/26/2016 10:30:52 AM",3035.19757542076,2016-04-26 11:33:14,2016-04-26
"428",41637,2016189,17000202977,2017202977,"031","STRONG ARM ROBBERY","ROBBERY","ROBBERY","06/06/2017 09:18:40 PM","65XX BLOCK OF SAND POINT WY NE","U","U3","4000.1028",-122.26355,47.676197,"(47.676197, -122.26355)","ROBBERY - IP/JO (INCLUDES STRONG ARM)","ROBBERY","ROBBERY","06/06/2017 08:05:36 PM",4117.37052735623,2017-06-06 21:18:40,2017-06-07
"429",41639,1786215,16000253095,2016253095,"041","HARASSMENT, THREATS","THREATS, HARASSMENT","THREATS, HARASSMENT","07/15/2016 03:49:39 AM","NE RAVENNA BV / 15 AV NE","U","U1","4400.2022",-122.311905,47.671204,"(47.671204, -122.311905)","WEAPN-IP/JO-GUN,DEADLY WPN (NO THRT/ASLT/DIST)","WEAPONS CALLS","WEAPONS CALLS","07/15/2016 01:57:18 AM",1700.06205431391,2016-07-15 03:49:39,2016-07-15
"430",41648,2004074,17000180663,2017180663,"041","HARASSMENT, THREATS","THREATS, HARASSMENT","THREATS, HARASSMENT","05/22/2017 04:46:02 PM","50XX BLOCK OF 12 AV NE","U","U1","4400.4006",-122.31523,47.66568,"(47.66568, -122.31523)","HARAS - NO BIAS, THREATS OR MALICIOUSNESS","THREATS, HARASSMENT","THREATS, HARASSMENT","05/22/2017 01:45:55 PM",1159.12682011732,2017-05-22 16:46:02,2017-05-22
"431",41680,1846789,16000357548,2016357548,"041","HARASSMENT, THREATS","THREATS, HARASSMENT","THREATS, HARASSMENT","10/02/2016 07:10:20 PM","43XX BLOCK OF UNIVERSITY WY NE","U","U2","5301.3000",-122.31278,47.66024,"(47.66024, -122.31278)","TRU - HARASSMENT","THREATS, HARASSMENT","THREATS, HARASSMENT","",531.921704166654,2016-10-02 19:10:20,2016-10-03
"432",41684,2076657,17000312363,2017312363,"350","HAZARDS","HAZARDS","HAZARDS","08/23/2017 06:11:28 PM","NE PACIFIC ST / 15 AV NE","U","U2","5302.2022",-122.31247,47.652973,"(47.652973, -122.31247)","TRAFFIC - BO SIGNALS AND DOWN SIGNS","TRAFFIC RELATED CALLS","TRAFFIC RELATED CALLS","08/23/2017 04:05:24 PM",403.791075048216,2017-08-23 18:11:28,2017-08-24
"433",41690,1775452,16000235354,2016235354,"220","CRISIS COMPLAINT - GENERAL","CRISIS CALL","BEHAVIORAL HEALTH","07/02/2016 07:18:01 AM","42XX BLOCK OF UNIVERSITY WY NE","U","U2","5301.3009",-122.31319,47.659054,"(47.659054, -122.31319)","SUSPICIOUS PERSON, VEHICLE OR INCIDENT","SUSPICIOUS CIRCUMSTANCES","SUSPICIOUS CIRCUMSTANCES","",438.325335850633,2016-07-02 07:18:01,2016-07-02
"434",41692,1923456,17000029094,201729094,"350","HAZARDS","HAZARDS","HAZARDS","01/24/2017 06:02:48 PM","NE 45 ST / 7 AV NE","U","U2","5200.1000",-122.32073,47.661316,"(47.661316, -122.32073)","HAZ - POTENTIAL THRT TO PHYS SAFETY (NO HAZMAT)","HAZARDS","HAZARDS","",1030.01436970243,2017-01-24 18:02:48,2017-01-25
"435",41734,1723339,16000144346,2016144346,"041","HARASSMENT, THREATS","THREATS, HARASSMENT","THREATS, HARASSMENT","04/26/2016 04:08:32 PM","47XX BLOCK OF 16 AV NE","U","U2","5301.1004",-122.310814,47.66398,"(47.66398, -122.310814)","THREATS (INCLS IN-PERSON/BY PHONE/IN WRITING)","THREATS, HARASSMENT","THREATS, HARASSMENT","04/26/2016 02:16:35 PM",892.71896599991,2016-04-26 16:08:32,2016-04-26
"436",41741,1734119,16000163160,2016163160,"041","HARASSMENT, THREATS","THREATS, HARASSMENT","THREATS, HARASSMENT","05/10/2016 05:36:42 PM","NE 43 ST / UNIVERSITY WY NE","U","U2","5301.3008",-122.31317,47.659794,"(47.659794, -122.31317)","THREATS (INCLS IN-PERSON/BY PHONE/IN WRITING)","THREATS, HARASSMENT","THREATS, HARASSMENT","",503.925729388642,2016-05-10 17:36:42,2016-05-11
"437",41753,1775584,16000233750,2016233750,"220","CRISIS COMPLAINT - GENERAL","CRISIS CALL","BEHAVIORAL HEALTH","07/01/2016 11:29:15 AM","47XX BLOCK OF 12 AV NE","U","U2","5301.2004",-122.315254,47.664013,"(47.664013, -122.315254)","CRISIS - PERSON IN BEHAVIORAL/EMOTIONAL CRISIS","BEHAVIORAL HEALTH","CRISIS CALL","07/01/2016 05:47:37 AM",990.218839131712,2016-07-01 11:29:15,2016-07-01
"438",41766,1867576,16000394622,2016394622,"031","STRONG ARM ROBBERY","ROBBERY","ROBBERY","10/31/2016 07:03:03 PM","20 AV NE / NE 85 ST","U","U1","2100.3009",-122.306854,47.6903,"(47.6903, -122.306854)","TRU - ROBBERY","ROBBERY","ROBBERY","",3818.78292239059,2016-10-31 19:03:03,2016-11-01
"439",41785,1786232,16000253136,2016253136,"041","HARASSMENT, THREATS","THREATS, HARASSMENT","THREATS, HARASSMENT","07/15/2016 04:31:36 AM","11 AV NE / NE 43 ST","U","U2","5301.3006",-122.31662,47.659836,"(47.659836, -122.31662)","THREATS (INCLS IN-PERSON/BY PHONE/IN WRITING)","THREATS, HARASSMENT","THREATS, HARASSMENT","07/15/2016 03:41:44 AM",684.070000729982,2016-07-15 04:31:36,2016-07-15
"440",41804,1775697,16000235670,2016235670,"041","HARASSMENT, THREATS","THREATS, HARASSMENT","THREATS, HARASSMENT","07/02/2016 02:53:18 PM","46XX BLOCK OF 25 AV NE","U","U3","4301.1016",-122.3009,47.66189,"(47.66189, -122.3009)","THREATS (INCLS IN-PERSON/BY PHONE/IN WRITING)","THREATS, HARASSMENT","THREATS, HARASSMENT","07/02/2016 01:00:41 PM",919.874315224969,2016-07-02 14:53:18,2016-07-02
"441",41817,1775694,16000235764,2016235764,"041","HARASSMENT, THREATS","THREATS, HARASSMENT","THREATS, HARASSMENT","07/02/2016 03:11:57 PM","86XX BLOCK OF 35 AV NE","U","U3","2100.1022",-122.29069,47.691288,"(47.691288, -122.29069)","HARAS - NO BIAS, THREATS OR MALICIOUSNESS","THREATS, HARASSMENT","THREATS, HARASSMENT","",4169.98650210028,2016-07-02 15:11:57,2016-07-02
"442",41831,1948421,17000077244,201777244,"220","CRISIS COMPLAINT - GENERAL","CRISIS CALL","BEHAVIORAL HEALTH","03/03/2017 07:18:04 PM","75XX BLOCK OF 39 AV NE","U","U3","2400.2009",-122.286285,47.683937,"(47.683937, -122.286285)","UNKNOWN - COMPLAINT OF UNKNOWN NATURE","SUSPICIOUS CIRCUMSTANCES","SUSPICIOUS CIRCUMSTANCES","03/03/2017 06:49:06 PM",3561.98610106541,2017-03-03 19:18:04,2017-03-04
"443",41855,1742397,16000180589,2016180589,"220","CRISIS COMPLAINT - GENERAL","CRISIS CALL","BEHAVIORAL HEALTH","05/23/2016 02:40:59 PM","66XX BLOCK OF 62 AV NE","U","U3","4000.1014",-122.26223,47.67889,"(47.67889, -122.26223)","CRISIS - PERSON IN BEHAVIORAL/EMOTIONAL CRISIS","BEHAVIORAL HEALTH","CRISIS CALL","05/23/2016 02:00:21 PM",4368.13337390337,2016-05-23 14:40:59,2016-05-23
"444",41908,1867601,16000394104,2016394104,"041","HARASSMENT, THREATS","THREATS, HARASSMENT","THREATS, HARASSMENT","10/31/2016 07:13:45 PM","45XX BLOCK OF 17 AV NE","U","U1","5301.1007",-122.30917,47.662064,"(47.662064, -122.30917)","HARAS - NO BIAS, THREATS OR MALICIOUSNESS","THREATS, HARASSMENT","THREATS, HARASSMENT","10/31/2016 03:02:05 PM",674.673399863121,2016-10-31 19:13:45,2016-11-01
"445",41912,1923393,17000028966,201728966,"242","FIGHT DISTURBANCE","DISTURBANCES","DISTURBANCES","01/24/2017 04:16:45 PM","42XX BLOCK OF UNIVERSITY WY NE","U","U2","5301.3009",-122.31319,47.659054,"(47.659054, -122.31319)","DISTURBANCE, MISCELLANEOUS/OTHER","DISTURBANCES","DISTURBANCES","01/24/2017 02:49:43 PM",438.325335850633,2017-01-24 16:16:45,2017-01-25
"446",41939,1734506,16000163670,2016163670,"031","STRONG ARM ROBBERY","ROBBERY","ROBBERY","05/11/2016 04:21:15 AM","21 AV NE / NE 45 ST","U","U2","5302.3013",-122.30547,47.661255,"(47.661255, -122.30547)","ROBBERY (INCLUDES STRONG ARM)","ROBBERY","ROBBERY","",658.035249179753,2016-05-11 04:21:15,2016-05-11
"447",41964,1734641,16000164012,2016164012,"220","CRISIS COMPLAINT - GENERAL","CRISIS CALL","BEHAVIORAL HEALTH","05/11/2016 10:53:48 AM","42XX BLOCK OF UNIVERSITY WY NE","U","U2","5301.3008",-122.31319,47.659054,"(47.659054, -122.31319)","CRISIS - PERSON IN BEHAVIORAL/EMOTIONAL CRISIS","BEHAVIORAL HEALTH","CRISIS CALL","05/11/2016 10:23:42 AM",438.325335850633,2016-05-11 10:53:48,2016-05-11
"448",41976,1798519,16000274245,2016274245,"350","HAZARDS","HAZARDS","HAZARDS","07/31/2016 01:43:49 AM","20 AV NE / NE 62 ST","U","U1","4301.3006",-122.30651,47.67262,"(47.67262, -122.30651)","FIREWORKS - NUISANCE (NO HAZARD)","MISCELLANEOUS MISDEMEANORS","MISCELLANEOUS MISDEMEANORS","",1861.47083962783,2016-07-31 01:43:49,2016-07-31
"449",41979,1723481,16000144724,2016144724,"350","HAZARDS","HAZARDS","HAZARDS","04/26/2016 07:59:51 PM","NE 42 ST / ROOSEVELT WY NE","U","U2","5301.4004",-122.3178,47.657513,"(47.657513, -122.3178)","HAZ - POTENTIAL THRT TO PHYS SAFETY (NO HAZMAT)","HAZARDS","HAZARDS","",645.782739718582,2016-04-26 19:59:51,2016-04-27
"450",42015,1847145,16000353959,2016353959,"350","HAZARDS","HAZARDS","HAZARDS","09/29/2016 11:27:07 PM","MONTLAKE BV NE / NE PACIFIC ST","U","U3","5302.2018",-122.30459,47.648994,"(47.648994, -122.30459)","TRAFFIC - BO SIGNALS AND DOWN SIGNS","TRAFFIC RELATED CALLS","TRAFFIC RELATED CALLS","",861.874216742478,2016-09-29 23:27:07,2016-09-30
"451",42043,1723504,16000144818,2016144818,"350","HAZARDS","HAZARDS","HAZARDS","04/26/2016 08:40:51 PM","NE 47 ST / BROOKLYN AV NE","U","U2","5301.2008",-122.31424,47.663097,"(47.663097, -122.31424)","HAZ - POTENTIAL THRT TO PHYS SAFETY (NO HAZMAT)","HAZARDS","HAZARDS","",865.679337340903,2016-04-26 20:40:51,2016-04-27
"452",42050,1742690,16000179772,2016179772,"242","FIGHT DISTURBANCE","DISTURBANCES","DISTURBANCES","05/22/2016 09:08:27 PM","47XX BLOCK OF 16 AV NE","U","U2","5301.1004",-122.310814,47.66398,"(47.66398, -122.310814)","FIGHT - IP - PHYSICAL (NO WEAPONS)","DISTURBANCES","DISTURBANCES","05/22/2016 09:01:19 PM",892.71896599991,2016-05-22 21:08:27,2016-05-23
"453",42055,1857470,16000376343,2016376343,"041","HARASSMENT, THREATS","THREATS, HARASSMENT","THREATS, HARASSMENT","10/17/2016 10:08:48 PM","52XX BLOCK OF MITHUN PL NE","U","U3","4200.2010",-122.28097,47.668034,"(47.668034, -122.28097)","TRU - HARASSMENT","THREATS, HARASSMENT","THREATS, HARASSMENT","",2526.33222568909,2016-10-17 22:08:48,2016-10-18
"454",42057,1786530,16000253635,2016253635,"350","HAZARDS","HAZARDS","HAZARDS","07/15/2016 03:37:22 PM","NE 45 ST / MONTLAKE BV NE","U","U3","5302.3007",-122.29834,47.661087,"(47.661087, -122.29834)","HAZ - POTENTIAL THRT TO PHYS SAFETY (NO HAZMAT)","HAZARDS","HAZARDS","07/15/2016 02:03:26 PM",1011.2565741436,2016-07-15 15:37:22,2016-07-15
"455",42083,1797163,16000271762,2016271762,"041","HARASSMENT, THREATS","THREATS, HARASSMENT","THREATS, HARASSMENT","07/29/2016 02:06:32 PM","65XX BLOCK OF 62 AV NE","U","U3","4000.1014",-122.26223,47.67889,"(47.67889, -122.26223)","HARAS - NO BIAS, THREATS OR MALICIOUSNESS","THREATS, HARASSMENT","THREATS, HARASSMENT","07/29/2016 11:53:48 AM",4368.13337390337,2016-07-29 14:06:32,2016-07-29
"456",42091,1890184,16000435285,2016435285,"041","HARASSMENT, THREATS","THREATS, HARASSMENT","THREATS, HARASSMENT","12/03/2016 07:16:33 PM","45XX BLOCK OF 12 AV NE","U","U2","5301.2008",-122.31539,47.662197,"(47.662197, -122.31539)","THREATS (INCLS IN-PERSON/BY PHONE/IN WRITING)","THREATS, HARASSMENT","THREATS, HARASSMENT","12/03/2016 05:20:28 PM",818.824590825285,2016-12-03 19:16:33,2016-12-04
"457",42098,1824505,16000318142,2016318142,"220","CRISIS COMPLAINT - GENERAL","CRISIS CALL","BEHAVIORAL HEALTH","09/02/2016 01:39:44 PM","NE 41 ST / UNIVERSITY WY NE","U","U2","5301.4000",-122.31325,47.656834,"(47.656834, -122.31325)","CRISIS - PERSON IN BEHAVIORAL/EMOTIONAL CRISIS","BEHAVIORAL HEALTH","CRISIS CALL","",296.567307084639,2016-09-02 13:39:44,2016-09-02
"458",42116,1723583,16000144913,2016144913,"350","HAZARDS","HAZARDS","HAZARDS","04/26/2016 09:46:09 PM","NE 47 ST / BROOKLYN AV NE","U","U2","5301.2008",-122.31424,47.663097,"(47.663097, -122.31424)","SICK PERSON","PERSON DOWN/INJURY","CASUALTIES","",865.679337340903,2016-04-26 21:46:09,2016-04-27
"459",42126,1923576,17000029301,201729301,"041","HARASSMENT, THREATS","THREATS, HARASSMENT","THREATS, HARASSMENT","01/24/2017 08:59:28 PM","50XX BLOCK OF BROOKLYN AV NE","U","U1","4400.4007",-122.3142,47.665676,"(47.665676, -122.3142)","THREATS (INCLS IN-PERSON/BY PHONE/IN WRITING)","THREATS, HARASSMENT","THREATS, HARASSMENT","01/24/2017 07:32:30 PM",1132.25729952174,2017-01-24 20:59:28,2017-01-25
"460",42159,1786699,16000254113,2016254113,"242","FIGHT DISTURBANCE","DISTURBANCES","DISTURBANCES","07/15/2016 08:17:30 PM","45XX BLOCK OF UNIVERSITY WY NE","U","U2","5301.2009",-122.31312,47.66218,"(47.66218, -122.31312)","SUSPICIOUS STOP - OFFICER INITIATED ONVIEW","SUSPICIOUS CIRCUMSTANCES","SUSPICIOUS CIRCUMSTANCES","",738.963514898043,2016-07-15 20:17:30,2016-07-16
"461",42189,1776058,16000236125,2016236125,"041","HARASSMENT, THREATS","THREATS, HARASSMENT","THREATS, HARASSMENT","07/02/2016 11:04:04 PM","86XX BLOCK OF 35 AV NE","U","U3","2100.1022",-122.29069,47.691288,"(47.691288, -122.29069)","HARAS - NO BIAS, THREATS OR MALICIOUSNESS","THREATS, HARASSMENT","THREATS, HARASSMENT","07/02/2016 08:41:06 PM",4169.98650210028,2016-07-02 23:04:04,2016-07-03
"462",42202,1867846,16000394878,2016394878,"220","CRISIS COMPLAINT - GENERAL","CRISIS CALL","BEHAVIORAL HEALTH","11/01/2016 02:38:01 AM","39XX BLOCK OF NE 45 ST","U","U3","4100.5002",-122.28577,47.660854,"(47.660854, -122.28577)","CRISIS - PERSON IN BEHAVIORAL/EMOTIONAL CRISIS","BEHAVIORAL HEALTH","CRISIS CALL","11/01/2016 01:06:11 AM",1862.42553352032,2016-11-01 02:38:01,2016-11-01
"463",42207,1723675,16000144955,2016144955,"041","HARASSMENT, THREATS","THREATS, HARASSMENT","THREATS, HARASSMENT","04/27/2016 12:57:51 AM","45XX BLOCK OF UNIVERSITY WY NE","U","U2","5301.2009",-122.31312,47.66218,"(47.66218, -122.31312)","DISTURBANCE, MISCELLANEOUS/OTHER","DISTURBANCES","DISTURBANCES","04/26/2016 10:20:26 PM",738.963514898043,2016-04-27 00:57:51,2016-04-27
"464",42238,1765233,16000217615,2016217615,"242","FIGHT DISTURBANCE","DISTURBANCES","DISTURBANCES","06/19/2016 01:43:38 AM","UNIVERSITY WY NE / NE 45 ST","U","U2","5301.3001",-122.31313,47.661266,"(47.661266, -122.31313)","FIGHT - IP - PHYSICAL (NO WEAPONS)","DISTURBANCES","DISTURBANCES","06/18/2016 11:31:44 PM",645.873447683438,2016-06-19 01:43:38,2016-06-19
"465",42245,2114407,17000381345,2017381345,"350","HAZARDS","HAZARDS","HAZARDS","10/13/2017 09:27:04 PM","11 AV NE / NE 42 ST","U","U2","5301.3005",-122.31666,47.65835,"(47.65835, -122.31666)","HAZ - POTENTIAL THRT TO PHYS SAFETY (NO HAZMAT)","HAZARDS","HAZARDS","10/13/2017 05:56:02 PM",597.953502334229,2017-10-13 21:27:04,2017-10-14
"466",42256,1724006,16000145726,2016145726,"350","HAZARDS","HAZARDS","HAZARDS","04/27/2016 02:21:45 PM","12 AV NE / NE CAMPUS PY","U","U2","5302.1012",-122.315575,47.65601,"(47.65601, -122.315575)","HAZ - POTENTIAL THRT TO PHYS SAFETY (NO HAZMAT)","HAZARDS","HAZARDS","",456.355933412924,2016-04-27 14:21:45,2016-04-27
"467",42257,1981692,17000139090,2017139090,"030","ARMED ROBBERY","GUN CALLS","ROBBERY","04/21/2017 11:08:18 PM","47XX BLOCK OF UNIVERSITY WY NE","U","U2","5301.2002",-122.31309,47.663998,"(47.663998, -122.31309)","ROBBERY - IP/JO (INCLUDES STRONG ARM)","ROBBERY","ROBBERY","04/21/2017 12:34:39 PM",929.234922041086,2017-04-21 23:08:18,2017-04-22
"468",42261,1824830,16000318686,2016318686,"242","FIGHT DISTURBANCE","DISTURBANCES","DISTURBANCES","09/02/2016 08:37:39 PM","52XX BLOCK OF UNIVERSITY WY NE","U","U1","4400.4000",-122.313034,47.667492,"(47.667492, -122.313034)","FIGHT - IP - PHYSICAL (NO WEAPONS)","DISTURBANCES","DISTURBANCES","",1305.00522461218,2016-09-02 20:37:39,2016-09-03
"469",42340,1935197,17000054319,201754319,"031","STRONG ARM ROBBERY","ROBBERY","ROBBERY","02/13/2017 09:50:56 PM","26XX BLOCK OF NE UNIVERSITY VILLAGE ST","U","U3","4301.1012",-122.29841,47.663322,"(47.663322, -122.29841)","SHOPLIFT - THEFT","SHOPLIFTING","THEFT","02/13/2017 08:36:31 PM",1164.76014484058,2017-02-13 21:50:56,2017-02-14
"470",42350,2004216,17000181077,2017181077,"350","HAZARDS","HAZARDS","HAZARDS","05/22/2017 08:25:15 PM","48XX BLOCK OF SAND POINT WY NE","U","U3","4100.4008",-122.28316,47.66458,"(47.66458, -122.28316)","ANIMAL - INJURED, DEAD HAZARD","ANIMAL COMPLAINTS","ANIMAL COMPLAINTS","",2196.47452707793,2017-05-22 20:25:15,2017-05-23
"471",42375,1775914,16000236119,2016236119,"242","FIGHT DISTURBANCE","DISTURBANCES","DISTURBANCES","07/02/2016 08:18:55 PM","52XX BLOCK OF SAND POINT WY NE","U","U3","4200.2023",-122.279465,47.667957,"(47.667957, -122.279465)","FIGHT - VERBAL/ORAL (NO WEAPONS)","DISTURBANCES","DISTURBANCES","",2618.54732141085,2016-07-02 20:18:55,2016-07-03
"472",42392,1765464,16000218154,2016218154,"031","STRONG ARM ROBBERY","ROBBERY","ROBBERY","06/19/2016 03:40:00 PM","45XX BLOCK OF 9 AV NE","U","U2","5200.5009",-122.318405,47.662212,"(47.662212, -122.318405)","ROBBERY (INCLUDES STRONG ARM)","ROBBERY","ROBBERY","06/19/2016 12:13:09 PM",961.489975065257,2016-06-19 15:40:00,2016-06-19
"473",42399,1947277,17000074818,201774818,"220","CRISIS COMPLAINT - GENERAL","CRISIS CALL","BEHAVIORAL HEALTH","03/02/2017 02:27:07 AM","55XX BLOCK OF 25 AV NE","U","U1","4301.3017",-122.30062,47.66926,"(47.66926, -122.30062)","CRISIS - PERSON IN BEHAVIORAL/EMOTIONAL CRISIS","BEHAVIORAL HEALTH","CRISIS CALL","03/02/2017 12:02:04 AM",1618.15189608469,2017-03-02 02:27:07,2017-03-02
"474",42485,1900554,16000454651,2016454651,"220","CRISIS COMPLAINT - GENERAL","CRISIS CALL","BEHAVIORAL HEALTH","12/19/2016 02:18:20 PM","10XX BLOCK OF NE 45 ST","U","U2","5301.3004",-122.31711,47.661297,"(47.661297, -122.31711)","DISTURBANCE, MISCELLANEOUS/OTHER","DISTURBANCES","DISTURBANCES","12/19/2016 11:17:38 AM",820.741685950805,2016-12-19 14:18:20,2016-12-19
"475",42534,1724748,16000146739,2016146739,"350","HAZARDS","HAZARDS","HAZARDS","04/28/2016 02:49:37 PM","MONTLAKE BV NE / NE PACIFIC ST","U","U3","5302.2018",-122.30459,47.648994,"(47.648994, -122.30459)","TRAFFIC - BO SIGNALS AND DOWN SIGNS","TRAFFIC RELATED CALLS","TRAFFIC RELATED CALLS","04/28/2016 10:07:39 AM",861.874216742478,2016-04-28 14:49:37,2016-04-28
"476",42550,1900776,16000455278,2016455278,"220","CRISIS COMPLAINT - GENERAL","CRISIS CALL","BEHAVIORAL HEALTH","12/19/2016 08:17:59 PM","30XX BLOCK OF NE 88 ST","U","U3","2100.1020",-122.29469,47.692375,"(47.692375, -122.29469)","CRISIS - PERSON IN BEHAVIORAL/EMOTIONAL CRISIS","BEHAVIORAL HEALTH","CRISIS CALL","",4194.44430222899,2016-12-19 20:17:59,2016-12-20
"477",42581,1765720,16000218671,2016218671,"350","HAZARDS","HAZARDS","HAZARDS","06/19/2016 10:30:02 PM","12 AV NE / NE 70 ST","U","U1","2600.3005",-122.31567,47.67945,"(47.67945, -122.31567)","TRAFFIC - BO SIGNALS AND DOWN SIGNS","TRAFFIC RELATED CALLS","TRAFFIC RELATED CALLS","06/19/2016 09:21:56 PM",2648.12005497198,2016-06-19 22:30:02,2016-06-20
"478",42591,1890523,16000435879,2016435879,"350","HAZARDS","HAZARDS","HAZARDS","12/04/2016 05:09:30 AM","20 AV NE / NE 50 ST","U","U1","4302.1008",-122.30651,47.664852,"(47.664852, -122.30651)","HAZ - POTENTIAL THRT TO PHYS SAFETY (NO HAZMAT)","HAZARDS","HAZARDS","12/04/2016 03:09:13 AM",1009.49833258589,2016-12-04 05:09:30,2016-12-04
"479",42613,1765661,16000218618,2016218618,"220","CRISIS COMPLAINT - GENERAL","CRISIS CALL","BEHAVIORAL HEALTH","06/19/2016 08:51:00 PM","43XX BLOCK OF UNIVERSITY WY NE","U","U2","5301.3001",-122.31315,47.660534,"(47.660534, -122.31315)","THREATS (INCLS IN-PERSON/BY PHONE/IN WRITING)","THREATS, HARASSMENT","THREATS, HARASSMENT","",573.843522369168,2016-06-19 20:51:00,2016-06-20
"480",42621,1847454,16000358407,2016358407,"220","CRISIS COMPLAINT - GENERAL","CRISIS CALL","BEHAVIORAL HEALTH","10/03/2016 01:03:13 PM","55XX BLOCK OF UNIVERSITY WY NE","U","U1","4400.2024",-122.313286,47.66931,"(47.66931, -122.313286)","CRISIS - PERSON IN BEHAVIORAL/EMOTIONAL CRISIS","BEHAVIORAL HEALTH","CRISIS CALL","10/03/2016 12:57:36 PM",1506.93021833908,2016-10-03 13:03:13,2016-10-03
"481",42633,1755116,16000194177,2016194177,"350","HAZARDS","HAZARDS","HAZARDS","06/02/2016 10:27:16 AM","ROOSEVELT WY NE / NE RAVENNA BV","U","U1","4400.2012",-122.31737,47.672268,"(47.672268, -122.31737)","TRAFFIC - BO SIGNALS AND DOWN SIGNS","TRAFFIC RELATED CALLS","TRAFFIC RELATED CALLS","",1902.87564631474,2016-06-02 10:27:16,2016-06-02
"482",42643,1797425,16000272453,2016272453,"350","HAZARDS","HAZARDS","HAZARDS","07/29/2016 08:11:50 PM","42XX BLOCK OF 9 AV NE","U","U2","5200.2001",-122.318794,47.658485,"(47.658485, -122.318794)","WIRES DOWN (PHONE, ELECTRICAL,ETC.)","HAZARDS","HAZARDS","",750.832793594975,2016-07-29 20:11:50,2016-07-30
"483",42758,1880213,16000417088,2016417088,"041","HARASSMENT, THREATS","THREATS, HARASSMENT","THREATS, HARASSMENT","11/18/2016 11:50:25 AM","45XX BLOCK OF UNIVERSITY WY NE","U","U2","5301.2009",-122.31312,47.66218,"(47.66218, -122.31312)","THREATS (INCLS IN-PERSON/BY PHONE/IN WRITING)","THREATS, HARASSMENT","THREATS, HARASSMENT","",738.963514898043,2016-11-18 11:50:25,2016-11-18
"484",42759,1765808,16000218780,2016218780,"030","ARMED ROBBERY","GUN CALLS","ROBBERY","06/20/2016 01:23:54 AM","NE 55 ST / 17 AV NE","U","U1","4400.3002",-122.30942,47.66854,"(47.66854, -122.30942)","ROBBERY - IP/JO (INCLUDES STRONG ARM)","ROBBERY","ROBBERY","06/19/2016 11:19:32 PM",1394.25716601234,2016-06-20 01:23:54,2016-06-20
"485",42764,1765802,16000218824,2016218824,"220","CRISIS COMPLAINT - GENERAL","CRISIS CALL","BEHAVIORAL HEALTH","06/20/2016 01:11:01 AM","14XX BLOCK OF NE 43 ST","U","U2","5301.3009",-122.3126,47.65979,"(47.65979, -122.3126)","CRISIS - PERSON IN BEHAVIORAL/EMOTIONAL CRISIS","BEHAVIORAL HEALTH","CRISIS CALL","",481.44763654886,2016-06-20 01:11:01,2016-06-20
"486",42792,1725107,16000147509,2016147509,"350","HAZARDS","HAZARDS","HAZARDS","04/28/2016 10:06:05 PM","I5 / NE 45 ST","U","U2","5200.1001",-122.3219,47.661327,"(47.661327, -122.3219)","HAZ - POTENTIAL THRT TO PHYS SAFETY (NO HAZMAT)","HAZARDS","HAZARDS","04/28/2016 09:58:36 PM",1103.79990374045,2016-04-28 22:06:05,2016-04-29
"487",42800,1735441,16000165437,2016165437,"350","HAZARDS","HAZARDS","HAZARDS","05/12/2016 11:01:30 AM","NE 75 ST / 18 AV NE","U","U1","2600.2007",-122.30887,47.683044,"(47.683044, -122.30887)","HAZ - POTENTIAL THRT TO PHYS SAFETY (NO HAZMAT)","HAZARDS","HAZARDS","",3007.22935778384,2016-05-12 11:01:30,2016-05-12
"488",42832,1868176,16000395398,2016395398,"041","HARASSMENT, THREATS","THREATS, HARASSMENT","THREATS, HARASSMENT","11/01/2016 03:14:17 PM","26XX BLOCK OF NE UNIVERSITY VILLAGE ST","U","U3","4301.1015",-122.29911,47.663197,"(47.663197, -122.29911)","THREATS (INCLS IN-PERSON/BY PHONE/IN WRITING)","THREATS, HARASSMENT","THREATS, HARASSMENT","11/01/2016 02:21:43 PM",1117.7637284671,2016-11-01 15:14:17,2016-11-01
"489",42844,1735547,16000165670,2016165670,"350","HAZARDS","HAZARDS","HAZARDS","05/12/2016 01:31:49 PM","NE PACIFIC ST / 15 AV NE","U","U2","5302.2015",-122.31247,47.652973,"(47.652973, -122.31247)","WIRES DOWN (PHONE, ELECTRICAL,ETC.)","HAZARDS","HAZARDS","",403.791075048216,2016-05-12 13:31:49,2016-05-12
"490",42848,1826324,16000321323,2016321323,"350","HAZARDS","HAZARDS","HAZARDS","09/04/2016 10:58:48 PM","NE 65 ST / 12 AV NE","U","U1","2600.3013",-122.31566,47.675816,"(47.675816, -122.31566)","HAZ - POTENTIAL THRT TO PHYS SAFETY (NO HAZMAT)","HAZARDS","HAZARDS","",2251.27058537476,2016-09-04 22:58:48,2016-09-05
"491",42866,1735574,16000165741,2016165741,"242","FIGHT DISTURBANCE","DISTURBANCES","DISTURBANCES","05/12/2016 02:29:53 PM","43XX BLOCK OF UNIVERSITY WY NE","U","U2","5301.3000",-122.31315,47.660534,"(47.660534, -122.31315)","FIGHT - IP - PHYSICAL (NO WEAPONS)","DISTURBANCES","DISTURBANCES","",573.843522369168,2016-05-12 14:29:53,2016-05-12
"492",42879,1735550,16000165411,2016165411,"350","HAZARDS","HAZARDS","HAZARDS","05/12/2016 01:31:29 PM","NE 75 ST / RAVENNA AV NE","U","U1","2500.1026",-122.30399,47.683044,"(47.683044, -122.30399)","HAZ - POTENTIAL THRT TO PHYS SAFETY (NO HAZMAT)","HAZARDS","HAZARDS","",3035.19757542076,2016-05-12 13:31:29,2016-05-12
"493",42880,2052252,17000268393,2017268393,"242","FIGHT DISTURBANCE","DISTURBANCES","DISTURBANCES","07/22/2017 11:59:21 PM","47XX BLOCK OF UNIVERSITY WY NE","U","U2","5301.2002",-122.31309,47.663998,"(47.663998, -122.31309)","WEAPN-IP/JO-GUN,DEADLY WPN (NO THRT/ASLT/DIST)","WEAPONS CALLS","WEAPONS CALLS","",929.234922041086,2017-07-22 23:59:21,2017-07-23
"494",42888,1725615,16000148118,2016148118,"041","HARASSMENT, THREATS","THREATS, HARASSMENT","THREATS, HARASSMENT","04/29/2016 03:06:20 PM","40XX BLOCK OF ROOSEVELT WY NE","U","U2","5200.2003",-122.317825,47.656597,"(47.656597, -122.317825)","THREATS (INCLS IN-PERSON/BY PHONE/IN WRITING)","THREATS, HARASSMENT","THREATS, HARASSMENT","04/29/2016 01:07:30 PM",628.884016143422,2016-04-29 15:06:20,2016-04-29
"495",42917,1735842,16000166156,2016166156,"242","FIGHT DISTURBANCE","DISTURBANCES","DISTURBANCES","05/12/2016 09:16:41 PM","52XX BLOCK OF 19 AV NE","U","U1","4400.3000",-122.30715,47.667465,"(47.667465, -122.30715)","FIGHT - IP/JO - WITH WEAPONS","DISTURBANCES","DISTURBANCES","05/12/2016 08:12:51 PM",1286.88456481832,2016-05-12 21:16:41,2016-05-13
"496",42925,1869046,16000397136,2016397136,"041","HARASSMENT, THREATS","THREATS, HARASSMENT","THREATS, HARASSMENT","11/02/2016 07:09:48 PM","86XX BLOCK OF RAVENNA AV NE","U","U1","2100.3002",-122.301956,47.69178,"(47.69178, -122.301956)","THREATS (INCLS IN-PERSON/BY PHONE/IN WRITING)","THREATS, HARASSMENT","THREATS, HARASSMENT","11/02/2016 06:15:06 PM",4018.29744788796,2016-11-02 19:09:48,2016-11-03
"497",42945,1735593,16000165463,2016165463,"041","HARASSMENT, THREATS","THREATS, HARASSMENT","THREATS, HARASSMENT","05/12/2016 02:32:00 PM","75XX BLOCK OF 31 AV NE","U","U3","2400.3018",-122.2948,47.683952,"(47.683952, -122.2948)","HARAS - NO BIAS, THREATS OR MALICIOUSNESS","THREATS, HARASSMENT","THREATS, HARASSMENT","05/12/2016 11:45:28 AM",3298.06747661298,2016-05-12 14:32:00,2016-05-12
"498",42949,1880329,16000417222,2016417222,"350","HAZARDS","HAZARDS","HAZARDS","11/18/2016 03:28:34 PM","25 AV NE / NE 47 ST","U","U1","4301.1012",-122.30089,47.663265,"(47.663265, -122.30089)","HAZ - POTENTIAL THRT TO PHYS SAFETY (NO HAZMAT)","HAZARDS","HAZARDS","",1034.76131639558,2016-11-18 15:28:34,2016-11-18
"499",42962,1766063,16000219345,2016219345,"041","HARASSMENT, THREATS","THREATS, HARASSMENT","THREATS, HARASSMENT","06/20/2016 12:20:20 PM","69XX BLOCK OF 62 AV NE","U","U3","4000.1014",-122.26223,47.67889,"(47.67889, -122.26223)","TRU - HARASSMENT","THREATS, HARASSMENT","THREATS, HARASSMENT","",4368.13337390337,2016-06-20 12:20:20,2016-06-20
"500",42973,1798550,16000274435,2016274435,"242","FIGHT DISTURBANCE","DISTURBANCES","DISTURBANCES","07/31/2016 02:26:52 AM","50XX BLOCK OF UNIVERSITY WY NE","U","U1","4400.4008",-122.313065,47.66567,"(47.66567, -122.313065)","FIGHT - VERBAL/ORAL (NO WEAPONS)","DISTURBANCES","DISTURBANCES","",1107.99164074666,2016-07-31 02:26:52,2016-07-31
"501",42986,1735743,16000165850,2016165850,"041","HARASSMENT, THREATS","THREATS, HARASSMENT","THREATS, HARASSMENT","05/12/2016 07:14:55 PM","14XX BLOCK OF NE 43 ST","U","U2","5301.3009",-122.3126,47.65979,"(47.65979, -122.3126)","THREATS (INCLS IN-PERSON/BY PHONE/IN WRITING)","THREATS, HARASSMENT","THREATS, HARASSMENT","05/12/2016 03:25:51 PM",481.44763654886,2016-05-12 19:14:55,2016-05-13
"502",42999,1758249,16000205618,2016205618,"220","CRISIS COMPLAINT - GENERAL","CRISIS CALL","BEHAVIORAL HEALTH","06/10/2016 05:07:11 AM","47XX BLOCK OF 12 AV NE","U","U2","5301.2004",-122.315254,47.664013,"(47.664013, -122.315254)","ASLT - IP/JO - WITH OR W/O WPNS (NO SHOOTINGS)","ASSAULTS","ASSAULTS","06/10/2016 04:18:22 AM",990.218839131712,2016-06-10 05:07:11,2016-06-10
"503",43018,2004339,17000181287,2017181287,"220","CRISIS COMPLAINT - GENERAL","CRISIS CALL","BEHAVIORAL HEALTH","05/22/2017 11:52:07 PM","NE 40 ST / BROOKLYN AV NE","U","U2","5302.2001",-122.314445,47.655365,"(47.655365, -122.314445)","CRISIS - PERSON IN BEHAVIORAL/EMOTIONAL CRISIS","BEHAVIORAL HEALTH","CRISIS CALL","",378.120890114071,2017-05-22 23:52:07,2017-05-23
"504",43029,1735655,16000165716,2016165716,"041","HARASSMENT, THREATS","THREATS, HARASSMENT","THREATS, HARASSMENT","05/12/2016 04:43:46 PM","14XX BLOCK OF NE 50 ST","U","U2","5301.2001",-122.31251,47.664898,"(47.664898, -122.31251)","WEAPN-IP/JO-GUN,DEADLY WPN (NO THRT/ASLT/DIST)","WEAPONS CALLS","WEAPONS CALLS","05/12/2016 01:46:26 PM",1014.81886073838,2016-05-12 16:43:46,2016-05-12
"505",43038,1948243,17000076878,201776878,"350","HAZARDS","HAZARDS","HAZARDS","03/03/2017 02:15:19 PM","NE 50 ST / I5","U","U1","5200.5003",-122.321724,47.664963,"(47.664963, -122.321724)","HAZ - POTENTIAL THRT TO PHYS SAFETY (NO HAZMAT)","HAZARDS","HAZARDS","",1355.05103119415,2017-03-03 14:15:19,2017-03-03
"506",43039,1776444,16000236836,2016236836,"242","FIGHT DISTURBANCE","DISTURBANCES","DISTURBANCES","07/03/2016 01:26:06 PM","65XX BLOCK OF SAND POINT WY NE","U","U3","4000.1028",-122.26355,47.676197,"(47.676197, -122.26355)","FIGHT - IP - PHYSICAL (NO WEAPONS)","DISTURBANCES","DISTURBANCES","07/03/2016 09:52:58 AM",4117.37052735623,2016-07-03 13:26:06,2016-07-03
"507",43099,2040178,17000246426,2017246426,"041","HARASSMENT, THREATS","THREATS, HARASSMENT","THREATS, HARASSMENT","07/07/2017 07:15:36 PM","62XX BLOCK OF 27 AV NE","U","U3","4301.2002",-122.298546,47.674896,"(47.674896, -122.298546)","THREATS (INCLS IN-PERSON/BY PHONE/IN WRITING)","THREATS, HARASSMENT","THREATS, HARASSMENT","07/07/2017 04:48:15 PM",2256.27290076452,2017-07-07 19:15:36,2017-07-08
"508",43101,1993140,17000160666,2017160666,"242","FIGHT DISTURBANCE","DISTURBANCES","DISTURBANCES","05/07/2017 11:21:34 PM","16 AV NE / NE 80 ST","U","U1","2600.1018",-122.31108,47.686676,"(47.686676, -122.31108)","FIGHT - JO - PHYSICAL (NO WEAPONS)","DISTURBANCES","DISTURBANCES","",3412.74144953467,2017-05-07 23:21:34,2017-05-08
"509",43102,1735906,16000166320,2016166320,"350","HAZARDS","HAZARDS","HAZARDS","05/12/2016 11:17:19 PM","15 AV NE / NE 40 ST","U","U2","5302.2000",-122.31215,47.65534,"(47.65534, -122.31215)","HAZ - POTENTIAL THRT TO PHYS SAFETY (NO HAZMAT)","HAZARDS","HAZARDS","",212.163793200673,2016-05-12 23:17:19,2016-05-13
"510",43114,2114096,17000380875,2017380875,"350","HAZARDS","HAZARDS","HAZARDS","10/13/2017 12:36:42 PM","NE 45 ST / 11 AV NE","U","U2","5301.2006",-122.31658,47.661293,"(47.661293, -122.31658)","HAZ - POTENTIAL THRT TO PHYS SAFETY (NO HAZMAT)","HAZARDS","HAZARDS","",793.197829416394,2017-10-13 12:36:42,2017-10-13
"511",43125,1766255,16000219595,2016219595,"041","HARASSMENT, THREATS","THREATS, HARASSMENT","THREATS, HARASSMENT","06/20/2016 04:55:44 PM","50XX BLOCK OF 7 AV NE","U","U1","4500.1011",-122.3207,47.665226,"(47.665226, -122.3207)","THREATS (INCLS IN-PERSON/BY PHONE/IN WRITING)","THREATS, HARASSMENT","THREATS, HARASSMENT","06/20/2016 03:33:57 PM",1326.63618482828,2016-06-20 16:55:44,2016-06-20
"512",43132,1726029,16000149073,2016149073,"030","ARMED ROBBERY","GUN CALLS","ROBBERY","04/30/2016 04:18:41 AM","45XX BLOCK OF UNIVERSITY WY NE","U","U2","5301.2010",-122.31312,47.66218,"(47.66218, -122.31312)","WEAPN-IP/JO-GUN,DEADLY WPN (NO THRT/ASLT/DIST)","WEAPONS CALLS","WEAPONS CALLS","04/30/2016 01:46:41 AM",738.963514898043,2016-04-30 04:18:41,2016-04-30
"513",43155,1725895,16000148918,2016148918,"031","STRONG ARM ROBBERY","ROBBERY","ROBBERY","04/30/2016 12:30:19 AM","65XX BLOCK OF SAND POINT WY NE","U","U3","4000.1028",-122.26355,47.676197,"(47.676197, -122.26355)","ROBBERY - IP/JO (INCLUDES STRONG ARM)","ROBBERY","ROBBERY","04/29/2016 11:07:46 PM",4117.37052735623,2016-04-30 00:30:19,2016-04-30
"514",43161,1809083,16000292997,2016292997,"350","HAZARDS","HAZARDS","HAZARDS","08/13/2016 10:49:25 PM","44XX BLOCK OF NE 70 ST","U","U3","3900.1011",-122.28079,47.679413,"(47.679413, -122.28079)","FIREWORKS - NUISANCE (NO HAZARD)","MISCELLANEOUS MISDEMEANORS","MISCELLANEOUS MISDEMEANORS","",3380.18413397909,2016-08-13 22:49:25,2016-08-14
"515",43227,1859405,16000379957,2016379957,"041","HARASSMENT, THREATS","THREATS, HARASSMENT","THREATS, HARASSMENT","10/20/2016 03:03:16 PM","41XX BLOCK OF UNIVERSITY WY NE","U","U2","5301.4001",-122.31366,47.65818,"(47.65818, -122.31366)","THREATS (INCLS IN-PERSON/BY PHONE/IN WRITING)","THREATS, HARASSMENT","THREATS, HARASSMENT","10/20/2016 01:24:12 PM",395.474635897323,2016-10-20 15:03:16,2016-10-20
"516",43248,1787003,16000254037,2016254037,"242","FIGHT DISTURBANCE","DISTURBANCES","DISTURBANCES","07/16/2016 01:36:13 AM","52XX BLOCK OF MITHUN PL NE","U","U3","4200.2023",-122.28154,47.667786,"(47.667786, -122.28154)","FIGHT - IP - PHYSICAL (NO WEAPONS)","DISTURBANCES","DISTURBANCES","07/15/2016 07:03:51 PM",2475.41708107211,2016-07-16 01:36:13,2016-07-16
"517",43252,2114576,17000381716,2017381716,"041","HARASSMENT, THREATS","THREATS, HARASSMENT","THREATS, HARASSMENT","10/14/2017 02:00:15 AM","50XX BLOCK OF 7 AV NE","U","U1","4500.1011",-122.320694,47.66631,"(47.66631, -122.320694)","ASLT - IP/JO - WITH OR W/O WPNS (NO SHOOTINGS)","ASSAULTS","ASSAULTS","10/13/2017 11:38:56 PM",1421.61092789954,2017-10-14 02:00:15,2017-10-14
"518",43255,1736004,16000166428,2016166428,"220","CRISIS COMPLAINT - GENERAL","CRISIS CALL","BEHAVIORAL HEALTH","05/13/2016 01:43:42 AM","43XX BLOCK OF UNIVERSITY WY NE","U","U2","5301.3001",-122.31315,47.660534,"(47.660534, -122.31315)","CRISIS - PERSON IN BEHAVIORAL/EMOTIONAL CRISIS","BEHAVIORAL HEALTH","CRISIS CALL","",573.843522369168,2016-05-13 01:43:42,2016-05-13
"519",43289,1787184,16000254771,2016254771,"350","HAZARDS","HAZARDS","HAZARDS","07/16/2016 09:09:15 AM","35 AV NE / NE 55 ST","U","U3","4200.4024",-122.29019,47.66851,"(47.66851, -122.29019)","HAZ - POTENTIAL THRT TO PHYS SAFETY (NO HAZMAT)","HAZARDS","HAZARDS","",2009.54605492854,2016-07-16 09:09:15,2016-07-16
"520",43342,1726626,16000150157,2016150157,"041","HARASSMENT, THREATS","THREATS, HARASSMENT","THREATS, HARASSMENT","04/30/2016 11:37:55 PM","NE 42 ST / 8 AV NE","U","U2","5200.2002",-122.31979,47.657516,"(47.657516, -122.31979)","THREATS (INCLS IN-PERSON/BY PHONE/IN WRITING)","THREATS, HARASSMENT","THREATS, HARASSMENT","04/30/2016 10:48:47 PM",791.138686962686,2016-04-30 23:37:55,2016-05-01
"521",43363,1868338,16000395772,2016395772,"220","CRISIS COMPLAINT - GENERAL","CRISIS CALL","BEHAVIORAL HEALTH","11/01/2016 07:15:07 PM","57XX BLOCK OF 17 AV NE","U","U1","4400.1024",-122.30936,47.67082,"(47.67082, -122.30936)","DISTURBANCE, MISCELLANEOUS/OTHER","DISTURBANCES","DISTURBANCES","11/01/2016 04:35:51 PM",1647.7770474482,2016-11-01 19:15:07,2016-11-02
"522",43384,1993211,17000160533,2017160533,"041","HARASSMENT, THREATS","THREATS, HARASSMENT","THREATS, HARASSMENT","05/08/2017 02:12:31 AM","7 AV NE / NE 45 ST","U","U2","5200.5005",-122.32073,47.661316,"(47.661316, -122.32073)","ASLT - IP/JO - WITH OR W/O WPNS (NO SHOOTINGS)","ASSAULTS","ASSAULTS","05/07/2017 09:03:53 PM",1030.01436970243,2017-05-08 02:12:31,2017-05-08
"523",43385,1736133,16000166573,2016166573,"030","ARMED ROBBERY","GUN CALLS","ROBBERY","05/13/2016 07:48:12 AM","16 AV NE / NE 47 ST","U","U2","5301.1005",-122.31083,47.663074,"(47.663074, -122.31083)","ROBBERY - IP/JO (INCLUDES STRONG ARM)","ROBBERY","ROBBERY","05/13/2016 05:25:22 AM",792.832921032722,2016-05-13 07:48:12,2016-05-13
"524",43413,1726712,16000150357,2016150357,"220","CRISIS COMPLAINT - GENERAL","CRISIS CALL","BEHAVIORAL HEALTH","05/01/2016 06:01:03 AM","41XX BLOCK OF 11 AV NE","U","U2","5301.4004",-122.316666,47.657917,"(47.657917, -122.316666)","CRISIS - PERSON IN BEHAVIORAL/EMOTIONAL CRISIS","BEHAVIORAL HEALTH","CRISIS CALL","05/01/2016 03:39:17 AM",578.961145985207,2016-05-01 06:01:03,2016-05-01
"525",43463,1726753,16000150301,2016150301,"350","HAZARDS","HAZARDS","HAZARDS","05/01/2016 02:03:19 AM","NE 42 ST / ROOSEVELT WY NE","U","U2","5301.4004",-122.3178,47.657513,"(47.657513, -122.3178)","DISTURBANCE, MISCELLANEOUS/OTHER","DISTURBANCES","DISTURBANCES","05/01/2016 01:54:46 AM",645.782739718582,2016-05-01 02:03:19,2016-05-01
"526",43479,1776980,16000237739,2016237739,"031","STRONG ARM ROBBERY","ROBBERY","ROBBERY","07/04/2016 02:37:49 AM","47XX BLOCK OF BROOKLYN AV NE","U","U2","5301.2002",-122.314224,47.664005,"(47.664005, -122.314224)","SHOPLIFT - THEFT","SHOPLIFTING","THEFT","07/03/2016 11:33:09 PM",958.152960945758,2016-07-04 02:37:49,2016-07-04
"527",43501,2114714,17000382012,2017382012,"220","CRISIS COMPLAINT - GENERAL","CRISIS CALL","BEHAVIORAL HEALTH","10/14/2017 09:33:20 AM","4213 1 / 2 UNIVERSITY WY NE","U","U2","5301.3008",-122.31347,47.658783,"(47.658783, -122.31347)","CRISIS - PERSON IN BEHAVIORAL/EMOTIONAL CRISIS","BEHAVIORAL HEALTH","CRISIS CALL","",429.741529773383,2017-10-14 09:33:20,2017-10-14
"528",43509,1857979,16000377401,2016377401,"350","HAZARDS","HAZARDS","HAZARDS","10/18/2016 03:43:22 PM","52XX BLOCK OF 20 AV NE","U","U1","4302.1003",-122.30622,47.667866,"(47.667866, -122.30622)","HAZ - POTENTIAL THRT TO PHYS SAFETY (NO HAZMAT)","HAZARDS","HAZARDS","10/18/2016 03:08:38 PM",1342.11225697673,2016-10-18 15:43:22,2016-10-18
"529",43510,1727147,16000151091,2016151091,"350","HAZARDS","HAZARDS","HAZARDS","05/01/2016 07:27:56 PM","NE 45 ST / 15 AV NE","U","U2","5301.2010",-122.312,47.66126,"(47.66126, -122.312)","HAZ - POTENTIAL THRT TO PHYS SAFETY (NO HAZMAT)","HAZARDS","HAZARDS","",614.236940217108,2016-05-01 19:27:56,2016-05-02
"530",43520,1743138,16000180981,2016180981,"220","CRISIS COMPLAINT - GENERAL","CRISIS CALL","BEHAVIORAL HEALTH","05/23/2016 09:05:23 PM","45XX BLOCK OF 7 AV NE","U","U2","5200.5005",-122.320724,47.661564,"(47.661564, -122.320724)","CRISIS - PERSON IN BEHAVIORAL/EMOTIONAL CRISIS","BEHAVIORAL HEALTH","CRISIS CALL","05/23/2016 07:37:54 PM",1045.71564454053,2016-05-23 21:05:23,2016-05-24
"531",43535,1727267,16000150890,2016150890,"350","HAZARDS","HAZARDS","HAZARDS","05/01/2016 11:02:47 PM","83XX BLOCK OF LAKE CITY WY NE","U","U1","2600.1001",-122.30858,47.690025,"(47.690025, -122.30858)","TRAFFIC - BO SIGNALS AND DOWN SIGNS","TRAFFIC RELATED CALLS","TRAFFIC RELATED CALLS","05/01/2016 04:00:38 PM",3783.66500205036,2016-05-01 23:02:47,2016-05-02
"532",43537,1727275,16000151251,2016151251,"220","CRISIS COMPLAINT - GENERAL","CRISIS CALL","BEHAVIORAL HEALTH","05/01/2016 11:33:47 PM","41XX BLOCK OF 11 AV NE","U","U2","5301.4004",-122.316666,47.657917,"(47.657917, -122.316666)","UNKNOWN - COMPLAINT OF UNKNOWN NATURE","SUSPICIOUS CIRCUMSTANCES","SUSPICIOUS CIRCUMSTANCES","",578.961145985207,2016-05-01 23:33:47,2016-05-02
"533",43541,1890867,16000436307,2016436307,"350","HAZARDS","HAZARDS","HAZARDS","12/04/2016 05:48:17 PM","RAVENNA AV NE / NE 85 ST","U","U1","2100.3002",-122.301674,47.690266,"(47.690266, -122.301674)","ILLEGAL DUMPING","MISCELLANEOUS MISDEMEANORS","MISCELLANEOUS MISDEMEANORS","12/04/2016 01:23:51 PM",3854.89170101851,2016-12-04 17:48:17,2016-12-05
"534",43571,1824797,16000318244,2016318244,"350","HAZARDS","HAZARDS","HAZARDS","09/02/2016 07:41:31 PM","NE PACIFIC ST / MONTLAKE BV NE","U","U2","5302.2018",-122.30459,47.648994,"(47.648994, -122.30459)","TRAFFIC - BO SIGNALS AND DOWN SIGNS","TRAFFIC RELATED CALLS","TRAFFIC RELATED CALLS","",861.874216742478,2016-09-02 19:41:31,2016-09-03
"535",43611,1969288,17000116408,2017116408,"220","CRISIS COMPLAINT - GENERAL","CRISIS CALL","BEHAVIORAL HEALTH","04/03/2017 03:24:15 PM","45XX BLOCK OF BROOKLYN AV NE","U","U2","5301.2009",-122.31426,47.66219,"(47.66219, -122.31426)","THREATS (INCLS IN-PERSON/BY PHONE/IN WRITING)","THREATS, HARASSMENT","THREATS, HARASSMENT","",775.56356285686,2017-04-03 15:24:15,2017-04-03
"536",43652,1743230,16000179203,2016179203,"031","STRONG ARM ROBBERY","ROBBERY","ROBBERY","05/22/2016 02:47:16 PM","50XX BLOCK OF 15 AV NE","U","U1","4400.3006",-122.31193,47.66566,"(47.66566, -122.31193)","ROBBERY (INCLUDES STRONG ARM)","ROBBERY","ROBBERY","05/22/2016 12:07:58 PM",1089.43380769836,2016-05-22 14:47:16,2016-05-22
"537",43659,1947723,17000075494,201775494,"220","CRISIS COMPLAINT - GENERAL","CRISIS CALL","BEHAVIORAL HEALTH","03/02/2017 06:51:05 PM","30XX BLOCK OF NE 75 ST","U","U3","3800.1002",-122.29533,47.68305,"(47.68305, -122.29533)","DISTURBANCE, MISCELLANEOUS/OTHER","DISTURBANCES","DISTURBANCES","03/02/2017 01:53:29 PM",3190.24678435193,2017-03-02 18:51:05,2017-03-03
"538",43673,1847935,16000359315,2016359315,"030","ARMED ROBBERY","GUN CALLS","ROBBERY","10/04/2016 11:11:53 AM","45XX BLOCK OF BROOKLYN AV NE","U","U2","5301.2007",-122.31467,47.662823,"(47.662823, -122.31467)","SHOPLIFT - THEFT","SHOPLIFTING","THEFT","10/04/2016 05:10:31 AM",852.22996433205,2016-10-04 11:11:53,2016-10-04
"539",43678,1756000,16000201572,2016201572,"350","HAZARDS","HAZARDS","HAZARDS","06/07/2016 11:37:14 AM","17 AV NE / NE 62 ST","U","U1","4400.1010",-122.30978,47.673813,"(47.673813, -122.30978)","HAZ - POTENTIAL THRT TO PHYS SAFETY (NO HAZMAT)","HAZARDS","HAZARDS","06/07/2016 09:58:32 AM",1980.62869300646,2016-06-07 11:37:14,2016-06-07
"540",43681,1858124,16000377629,2016377629,"220","CRISIS COMPLAINT - GENERAL","CRISIS CALL","BEHAVIORAL HEALTH","10/18/2016 07:09:10 PM","45XX BLOCK OF 15 AV NE","U","U2","5301.2011",-122.31166,47.661858,"(47.661858, -122.31166)","DISTURBANCE, MISCELLANEOUS/OTHER","DISTURBANCES","DISTURBANCES","10/18/2016 05:25:14 PM",671.219138188232,2016-10-18 19:09:10,2016-10-19
"541",43683,1727673,16000151784,2016151784,"041","HARASSMENT, THREATS","THREATS, HARASSMENT","THREATS, HARASSMENT","05/02/2016 02:23:41 PM","45XX BLOCK OF UNIVERSITY WY NE","U","U2","5301.2009",-122.31312,47.66218,"(47.66218, -122.31312)","THREATS (INCLS IN-PERSON/BY PHONE/IN WRITING)","THREATS, HARASSMENT","THREATS, HARASSMENT","05/02/2016 12:11:13 PM",738.963514898043,2016-05-02 14:23:41,2016-05-02
"542",43695,1798762,16000274655,2016274655,"041","HARASSMENT, THREATS","THREATS, HARASSMENT","THREATS, HARASSMENT","07/31/2016 11:22:04 AM","65XX BLOCK OF 40 AV NE","U","U3","3900.1024",-122.28493,47.676693,"(47.676693, -122.28493)","THREATS (INCLS IN-PERSON/BY PHONE/IN WRITING)","THREATS, HARASSMENT","THREATS, HARASSMENT","07/31/2016 10:22:20 AM",2949.34067058027,2016-07-31 11:22:04,2016-07-31
"543",43728,2052305,17000268389,2017268389,"242","FIGHT DISTURBANCE","DISTURBANCES","DISTURBANCES","07/23/2017 12:52:09 AM","11 AV NE / NE 43 ST","U","U2","5301.3005",-122.31662,47.659836,"(47.659836, -122.31662)","FIGHT - IP - PHYSICAL (NO WEAPONS)","DISTURBANCES","DISTURBANCES","07/22/2017 11:19:46 PM",684.070000729982,2017-07-23 00:52:09,2017-07-23
"544",43754,1736676,16000167655,2016167655,"350","HAZARDS","HAZARDS","HAZARDS","05/13/2016 09:29:26 PM","NE 65 ST / 57 AV NE","U","U3","4000.1032",-122.2679,47.675743,"(47.675743, -122.2679)","HAZ - POTENTIAL THRT TO PHYS SAFETY (NO HAZMAT)","HAZARDS","HAZARDS","",3818.4281282345,2016-05-13 21:29:26,2016-05-14
"545",43809,1758131,16000205437,2016205437,"220","CRISIS COMPLAINT - GENERAL","CRISIS CALL","BEHAVIORAL HEALTH","06/10/2016 01:02:51 AM","15 AV NE / NE 50 ST","U","U1","4400.4009",-122.311935,47.66489,"(47.66489, -122.311935)","CRISIS - PERSON IN BEHAVIORAL/EMOTIONAL CRISIS","BEHAVIORAL HEALTH","CRISIS CALL","06/09/2016 11:31:04 PM",1005.20324732383,2016-06-10 01:02:51,2016-06-10
"546",43813,2114201,17000380990,2017380990,"041","HARASSMENT, THREATS","THREATS, HARASSMENT","THREATS, HARASSMENT","10/13/2017 03:55:55 PM","46XX BLOCK OF 27 AV NE","U","U3","4301.1014",-122.29765,47.66284,"(47.66284, -122.29765)","THREATS (INCLS IN-PERSON/BY PHONE/IN WRITING)","THREATS, HARASSMENT","THREATS, HARASSMENT","10/13/2017 02:17:20 PM",1170.75178270805,2017-10-13 15:55:55,2017-10-13
"547",43815,1808451,16000291991,2016291991,"350","HAZARDS","HAZARDS","HAZARDS","08/13/2016 02:37:47 AM","32 AV NE / NE 60 ST","U","U3","4200.5008",-122.29325,47.672146,"(47.672146, -122.29325)","HAZ - POTENTIAL THRT TO PHYS SAFETY (NO HAZMAT)","HAZARDS","HAZARDS","",2170.7834158581,2016-08-13 02:37:47,2016-08-13
"548",43876,1756302,16000201956,2016201956,"350","HAZARDS","HAZARDS","HAZARDS","06/07/2016 07:26:08 PM","SAND POINT WY NE / NE 45 ST","U","U3","4100.5019",-122.28722,47.66137,"(47.66137, -122.28722)","TRAFFIC - BO SIGNALS AND DOWN SIGNS","TRAFFIC RELATED CALLS","TRAFFIC RELATED CALLS","",1776.90181166702,2016-06-07 19:26:08,2016-06-08
"549",43908,1736815,16000167000,2016167000,"350","HAZARDS","HAZARDS","HAZARDS","05/13/2016 11:44:05 PM","MONTLAKE BV NE / NE PACIFIC ST","U","U3","5302.2018",-122.30459,47.648994,"(47.648994, -122.30459)","TRAFFIC - BO SIGNALS AND DOWN SIGNS","TRAFFIC RELATED CALLS","TRAFFIC RELATED CALLS","05/13/2016 12:07:30 PM",861.874216742478,2016-05-13 23:44:05,2016-05-14
"550",43909,1767257,16000221305,2016221305,"220","CRISIS COMPLAINT - GENERAL","CRISIS CALL","BEHAVIORAL HEALTH","06/21/2016 10:30:54 PM","62XX BLOCK OF 32 AV NE","U","U3","4200.5002",-122.29326,47.67488,"(47.67488, -122.29326)","CRISIS - PERSON IN BEHAVIORAL/EMOTIONAL CRISIS","BEHAVIORAL HEALTH","CRISIS CALL","",2427.79216749424,2016-06-21 22:30:54,2016-06-22
"551",43927,1834676,16000335817,2016335817,"031","STRONG ARM ROBBERY","ROBBERY","ROBBERY","09/16/2016 09:50:02 AM","82XX BLOCK OF LAKE CITY WY NE","U","U1","2600.1009",-122.309616,47.68897,"(47.68897, -122.309616)","ROBBERY (INCLUDES STRONG ARM)","ROBBERY","ROBBERY","09/16/2016 04:08:31 AM",3665.74512663716,2016-09-16 09:50:02,2016-09-16
"552",43943,1868326,16000395974,2016395974,"030","ARMED ROBBERY","GUN CALLS","ROBBERY","11/01/2016 07:31:05 PM","UNIVERSITY WY NE / NE 42 ST","U","U2","5301.3008",-122.31321,47.658314,"(47.658314, -122.31321)","ROBBERY - IP/JO (INCLUDES STRONG ARM)","ROBBERY","ROBBERY","11/01/2016 06:49:53 PM",379.289152249279,2016-11-01 19:31:05,2016-11-02
"553",43949,1798079,16000273658,2016273658,"220","CRISIS COMPLAINT - GENERAL","CRISIS CALL","BEHAVIORAL HEALTH","07/30/2016 03:35:11 PM","ROOSEVELT WY NE / NE 41 ST","U","U2","5301.4004",-122.317825,47.656887,"(47.656887, -122.317825)","CRISIS - PERSON IN BEHAVIORAL/EMOTIONAL CRISIS","BEHAVIORAL HEALTH","CRISIS CALL","",633.09791117396,2016-07-30 15:35:11,2016-07-30
"554",43956,1901042,16000455682,2016455682,"350","HAZARDS","HAZARDS","HAZARDS","12/20/2016 07:58:48 AM","30 AV NE / NE 54 ST","U","U3","4301.1000",-122.29564,47.667862,"(47.667862, -122.29564)","TREES DOWN, OBSTRUCTING PUBLIC PROP (NO HAZ)","TREES DOWN","TREES DOWN","",1680.23035477845,2016-12-20 07:58:48,2016-12-20
"555",44026,1736858,16000168105,2016168105,"242","FIGHT DISTURBANCE","DISTURBANCES","DISTURBANCES","05/14/2016 01:22:26 AM","18 AV NE / NE 52 ST","U","U1","4400.3009",-122.308304,47.6664,"(47.6664, -122.308304)","FIGHT - IP - PHYSICAL (NO WEAPONS)","DISTURBANCES","DISTURBANCES","",1159.79519336649,2016-05-14 01:22:26,2016-05-14
"556",44042,1981065,17000138575,2017138575,"220","CRISIS COMPLAINT - GENERAL","CRISIS CALL","BEHAVIORAL HEALTH","04/21/2017 02:30:27 AM","47XX BLOCK OF 18 AV NE","U","U1","5301.1002",-122.30834,47.663963,"(47.663963, -122.30834)","UNKNOWN - COMPLAINT OF UNKNOWN NATURE","SUSPICIOUS CIRCUMSTANCES","SUSPICIOUS CIRCUMSTANCES","04/21/2017 12:26:29 AM",889.633111327838,2017-04-21 02:30:27,2017-04-21
"557",44055,1798178,16000273598,2016273598,"350","HAZARDS","HAZARDS","HAZARDS","07/30/2016 06:14:12 PM","NE PACIFIC ST / MONTLAKE BV NE","U","U3","5302.2018",-122.30459,47.648994,"(47.648994, -122.30459)","TRAFFIC - BO SIGNALS AND DOWN SIGNS","TRAFFIC RELATED CALLS","TRAFFIC RELATED CALLS","07/30/2016 02:56:38 PM",861.874216742478,2016-07-30 18:14:12,2016-07-31
"558",44086,1777392,16000238500,2016238500,"350","HAZARDS","HAZARDS","HAZARDS","07/04/2016 03:57:31 PM","45XX BLOCK OF 7 AV NE","U","U2","5200.5005",-122.320724,47.661564,"(47.661564, -122.320724)","HAZ - POTENTIAL THRT TO PHYS SAFETY (NO HAZMAT)","HAZARDS","HAZARDS","",1045.71564454053,2016-07-04 15:57:31,2016-07-04
"559",44092,1756337,16000202394,2016202394,"242","FIGHT DISTURBANCE","DISTURBANCES","DISTURBANCES","06/07/2016 08:20:34 PM","47XX BLOCK OF 12 AV NE","U","U2","5301.2004",-122.315254,47.664013,"(47.664013, -122.315254)","FIGHT - IP - PHYSICAL (NO WEAPONS)","DISTURBANCES","DISTURBANCES","",990.218839131712,2016-06-07 20:20:34,2016-06-08
"560",44108,1767300,16000221312,2016221312,"220","CRISIS COMPLAINT - GENERAL","CRISIS CALL","BEHAVIORAL HEALTH","06/21/2016 11:34:18 PM","15 AV NE / NE 45 ST","U","U2","5301.2010",-122.312,47.66126,"(47.66126, -122.312)","CRISIS - PERSON IN BEHAVIORAL/EMOTIONAL CRISIS","BEHAVIORAL HEALTH","CRISIS CALL","06/21/2016 09:18:36 PM",614.236940217108,2016-06-21 23:34:18,2016-06-22
"561",44128,1981201,17000138897,2017138897,"030","ARMED ROBBERY","GUN CALLS","ROBBERY","04/21/2017 11:03:09 AM","46XX BLOCK OF 26 AV NE","U","U3","4301.1014",-122.29986,47.6628,"(47.6628, -122.29986)","ROBBERY (INCLUDES STRONG ARM)","ROBBERY","ROBBERY","04/21/2017 09:57:27 AM",1046.87472030832,2017-04-21 11:03:09,2017-04-21
"562",44150,1912358,17000007982,20177982,"220","CRISIS COMPLAINT - GENERAL","CRISIS CALL","BEHAVIORAL HEALTH","01/07/2017 03:11:38 PM","94XX BLOCK OF RAVENNA AV NE","U","U1","2100.2003",-122.30521,47.69678,"(47.69678, -122.30521)","CRISIS - PERSON IN BEHAVIORAL/EMOTIONAL CRISIS","BEHAVIORAL HEALTH","CRISIS CALL","01/07/2017 12:24:43 PM",4545.51387393368,2017-01-07 15:11:38,2017-01-07
"563",44170,1756489,16000202240,2016202240,"041","HARASSMENT, THREATS","THREATS, HARASSMENT","THREATS, HARASSMENT","06/07/2016 11:46:25 PM","43XX BLOCK OF UNIVERSITY WY NE","U","U2","5301.3000",-122.31315,47.660534,"(47.660534, -122.31315)","THREATS (INCLS IN-PERSON/BY PHONE/IN WRITING)","THREATS, HARASSMENT","THREATS, HARASSMENT","06/07/2016 08:04:30 PM",573.843522369168,2016-06-07 23:46:25,2016-06-08
"564",44187,1788089,16000256288,2016256288,"350","HAZARDS","HAZARDS","HAZARDS","07/17/2016 05:39:57 PM","55XX BLOCK OF RAVENNA AV NE","U","U1","4301.3012",-122.30385,47.66905,"(47.66905, -122.30385)","TREES DOWN, OBSTRUCTING PUBLIC PROP (NO HAZ)","TREES DOWN","TREES DOWN","07/17/2016 03:54:10 PM",1511.73569592103,2016-07-17 17:39:57,2016-07-18
"565",44209,1808554,16000292031,2016292031,"220","CRISIS COMPLAINT - GENERAL","CRISIS CALL","BEHAVIORAL HEALTH","08/13/2016 06:04:32 AM","52XX BLOCK OF UNIVERSITY WY NE","U","U1","4400.4000",-122.313034,47.667492,"(47.667492, -122.313034)","ASLT - IP/JO - WITH OR W/O WPNS (NO SHOOTINGS)","ASSAULTS","ASSAULTS","08/13/2016 03:40:54 AM",1305.00522461218,2016-08-13 06:04:32,2016-08-13
"566",44213,1767397,16000221457,2016221457,"030","ARMED ROBBERY","GUN CALLS","ROBBERY","06/22/2016 02:46:13 AM","NE 42 ST / BROOKLYN AV NE","U","U2","5301.3008",-122.31436,47.658325,"(47.658325, -122.31436)","ROBBERY - IP/JO (INCLUDES STRONG ARM)","ROBBERY","ROBBERY","06/22/2016 12:04:50 AM",447.329259770333,2016-06-22 02:46:13,2016-06-22
"567",44234,1767418,16000221463,2016221463,"030","ARMED ROBBERY","GUN CALLS","ROBBERY","06/22/2016 03:31:51 AM","41XX BLOCK OF 12 AV NE","U","U2","5301.4002",-122.31554,47.657604,"(47.657604, -122.31554)","ASLT - IP/JO - PERSON SHOT OR SHOT AT","ASSAULTS","GUN CALLS","06/22/2016 12:10:34 AM",487.509070921015,2016-06-22 03:31:51,2016-06-22
"568",44237,1825253,16000319371,2016319371,"220","CRISIS COMPLAINT - GENERAL","CRISIS CALL","BEHAVIORAL HEALTH","09/03/2016 12:01:24 PM","58XX BLOCK OF NE 75 ST","U","U3","4000.1026",-122.264496,47.682926,"(47.682926, -122.264496)","CRISIS - PERSON IN BEHAVIORAL/EMOTIONAL CRISIS","BEHAVIORAL HEALTH","CRISIS CALL","",4515.05855960865,2016-09-03 12:01:24,2016-09-03
"569",44242,1880792,16000417720,2016417720,"350","HAZARDS","HAZARDS","HAZARDS","11/19/2016 03:01:58 AM","55XX BLOCK OF 25 AV NE","U","U3","4301.2012",-122.30062,47.66926,"(47.66926, -122.30062)","TRAFFIC - BO SIGNALS AND DOWN SIGNS","TRAFFIC RELATED CALLS","TRAFFIC RELATED CALLS","",1618.15189608469,2016-11-19 03:01:58,2016-11-19
"570",44243,1993383,17000161054,2017161054,"041","HARASSMENT, THREATS","THREATS, HARASSMENT","THREATS, HARASSMENT","05/08/2017 11:21:01 AM","10XX BLOCK OF NE 45 ST","U","U2","5301.3004",-122.31711,47.661297,"(47.661297, -122.31711)","ASLT - WITH OR W/O WEAPONS (NO SHOOTINGS)","ASSAULTS","ASSAULTS","05/08/2017 10:17:12 AM",820.741685950805,2017-05-08 11:21:01,2017-05-08
"571",44277,1788312,16000256723,2016256723,"220","CRISIS COMPLAINT - GENERAL","CRISIS CALL","BEHAVIORAL HEALTH","07/18/2016 03:18:14 AM","26XX BLOCK OF NE UNIVERSITY VILLAGE ST","U","U3","4301.1014",-122.29841,47.663322,"(47.663322, -122.29841)","DISTURBANCE, MISCELLANEOUS/OTHER","DISTURBANCES","DISTURBANCES","",1164.76014484058,2016-07-18 03:18:14,2016-07-18
"572",44290,1969406,17000116600,2017116600,"220","CRISIS COMPLAINT - GENERAL","CRISIS CALL","BEHAVIORAL HEALTH","04/03/2017 07:15:36 PM","41XX BLOCK OF UNIVERSITY WY NE","U","U2","5301.4001",-122.313225,47.657574,"(47.657574, -122.313225)","CRISIS - PERSON IN BEHAVIORAL/EMOTIONAL CRISIS","BEHAVIORAL HEALTH","CRISIS CALL","04/03/2017 05:11:33 PM",330.036787270645,2017-04-03 19:15:36,2017-04-04
"573",44313,1788487,16000256939,2016256939,"350","HAZARDS","HAZARDS","HAZARDS","07/18/2016 12:14:28 PM","35 AV NE / NE 50 ST","U","U3","4200.3011",-122.29017,47.664875,"(47.664875, -122.29017)","HAZ - POTENTIAL THRT TO PHYS SAFETY (NO HAZMAT)","HAZARDS","HAZARDS","",1755.51727793273,2016-07-18 12:14:28,2016-07-18
"574",44334,1737390,16000168962,2016168962,"220","CRISIS COMPLAINT - GENERAL","CRISIS CALL","BEHAVIORAL HEALTH","05/14/2016 07:35:06 PM","43XX BLOCK OF 8 AV NE","U","U2","5200.1000",-122.31978,47.660385,"(47.660385, -122.31978)","OVERDOSE - DRUG RELATED CASUALTY","PERSON DOWN/INJURY","CASUALTIES","05/14/2016 06:59:54 PM",913.231660313895,2016-05-14 19:35:06,2016-05-15
"575",44365,1858531,16000378264,2016378264,"220","CRISIS COMPLAINT - GENERAL","CRISIS CALL","BEHAVIORAL HEALTH","10/19/2016 11:19:40 AM","NE 45 ST / UNIVERSITY WY NE","U","U2","5301.3001",-122.31313,47.661266,"(47.661266, -122.31313)","DOWN - CHECK FOR PERSON DOWN","PERSON DOWN/INJURY","CASUALTIES","10/19/2016 08:49:33 AM",645.873447683438,2016-10-19 11:19:40,2016-10-19
"576",44377,1868530,16000395935,2016395935,"031","STRONG ARM ROBBERY","ROBBERY","ROBBERY","11/02/2016 01:25:08 AM","85XX BLOCK OF 20 AV NE","U","U1","2100.3008",-122.30628,47.690872,"(47.690872, -122.30628)","ROBBERY (INCLUDES STRONG ARM)","ROBBERY","ROBBERY","11/02/2016 12:04:17 AM",3884.74022407329,2016-11-02 01:25:08,2016-11-02
"577",44431,2076725,17000312507,2017312507,"220","CRISIS COMPLAINT - GENERAL","CRISIS CALL","BEHAVIORAL HEALTH","08/23/2017 07:24:37 PM","42XX BLOCK OF UNIVERSITY WY NE","U","U2","5301.3009",-122.31319,47.659054,"(47.659054, -122.31319)","CRISIS - PERSON IN BEHAVIORAL/EMOTIONAL CRISIS","BEHAVIORAL HEALTH","CRISIS CALL","08/23/2017 05:55:01 PM",438.325335850633,2017-08-23 19:24:37,2017-08-24
"578",44453,1756761,16000203049,2016203049,"242","FIGHT DISTURBANCE","DISTURBANCES","DISTURBANCES","06/08/2016 10:54:53 AM","14XX BLOCK OF NE 42 ST","U","U2","5301.3009",-122.31264,47.65831,"(47.65831, -122.31264)","FIGHT - VERBAL/ORAL (NO WEAPONS)","DISTURBANCES","DISTURBANCES","06/08/2016 10:06:01 AM",348.711033535852,2016-06-08 10:54:53,2016-06-08
"579",44467,2126578,17000403774,2017403774,"220","CRISIS COMPLAINT - GENERAL","CRISIS CALL","BEHAVIORAL HEALTH","10/31/2017 12:31:37 AM","14XX BLOCK OF NE 43 ST","U","U2","5301.3009",-122.3126,47.65979,"(47.65979, -122.3126)","THREATS (INCLS IN-PERSON/BY PHONE/IN WRITING)","THREATS, HARASSMENT","THREATS, HARASSMENT","",481.44763654886,2017-10-31 00:31:37,2017-10-31
"580",44483,1959116,17000097485,201797485,"350","HAZARDS","HAZARDS","HAZARDS","03/19/2017 10:12:39 PM","44XX BLOCK OF NE 70 ST","U","U3","3900.1011",-122.28079,47.679413,"(47.679413, -122.28079)","WATER FLOODS (BROKEN MAINS/HYDRANTS, NO HAZ)","PUBLIC WATER","PUBLIC WATER","",3380.18413397909,2017-03-19 22:12:39,2017-03-20
"581",44490,1743836,16000178436,2016178436,"031","STRONG ARM ROBBERY","ROBBERY","ROBBERY","05/21/2016 10:04:10 PM","50XX BLOCK OF 15 AV NE","U","U1","4400.3006",-122.31193,47.66566,"(47.66566, -122.31193)","ROBBERY (INCLUDES STRONG ARM)","ROBBERY","ROBBERY","05/21/2016 09:58:50 PM",1089.43380769836,2016-05-21 22:04:10,2016-05-22
"582",44519,1744386,16000177529,2016177529,"242","FIGHT DISTURBANCE","DISTURBANCES","DISTURBANCES","05/21/2016 03:41:45 AM","42XX BLOCK OF 7 AV NE","U","U2","5200.1004",-122.32084,47.65849,"(47.65849, -122.32084)","FIGHT - VERBAL/ORAL (NO WEAPONS)","DISTURBANCES","DISTURBANCES","05/21/2016 03:38:36 AM",895.700131218965,2016-05-21 03:41:45,2016-05-21
"583",44522,2004766,17000182164,2017182164,"350","HAZARDS","HAZARDS","HAZARDS","05/23/2017 02:01:55 PM","NE 62 ST / 20 AV NE","U","U1","4301.3006",-122.30651,47.67262,"(47.67262, -122.30651)","NUISANCE - MISCHIEF","MISCELLANEOUS MISDEMEANORS","MISCELLANEOUS MISDEMEANORS","",1861.47083962783,2017-05-23 14:01:55,2017-05-23
"584",44525,1868907,16000396813,2016396813,"220","CRISIS COMPLAINT - GENERAL","CRISIS CALL","BEHAVIORAL HEALTH","11/02/2016 04:00:48 PM","39XX BLOCK OF NE 45 ST","U","U3","4100.5002",-122.28577,47.660854,"(47.660854, -122.28577)","CRISIS - PERSON IN BEHAVIORAL/EMOTIONAL CRISIS","BEHAVIORAL HEALTH","CRISIS CALL","11/02/2016 01:34:16 PM",1862.42553352032,2016-11-02 16:00:48,2016-11-02
"585",44549,1767748,16000222191,2016222191,"242","FIGHT DISTURBANCE","DISTURBANCES","DISTURBANCES","06/22/2016 03:08:51 PM","42XX BLOCK OF UNIVERSITY WY NE","U","U2","5301.3008",-122.31319,47.659054,"(47.659054, -122.31319)","FIGHT - IP - PHYSICAL (NO WEAPONS)","DISTURBANCES","DISTURBANCES","",438.325335850633,2016-06-22 15:08:51,2016-06-22
"586",44576,1743804,16000178493,2016178493,"350","HAZARDS","HAZARDS","HAZARDS","05/21/2016 09:16:23 PM","65XX BLOCK OF 26 AV NE","U","U3","3800.2013",-122.29954,47.67714,"(47.67714, -122.29954)","SHOTS - IP/JO - INCLUDES HEARD/NO ASSAULT","WEAPONS CALLS","GUN CALLS","05/21/2016 09:07:59 PM",2466.5917953314,2016-05-21 21:16:23,2016-05-22
"587",44598,1757121,16000203359,2016203359,"220","CRISIS COMPLAINT - GENERAL","CRISIS CALL","BEHAVIORAL HEALTH","06/08/2016 07:26:59 PM","45XX BLOCK OF 15 AV NE","U","U2","5301.2011",-122.31198,47.662174,"(47.662174, -122.31198)","CRISIS - PERSON IN BEHAVIORAL/EMOTIONAL CRISIS","BEHAVIORAL HEALTH","CRISIS CALL","06/08/2016 02:48:38 PM",711.276158808105,2016-06-08 19:26:59,2016-06-09
"588",44600,1881084,16000418548,2016418548,"220","CRISIS COMPLAINT - GENERAL","CRISIS CALL","BEHAVIORAL HEALTH","11/19/2016 04:18:55 PM","63XX BLOCK OF 60 AV NE","U","U3","4100.1001",-122.26353,47.674637,"(47.674637, -122.26353)","HARAS - NO BIAS, THREATS OR MALICIOUSNESS","THREATS, HARASSMENT","THREATS, HARASSMENT","11/19/2016 02:50:26 PM",4026.73205049913,2016-11-19 16:18:55,2016-11-20
"589",44617,1881652,16000419494,2016419494,"041","HARASSMENT, THREATS","THREATS, HARASSMENT","THREATS, HARASSMENT","11/20/2016 01:35:06 PM","45XX BLOCK OF 18 AV NE","U","U1","5301.1008",-122.308365,47.66216,"(47.66216, -122.308365)","TRU - HARASSMENT","THREATS, HARASSMENT","THREATS, HARASSMENT","11/20/2016 12:50:39 PM",690.177529761912,2016-11-20 13:35:06,2016-11-20
"590",44634,1835077,16000336745,2016336745,"242","FIGHT DISTURBANCE","DISTURBANCES","DISTURBANCES","09/16/2016 08:18:49 PM","NE 43 ST / UNIVERSITY WY NE","U","U2","5301.3008",-122.31317,47.659794,"(47.659794, -122.31317)","DISTURBANCE, MISCELLANEOUS/OTHER","DISTURBANCES","DISTURBANCES","",503.925729388642,2016-09-16 20:18:49,2016-09-17
"591",44641,1891340,16000437385,2016437385,"350","HAZARDS","HAZARDS","HAZARDS","12/05/2016 11:55:30 AM","25 AV NE / NE 45 ST","U","U2","5302.3010",-122.3009,47.66125,"(47.66125, -122.3009)","HAZ - POTENTIAL THRT TO PHYS SAFETY (NO HAZMAT)","HAZARDS","HAZARDS","",870.654377405696,2016-12-05 11:55:30,2016-12-05
"592",44651,1777891,16000239199,2016239199,"242","FIGHT DISTURBANCE","DISTURBANCES","DISTURBANCES","07/04/2016 11:18:38 PM","MONTLAKE BV NE / NE PACIFIC PL","U","U2","5302.3054",-122.30391,47.65108,"(47.65108, -122.30391)","FIGHT - IP - PHYSICAL (NO WEAPONS)","DISTURBANCES","DISTURBANCES","",689.626649964796,2016-07-04 23:18:38,2016-07-05
"593",44661,1778031,16000239371,2016239371,"242","FIGHT DISTURBANCE","DISTURBANCES","DISTURBANCES","07/05/2016 01:39:07 AM","21 AV NE / NE 45 ST","U","U2","5302.3013",-122.30547,47.661255,"(47.661255, -122.30547)","FIGHT - IP - PHYSICAL (NO WEAPONS)","DISTURBANCES","DISTURBANCES","07/05/2016 12:49:58 AM",658.035249179753,2016-07-05 01:39:07,2016-07-05
"594",44664,1869133,16000397331,2016397331,"220","CRISIS COMPLAINT - GENERAL","CRISIS CALL","BEHAVIORAL HEALTH","11/02/2016 09:39:51 PM","7 AV NE / NE 45 ST","U","U2","5200.1000",-122.32073,47.661316,"(47.661316, -122.32073)","HAZ - POTENTIAL THRT TO PHYS SAFETY (NO HAZMAT)","HAZARDS","HAZARDS","11/02/2016 08:23:31 PM",1030.01436970243,2016-11-02 21:39:51,2016-11-03
"595",44702,1868926,16000397063,2016397063,"350","HAZARDS","HAZARDS","HAZARDS","11/02/2016 04:39:35 PM","42XX BLOCK OF UNIVERSITY WY NE","U","U2","5301.3009",-122.3128,47.658527,"(47.658527, -122.3128)","HAZ - POTENTIAL THRT TO PHYS SAFETY (NO HAZMAT)","HAZARDS","HAZARDS","",374.684884533166,2016-11-02 16:39:35,2016-11-02
"596",44709,1891361,16000437223,2016437223,"220","CRISIS COMPLAINT - GENERAL","CRISIS CALL","BEHAVIORAL HEALTH","12/05/2016 12:31:01 PM","39XX BLOCK OF NE 45 ST","U","U3","4100.5002",-122.28599,47.661263,"(47.661263, -122.28599)","HARAS - NO BIAS, THREATS OR MALICIOUSNESS","THREATS, HARASSMENT","THREATS, HARASSMENT","12/05/2016 11:11:19 AM",1860.40706322282,2016-12-05 12:31:01,2016-12-05
"597",44712,1737592,16000169162,2016169162,"350","HAZARDS","HAZARDS","HAZARDS","05/15/2016 03:10:13 AM","77XX BLOCK OF 45 AV NE","U","U3","2400.1020",-122.27983,47.685745,"(47.685745, -122.27983)","WIRES DOWN (PHONE, ELECTRICAL,ETC.)","HAZARDS","HAZARDS","",3987.74773967565,2016-05-15 03:10:13,2016-05-15
"598",44714,1835006,16000336179,2016336179,"350","HAZARDS","HAZARDS","HAZARDS","09/16/2016 07:01:44 PM","NE 40 ST / 7 AV NE","U","U2","5200.2011",-122.320854,47.65589,"(47.65589, -122.320854)","TRAFFIC - BO SIGNALS AND DOWN SIGNS","TRAFFIC RELATED CALLS","TRAFFIC RELATED CALLS","",853.00222043031,2016-09-16 19:01:44,2016-09-17
"599",44756,1757369,16000204108,2016204108,"242","FIGHT DISTURBANCE","DISTURBANCES","DISTURBANCES","06/09/2016 02:27:26 AM","42XX BLOCK OF UNIVERSITY WY NE","U","U2","5301.3008",-122.31319,47.659054,"(47.659054, -122.31319)","FIGHT - VERBAL/ORAL (NO WEAPONS)","DISTURBANCES","DISTURBANCES","",438.325335850633,2016-06-09 02:27:26,2016-06-09
"600",44775,1798503,16000274339,2016274339,"350","HAZARDS","HAZARDS","HAZARDS","07/31/2016 01:18:50 AM","47XX BLOCK OF 8 AV NE","U","U2","5200.5001",-122.31955,47.663574,"(47.663574, -122.31955)","HAZ - POTENTIAL THRT TO PHYS SAFETY (NO HAZMAT)","HAZARDS","HAZARDS","",1130.93727265743,2016-07-31 01:18:50,2016-07-31
"601",44793,1798526,16000274098,2016274098,"350","HAZARDS","HAZARDS","HAZARDS","07/31/2016 01:31:58 AM","12 AV NE / NE 70 ST","U","U1","2600.3005",-122.31567,47.67945,"(47.67945, -122.31567)","TRAFFIC - BO SIGNALS AND DOWN SIGNS","TRAFFIC RELATED CALLS","TRAFFIC RELATED CALLS","07/30/2016 09:45:13 PM",2648.12005497198,2016-07-31 01:31:58,2016-07-31
"602",44864,1969636,17000116953,2017116953,"041","HARASSMENT, THREATS","THREATS, HARASSMENT","THREATS, HARASSMENT","04/04/2017 02:02:36 AM","7XX BLOCK OF NE 60 ST","U","U1","4500.1001",-122.32043,47.672226,"(47.672226, -122.32043)","THREATS (INCLS IN-PERSON/BY PHONE/IN WRITING)","THREATS, HARASSMENT","THREATS, HARASSMENT","04/03/2017 11:12:08 PM",1982.06882575709,2017-04-04 02:02:36,2017-04-04
"603",44912,1744196,16000177875,2016177875,"350","HAZARDS","HAZARDS","HAZARDS","05/21/2016 11:14:26 AM","ROOSEVELT WY NE / NE 67 ST","U","U1","2600.3010",-122.31738,47.677284,"(47.677284, -122.31738)","HAZ - POTENTIAL THRT TO PHYS SAFETY (NO HAZMAT)","HAZARDS","HAZARDS","05/21/2016 10:56:44 AM",2439.31977341002,2016-05-21 11:14:26,2016-05-21
"604",44945,1858708,16000378581,2016378581,"041","HARASSMENT, THREATS","THREATS, HARASSMENT","THREATS, HARASSMENT","10/19/2016 03:49:51 PM","21XX BLOCK OF NE 47 ST","U","U1","4300.4004",-122.30511,47.66331,"(47.66331, -122.30511)","BIAS -RACIAL, POLITICAL, SEXUAL MOTIVATION","SUSPICIOUS CIRCUMSTANCES","SUSPICIOUS CIRCUMSTANCES","10/19/2016 01:14:19 PM",877.100352109428,2016-10-19 15:49:51,2016-10-19
"605",44960,1825706,16000319657,2016319657,"350","HAZARDS","HAZARDS","HAZARDS","09/04/2016 12:13:35 AM","NE 45 ST / 15 AV NE","U","U2","5301.2010",-122.312,47.66126,"(47.66126, -122.312)","TRAFFIC - BO SIGNALS AND DOWN SIGNS","TRAFFIC RELATED CALLS","TRAFFIC RELATED CALLS","",614.236940217108,2016-09-04 00:13:35,2016-09-04
"606",44993,1798500,16000274358,2016274358,"220","CRISIS COMPLAINT - GENERAL","CRISIS CALL","BEHAVIORAL HEALTH","07/31/2016 01:18:07 AM","NE 40 ST / 9 AV NE","U","U2","5200.2006",-122.31881,47.655727,"(47.655727, -122.31881)","DISTURBANCE, MISCELLANEOUS/OTHER","DISTURBANCES","DISTURBANCES","",700.02833982456,2016-07-31 01:18:07,2016-07-31
"607",45003,1809066,16000292905,2016292905,"350","HAZARDS","HAZARDS","HAZARDS","08/13/2016 10:05:52 PM","LAKE CITY WY NE / NE 92 ST","U","U1","2100.2002",-122.305695,47.695747,"(47.695747, -122.305695)","TRAFFIC - BO SIGNALS AND DOWN SIGNS","TRAFFIC RELATED CALLS","TRAFFIC RELATED CALLS","",4428.45804861896,2016-08-13 22:05:52,2016-08-14
"608",45012,1825723,16000320045,2016320045,"350","HAZARDS","HAZARDS","HAZARDS","09/04/2016 12:20:53 AM","12 AV NE / NE 70 ST","U","U1","2600.3005",-122.31567,47.67945,"(47.67945, -122.31567)","TRAFFIC - BO SIGNALS AND DOWN SIGNS","TRAFFIC RELATED CALLS","TRAFFIC RELATED CALLS","",2648.12005497198,2016-09-04 00:20:53,2016-09-04
"609",45017,1835222,16000336672,2016336672,"041","HARASSMENT, THREATS","THREATS, HARASSMENT","THREATS, HARASSMENT","09/17/2016 12:05:48 AM","18XX BLOCK OF NE RAVENNA BV","U","U1","4400.1028",-122.308205,47.670086,"(47.670086, -122.308205)","TRU - THREATS","THREATS, HARASSMENT","THREATS, HARASSMENT","09/16/2016 07:58:43 PM",1569.15207936411,2016-09-17 00:05:48,2016-09-17
"610",45034,1825741,16000319945,2016319945,"041","HARASSMENT, THREATS","THREATS, HARASSMENT","THREATS, HARASSMENT","09/04/2016 01:08:24 AM","86XX BLOCK OF 23 AV NE","U","U1","2100.3008",-122.30417,47.691647,"(47.691647, -122.30417)","SUSPICIOUS PERSON, VEHICLE OR INCIDENT","SUSPICIOUS CIRCUMSTANCES","SUSPICIOUS CIRCUMSTANCES","09/03/2016 08:38:21 PM",3983.53430987397,2016-09-04 01:08:24,2016-09-04
"611",45042,1757954,16000205237,2016205237,"242","FIGHT DISTURBANCE","DISTURBANCES","DISTURBANCES","06/09/2016 08:21:11 PM","13XX BLOCK OF NE 45 ST","U","U2","5301.2009",-122.313705,47.661274,"(47.661274, -122.313705)","FIGHT - IP - PHYSICAL (NO WEAPONS)","DISTURBANCES","DISTURBANCES","",666.044174195878,2016-06-09 20:21:11,2016-06-10
"612",45069,1744168,16000177908,2016177908,"220","CRISIS COMPLAINT - GENERAL","CRISIS CALL","BEHAVIORAL HEALTH","05/21/2016 11:45:50 AM","NE 65 ST / 35 AV NE","U","U3","3900.1017",-122.290276,47.67578,"(47.67578, -122.290276)","HAZ - POTENTIAL THRT TO PHYS SAFETY (NO HAZMAT)","HAZARDS","HAZARDS","05/21/2016 11:33:50 AM",2630.81993517566,2016-05-21 11:45:50,2016-05-21
"613",45073,1798415,16000274111,2016274111,"350","HAZARDS","HAZARDS","HAZARDS","07/30/2016 11:28:54 PM","70XX BLOCK OF 50 AV NE","U","U3","3900.2000",-122.27432,47.68031,"(47.68031, -122.27432)","FIREWORKS - NUISANCE (NO HAZARD)","MISCELLANEOUS MISDEMEANORS","MISCELLANEOUS MISDEMEANORS","",3779.72396513945,2016-07-30 23:28:54,2016-07-31
"614",45076,1826131,16000320745,2016320745,"041","HARASSMENT, THREATS","THREATS, HARASSMENT","THREATS, HARASSMENT","09/04/2016 04:59:33 PM","43XX BLOCK OF UNIVERSITY WY NE","U","U2","5301.3000",-122.31315,47.660534,"(47.660534, -122.31315)","THREATS (INCLS IN-PERSON/BY PHONE/IN WRITING)","THREATS, HARASSMENT","THREATS, HARASSMENT","09/04/2016 02:28:05 PM",573.843522369168,2016-09-04 16:59:33,2016-09-04
"615",45087,1826219,16000321074,2016321074,"030","ARMED ROBBERY","GUN CALLS","ROBBERY","09/04/2016 07:49:04 PM","47XX BLOCK OF UNIVERSITY WY NE","U","U2","5301.2001",-122.31309,47.663998,"(47.663998, -122.31309)","ROBBERY - IP/JO (INCLUDES STRONG ARM)","ROBBERY","ROBBERY","09/04/2016 06:02:22 PM",929.234922041086,2016-09-04 19:49:04,2016-09-05
"616",45096,1826040,16000320747,2016320747,"220","CRISIS COMPLAINT - GENERAL","CRISIS CALL","BEHAVIORAL HEALTH","09/04/2016 02:21:46 PM","45XX BLOCK OF UNIVERSITY WY NE","U","U2","5301.2009",-122.31312,47.66218,"(47.66218, -122.31312)","DISTURBANCE, MISCELLANEOUS/OTHER","DISTURBANCES","DISTURBANCES","09/04/2016 12:33:21 PM",738.963514898043,2016-09-04 14:21:46,2016-09-04
"617",45107,1809072,16000293061,2016293061,"242","FIGHT DISTURBANCE","DISTURBANCES","DISTURBANCES","08/13/2016 10:43:28 PM","68XX BLOCK OF 62 AV NE","U","U3","4000.1014",-122.26223,47.67889,"(47.67889, -122.26223)","FIGHT - VERBAL/ORAL (NO WEAPONS)","DISTURBANCES","DISTURBANCES","",4368.13337390337,2016-08-13 22:43:28,2016-08-14
"618",45117,1789543,16000258778,2016258778,"242","FIGHT DISTURBANCE","DISTURBANCES","DISTURBANCES","07/19/2016 11:53:02 PM","47XX BLOCK OF 12 AV NE","U","U2","5301.2004",-122.315254,47.664013,"(47.664013, -122.315254)","ASLT - WITH OR W/O WEAPONS (NO SHOOTINGS)","ASSAULTS","ASSAULTS","07/19/2016 09:28:32 PM",990.218839131712,2016-07-19 23:53:02,2016-07-20
"619",45135,1881704,16000419721,2016419721,"350","HAZARDS","HAZARDS","HAZARDS","11/20/2016 03:46:59 PM","37 AV NE / NE 48 ST","U","U3","4200.3022",-122.288216,47.66359,"(47.66359, -122.288216)","HAZ - POTENTIAL THRT TO PHYS SAFETY (NO HAZMAT)","HAZARDS","HAZARDS","",1807.79190644173,2016-11-20 15:46:59,2016-11-20
"620",45168,1959363,17000097967,201797967,"242","FIGHT DISTURBANCE","DISTURBANCES","DISTURBANCES","03/20/2017 10:11:06 AM","12 AV NE / NE 47 ST","U","U2","5301.2007",-122.31526,47.663105,"(47.663105, -122.31526)","FIGHT - IP - PHYSICAL (NO WEAPONS)","DISTURBANCES","DISTURBANCES","03/20/2017 08:24:51 AM",900.685209550702,2017-03-20 10:11:06,2017-03-20
"621",45183,1744675,16000181729,2016181729,"350","HAZARDS","HAZARDS","HAZARDS","05/24/2016 11:28:57 AM","65XX BLOCK OF SAND POINT WY NE","U","U3","4000.1028",-122.26355,47.676197,"(47.676197, -122.26355)","HAZ - POTENTIAL THRT TO PHYS SAFETY (NO HAZMAT)","HAZARDS","HAZARDS","05/24/2016 09:53:59 AM",4117.37052735623,2016-05-24 11:28:57,2016-05-24
"622",45184,1835376,16000337032,2016337032,"041","HARASSMENT, THREATS","THREATS, HARASSMENT","THREATS, HARASSMENT","09/17/2016 04:32:11 AM","52XX BLOCK OF 11 AV NE","U","U1","4400.4003",-122.31605,47.66745,"(47.66745, -122.31605)","WEAPN-IP/JO-GUN,DEADLY WPN (NO THRT/ASLT/DIST)","WEAPONS CALLS","WEAPONS CALLS","09/16/2016 11:07:35 PM",1364.81249888164,2016-09-17 04:32:11,2016-09-17
"623",45191,1744643,16000181757,2016181757,"220","CRISIS COMPLAINT - GENERAL","CRISIS CALL","BEHAVIORAL HEALTH","05/24/2016 10:44:37 AM","61XX BLOCK OF BROOKLYN AV NE","U","U1","4400.2008",-122.314255,47.672745,"(47.672745, -122.314255)","CRISIS - PERSON IN BEHAVIORAL/EMOTIONAL CRISIS","BEHAVIORAL HEALTH","CRISIS CALL","05/24/2016 10:18:14 AM",1895.71763445181,2016-05-24 10:44:37,2016-05-24
"624",45215,1835510,16000336703,2016336703,"041","HARASSMENT, THREATS","THREATS, HARASSMENT","THREATS, HARASSMENT","09/17/2016 11:17:26 AM","45XX BLOCK OF 16 AV NE","U","U2","5301.1005",-122.31052,47.662617,"(47.662617, -122.31052)","HARAS - NO BIAS, THREATS OR MALICIOUSNESS","THREATS, HARASSMENT","THREATS, HARASSMENT","09/17/2016 08:11:36 AM",739.681294637528,2016-09-17 11:17:26,2016-09-17
"625",45223,1758549,16000206213,2016206213,"242","FIGHT DISTURBANCE","DISTURBANCES","DISTURBANCES","06/10/2016 04:26:03 PM","45XX BLOCK OF 16 AV NE","U","U2","5301.2011",-122.310844,47.662167,"(47.662167, -122.310844)","FIGHT - IP - PHYSICAL (NO WEAPONS)","DISTURBANCES","DISTURBANCES","06/10/2016 02:17:48 PM",693.062105557224,2016-06-10 16:26:03,2016-06-10
"626",45239,1891594,16000437663,2016437663,"041","HARASSMENT, THREATS","THREATS, HARASSMENT","THREATS, HARASSMENT","12/05/2016 07:07:53 PM","8XX BLOCK OF NE 69 ST","U","U1","3600.1012",-122.31873,47.678753,"(47.678753, -122.31873)","THREATS (INCLS IN-PERSON/BY PHONE/IN WRITING)","THREATS, HARASSMENT","THREATS, HARASSMENT","12/05/2016 04:29:21 PM",2623.02378672877,2016-12-05 19:07:53,2016-12-06
"627",45290,1869238,16000397540,2016397540,"242","FIGHT DISTURBANCE","DISTURBANCES","DISTURBANCES","11/03/2016 12:47:31 AM","NE 45 ST / ROOSEVELT WY NE","U","U2","5301.2006",-122.31764,47.661297,"(47.661297, -122.31764)","FIGHT - IP - PHYSICAL (NO WEAPONS)","DISTURBANCES","DISTURBANCES","",848.950730071322,2016-11-03 00:47:31,2016-11-03
"628",45294,2029257,17000227144,2017227144,"242","FIGHT DISTURBANCE","DISTURBANCES","DISTURBANCES","06/24/2017 12:48:58 AM","47XX BLOCK OF BROOKLYN AV NE","U","U2","5301.2002",-122.314224,47.664005,"(47.664005, -122.314224)","DISTURBANCE, MISCELLANEOUS/OTHER","DISTURBANCES","DISTURBANCES","06/23/2017 11:19:28 PM",958.152960945758,2017-06-24 00:48:58,2017-06-24
"629",45299,1859078,16000379411,2016379411,"242","FIGHT DISTURBANCE","DISTURBANCES","DISTURBANCES","10/20/2016 01:17:11 AM","43XX BLOCK OF UNIVERSITY WY NE","U","U2","5301.3001",-122.31359,47.660927,"(47.660927, -122.31359)","DISTURBANCE, MISCELLANEOUS/OTHER","DISTURBANCES","DISTURBANCES","",628.072673159997,2016-10-20 01:17:11,2016-10-20
"630",45301,1891612,16000437668,2016437668,"041","HARASSMENT, THREATS","THREATS, HARASSMENT","THREATS, HARASSMENT","12/05/2016 07:16:19 PM","45XX BLOCK OF UNIVERSITY WY NE","U","U2","5301.2009",-122.31312,47.66218,"(47.66218, -122.31312)","THREATS (INCLS IN-PERSON/BY PHONE/IN WRITING)","THREATS, HARASSMENT","THREATS, HARASSMENT","12/05/2016 04:52:27 PM",738.963514898043,2016-12-05 19:16:19,2016-12-06
"631",45302,1891613,16000437468,2016437468,"030","ARMED ROBBERY","GUN CALLS","ROBBERY","12/05/2016 07:17:30 PM","15 AV NE / NE 66 ST","U","U1","2600.3016",-122.31195,47.676506,"(47.676506, -122.31195)","ROBBERY - IP/JO (INCLUDES STRONG ARM)","ROBBERY","ROBBERY","12/05/2016 12:49:00 PM",2287.34893748436,2016-12-05 19:17:30,2016-12-06
"632",45330,1860730,16000382356,2016382356,"350","HAZARDS","HAZARDS","HAZARDS","10/22/2016 12:01:55 PM","47XX BLOCK OF BROOKLYN AV NE","U","U2","5301.2002",-122.313866,47.66346,"(47.66346, -122.313866)","HAZ - POTENTIAL THRT TO PHYS SAFETY (NO HAZMAT)","HAZARDS","HAZARDS","",891.911797782892,2016-10-22 12:01:55,2016-10-22
"633",45356,1745258,16000182698,2016182698,"031","STRONG ARM ROBBERY","ROBBERY","ROBBERY","05/25/2016 12:54:32 AM","UNIVERSITY WY NE / NE 45 ST","U","U2","5301.3001",-122.31313,47.661266,"(47.661266, -122.31313)","FIGHT - IP - PHYSICAL (NO WEAPONS)","DISTURBANCES","DISTURBANCES","05/24/2016 09:35:52 PM",645.873447683438,2016-05-25 00:54:32,2016-05-25
"634",45360,1969732,17000117226,2017117226,"350","HAZARDS","HAZARDS","HAZARDS","04/04/2017 08:07:51 AM","NE PACIFIC PL / MONTLAKE BV NE","U","U3","5302.3045",-122.30391,47.65108,"(47.65108, -122.30391)","HAZ - POTENTIAL THRT TO PHYS SAFETY (NO HAZMAT)","HAZARDS","HAZARDS","",689.626649964796,2017-04-04 08:07:51,2017-04-04
"635",45363,1859230,16000379675,2016379675,"350","HAZARDS","HAZARDS","HAZARDS","10/20/2016 09:58:22 AM","11 AV NE / NE 45 ST","U","U2","5301.2006",-122.31658,47.661293,"(47.661293, -122.31658)","DISTURBANCE, MISCELLANEOUS/OTHER","DISTURBANCES","DISTURBANCES","",793.197829416394,2016-10-20 09:58:22,2016-10-20
"636",45375,1982134,17000140679,2017140679,"350","HAZARDS","HAZARDS","HAZARDS","04/22/2017 03:44:44 PM","45XX BLOCK OF UNIVERSITY WY NE","U","U2","5301.201",-122.31312,47.66218,"(47.66218, -122.31312)","HAZ - POTENTIAL THRT TO PHYS SAFETY (NO HAZMAT)","HAZARDS","HAZARDS","",738.963514898043,2017-04-22 15:44:44,2017-04-22
"637",45378,1758658,16000206567,2016206567,"350","HAZARDS","HAZARDS","HAZARDS","06/10/2016 06:45:46 PM","38XX BLOCK OF MONTLAKE BV NE","U","U3","5302.3006",-122.30293,47.653004,"(47.653004, -122.30293)","HAZ - POTENTIAL THRT TO PHYS SAFETY (NO HAZMAT)","HAZARDS","HAZARDS","",595.444705489101,2016-06-10 18:45:46,2016-06-11
"638",45394,2016742,17000204077,2017204077,"350","HAZARDS","HAZARDS","HAZARDS","06/07/2017 02:38:45 PM","43XX BLOCK OF ROOSEVELT WY NE","U","U2","5301.3004",-122.317726,47.66058,"(47.66058, -122.317726)","HAZ - POTENTIAL THRT TO PHYS SAFETY (NO HAZMAT)","HAZARDS","HAZARDS","",800.699807898046,2017-06-07 14:38:45,2017-06-07
"639",45395,1738000,16000170047,2016170047,"242","FIGHT DISTURBANCE","DISTURBANCES","DISTURBANCES","05/15/2016 06:48:59 PM","47XX BLOCK OF 12 AV NE","U","U2","5301.2004",-122.315254,47.664013,"(47.664013, -122.315254)","FIGHT - IP - PHYSICAL (NO WEAPONS)","DISTURBANCES","DISTURBANCES","",990.218839131712,2016-05-15 18:48:59,2016-05-16
"640",45405,1745319,16000182903,2016182903,"220","CRISIS COMPLAINT - GENERAL","CRISIS CALL","BEHAVIORAL HEALTH","05/25/2016 03:23:24 AM","45XX BLOCK OF 18 AV NE","U","U1","5301.1007",-122.308365,47.66216,"(47.66216, -122.308365)","SUSPICIOUS PERSON, VEHICLE OR INCIDENT","SUSPICIOUS CIRCUMSTANCES","SUSPICIOUS CIRCUMSTANCES","05/25/2016 02:05:08 AM",690.177529761912,2016-05-25 03:23:24,2016-05-25
"641",45421,1969720,17000101369,2017101369,"350","HAZARDS","HAZARDS","HAZARDS","03/22/2017 07:29:30 PM","UNIVERSITY BR / SB","U","U2","5200.202",-122.319374,47.65404,"(47.65404, -122.319374)","HAZ - POTENTIAL THRT TO PHYS SAFETY (NO HAZMAT)","HAZARDS","HAZARDS","03/22/2017 07:29:18 PM",773.098824199806,2017-03-22 19:29:30,2017-03-23
"642",45433,1936105,17000050622,201750622,"350","HAZARDS","HAZARDS","HAZARDS","02/11/2017 02:36:45 AM","47XX BLOCK OF 22 AV NE","U","U1","4300.4006",-122.30413,47.663994,"(47.663994, -122.30413)","TREES DOWN, OBSTRUCTING PUBLIC PROP (NO HAZ)","TREES DOWN","TREES DOWN","02/10/2017 09:17:28 PM",976.049487035652,2017-02-11 02:36:45,2017-02-11
"643",45492,1949459,17000079019,201779019,"220","CRISIS COMPLAINT - GENERAL","CRISIS CALL","BEHAVIORAL HEALTH","03/05/2017 09:05:01 AM","46XX BLOCK OF 22 AV NE","U","U1","4302.101",-122.304474,47.662556,"(47.662556, -122.304474)","OVERDOSE - DRUG RELATED CASUALTY","PERSON DOWN/INJURY","CASUALTIES","03/05/2017 05:47:49 AM",820.885909866053,2017-03-05 09:05:01,2017-03-05
"644",45495,1849167,16000361598,2016361598,"041","HARASSMENT, THREATS","THREATS, HARASSMENT","THREATS, HARASSMENT","10/05/2016 11:09:49 PM","63XX BLOCK OF 22 AV NE","U","U1","4301.3003",-122.30419,47.675186,"(47.675186, -122.30419)","HARAS - NO BIAS, THREATS OR MALICIOUSNESS","THREATS, HARASSMENT","THREATS, HARASSMENT","10/05/2016 08:43:56 PM",2170.13334344741,2016-10-05 23:09:49,2016-10-06
"645",45506,1745396,16000183001,2016183001,"041","HARASSMENT, THREATS","THREATS, HARASSMENT","THREATS, HARASSMENT","05/25/2016 07:38:34 AM","15 AV NE / NE 42 ST","U","U2","5301.4000",-122.31207,47.658302,"(47.658302, -122.31207)","PROPERTY - DAMAGE","PROPERTY DAMAGE","PROPERTY DAMAGE","05/25/2016 06:12:08 AM",320.589660408362,2016-05-25 07:38:34,2016-05-25
"646",45511,1745931,16000183865,2016183865,"041","HARASSMENT, THREATS","THREATS, HARASSMENT","THREATS, HARASSMENT","05/25/2016 07:16:56 PM","47XX BLOCK OF 12 AV NE","U","U2","5301.2004",-122.315254,47.664013,"(47.664013, -122.315254)","THREATS (INCLS IN-PERSON/BY PHONE/IN WRITING)","THREATS, HARASSMENT","THREATS, HARASSMENT","05/25/2016 06:08:07 PM",990.218839131712,2016-05-25 19:16:56,2016-05-26
"647",45562,1791892,16000262809,2016262809,"350","HAZARDS","HAZARDS","HAZARDS","07/22/2016 09:31:28 PM","NE 47 ST / 15 AV NE","U","U2","5301.2011",-122.311966,47.663082,"(47.663082, -122.311966)","NUISANCE - MISCHIEF","MISCELLANEOUS MISDEMEANORS","MISCELLANEOUS MISDEMEANORS","",808.897329309375,2016-07-22 21:31:28,2016-07-23
"648",45563,1835752,16000337839,2016337839,"350","HAZARDS","HAZARDS","HAZARDS","09/17/2016 06:55:35 PM","7 AV NE / NE 45 ST","U","U2","5200.1000",-122.32073,47.661316,"(47.661316, -122.32073)","HAZ - POTENTIAL THRT TO PHYS SAFETY (NO HAZMAT)","HAZARDS","HAZARDS","",1030.01436970243,2016-09-17 18:55:35,2016-09-18
"649",45578,1835718,16000337922,2016337922,"350","HAZARDS","HAZARDS","HAZARDS","09/17/2016 05:52:11 PM","65XX BLOCK OF 35 AV NE","U","U3","3900.1017",-122.28993,47.676067,"(47.676067, -122.28993)","WIRES DOWN (PHONE, ELECTRICAL,ETC.)","HAZARDS","HAZARDS","",2671.75771393121,2016-09-17 17:52:11,2016-09-18
"650",45582,1745623,16000183225,2016183225,"350","HAZARDS","HAZARDS","HAZARDS","05/25/2016 01:47:47 PM","16 AV NE / NE 47 ST","U","U2","5301.1005",-122.31083,47.663074,"(47.663074, -122.31083)","TRAFFIC - BO SIGNALS AND DOWN SIGNS","TRAFFIC RELATED CALLS","TRAFFIC RELATED CALLS","",792.832921032722,2016-05-25 13:47:47,2016-05-25
"651",45598,1758667,16000206471,2016206471,"350","HAZARDS","HAZARDS","HAZARDS","06/10/2016 06:25:34 PM","NE 45 ST / 8 AV NE","U","U2","5200.5006",-122.319565,47.66131,"(47.66131, -122.319565)","TRAFFIC - BO SIGNALS AND DOWN SIGNS","TRAFFIC RELATED CALLS","TRAFFIC RELATED CALLS","06/10/2016 05:08:45 PM",959.249521875689,2016-06-10 18:25:34,2016-06-11
"652",45620,1745641,16000183510,2016183510,"242","FIGHT DISTURBANCE","DISTURBANCES","DISTURBANCES","05/25/2016 02:18:48 PM","47XX BLOCK OF 22 AV NE","U","U1","4302.1007",-122.30413,47.663994,"(47.663994, -122.30413)","NOISE - DISTURBANCE (PARTY, ETC)","DISTURBANCES","DISTURBANCES","",976.049487035652,2016-05-25 14:18:48,2016-05-25
"653",45651,1738150,16000170297,2016170297,"350","HAZARDS","HAZARDS","HAZARDS","05/15/2016 11:46:18 PM","40XX BLOCK OF 9 AV NE","U","U2","5200.2003",-122.3188,47.656826,"(47.656826, -122.3188)","SUSPICIOUS PERSON, VEHICLE OR INCIDENT","SUSPICIOUS CIRCUMSTANCES","SUSPICIOUS CIRCUMSTANCES","",704.621962156095,2016-05-15 23:46:18,2016-05-16
"654",45680,1738187,16000170326,2016170326,"242","FIGHT DISTURBANCE","DISTURBANCES","DISTURBANCES","05/16/2016 12:28:30 AM","NE 52 ST / UNIVERSITY WY NE","U","U1","4400.4009",-122.31305,47.666435,"(47.666435, -122.31305)","FIGHT - IP - PHYSICAL (NO WEAPONS)","DISTURBANCES","DISTURBANCES","",1190.45003433767,2016-05-16 00:28:30,2016-05-16
"655",45696,1901507,16000456492,2016456492,"220","CRISIS COMPLAINT - GENERAL","CRISIS CALL","BEHAVIORAL HEALTH","12/20/2016 09:44:52 PM","30XX BLOCK OF NE 88 ST","U","U3","2100.1020",-122.29469,47.692375,"(47.692375, -122.29469)","CRISIS - PERSON IN BEHAVIORAL/EMOTIONAL CRISIS","BEHAVIORAL HEALTH","CRISIS CALL","12/20/2016 06:46:32 PM",4194.44430222899,2016-12-20 21:44:52,2016-12-21
"656",45713,1859605,16000380218,2016380218,"220","CRISIS COMPLAINT - GENERAL","CRISIS CALL","BEHAVIORAL HEALTH","10/20/2016 07:27:37 PM","47XX BLOCK OF 12 AV NE","U","U2","5301.2004",-122.315544,47.663677,"(47.663677, -122.315544)","PROPERTY - DAMAGE","PROPERTY DAMAGE","PROPERTY DAMAGE","10/20/2016 06:46:14 PM",966.782980955662,2016-10-20 19:27:37,2016-10-21
"657",45742,1790334,16000260265,2016260265,"242","FIGHT DISTURBANCE","DISTURBANCES","DISTURBANCES","07/21/2016 12:24:51 AM","51XX BLOCK OF 25 AV NE","U","U3","4301.1003",-122.30061,47.66712,"(47.66712, -122.30061)","ASLT - IP/JO - WITH OR W/O WPNS (NO SHOOTINGS)","ASSAULTS","ASSAULTS","07/20/2016 11:34:24 PM",1405.16177523332,2016-07-21 00:24:51,2016-07-21
"658",45744,1912827,16000456523,2016456523,"350","HAZARDS","HAZARDS","HAZARDS","12/21/2016 01:29:13 AM","SAND POINT WY NE / NE 50 ST","U","U3","4200.3034",-122.28284,47.664886,"(47.664886, -122.28284)","HAZ - POTENTIAL THRT TO PHYS SAFETY (NO HAZMAT)","HAZARDS","HAZARDS","",2232.9881305333,2016-12-21 01:29:13,2016-12-21
"659",45748,1948541,17000077448,201777448,"350","HAZARDS","HAZARDS","HAZARDS","03/03/2017 10:05:01 PM","47XX BLOCK OF 45 AV NE","U","U3","4100.401",-122.2794,47.663998,"(47.663998, -122.2794)","HAZ - POTENTIAL THRT TO PHYS SAFETY (NO HAZMAT)","HAZARDS","HAZARDS","",2429.53109729854,2017-03-03 22:05:01,2017-03-04
"660",45762,1778590,16000240160,2016240160,"220","CRISIS COMPLAINT - GENERAL","CRISIS CALL","BEHAVIORAL HEALTH","07/05/2016 05:27:53 PM","47XX BLOCK OF 12 AV NE","U","U2","5301.2004",-122.315254,47.664013,"(47.664013, -122.315254)","CRISIS - PERSON IN BEHAVIORAL/EMOTIONAL CRISIS","BEHAVIORAL HEALTH","CRISIS CALL","07/05/2016 02:53:39 PM",990.218839131712,2016-07-05 17:27:53,2016-07-06
"661",45783,1860866,16000382697,2016382697,"220","CRISIS COMPLAINT - GENERAL","CRISIS CALL","BEHAVIORAL HEALTH","10/22/2016 04:09:20 PM","82XX BLOCK OF 19 AV NE","U","U1","2600.1000",-122.30765,47.689716,"(47.689716, -122.30765)","CRISIS - PERSON IN BEHAVIORAL/EMOTIONAL CRISIS","BEHAVIORAL HEALTH","CRISIS CALL","",3751.25171505974,2016-10-22 16:09:20,2016-10-22
"662",45796,2029545,17000226506,2017226506,"350","HAZARDS","HAZARDS","HAZARDS","06/24/2017 12:23:22 AM","BURKE GILMAN TL / NE 45 PL","U","U3","4200.3038",-122.2917,47.661854,"(47.661854, -122.2917)","TRAFFIC - BO SIGNALS AND DOWN SIGNS","TRAFFIC RELATED CALLS","TRAFFIC RELATED CALLS","",1487.06709734552,2017-06-24 00:23:22,2017-06-24
"663",45797,1969930,17000117665,2017117665,"350","HAZARDS","HAZARDS","HAZARDS","04/04/2017 02:12:24 PM","35 AV NE / NE 65 ST","U","U3","4200.4006",-122.290276,47.67578,"(47.67578, -122.290276)","HAZ - POTENTIAL THRT TO PHYS SAFETY (NO HAZMAT)","HAZARDS","HAZARDS","",2630.81993517566,2017-04-04 14:12:24,2017-04-04
"664",45806,1745904,16000184058,2016184058,"350","HAZARDS","HAZARDS","HAZARDS","05/25/2016 08:45:39 PM","65XX BLOCK OF SAND POINT WY NE","U","U3","4000.1028",-122.26355,47.676197,"(47.676197, -122.26355)","HAZ - POTENTIAL THRT TO PHYS SAFETY (NO HAZMAT)","HAZARDS","HAZARDS","",4117.37052735623,2016-05-25 20:45:39,2016-05-26
"665",45851,2077032,17000312818,2017312818,"031","STRONG ARM ROBBERY","ROBBERY","ROBBERY","08/24/2017 03:45:02 AM","65XX BLOCK OF SAND POINT WY NE","U","U3","4000.1028",-122.26355,47.676197,"(47.676197, -122.26355)","ROBBERY (INCLUDES STRONG ARM)","ROBBERY","ROBBERY","08/23/2017 11:46:15 PM",4117.37052735623,2017-08-24 03:45:02,2017-08-24
"666",45863,1891691,16000438104,2016438104,"242","FIGHT DISTURBANCE","DISTURBANCES","DISTURBANCES","12/05/2016 10:32:58 PM","NE 45 ST / UNIVERSITY WY NE","U","U2","5301.3001",-122.31313,47.661266,"(47.661266, -122.31313)","FIGHT - IP - PHYSICAL (NO WEAPONS)","DISTURBANCES","DISTURBANCES","",645.873447683438,2016-12-05 22:32:58,2016-12-06
"667",45870,1790440,16000260367,2016260367,"242","FIGHT DISTURBANCE","DISTURBANCES","DISTURBANCES","07/21/2016 03:24:09 AM","58XX BLOCK OF NE 75 ST","U","U3","4000.1026",-122.264496,47.682926,"(47.682926, -122.264496)","DISTURBANCE, MISCELLANEOUS/OTHER","DISTURBANCES","DISTURBANCES","07/21/2016 01:58:54 AM",4515.05855960865,2016-07-21 03:24:09,2016-07-21
"668",45883,1790310,16000260221,2016260221,"350","HAZARDS","HAZARDS","HAZARDS","07/20/2016 11:52:05 PM","NE 45 ST / 20 AV NE","U","U1","5302.3013",-122.306526,47.661255,"(47.661255, -122.306526)","HAZ - POTENTIAL THRT TO PHYS SAFETY (NO HAZMAT)","HAZARDS","HAZARDS","07/20/2016 10:59:14 PM",625.521753811904,2016-07-20 23:52:05,2016-07-21
"669",45911,1859677,16000380442,2016380442,"031","STRONG ARM ROBBERY","ROBBERY","ROBBERY","10/20/2016 09:50:29 PM","15 AV NE / NE 41 ST","U","U2","5301.4000",-122.31211,47.65682,"(47.65682, -122.31211)","ROBBERY (INCLUDES STRONG ARM)","ROBBERY","ROBBERY","10/20/2016 07:48:16 PM",216.222931905124,2016-10-20 21:50:29,2016-10-21
"670",45970,1746092,16000184266,2016184266,"041","HARASSMENT, THREATS","THREATS, HARASSMENT","THREATS, HARASSMENT","05/26/2016 01:51:34 AM","NE 47 ST / 17 AV NE","U","U2","5301.1005",-122.309685,47.663055,"(47.663055, -122.309685)","SUSPICIOUS PERSON, VEHICLE OR INCIDENT","SUSPICIOUS CIRCUMSTANCES","SUSPICIOUS CIRCUMSTANCES","05/26/2016 12:14:51 AM",784.524057458698,2016-05-26 01:51:34,2016-05-26
"671",46021,1799105,16000275281,2016275281,"041","HARASSMENT, THREATS","THREATS, HARASSMENT","THREATS, HARASSMENT","07/31/2016 09:26:05 PM","27XX BLOCK OF NE 54 ST","U","U3","4301.1005",-122.29707,47.667862,"(47.667862, -122.29707)","BIAS -RACIAL, POLITICAL, SEXUAL MOTIVATION","SUSPICIOUS CIRCUMSTANCES","SUSPICIOUS CIRCUMSTANCES","07/31/2016 08:13:20 PM",1615.88182867838,2016-07-31 21:26:05,2016-08-01
"672",46051,2102030,17000358382,2017358382,"220","CRISIS COMPLAINT - GENERAL","CRISIS CALL","BEHAVIORAL HEALTH","09/26/2017 04:29:06 PM","72XX BLOCK OF ROOSEVELT WY NE","U","U1","2600.2022",-122.31745,47.68121,"(47.68121, -122.31745)","CRISIS - PERSON IN BEHAVIORAL/EMOTIONAL CRISIS","BEHAVIORAL HEALTH","CRISIS CALL","09/26/2017 02:30:01 PM",2865.83059429477,2017-09-26 16:29:06,2017-09-26
"673",46092,1827139,16000322464,2016322464,"030","ARMED ROBBERY","GUN CALLS","ROBBERY","09/06/2016 01:00:31 AM","NE 62 ST / ROOSEVELT WY NE","U","U1","4400.2011",-122.31737,47.673332,"(47.673332, -122.31737)","ROBBERY (INCLUDES STRONG ARM)","ROBBERY","ROBBERY","09/05/2016 10:03:20 PM",2015.65617932773,2016-09-06 01:00:31,2016-09-06
"674",46132,1836463,16000339163,2016339163,"041","HARASSMENT, THREATS","THREATS, HARASSMENT","THREATS, HARASSMENT","09/18/2016 08:28:46 PM","7XX BLOCK OF NE 42 ST","U","U2","5200.1004",-122.320366,47.657696,"(47.657696, -122.320366)","DISTURBANCE, MISCELLANEOUS/OTHER","DISTURBANCES","DISTURBANCES","09/18/2016 07:40:29 PM",837.740049656134,2016-09-18 20:28:46,2016-09-19
"675",46145,1791755,16000262476,2016262476,"350","HAZARDS","HAZARDS","HAZARDS","07/22/2016 06:13:35 PM","PRINCETON AV NE / BURKE GILMAN TL","U","U3","4200.1027",-122.2757,47.668667,"(47.668667, -122.2757)","TREES DOWN, OBSTRUCTING PUBLIC PROP (NO HAZ)","TREES DOWN","TREES DOWN","",2903.23171543229,2016-07-22 18:13:35,2016-07-23
"676",46151,2016707,17000203813,2017203813,"041","HARASSMENT, THREATS","THREATS, HARASSMENT","THREATS, HARASSMENT","06/07/2017 02:05:11 PM","47XX BLOCK OF 12 AV NE","U","U2","5301.2003",-122.315254,47.664013,"(47.664013, -122.315254)","HARAS - NO BIAS, THREATS OR MALICIOUSNESS","THREATS, HARASSMENT","THREATS, HARASSMENT","06/07/2017 12:02:20 PM",990.218839131712,2017-06-07 14:05:11,2017-06-07
"677",46223,1746359,16000184823,2016184823,"350","HAZARDS","HAZARDS","HAZARDS","05/26/2016 11:55:31 AM","41XX BLOCK OF BROOKLYN AV NE","U","U2","5301.4001",-122.314384,47.65759,"(47.65759, -122.314384)","TRAFFIC - BO SIGNALS AND DOWN SIGNS","TRAFFIC RELATED CALLS","TRAFFIC RELATED CALLS","",407.251211570122,2016-05-26 11:55:31,2016-05-26
"678",46224,1912893,17000009069,20179069,"350","HAZARDS","HAZARDS","HAZARDS","01/08/2017 10:00:46 AM","21 AV NE / NE 65 ST","U","U1","2500.2013",-122.30547,47.675777,"(47.675777, -122.30547)","HAZ - POTENTIAL THRT TO PHYS SAFETY (NO HAZMAT)","HAZARDS","HAZARDS","01/08/2017 07:38:09 AM",2219.61643219841,2017-01-08 10:00:46,2017-01-08
"679",46326,1993928,17000162014,2017162014,"220","CRISIS COMPLAINT - GENERAL","CRISIS CALL","BEHAVIORAL HEALTH","05/09/2017 03:31:04 AM","45XX BLOCK OF 19 AV NE","U","U1","5301.1009",-122.30723,47.662155,"(47.662155, -122.30723)","OVERDOSE - DRUG RELATED CASUALTY","PERSON DOWN/INJURY","CASUALTIES","05/09/2017 12:28:01 AM",705.258645823833,2017-05-09 03:31:04,2017-05-09
"680",46336,1759585,16000208045,2016208045,"350","HAZARDS","HAZARDS","HAZARDS","06/11/2016 09:40:33 PM","MONTLAKE BR / SB","U","U3","5302.3057",-122.304596,47.647484,"(47.647484, -122.304596)","HAZ - POTENTIAL THRT TO PHYS SAFETY (NO HAZMAT)","HAZARDS","HAZARDS","",1015.99051207712,2016-06-11 21:40:33,2016-06-12
"681",46342,1827066,16000322483,2016322483,"041","HARASSMENT, THREATS","THREATS, HARASSMENT","THREATS, HARASSMENT","09/05/2016 10:52:51 PM","NE 42 ST / 12 AV NE","U","U2","5301.3006",-122.31552,47.65834,"(47.65834, -122.31552)","HARAS - NO BIAS, THREATS OR MALICIOUSNESS","THREATS, HARASSMENT","THREATS, HARASSMENT","09/05/2016 10:10:54 PM",521.713345018583,2016-09-05 22:52:51,2016-09-06
"682",46355,1799374,16000275660,2016275660,"220","CRISIS COMPLAINT - GENERAL","CRISIS CALL","BEHAVIORAL HEALTH","08/01/2016 08:25:34 AM","52XX BLOCK OF MITHUN PL NE","U","U3","4200.2023",-122.28154,47.667786,"(47.667786, -122.28154)","CRISIS - PERSON IN BEHAVIORAL/EMOTIONAL CRISIS","BEHAVIORAL HEALTH","CRISIS CALL","08/01/2016 05:30:46 AM",2475.41708107211,2016-08-01 08:25:34,2016-08-01
"683",46446,1859668,16000380533,2016380533,"350","HAZARDS","HAZARDS","HAZARDS","10/20/2016 09:53:53 PM","NE 50 ST / BROOKLYN AV NE","U","U1","5301.2002",-122.31421,47.664906,"(47.664906, -122.31421)","HAZ - POTENTIAL THRT TO PHYS SAFETY (NO HAZMAT)","HAZARDS","HAZARDS","",1051.50585422232,2016-10-20 21:53:53,2016-10-21
"684",46501,2040880,17000247972,2017247972,"350","HAZARDS","HAZARDS","HAZARDS","07/08/2017 03:39:32 PM","12 AV NE / NE 47 ST","U","U2","5301.2007",-122.31526,47.663105,"(47.663105, -122.31526)","HAZ - POTENTIAL THRT TO PHYS SAFETY (NO HAZMAT)","HAZARDS","HAZARDS","",900.685209550702,2017-07-08 15:39:32,2017-07-08
"685",46508,1779077,16000241057,2016241057,"350","HAZARDS","HAZARDS","HAZARDS","07/06/2016 06:33:31 AM","NE 45 ST / UNIVERSITY WY NE","U","U2","5301.3001",-122.31313,47.661266,"(47.661266, -122.31313)","DOWN - CHECK FOR PERSON DOWN","PERSON DOWN/INJURY","CASUALTIES","",645.873447683438,2016-07-06 06:33:31,2016-07-06
"686",46531,1810168,16000294581,2016294581,"220","CRISIS COMPLAINT - GENERAL","CRISIS CALL","BEHAVIORAL HEALTH","08/15/2016 11:15:56 AM","LAKE CITY WY NE / NE 88 ST","U","U1","2000.1016",-122.305855,47.692112,"(47.692112, -122.305855)","SUSPICIOUS PERSON, VEHICLE OR INCIDENT","SUSPICIOUS CIRCUMSTANCES","SUSPICIOUS CIRCUMSTANCES","08/15/2016 07:44:36 AM",4024.39508301583,2016-08-15 11:15:56,2016-08-15
"687",46568,1827271,16000322866,2016322866,"350","HAZARDS","HAZARDS","HAZARDS","09/06/2016 08:35:31 AM","38XX BLOCK OF NE 88 ST","U","U3","2200.2008",-122.28665,47.69236,"(47.69236, -122.28665)","TREES DOWN, OBSTRUCTING PUBLIC PROP (NO HAZ)","TREES DOWN","TREES DOWN","",4391.73342541042,2016-09-06 08:35:31,2016-09-06
"688",46614,1959616,17000098522,201798522,"041","HARASSMENT, THREATS","THREATS, HARASSMENT","THREATS, HARASSMENT","03/20/2017 05:29:53 PM","50XX BLOCK OF ROOSEVELT WY NE","U","U1","4500.1009",-122.3174,47.665688,"(47.665688, -122.3174)","HARAS - NO BIAS, THREATS OR MALICIOUSNESS","THREATS, HARASSMENT","THREATS, HARASSMENT","03/20/2017 03:54:13 PM",1229.78206620259,2017-03-20 17:29:53,2017-03-21
"689",46617,1759716,16000208227,2016208227,"220","CRISIS COMPLAINT - GENERAL","CRISIS CALL","BEHAVIORAL HEALTH","06/12/2016 01:09:28 AM","NE 42 ST / 12 AV NE","U","U2","5301.3006",-122.31552,47.65834,"(47.65834, -122.31552)","LEWD - (EXPOSING, FLASHING, URINATING IN PUB)","LEWD CONDUCT","SUSPICIOUS CIRCUMSTANCES","06/11/2016 11:40:51 PM",521.713345018583,2016-06-12 01:09:28,2016-06-12
"690",46627,1935699,17000051328,201751328,"220","CRISIS COMPLAINT - GENERAL","CRISIS CALL","BEHAVIORAL HEALTH","02/11/2017 05:47:01 PM","48XX BLOCK OF NE 44 ST","U","U3","4100.3007",-122.275345,47.660572,"(47.660572, -122.275345)","CRISIS - PERSON IN BEHAVIORAL/EMOTIONAL CRISIS","BEHAVIORAL HEALTH","CRISIS CALL","02/11/2017 03:17:34 PM",2615.48886474452,2017-02-11 17:47:01,2017-02-12
"691",46637,1859734,16000380587,2016380587,"242","FIGHT DISTURBANCE","DISTURBANCES","DISTURBANCES","10/20/2016 11:16:30 PM","NE 52 ST / SAND POINT WY NE","U","U3","4200.2022",-122.280846,47.66681,"(47.66681, -122.280846)","ASLT - IP/JO - WITH OR W/O WPNS (NO SHOOTINGS)","ASSAULTS","ASSAULTS","10/20/2016 10:43:56 PM",2465.1201399768,2016-10-20 23:16:30,2016-10-21
"692",46644,1902256,16000458067,2016458067,"220","CRISIS COMPLAINT - GENERAL","CRISIS CALL","BEHAVIORAL HEALTH","12/22/2016 02:15:00 AM","45XX BLOCK OF BROOKLYN AV NE","U","U2","5301.2008",-122.31426,47.66219,"(47.66219, -122.31426)","DISTURBANCE, MISCELLANEOUS/OTHER","DISTURBANCES","DISTURBANCES","",775.56356285686,2016-12-22 02:15:00,2016-12-22
"693",46645,1982538,17000141371,2017141371,"350","HAZARDS","HAZARDS","HAZARDS","04/23/2017 03:29:55 AM","7 AV NE / NE 43 ST","U","U2","5200.1003",-122.32084,47.659462,"(47.659462, -122.32084)","HAZ - POTENTIAL THRT TO PHYS SAFETY (NO HAZMAT)","HAZARDS","HAZARDS","04/23/2017 02:44:49 AM",934.76337828761,2017-04-23 03:29:55,2017-04-23
"694",46703,1799613,16000275945,2016275945,"041","HARASSMENT, THREATS","THREATS, HARASSMENT","THREATS, HARASSMENT","08/01/2016 03:15:09 PM","47XX BLOCK OF 18 AV NE","U","U1","5301.1001",-122.30834,47.663963,"(47.663963, -122.30834)","HARAS - NO BIAS, THREATS OR MALICIOUSNESS","THREATS, HARASSMENT","THREATS, HARASSMENT","08/01/2016 11:43:09 AM",889.633111327838,2016-08-01 15:15:09,2016-08-01
"695",46739,1859831,16000380625,2016380625,"242","FIGHT DISTURBANCE","DISTURBANCES","DISTURBANCES","10/21/2016 03:01:28 AM","44 AV NE / SAND POINT PL NE","U","U3","4100.4006",-122.28025,47.666523,"(47.666523, -122.28025)","FIGHT - JO - PHYSICAL (NO WEAPONS)","DISTURBANCES","DISTURBANCES","10/20/2016 11:33:53 PM",2489.14899951184,2016-10-21 03:01:28,2016-10-21
"696",46749,1935655,17000051406,201751406,"031","STRONG ARM ROBBERY","ROBBERY","ROBBERY","02/11/2017 06:00:41 PM","65XX BLOCK OF 62 AV NE","U","U3","4000.1014",-122.26223,47.67889,"(47.67889, -122.26223)","ASLT - IP/JO - WITH OR W/O WPNS (NO SHOOTINGS)","ASSAULTS","ASSAULTS","02/11/2017 02:39:53 PM",4368.13337390337,2017-02-11 18:00:41,2017-02-12
"697",46766,1769833,16000225267,2016225267,"220","CRISIS COMPLAINT - GENERAL","CRISIS CALL","BEHAVIORAL HEALTH","06/25/2016 03:43:35 AM","47XX BLOCK OF 12 AV NE","U","U2","5301.2004",-122.315254,47.664013,"(47.664013, -122.315254)","CRISIS - PERSON IN BEHAVIORAL/EMOTIONAL CRISIS","BEHAVIORAL HEALTH","CRISIS CALL","06/24/2016 09:46:01 PM",990.218839131712,2016-06-25 03:43:35,2016-06-25
"698",46782,1859850,16000380710,2016380710,"242","FIGHT DISTURBANCE","DISTURBANCES","DISTURBANCES","10/21/2016 03:26:54 AM","65XX BLOCK OF ROOSEVELT WY NE","U","U1","2600.3012",-122.31709,47.67615,"(47.67615, -122.31709)","DISTURBANCE, MISCELLANEOUS/OTHER","DISTURBANCES","DISTURBANCES","10/21/2016 01:52:04 AM",2311.74076923683,2016-10-21 03:26:54,2016-10-21
"699",46811,2102112,17000358844,2017358844,"242","FIGHT DISTURBANCE","DISTURBANCES","DISTURBANCES","09/26/2017 06:29:04 PM","13XX BLOCK OF NE BOAT ST","U","U2","5302.201",-122.31415,47.651676,"(47.651676, -122.31415)","FIGHT - IP - PHYSICAL (NO WEAPONS)","DISTURBANCES","DISTURBANCES","09/26/2017 05:51:02 PM",594.268095090348,2017-09-26 18:29:04,2017-09-27
"700",46865,1901879,16000457469,2016457469,"220","CRISIS COMPLAINT - GENERAL","CRISIS CALL","BEHAVIORAL HEALTH","12/21/2016 03:41:02 PM","UNIVERSITY WY NE / NE 45 ST","U","U2","5301.3001",-122.31313,47.661266,"(47.661266, -122.31313)","HAZ - POTENTIAL THRT TO PHYS SAFETY (NO HAZMAT)","HAZARDS","HAZARDS","",645.873447683438,2016-12-21 15:41:02,2016-12-21
"701",46884,1738545,16000171010,2016171010,"350","HAZARDS","HAZARDS","HAZARDS","05/16/2016 02:54:46 PM","NE 65 ST / 12 AV NE","U","U1","2600.3013",-122.31566,47.675816,"(47.675816, -122.31566)","HAZ - POTENTIAL THRT TO PHYS SAFETY (NO HAZMAT)","HAZARDS","HAZARDS","",2251.27058537476,2016-05-16 14:54:46,2016-05-16
"702",46926,1994009,17000162233,2017162233,"220","CRISIS COMPLAINT - GENERAL","CRISIS CALL","BEHAVIORAL HEALTH","05/09/2017 07:56:52 AM","47XX BLOCK OF 9 AV NE","U","U2","5200.5001",-122.31839,47.663567,"(47.663567, -122.31839)","SUSPICIOUS PERSON, VEHICLE OR INCIDENT","SUSPICIOUS CIRCUMSTANCES","SUSPICIOUS CIRCUMSTANCES","",1074.12629124566,2017-05-09 07:56:52,2017-05-09
"703",46928,1790988,16000261405,2016261405,"350","HAZARDS","HAZARDS","HAZARDS","07/21/2016 08:05:14 PM","68XX BLOCK OF 26 AV NE","U","U3","3800.2012",-122.29957,47.6785,"(47.6785, -122.29957)","WIRES DOWN (PHONE, ELECTRICAL,ETC.)","HAZARDS","HAZARDS","",2610.43611636791,2016-07-21 20:05:14,2016-07-22
"704",47014,1861137,16000383065,2016383065,"350","HAZARDS","HAZARDS","HAZARDS","10/22/2016 09:55:41 PM","NE 45 ST / 8 AV NE","U","U2","5200.5006",-122.319565,47.66131,"(47.66131, -122.319565)","HAZ - POTENTIAL THRT TO PHYS SAFETY (NO HAZMAT)","HAZARDS","HAZARDS","",959.249521875689,2016-10-22 21:55:41,2016-10-23
"705",47046,1959878,17000099011,201799011,"242","FIGHT DISTURBANCE","DISTURBANCES","DISTURBANCES","03/21/2017 12:27:24 AM","42XX BLOCK OF UNIVERSITY WY NE","U","U2","5301.3008",-122.31319,47.659054,"(47.659054, -122.31319)","FIGHT - VERBAL/ORAL (NO WEAPONS)","DISTURBANCES","DISTURBANCES","",438.325335850633,2017-03-21 00:27:24,2017-03-21
"706",47063,1810345,16000295256,2016295256,"242","FIGHT DISTURBANCE","DISTURBANCES","DISTURBANCES","08/15/2016 05:20:54 PM","NE 47 ST / BROOKLYN AV NE","U","U2","5301.2008",-122.31424,47.663097,"(47.663097, -122.31424)","ASLT - IP/JO - WITH OR W/O WPNS (NO SHOOTINGS)","ASSAULTS","ASSAULTS","",865.679337340903,2016-08-15 17:20:54,2016-08-16
"707",47099,2040977,17000247919,2017247919,"220","CRISIS COMPLAINT - GENERAL","CRISIS CALL","BEHAVIORAL HEALTH","07/08/2017 06:29:41 PM","22XX BLOCK OF NE BLAKELEY ST","U","U1","4302.2006",-122.30267,47.66536,"(47.66536, -122.30267)","CRISIS - PERSON IN BEHAVIORAL/EMOTIONAL CRISIS","BEHAVIORAL HEALTH","CRISIS CALL","07/08/2017 02:01:44 PM",1160.26209364191,2017-07-08 18:29:41,2017-07-09
"708",47152,1982559,17000141381,2017141381,"030","ARMED ROBBERY","GUN CALLS","ROBBERY","04/23/2017 04:42:22 AM","NE 45 ST / ROOSEVELT WY NE","U","U2","5301.3004",-122.31764,47.661297,"(47.661297, -122.31764)","ROBBERY - IP/JO (INCLUDES STRONG ARM)","ROBBERY","ROBBERY","04/23/2017 02:56:25 AM",848.950730071322,2017-04-23 04:42:22,2017-04-23
"709",47183,1860017,16000381122,2016381122,"031","STRONG ARM ROBBERY","ROBBERY","ROBBERY","10/21/2016 11:36:03 AM","30XX BLOCK OF NE 45 ST","U","U3","4301.1013",-122.29545,47.66205,"(47.66205, -122.29545)","ROBBERY - IP/JO (INCLUDES STRONG ARM)","ROBBERY","ROBBERY","10/21/2016 11:05:11 AM",1251.51617431619,2016-10-21 11:36:03,2016-10-21
"710",47196,1746753,16000184754,2016184754,"350","HAZARDS","HAZARDS","HAZARDS","05/26/2016 08:50:13 PM","87XX BLOCK OF 25 AV NE","U","U3","2100.3010",-122.30149,47.691933,"(47.691933, -122.30149)","TREES DOWN, OBSTRUCTING PUBLIC PROP (NO HAZ)","TREES DOWN","TREES DOWN","05/26/2016 10:52:46 AM",4040.20086333903,2016-05-26 20:50:13,2016-05-27
"711",47229,1860124,16000381234,2016381234,"041","HARASSMENT, THREATS","THREATS, HARASSMENT","THREATS, HARASSMENT","10/21/2016 02:28:01 PM","50XX BLOCK OF 39 AV NE","U","U3","4200.3002",-122.28559,47.66549,"(47.66549, -122.28559)","HARAS - NO BIAS, THREATS OR MALICIOUSNESS","THREATS, HARASSMENT","THREATS, HARASSMENT","10/21/2016 01:00:03 PM",2082.97266397012,2016-10-21 14:28:01,2016-10-21
"712",47276,1760063,16000208638,2016208638,"041","HARASSMENT, THREATS","THREATS, HARASSMENT","THREATS, HARASSMENT","06/12/2016 03:30:11 PM","26XX BLOCK OF NE 65 ST","U","U3","3800.2013",-122.298996,47.675777,"(47.675777, -122.298996)","HARAS - NO BIAS, THREATS OR MALICIOUSNESS","THREATS, HARASSMENT","THREATS, HARASSMENT","06/12/2016 01:15:32 PM",2336.12218132195,2016-06-12 15:30:11,2016-06-12
"713",47339,1983119,17000142316,2017142316,"031","STRONG ARM ROBBERY","ROBBERY","ROBBERY","04/24/2017 04:28:01 AM","28XX BLOCK OF NE 55 ST","U","U3","4301.1",-122.29592,47.668518,"(47.668518, -122.29592)","ROBBERY - IP/JO (INCLUDES STRONG ARM)","ROBBERY","ROBBERY","04/24/2017 03:30:38 AM",1725.54937585427,2017-04-24 04:28:01,2017-04-24
"714",47373,1790952,16000261093,2016261093,"041","HARASSMENT, THREATS","THREATS, HARASSMENT","THREATS, HARASSMENT","07/21/2016 07:17:22 PM","25XX BLOCK OF NE 75 ST","U","U3","3800.2003",-122.300224,47.68305,"(47.68305, -122.300224)","DISTURBANCE, MISCELLANEOUS/OTHER","DISTURBANCES","DISTURBANCES","07/21/2016 06:16:49 PM",3087.15097048475,2016-07-21 19:17:22,2016-07-22
"715",47378,1827695,16000323221,2016323221,"041","HARASSMENT, THREATS","THREATS, HARASSMENT","THREATS, HARASSMENT","09/06/2016 07:32:34 PM","NE 50 ST / 12 AV NE","U","U1","4400.4006",-122.31524,47.664917,"(47.664917, -122.31524)","THEFT (DOES NOT INCLUDE SHOPLIFT OR SVCS)","OTHER PROPERTY","THEFT","09/06/2016 01:29:36 PM",1081.11817967794,2016-09-06 19:32:34,2016-09-07
"716",47395,1790918,16000261202,2016261202,"242","FIGHT DISTURBANCE","DISTURBANCES","DISTURBANCES","07/21/2016 06:22:57 PM","42XX BLOCK OF UNIVERSITY WY NE","U","U2","5301.3008",-122.31319,47.659054,"(47.659054, -122.31319)","FIGHT - JO - PHYSICAL (NO WEAPONS)","DISTURBANCES","DISTURBANCES","07/21/2016 03:49:50 PM",438.325335850633,2016-07-21 18:22:57,2016-07-22
"717",47420,1810419,16000294950,2016294950,"220","CRISIS COMPLAINT - GENERAL","CRISIS CALL","BEHAVIORAL HEALTH","08/15/2016 07:07:41 PM","52XX BLOCK OF 12 AV NE","U","U1","4400.4003",-122.3152,47.667503,"(47.667503, -122.3152)","CRISIS - PERSON IN BEHAVIORAL/EMOTIONAL CRISIS","BEHAVIORAL HEALTH","CRISIS CALL","08/15/2016 04:20:43 PM",1348.7053255018,2016-08-15 19:07:41,2016-08-16
"718",47425,1836245,16000338735,2016338735,"041","HARASSMENT, THREATS","THREATS, HARASSMENT","THREATS, HARASSMENT","09/18/2016 01:19:59 PM","18XX BLOCK OF NE RAVENNA BV","U","U1","4400.1028",-122.308205,47.670086,"(47.670086, -122.308205)","THREATS (INCLS IN-PERSON/BY PHONE/IN WRITING)","THREATS, HARASSMENT","THREATS, HARASSMENT","09/18/2016 11:47:35 AM",1569.15207936411,2016-09-18 13:19:59,2016-09-18
"719",47436,1770525,16000226724,2016226724,"041","HARASSMENT, THREATS","THREATS, HARASSMENT","THREATS, HARASSMENT","06/26/2016 12:29:02 AM","42XX BLOCK OF UNIVERSITY WY NE","U","U2","5301.3008",-122.31319,47.659054,"(47.659054, -122.31319)","ASLT - WITH OR W/O WEAPONS (NO SHOOTINGS)","ASSAULTS","ASSAULTS","",438.325335850633,2016-06-26 00:29:02,2016-06-26
"720",47451,1779513,16000241984,2016241984,"220","CRISIS COMPLAINT - GENERAL","CRISIS CALL","BEHAVIORAL HEALTH","07/06/2016 07:28:08 PM","40XX BLOCK OF 7 AV NE","U","U2","5200.2009",-122.32085,47.656708,"(47.656708, -122.32085)","THREATS (INCLS IN-PERSON/BY PHONE/IN WRITING)","THREATS, HARASSMENT","THREATS, HARASSMENT","07/06/2016 06:05:24 PM",856.233556826154,2016-07-06 19:28:08,2016-07-07
"721",47514,1882780,16000421676,2016421676,"242","FIGHT DISTURBANCE","DISTURBANCES","DISTURBANCES","11/22/2016 08:12:30 AM","45XX BLOCK OF UNIVERSITY WY NE","U","U2","5301.2009",-122.31312,47.66218,"(47.66218, -122.31312)","FIGHT - IP - PHYSICAL (NO WEAPONS)","DISTURBANCES","DISTURBANCES","",738.963514898043,2016-11-22 08:12:30,2016-11-22
"722",47648,1810504,16000295466,2016295466,"242","FIGHT DISTURBANCE","DISTURBANCES","DISTURBANCES","08/15/2016 08:56:41 PM","NE 45 ST / 11 AV NE","U","U2","5301.2006",-122.31658,47.661293,"(47.661293, -122.31658)","WEAPN-IP/JO-GUN,DEADLY WPN (NO THRT/ASLT/DIST)","WEAPONS CALLS","WEAPONS CALLS","",793.197829416394,2016-08-15 20:56:41,2016-08-16
"723",47698,1902332,16000458152,2016458152,"220","CRISIS COMPLAINT - GENERAL","CRISIS CALL","BEHAVIORAL HEALTH","12/22/2016 05:54:58 AM","45XX BLOCK OF UNIVERSITY WY NE","U","U2","5301.2009",-122.31312,47.66218,"(47.66218, -122.31312)","TRESPASS","TRESPASS","TRESPASS","12/22/2016 05:15:33 AM",738.963514898043,2016-12-22 05:54:58,2016-12-22
"724",47712,1746963,16000185810,2016185810,"350","HAZARDS","HAZARDS","HAZARDS","05/27/2016 03:00:24 AM","ROOSEVELT WY NE / NE 42 ST","U","U2","5301.4004",-122.31778,47.65837,"(47.65837, -122.31778)","HAZ - POTENTIAL THRT TO PHYS SAFETY (NO HAZMAT)","HAZARDS","HAZARDS","",675.495821475095,2016-05-27 03:00:24,2016-05-27
"725",47715,1935849,17000051096,201751096,"041","HARASSMENT, THREATS","THREATS, HARASSMENT","THREATS, HARASSMENT","02/11/2017 11:02:12 AM","45XX BLOCK OF UNIVERSITY WY NE","U","U2","5301.2009",-122.31312,47.66218,"(47.66218, -122.31312)","THREATS (INCLS IN-PERSON/BY PHONE/IN WRITING)","THREATS, HARASSMENT","THREATS, HARASSMENT","02/11/2017 08:45:27 AM",738.963514898043,2017-02-11 11:02:12,2017-02-11
"726",47726,1902364,16000458181,2016458181,"220","CRISIS COMPLAINT - GENERAL","CRISIS CALL","BEHAVIORAL HEALTH","12/22/2016 08:04:43 AM","7XX BLOCK OF NE 43 ST","U","U2","5200.1003",-122.32031,47.659462,"(47.659462, -122.32031)","LEWD - (EXPOSING, FLASHING, URINATING IN PUB)","LEWD CONDUCT","SUSPICIOUS CIRCUMSTANCES","12/22/2016 06:32:52 AM",898.632630297104,2016-12-22 08:04:43,2016-12-22
"727",47731,1770829,16000227319,2016227319,"041","HARASSMENT, THREATS","THREATS, HARASSMENT","THREATS, HARASSMENT","06/26/2016 01:07:42 PM","77XX BLOCK OF 21 AV NE","U","U1","2500.1027",-122.3054,47.68545,"(47.68545, -122.3054)","HARAS - NO BIAS, THREATS OR MALICIOUSNESS","THREATS, HARASSMENT","THREATS, HARASSMENT","06/26/2016 11:27:50 AM",3288.81140322231,2016-06-26 13:07:42,2016-06-26
"728",47788,1779605,16000242151,2016242151,"220","CRISIS COMPLAINT - GENERAL","CRISIS CALL","BEHAVIORAL HEALTH","07/06/2016 09:10:24 PM","43XX BLOCK OF NE 55 ST","U","U3","4200.2016",-122.2808,47.66879,"(47.66879, -122.2808)","PROPERTY - DAMAGE","PROPERTY DAMAGE","PROPERTY DAMAGE","",2582.47368709095,2016-07-06 21:10:24,2016-07-07
"729",47926,1892240,16000438831,2016438831,"220","CRISIS COMPLAINT - GENERAL","CRISIS CALL","BEHAVIORAL HEALTH","12/06/2016 06:01:17 PM","48XX BLOCK OF NE 44 ST","U","U3","4100.3007",-122.275345,47.660572,"(47.660572, -122.275345)","CRISIS - PERSON IN BEHAVIORAL/EMOTIONAL CRISIS","BEHAVIORAL HEALTH","CRISIS CALL","12/06/2016 05:10:11 PM",2615.48886474452,2016-12-06 18:01:17,2016-12-07
"730",47997,1883004,16000421975,2016421975,"220","CRISIS COMPLAINT - GENERAL","CRISIS CALL","BEHAVIORAL HEALTH","11/22/2016 03:09:27 PM","48XX BLOCK OF SAND POINT WY NE","U","U3","4100.4008",-122.28316,47.66458,"(47.66458, -122.28316)","ASLT - IP/JO - WITH OR W/O WPNS (NO SHOOTINGS)","ASSAULTS","ASSAULTS","11/22/2016 12:14:19 PM",2196.47452707793,2016-11-22 15:09:27,2016-11-22
"731",48023,1970224,17000117968,2017117968,"242","FIGHT DISTURBANCE","DISTURBANCES","DISTURBANCES","04/04/2017 09:35:41 PM","71XX BLOCK OF 62 AV NE","U","U3","4000.1014",-122.26223,47.67889,"(47.67889, -122.26223)","FIGHT - JO - PHYSICAL (NO WEAPONS)","DISTURBANCES","DISTURBANCES","04/04/2017 05:26:15 PM",4368.13337390337,2017-04-04 21:35:41,2017-04-05
"732",48060,1739449,16000172336,2016172336,"031","STRONG ARM ROBBERY","ROBBERY","ROBBERY","05/17/2016 05:44:46 PM","26XX BLOCK OF NE UNIVERSITY VILLAGE ST","U","U3","4301.1011",-122.29841,47.663322,"(47.663322, -122.29841)","ROBBERY - IP/JO (INCLUDES STRONG ARM)","ROBBERY","ROBBERY","05/17/2016 01:34:43 PM",1164.76014484058,2016-05-17 17:44:46,2016-05-18
"733",48077,1860776,16000382363,2016382363,"220","CRISIS COMPLAINT - GENERAL","CRISIS CALL","BEHAVIORAL HEALTH","10/22/2016 01:20:54 PM","43XX BLOCK OF UNIVERSITY WY NE","U","U2","5301.3000",-122.31278,47.66024,"(47.66024, -122.31278)","TRESPASS","TRESPASS","TRESPASS","10/22/2016 12:12:09 PM",531.921704166654,2016-10-22 13:20:54,2016-10-22
"734",48080,1791302,16000261621,2016261621,"041","HARASSMENT, THREATS","THREATS, HARASSMENT","THREATS, HARASSMENT","07/22/2016 04:04:01 AM","65XX BLOCK OF 50 AV NE","U","U3","3900.2008",-122.27424,47.676678,"(47.676678, -122.27424)","THREATS (INCLS IN-PERSON/BY PHONE/IN WRITING)","THREATS, HARASSMENT","THREATS, HARASSMENT","",3506.95011561122,2016-07-22 04:04:01,2016-07-22
"735",48114,1779470,16000241680,2016241680,"041","HARASSMENT, THREATS","THREATS, HARASSMENT","THREATS, HARASSMENT","07/06/2016 05:59:23 PM","47XX BLOCK OF ROOSEVELT WY NE","U","U2","5200.5000",-122.31741,47.66403,"(47.66403, -122.31741)","HARAS - NO BIAS, THREATS OR MALICIOUSNESS","THREATS, HARASSMENT","THREATS, HARASSMENT","07/06/2016 04:37:48 PM",1072.43674086523,2016-07-06 17:59:23,2016-07-07
"736",48126,1902154,16000457727,2016457727,"041","HARASSMENT, THREATS","THREATS, HARASSMENT","THREATS, HARASSMENT","12/21/2016 10:03:21 PM","68XX BLOCK OF 32 AV NE","U","U3","3800.1006",-122.29306,47.678505,"(47.678505, -122.29306)","TRU - THREATS","THREATS, HARASSMENT","THREATS, HARASSMENT","12/21/2016 06:55:01 PM",2790.2461698291,2016-12-21 22:03:21,2016-12-22
"737",48179,1747458,16000186650,2016186650,"220","CRISIS COMPLAINT - GENERAL","CRISIS CALL","BEHAVIORAL HEALTH","05/27/2016 07:28:19 PM","30XX BLOCK OF WEBSTER POINT RD NE","U","U3","4100.6020",-122.27754,47.64912,"(47.64912, -122.27754)","OVERDOSE - DRUG RELATED CASUALTY","PERSON DOWN/INJURY","CASUALTIES","05/27/2016 05:29:06 PM",2519.90478221886,2016-05-27 19:28:19,2016-05-28
"738",48208,1994373,17000162708,2017162708,"220","CRISIS COMPLAINT - GENERAL","CRISIS CALL","BEHAVIORAL HEALTH","05/09/2017 05:29:36 PM","52XX BLOCK OF 22 AV NE","U","U1","4302.1",-122.304405,47.667004,"(47.667004, -122.304405)","OVERDOSE - DRUG RELATED CASUALTY","PERSON DOWN/INJURY","CASUALTIES","05/09/2017 01:37:52 PM",1281.92252912931,2017-05-09 17:29:36,2017-05-10
"739",48210,1779615,16000242217,2016242217,"350","HAZARDS","HAZARDS","HAZARDS","07/06/2016 09:48:34 PM","15 AV NE / NE 42 ST","U","U2","5301.4000",-122.31207,47.658302,"(47.658302, -122.31207)","HAZ - POTENTIAL THRT TO PHYS SAFETY (NO HAZMAT)","HAZARDS","HAZARDS","",320.589660408362,2016-07-06 21:48:34,2016-07-07
"740",48285,1747391,16000186519,2016186519,"350","HAZARDS","HAZARDS","HAZARDS","05/27/2016 05:32:34 PM","MONTLAKE BV NE / NE PACIFIC ST","U","U3","5302.2018",-122.30459,47.648994,"(47.648994, -122.30459)","HAZ - POTENTIAL THRT TO PHYS SAFETY (NO HAZMAT)","HAZARDS","HAZARDS","",861.874216742478,2016-05-27 17:32:34,2016-05-28
"741",48287,1924989,17000031757,201731757,"041","HARASSMENT, THREATS","THREATS, HARASSMENT","THREATS, HARASSMENT","01/26/2017 07:16:49 PM","50XX BLOCK OF ROOSEVELT WY NE","U","U1","4500.1009",-122.3174,47.665688,"(47.665688, -122.3174)","THREATS (INCLS IN-PERSON/BY PHONE/IN WRITING)","THREATS, HARASSMENT","THREATS, HARASSMENT","01/26/2017 03:32:01 PM",1229.78206620259,2017-01-26 19:16:49,2017-01-27
"742",48303,1949118,17000078416,201778416,"220","CRISIS COMPLAINT - GENERAL","CRISIS CALL","BEHAVIORAL HEALTH","03/04/2017 07:26:33 PM","56XX BLOCK OF UNIVERSITY WY NE","U","U1","4400.202",-122.31303,47.670216,"(47.670216, -122.31303)","CRISIS - PERSON IN BEHAVIORAL/EMOTIONAL CRISIS","BEHAVIORAL HEALTH","CRISIS CALL","03/04/2017 04:57:38 PM",1602.67210487326,2017-03-04 19:26:33,2017-03-05
"743",48304,1892770,16000439900,2016439900,"030","ARMED ROBBERY","GUN CALLS","ROBBERY","12/07/2016 02:47:27 PM","15 AV NE / NE 43 ST","U","U2","5301.3000",-122.312035,47.65978,"(47.65978, -122.312035)","ROBBERY - IP/JO (INCLUDES STRONG ARM)","ROBBERY","ROBBERY","12/07/2016 11:00:54 AM",461.401351808126,2016-12-07 14:47:27,2016-12-07
"744",48361,1810842,16000295928,2016295928,"220","CRISIS COMPLAINT - GENERAL","CRISIS CALL","BEHAVIORAL HEALTH","08/16/2016 10:24:43 AM","8XX BLOCK OF NE 65 ST","U","U1","3600.1021",-122.31902,47.675842,"(47.675842, -122.31902)","ASLT - IP/JO - WITH OR W/O WPNS (NO SHOOTINGS)","ASSAULTS","ASSAULTS","08/16/2016 08:17:57 AM",2319.08490824263,2016-08-16 10:24:43,2016-08-16
"745",48372,1970457,17000118638,2017118638,"220","CRISIS COMPLAINT - GENERAL","CRISIS CALL","BEHAVIORAL HEALTH","04/05/2017 08:29:06 AM","12 AV NE / NE 65 ST","U","U1","2600.3013",-122.31566,47.675816,"(47.675816, -122.31566)","CRISIS - PERSON IN BEHAVIORAL/EMOTIONAL CRISIS","BEHAVIORAL HEALTH","CRISIS CALL","",2251.27058537476,2017-04-05 08:29:06,2017-04-05
"746",48378,1791293,16000261870,2016261870,"041","HARASSMENT, THREATS","THREATS, HARASSMENT","THREATS, HARASSMENT","07/22/2016 03:37:46 AM","52XX BLOCK OF BROOKLYN AV NE","U","U1","4400.4001",-122.31417,47.6675,"(47.6675, -122.31417)","THREATS (INCLS IN-PERSON/BY PHONE/IN WRITING)","THREATS, HARASSMENT","THREATS, HARASSMENT","07/22/2016 02:32:16 AM",1325.85536809536,2016-07-22 03:37:46,2016-07-22
"747",48395,1827668,16000323346,2016323346,"220","CRISIS COMPLAINT - GENERAL","CRISIS CALL","BEHAVIORAL HEALTH","09/06/2016 05:38:24 PM","NE 55 ST / 25 AV NE","U","U3","4301.3017",-122.30062,47.66852,"(47.66852, -122.30062)","DISTURBANCE, MISCELLANEOUS/OTHER","DISTURBANCES","DISTURBANCES","09/06/2016 03:03:59 PM",1543.56487920368,2016-09-06 17:38:24,2016-09-07
"748",48428,1747646,16000187129,2016187129,"242","FIGHT DISTURBANCE","DISTURBANCES","DISTURBANCES","05/28/2016 12:01:00 AM","NE 45 ST / 15 AV NE","U","U2","5301.2010",-122.312,47.66126,"(47.66126, -122.312)","FIGHT - IP - PHYSICAL (NO WEAPONS)","DISTURBANCES","DISTURBANCES","",614.236940217108,2016-05-28 00:01:00,2016-05-28
"749",48533,1827884,16000323754,2016323754,"220","CRISIS COMPLAINT - GENERAL","CRISIS CALL","BEHAVIORAL HEALTH","09/07/2016 01:39:27 AM","43XX BLOCK OF ROOSEVELT WY NE","U","U2","5301.3004",-122.317726,47.66058,"(47.66058, -122.317726)","CRISIS - PERSON IN BEHAVIORAL/EMOTIONAL CRISIS","BEHAVIORAL HEALTH","CRISIS CALL","09/06/2016 11:27:34 PM",800.699807898046,2016-09-07 01:39:27,2016-09-07
"750",48692,1883141,16000421655,2016421655,"220","CRISIS COMPLAINT - GENERAL","CRISIS CALL","BEHAVIORAL HEALTH","11/22/2016 07:11:11 PM","62XX BLOCK OF ROOSEVELT WY NE","U","U1","3600.1026",-122.31736,47.673744,"(47.673744, -122.31736)","CRISIS - PERSON IN BEHAVIORAL/EMOTIONAL CRISIS","BEHAVIORAL HEALTH","CRISIS CALL","11/22/2016 11:52:28 AM",2059.27773082016,2016-11-22 19:11:11,2016-11-23
"751",48784,2114653,17000381838,2017381838,"350","HAZARDS","HAZARDS","HAZARDS","10/14/2017 04:45:23 AM","NE BLAKELEY ST / 25 AV NE","U","U1","4302.2006",-122.300606,47.666267,"(47.666267, -122.300606)","MISSING - ADULT","PERSONS - LOST, FOUND, MISSING","PERSONS - LOST, FOUND, MISSING","10/14/2017 04:01:45 AM",1322.63748539703,2017-10-14 04:45:23,2017-10-14
"752",48896,1892368,16000439288,2016439288,"220","CRISIS COMPLAINT - GENERAL","CRISIS CALL","BEHAVIORAL HEALTH","12/06/2016 09:53:49 PM","7 AV NE / NE 45 ST","U","U2","5200.1000",-122.32073,47.661316,"(47.661316, -122.32073)","CRISIS - PERSON IN BEHAVIORAL/EMOTIONAL CRISIS","BEHAVIORAL HEALTH","CRISIS CALL","12/06/2016 08:01:36 PM",1030.01436970243,2016-12-06 21:53:49,2016-12-07
"753",48927,1771764,16000228984,2016228984,"242","FIGHT DISTURBANCE","DISTURBANCES","DISTURBANCES","06/27/2016 07:26:32 PM","47XX BLOCK OF UNIVERSITY WY NE","U","U2","5301.2002",-122.31309,47.663998,"(47.663998, -122.31309)","ASLT - IP/JO - WITH OR W/O WPNS (NO SHOOTINGS)","ASSAULTS","ASSAULTS","",929.234922041086,2016-06-27 19:26:32,2016-06-28
"754",49006,1827914,16000323585,2016323585,"041","HARASSMENT, THREATS","THREATS, HARASSMENT","THREATS, HARASSMENT","09/07/2016 03:04:03 AM","47XX BLOCK OF 12 AV NE","U","U2","5301.2004",-122.315254,47.664013,"(47.664013, -122.315254)","THREATS (INCLS IN-PERSON/BY PHONE/IN WRITING)","THREATS, HARASSMENT","THREATS, HARASSMENT","09/07/2016 12:34:59 AM",990.218839131712,2016-09-07 03:04:03,2016-09-07
"755",49054,1949387,17000078606,201778606,"220","CRISIS COMPLAINT - GENERAL","CRISIS CALL","BEHAVIORAL HEALTH","03/05/2017 04:49:49 AM","75XX BLOCK OF 39 AV NE","U","U3","2400.2009",-122.286285,47.683937,"(47.683937, -122.286285)","CRISIS - PERSON IN BEHAVIORAL/EMOTIONAL CRISIS","BEHAVIORAL HEALTH","CRISIS CALL","03/05/2017 03:40:02 AM",3561.98610106541,2017-03-05 04:49:49,2017-03-05
"756",49109,1892507,16000439487,2016439487,"350","HAZARDS","HAZARDS","HAZARDS","12/07/2016 02:42:43 AM","15 AV NE / NE 65 ST","U","U1","2600.3016",-122.31193,47.67578,"(47.67578, -122.31193)","TRAFFIC - BO SIGNALS AND DOWN SIGNS","TRAFFIC RELATED CALLS","TRAFFIC RELATED CALLS","12/07/2016 12:05:21 AM",2206.77587655162,2016-12-07 02:42:43,2016-12-07
"757",49245,1836752,16000339608,2016339608,"350","HAZARDS","HAZARDS","HAZARDS","09/19/2016 07:36:30 AM","NE 45 ST / MARY GATES MEMORIAL DR NE","U","U3","4301.1013",-122.29287,47.66124,"(47.66124, -122.29287)","HAZ - POTENTIAL THRT TO PHYS SAFETY (NO HAZMAT)","HAZARDS","HAZARDS","",1378.36436997833,2016-09-19 07:36:30,2016-09-19
"758",49282,1771482,16000221495,2016221495,"030","ARMED ROBBERY","GUN CALLS","ROBBERY","06/22/2016 02:35:11 AM","45XX BLOCK OF 19 AV NE","U","U1","5301.1009",-122.30723,47.662155,"(47.662155, -122.30723)","ROBBERY - IP/JO (INCLUDES STRONG ARM)","ROBBERY","ROBBERY","06/22/2016 12:54:38 AM",705.258645823833,2016-06-22 02:35:11,2016-06-22
"759",49289,1779988,16000242653,2016242653,"220","CRISIS COMPLAINT - GENERAL","CRISIS CALL","BEHAVIORAL HEALTH","07/07/2016 10:13:00 AM","47XX BLOCK OF 12 AV NE","U","U2","5301.2004",-122.315254,47.664013,"(47.664013, -122.315254)","CRISIS - PERSON IN BEHAVIORAL/EMOTIONAL CRISIS","BEHAVIORAL HEALTH","CRISIS CALL","07/07/2016 08:07:12 AM",990.218839131712,2016-07-07 10:13:00,2016-07-07
"760",49313,1643043,16000002379,20162379,"242","FIGHT DISTURBANCE","DISTURBANCES","DISTURBANCES","01/03/2016 05:53:01 AM","47XX BLOCK OF UNIVERSITY WY NE","U","U2","5301.2002",-122.31309,47.663998,"(47.663998, -122.31309)","FIGHT - IP - PHYSICAL (NO WEAPONS)","DISTURBANCES","DISTURBANCES","",929.234922041086,2016-01-03 05:53:01,2016-01-03
"761",49324,1643429,16000003091,20163091,"242","FIGHT DISTURBANCE","DISTURBANCES","DISTURBANCES","01/03/2016 11:13:20 PM","13XX BLOCK OF NE RAVENNA BV","U","U1","4400.2020",-122.31361,47.67112,"(47.67112, -122.31361)","FIGHT - VERBAL/ORAL (NO WEAPONS)","DISTURBANCES","DISTURBANCES","",1709.20678804461,2016-01-03 23:13:20,2016-01-04
"762",49325,1643433,16000003035,20163035,"220","CRISIS COMPLAINT - GENERAL","CRISIS CALL","BEHAVIORAL HEALTH","01/03/2016 10:50:06 PM","8 AV NE / NE 70 ST","U","U1","3600.1012",-122.31997,47.679493,"(47.679493, -122.31997)","UNKNOWN - COMPLAINT OF UNKNOWN NATURE","SUSPICIOUS CIRCUMSTANCES","SUSPICIOUS CIRCUMSTANCES","01/03/2016 09:15:54 PM",2727.83460512413,2016-01-03 22:50:06,2016-01-04
"763",49330,1643537,16000003222,20163222,"242","FIGHT DISTURBANCE","DISTURBANCES","DISTURBANCES","01/04/2016 03:21:55 AM","45XX BLOCK OF 12 AV NE","U","U2","5301.2007",-122.31539,47.662197,"(47.662197, -122.31539)","ASLT - IP/JO - WITH OR W/O WPNS (NO SHOOTINGS)","ASSAULTS","ASSAULTS","01/04/2016 02:56:26 AM",818.824590825285,2016-01-04 03:21:55,2016-01-04
"764",49332,1643576,16000003320,20163320,"350","HAZARDS","HAZARDS","HAZARDS","01/04/2016 07:20:15 AM","52XX BLOCK OF 36 AV NE","U","U3","4200.4026",-122.28907,47.6676,"(47.6676, -122.28907)","HAZ - POTENTIAL THRT TO PHYS SAFETY (NO HAZMAT)","HAZARDS","HAZARDS","",2004.54503515859,2016-01-04 07:20:15,2016-01-04
"765",49334,1643617,16000003288,20163288,"030","ARMED ROBBERY","GUN CALLS","ROBBERY","01/04/2016 09:36:33 AM","I5 NB / NE 65 ST","U","U1","3600.1019",-122.320435,47.675854,"(47.675854, -122.320435)","ROBBERY (INCLUDES STRONG ARM)","ROBBERY","ROBBERY","01/04/2016 06:15:11 AM",2355.27328320448,2016-01-04 09:36:33,2016-01-04
"766",49349,2114776,17000381987,2017381987,"030","ARMED ROBBERY","GUN CALLS","ROBBERY","10/14/2017 11:42:49 AM","15 AV NE / NE 42 ST","U","U2","5301.4",-122.31207,47.658302,"(47.658302, -122.31207)","ROBBERY - IP/JO (INCLUDES STRONG ARM)","ROBBERY","ROBBERY","10/14/2017 08:04:21 AM",320.589660408362,2017-10-14 11:42:49,2017-10-14
"767",49393,1645716,16000007025,20167025,"041","HARASSMENT, THREATS","THREATS, HARASSMENT","THREATS, HARASSMENT","01/07/2016 07:07:09 AM","NE 40 ST / 7 AV NE","U","U2","5200.2011",-122.320854,47.65589,"(47.65589, -122.320854)","THREATS (INCLS IN-PERSON/BY PHONE/IN WRITING)","THREATS, HARASSMENT","THREATS, HARASSMENT","",853.00222043031,2016-01-07 07:07:09,2016-01-07
"768",49421,1883400,16000422821,2016422821,"041","HARASSMENT, THREATS","THREATS, HARASSMENT","THREATS, HARASSMENT","11/23/2016 03:30:49 AM","NE 55 ST / UNIVERSITY WY NE","U","U1","4400.2028",-122.31302,47.668545,"(47.668545, -122.31302)","THREATS (INCLS IN-PERSON/BY PHONE/IN WRITING)","THREATS, HARASSMENT","THREATS, HARASSMENT","",1419.63730229997,2016-11-23 03:30:49,2016-11-23
"769",49443,1647161,16000009573,20169573,"242","FIGHT DISTURBANCE","DISTURBANCES","DISTURBANCES","01/09/2016 01:28:16 AM","45XX BLOCK OF UNIVERSITY WY NE","U","U2","5301.2010",-122.31312,47.66218,"(47.66218, -122.31312)","FIGHT - IP - PHYSICAL (NO WEAPONS)","DISTURBANCES","DISTURBANCES","",738.963514898043,2016-01-09 01:28:16,2016-01-09
"770",49450,1647296,16000009772,20169772,"350","HAZARDS","HAZARDS","HAZARDS","01/09/2016 08:14:24 AM","NE 56 ST / UNIVERSITY WY NE","U","U1","4400.2028",-122.31303,47.66944,"(47.66944, -122.31303)","HAZ - POTENTIAL THRT TO PHYS SAFETY (NO HAZMAT)","HAZARDS","HAZARDS","",1517.64972687433,2016-01-09 08:14:24,2016-01-09
"771",49451,1647311,16000009726,20169726,"030","ARMED ROBBERY","GUN CALLS","ROBBERY","01/09/2016 08:50:21 AM","50XX BLOCK OF UNIVERSITY WY NE","U","U1","4400.4008",-122.313065,47.66567,"(47.66567, -122.313065)","ROBBERY - IP/JO (INCLUDES STRONG ARM)","ROBBERY","ROBBERY","01/09/2016 05:40:09 AM",1107.99164074666,2016-01-09 08:50:21,2016-01-09
"772",49458,1850802,16000364782,2016364782,"242","FIGHT DISTURBANCE","DISTURBANCES","DISTURBANCES","10/08/2016 07:00:57 AM","RAVENNA AV NE / NE 55 ST","U","U1","4301.3012",-122.303894,47.668697,"(47.668697, -122.303894)","FIGHT - VERBAL/ORAL (NO WEAPONS)","DISTURBANCES","DISTURBANCES","",1473.15951800738,2016-10-08 07:00:57,2016-10-08
"773",49463,1994454,17000162764,2017162764,"220","CRISIS COMPLAINT - GENERAL","CRISIS CALL","BEHAVIORAL HEALTH","05/09/2017 07:15:10 PM","47XX BLOCK OF 24 AV NE","U","U1","4302.2007",-122.301735,47.66358,"(47.66358, -122.301735)","DOWN - CHECK FOR PERSON DOWN","PERSON DOWN/INJURY","CASUALTIES","05/09/2017 02:25:36 PM",1024.92141985556,2017-05-09 19:15:10,2017-05-10
"774",49469,1647723,16000010588,201610588,"242","FIGHT DISTURBANCE","DISTURBANCES","DISTURBANCES","01/09/2016 11:59:29 PM","42XX BLOCK OF UNIVERSITY WY NE","U","U2","5301.3008",-122.31319,47.659054,"(47.659054, -122.31319)","FIGHT - IP - PHYSICAL (NO WEAPONS)","DISTURBANCES","DISTURBANCES","",438.325335850633,2016-01-09 23:59:29,2016-01-10
"775",49477,1647926,16000010793,201610793,"220","CRISIS COMPLAINT - GENERAL","CRISIS CALL","BEHAVIORAL HEALTH","01/10/2016 07:54:13 AM","47XX BLOCK OF BROOKLYN AV NE","U","U2","5301.2002",-122.314224,47.664005,"(47.664005, -122.314224)","DISTURBANCE, MISCELLANEOUS/OTHER","DISTURBANCES","DISTURBANCES","01/10/2016 05:20:07 AM",958.152960945758,2016-01-10 07:54:13,2016-01-10
"776",49494,1648293,16000011450,201611450,"220","CRISIS COMPLAINT - GENERAL","CRISIS CALL","BEHAVIORAL HEALTH","01/10/2016 09:15:52 PM","ROOSEVELT WY NE / NE 53 ST","U","U1","4400.4004",-122.31738,47.667107,"(47.667107, -122.31738)","CRISIS - PERSON IN BEHAVIORAL/EMOTIONAL CRISIS","BEHAVIORAL HEALTH","CRISIS CALL","01/10/2016 08:19:31 PM",1369.4334907043,2016-01-10 21:15:52,2016-01-11
"777",49508,1648706,16000012248,201612248,"350","HAZARDS","HAZARDS","HAZARDS","01/11/2016 01:54:15 PM","NE 41 ST / UNIVERSITY WY NE","U","U2","5301.4000",-122.31325,47.656834,"(47.656834, -122.31325)","HAZ - POTENTIAL THRT TO PHYS SAFETY (NO HAZMAT)","HAZARDS","HAZARDS","",296.567307084639,2016-01-11 13:54:15,2016-01-11
"778",49511,1648783,16000012302,201612302,"350","HAZARDS","HAZARDS","HAZARDS","01/11/2016 03:31:35 PM","NE 47 ST / 17 AV NE","U","U2","5301.1005",-122.309685,47.663055,"(47.663055, -122.309685)","TRAFFIC - BO SIGNALS AND DOWN SIGNS","TRAFFIC RELATED CALLS","TRAFFIC RELATED CALLS","",784.524057458698,2016-01-11 15:31:35,2016-01-11
"779",49512,1648841,16000012160,201612160,"220","CRISIS COMPLAINT - GENERAL","CRISIS CALL","BEHAVIORAL HEALTH","01/11/2016 04:54:30 PM","50XX BLOCK OF UNIVERSITY WY NE","U","U1","4400.4008",-122.313065,47.66567,"(47.66567, -122.313065)","MISSING - CHILD","PERSONS - LOST, FOUND, MISSING","PERSONS - LOST, FOUND, MISSING","01/11/2016 01:05:27 PM",1107.99164074666,2016-01-11 16:54:30,2016-01-12
"780",49517,1649138,16000012889,201612889,"242","FIGHT DISTURBANCE","DISTURBANCES","DISTURBANCES","01/12/2016 01:09:24 AM","42XX BLOCK OF UNIVERSITY WY NE","U","U2","5301.3008",-122.31319,47.659054,"(47.659054, -122.31319)","WEAPN-IP/JO-GUN,DEADLY WPN (NO THRT/ASLT/DIST)","WEAPONS CALLS","WEAPONS CALLS","",438.325335850633,2016-01-12 01:09:24,2016-01-12
"781",49564,1650524,16000015475,201615475,"242","FIGHT DISTURBANCE","DISTURBANCES","DISTURBANCES","01/14/2016 02:27:51 AM","42XX BLOCK OF UNIVERSITY WY NE","U","U2","5301.3008",-122.31319,47.659054,"(47.659054, -122.31319)","FIGHT - VERBAL/ORAL (NO WEAPONS)","DISTURBANCES","DISTURBANCES","",438.325335850633,2016-01-14 02:27:51,2016-01-14
"782",49605,1780111,16000242809,2016242809,"220","CRISIS COMPLAINT - GENERAL","CRISIS CALL","BEHAVIORAL HEALTH","07/07/2016 12:56:57 PM","NE 43 ST / 12 AV NE","U","U2","5301.3002",-122.31548,47.65982,"(47.65982, -122.31548)","HAZ - POTENTIAL THRT TO PHYS SAFETY (NO HAZMAT)","HAZARDS","HAZARDS","",618.199579833197,2016-07-07 12:56:57,2016-07-07
"783",49683,1653597,16000020625,201620625,"220","CRISIS COMPLAINT - GENERAL","CRISIS CALL","BEHAVIORAL HEALTH","01/18/2016 12:28:58 PM","47XX BLOCK OF 12 AV NE","U","U2","5301.2004",-122.315254,47.664013,"(47.664013, -122.315254)","CRISIS - PERSON IN BEHAVIORAL/EMOTIONAL CRISIS","BEHAVIORAL HEALTH","CRISIS CALL","",990.218839131712,2016-01-18 12:28:58,2016-01-18
"784",49685,1653669,16000020823,201620823,"350","HAZARDS","HAZARDS","HAZARDS","01/18/2016 02:51:33 PM","20 AV NE / NE 58 ST","U","U1","4301.3012",-122.3065,47.6707,"(47.6707, -122.3065)","HAZ - POTENTIAL THRT TO PHYS SAFETY (NO HAZMAT)","HAZARDS","HAZARDS","",1649.86091300544,2016-01-18 14:51:33,2016-01-18
"785",49729,1655090,16000023193,201623193,"350","HAZARDS","HAZARDS","HAZARDS","01/20/2016 02:02:53 PM","40XX BLOCK OF NE 68 ST","U","U3","3900.1024",-122.28429,47.6776,"(47.6776, -122.28429)","WIRES DOWN (PHONE, ELECTRICAL,ETC.)","HAZARDS","HAZARDS","",3058.17883890813,2016-01-20 14:02:53,2016-01-20
"786",49733,1655189,16000023394,201623394,"041","HARASSMENT, THREATS","THREATS, HARASSMENT","THREATS, HARASSMENT","01/20/2016 04:24:35 PM","NE 64 ST / ROOSEVELT WY NE","U","U1","4400.2003",-122.31737,47.674976,"(47.674976, -122.31737)","ASLT - WITH OR W/O WEAPONS (NO SHOOTINGS)","ASSAULTS","ASSAULTS","",2191.05967844583,2016-01-20 16:24:35,2016-01-21
"787",49772,1771898,16000228941,2016228941,"041","HARASSMENT, THREATS","THREATS, HARASSMENT","THREATS, HARASSMENT","06/27/2016 10:56:48 PM","56XX BLOCK OF BROOKLYN AV NE","U","U1","4400.2020",-122.31416,47.670345,"(47.670345, -122.31416)","BIAS -RACIAL, POLITICAL, SEXUAL MOTIVATION","SUSPICIOUS CIRCUMSTANCES","SUSPICIOUS CIRCUMSTANCES","06/27/2016 08:00:06 PM",1632.88503740822,2016-06-27 22:56:48,2016-06-28
"788",49787,1657143,16000026760,201626760,"220","CRISIS COMPLAINT - GENERAL","CRISIS CALL","BEHAVIORAL HEALTH","01/23/2016 03:26:58 AM","NE CAMPUS PY / BROOKLYN AV NE","U","U2","5302.1002",-122.31442,47.656223,"(47.656223, -122.31442)","FOUND - PERSON","PERSONS - LOST, FOUND, MISSING","PERSONS - LOST, FOUND, MISSING","",370.420834762338,2016-01-23 03:26:58,2016-01-23
"789",49811,1657822,16000027818,201627818,"242","FIGHT DISTURBANCE","DISTURBANCES","DISTURBANCES","01/24/2016 01:47:41 AM","42XX BLOCK OF 12 AV NE","U","U2","5301.3007",-122.3155,47.659084,"(47.659084, -122.3155)","FIGHT - IP - PHYSICAL (NO WEAPONS)","DISTURBANCES","DISTURBANCES","",566.313461259431,2016-01-24 01:47:41,2016-01-24
"790",49819,2005511,17000183247,2017183247,"041","HARASSMENT, THREATS","THREATS, HARASSMENT","THREATS, HARASSMENT","05/24/2017 12:36:55 PM","8XX BLOCK OF NE 66 ST","U","U1","3600.1021",-122.31874,47.676567,"(47.676567, -122.31874)","HARAS - NO BIAS, THREATS OR MALICIOUSNESS","THREATS, HARASSMENT","THREATS, HARASSMENT","",2389.70235393833,2017-05-24 12:36:55,2017-05-24
"791",49820,1780994,16000244156,2016244156,"220","CRISIS COMPLAINT - GENERAL","CRISIS CALL","BEHAVIORAL HEALTH","07/08/2016 01:20:58 PM","MONTLAKE BV NE / 25 AV NE","U","U3","5302.3038",-122.30114,47.65898,"(47.65898, -122.30114)","DISTURBANCE, MISCELLANEOUS/OTHER","DISTURBANCES","DISTURBANCES","",710.031289553402,2016-07-08 13:20:58,2016-07-08
"792",49879,1970583,17000118859,2017118859,"220","CRISIS COMPLAINT - GENERAL","CRISIS CALL","BEHAVIORAL HEALTH","04/05/2017 12:13:06 PM","NE 50 ST / 16 AV NE","U","U2","4400.3006",-122.31081,47.664883,"(47.664883, -122.31081)","CRISIS - PERSON IN BEHAVIORAL/EMOTIONAL CRISIS","BEHAVIORAL HEALTH","CRISIS CALL","",992.534567701538,2017-04-05 12:13:06,2017-04-05
"793",49885,1851305,16000365497,2016365497,"030","ARMED ROBBERY","GUN CALLS","ROBBERY","10/08/2016 10:16:22 PM","47XX BLOCK OF BROOKLYN AV NE","U","U2","5301.2002",-122.313896,47.66429,"(47.66429, -122.313896)","ROBBERY (INCLUDES STRONG ARM)","ROBBERY","ROBBERY","10/08/2016 08:16:48 PM",979.07507071689,2016-10-08 22:16:22,2016-10-09
"794",49889,1660378,16000032210,201632210,"220","CRISIS COMPLAINT - GENERAL","CRISIS CALL","BEHAVIORAL HEALTH","01/27/2016 07:15:05 PM","NE 64 ST / 9 AV NE","U","U1","3600.1020",-122.3187,47.674984,"(47.674984, -122.3187)","DISTURBANCE, MISCELLANEOUS/OTHER","DISTURBANCES","DISTURBANCES","01/27/2016 05:52:32 PM",2220.93771622943,2016-01-27 19:15:05,2016-01-28
"795",49897,1660709,16000032791,201632791,"350","HAZARDS","HAZARDS","HAZARDS","01/28/2016 09:14:37 AM","MONTLAKE BV NE / 25 AV NE","U","U3","5302.3038",-122.30114,47.65898,"(47.65898, -122.30114)","HAZ - POTENTIAL THRT TO PHYS SAFETY (NO HAZMAT)","HAZARDS","HAZARDS","",710.031289553402,2016-01-28 09:14:37,2016-01-28
"796",49902,1902397,16000458276,2016458276,"220","CRISIS COMPLAINT - GENERAL","CRISIS CALL","BEHAVIORAL HEALTH","12/22/2016 10:03:19 AM","UNIVERSITY WY NE / NE 42 ST","U","U2","5301.3008",-122.31321,47.658314,"(47.658314, -122.31321)","HAZ - POTENTIAL THRT TO PHYS SAFETY (NO HAZMAT)","HAZARDS","HAZARDS","12/22/2016 09:01:08 AM",379.289152249279,2016-12-22 10:03:19,2016-12-22
"797",49904,1883449,16000422801,2016422801,"350","HAZARDS","HAZARDS","HAZARDS","11/23/2016 05:29:08 AM","NE CAMPUS PY / BROOKLYN AV NE","U","U2","5302.1012",-122.31443,47.656,"(47.656, -122.31443)","TREES DOWN, OBSTRUCTING PUBLIC PROP (NO HAZ)","TREES DOWN","TREES DOWN","",370.342105264999,2016-11-23 05:29:08,2016-11-23
"798",49996,1663697,16000037855,201637855,"350","HAZARDS","HAZARDS","HAZARDS","02/01/2016 11:12:51 AM","16 AV NE / NE 52 ST","U","U1","4400.3006",-122.310776,47.666416,"(47.666416, -122.310776)","HAZ - POTENTIAL THRT TO PHYS SAFETY (NO HAZMAT)","HAZARDS","HAZARDS","",1162.04897241787,2016-02-01 11:12:51,2016-02-01
"799",49999,2126985,17000404135,2017404135,"041","HARASSMENT, THREATS","THREATS, HARASSMENT","THREATS, HARASSMENT","10/31/2017 04:26:56 PM","42XX BLOCK OF 55 AV NE","U","U3","4100.3003",-122.26933,47.659042,"(47.659042, -122.26933)","THREATS (INCLS IN-PERSON/BY PHONE/IN WRITING)","THREATS, HARASSMENT","THREATS, HARASSMENT","10/31/2017 01:28:37 PM",3036.38274630455,2017-10-31 16:26:56,2017-10-31
"800",50010,1664124,16000038643,201638643,"242","FIGHT DISTURBANCE","DISTURBANCES","DISTURBANCES","02/02/2016 12:18:30 AM","UNIVERSITY WY NE / NE CAMPUS PY","U","U2","5302.1009",-122.31326,47.656216,"(47.656216, -122.31326)","FIGHT - VERBAL/ORAL (NO WEAPONS)","DISTURBANCES","DISTURBANCES","",283.470141601472,2016-02-02 00:18:30,2016-02-02
"801",50021,1664692,16000039826,201639826,"242","FIGHT DISTURBANCE","DISTURBANCES","DISTURBANCES","02/02/2016 08:47:51 PM","45XX BLOCK OF UNIVERSITY WY NE","U","U2","5301.2010",-122.31312,47.66218,"(47.66218, -122.31312)","FIGHT - IP - PHYSICAL (NO WEAPONS)","DISTURBANCES","DISTURBANCES","",738.963514898043,2016-02-02 20:47:51,2016-02-03
"802",50022,1813471,16000300760,2016300760,"041","HARASSMENT, THREATS","THREATS, HARASSMENT","THREATS, HARASSMENT","08/19/2016 11:59:22 PM","ROOSEVELT WY NE / NE 42 ST","U","U2","5301.4004",-122.31778,47.65837,"(47.65837, -122.31778)","THREATS (INCLS IN-PERSON/BY PHONE/IN WRITING)","THREATS, HARASSMENT","THREATS, HARASSMENT","08/19/2016 10:16:10 PM",675.495821475095,2016-08-19 23:59:22,2016-08-20
"803",50028,1664930,16000040130,201640130,"220","CRISIS COMPLAINT - GENERAL","CRISIS CALL","BEHAVIORAL HEALTH","02/03/2016 05:46:35 AM","UNIVERSITY WY NE / NE 50 ST","U","U1","4400.4009",-122.31307,47.664898,"(47.664898, -122.31307)","THREATS (INCLS IN-PERSON/BY PHONE/IN WRITING)","THREATS, HARASSMENT","THREATS, HARASSMENT","",1025.0108407033,2016-02-03 05:46:35,2016-02-03
"804",50047,1665546,16000041256,201641256,"350","HAZARDS","HAZARDS","HAZARDS","02/03/2016 11:53:50 PM","NE 45 ST / 7 AV NE","U","U2","5200.1000",-122.32073,47.661316,"(47.661316, -122.32073)","WIRES DOWN (PHONE, ELECTRICAL,ETC.)","HAZARDS","HAZARDS","",1030.01436970243,2016-02-03 23:53:50,2016-02-04
"805",50049,1665605,16000041360,201641360,"242","FIGHT DISTURBANCE","DISTURBANCES","DISTURBANCES","02/04/2016 01:53:55 AM","14XX BLOCK OF NE 42 ST","U","U2","5301.3009",-122.31264,47.65831,"(47.65831, -122.31264)","FIGHT - IP - PHYSICAL (NO WEAPONS)","DISTURBANCES","DISTURBANCES","",348.711033535852,2016-02-04 01:53:55,2016-02-04
"806",50054,1665722,16000041576,201641576,"350","HAZARDS","HAZARDS","HAZARDS","02/04/2016 08:31:07 AM","ROOSEVELT WY NE / NE 55 ST","U","U1","4400.2027",-122.31737,47.668575,"(47.668575, -122.31737)","HAZ - POTENTIAL THRT TO PHYS SAFETY (NO HAZMAT)","HAZARDS","HAZARDS","",1517.96283061503,2016-02-04 08:31:07,2016-02-04
"807",50082,1666371,16000042698,201642698,"242","FIGHT DISTURBANCE","DISTURBANCES","DISTURBANCES","02/05/2016 01:42:39 AM","20 AV NE / NE 45 ST","U","U1","5302.3013",-122.306526,47.661255,"(47.661255, -122.306526)","FIGHT - IP - PHYSICAL (NO WEAPONS)","DISTURBANCES","DISTURBANCES","",625.521753811904,2016-02-05 01:42:39,2016-02-05
"808",50120,1780458,16000243605,2016243605,"350","HAZARDS","HAZARDS","HAZARDS","07/07/2016 09:09:31 PM","41XX BLOCK OF UNIVERSITY WY NE","U","U2","5301.4000",-122.313225,47.657574,"(47.657574, -122.313225)","FIREWORKS - NUISANCE (NO HAZARD)","MISCELLANEOUS MISDEMEANORS","MISCELLANEOUS MISDEMEANORS","",330.036787270645,2016-07-07 21:09:31,2016-07-08
"809",50148,1883980,16000423740,2016423740,"041","HARASSMENT, THREATS","THREATS, HARASSMENT","THREATS, HARASSMENT","11/23/2016 11:38:18 PM","56XX BLOCK OF 15 AV NE","U","U1","4400.102",-122.31189,47.670082,"(47.670082, -122.31189)","FRAUD - FORGERY,BUNCO, SCAMS, ID THEFT, ETC","FRAUD CALLS","FRAUD CALLS","11/23/2016 09:12:27 PM",1575.94712506895,2016-11-23 23:38:18,2016-11-24
"810",50159,1892989,16000440450,2016440450,"220","CRISIS COMPLAINT - GENERAL","CRISIS CALL","BEHAVIORAL HEALTH","12/07/2016 09:36:57 PM","43XX BLOCK OF UNIVERSITY WY NE","U","U2","5301.3001",-122.31315,47.660534,"(47.660534, -122.31315)","ROBBERY - IP/JO (INCLUDES STRONG ARM)","ROBBERY","ROBBERY","12/07/2016 06:50:49 PM",573.843522369168,2016-12-07 21:36:57,2016-12-08
"811",50169,1739579,16000172660,2016172660,"220","CRISIS COMPLAINT - GENERAL","CRISIS CALL","BEHAVIORAL HEALTH","05/17/2016 07:52:20 PM","63XX BLOCK OF 9 AV NE","U","U1","3600.1023",-122.3187,47.674576,"(47.674576, -122.3187)","OVERDOSE - DRUG RELATED CASUALTY","PERSON DOWN/INJURY","CASUALTIES","05/17/2016 04:52:53 PM",2177.8725823273,2016-05-17 19:52:20,2016-05-18
"812",50185,1936394,17000050207,201750207,"041","HARASSMENT, THREATS","THREATS, HARASSMENT","THREATS, HARASSMENT","02/10/2017 04:40:21 PM","45XX BLOCK OF UNIVERSITY WY NE","U","U2","5301.2010",-122.31312,47.66218,"(47.66218, -122.31312)","DISTURBANCE, MISCELLANEOUS/OTHER","DISTURBANCES","DISTURBANCES","02/10/2017 03:28:31 PM",738.963514898043,2017-02-10 16:40:21,2017-02-11
"813",50186,1772169,16000229582,2016229582,"350","HAZARDS","HAZARDS","HAZARDS","06/28/2016 09:52:09 AM","NE 68 ST / 35 AV NE","U","U3","3900.1017",-122.29033,47.677597,"(47.677597, -122.29033)","HAZ - POTENTIAL THRT TO PHYS SAFETY (NO HAZMAT)","HAZARDS","HAZARDS","",2799.79220129903,2016-06-28 09:52:09,2016-06-28
"814",50199,1781106,16000244325,2016244325,"220","CRISIS COMPLAINT - GENERAL","CRISIS CALL","BEHAVIORAL HEALTH","07/08/2016 03:45:05 PM","MONTLAKE BV NE / NE PACIFIC ST","U","U3","5302.2018",-122.30459,47.648994,"(47.648994, -122.30459)","SUSPICIOUS PERSON, VEHICLE OR INCIDENT","SUSPICIOUS CIRCUMSTANCES","SUSPICIOUS CIRCUMSTANCES","",861.874216742478,2016-07-08 15:45:05,2016-07-08
"815",50201,1739614,16000172524,2016172524,"350","HAZARDS","HAZARDS","HAZARDS","05/17/2016 08:44:24 PM","39XX BLOCK OF MONTLAKE BV NE","U","U3","5302.3006",-122.30293,47.653004,"(47.653004, -122.30293)","HAZ - POTENTIAL THRT TO PHYS SAFETY (NO HAZMAT)","HAZARDS","HAZARDS","05/17/2016 03:48:38 PM",595.444705489101,2016-05-17 20:44:24,2016-05-18
"816",50205,1813602,16000301042,2016301042,"242","FIGHT DISTURBANCE","DISTURBANCES","DISTURBANCES","08/20/2016 05:47:22 AM","41XX BLOCK OF BROOKLYN AV NE","U","U2","5301.4002",-122.314384,47.65759,"(47.65759, -122.314384)","FIGHT - VERBAL/ORAL (NO WEAPONS)","DISTURBANCES","DISTURBANCES","",407.251211570122,2016-08-20 05:47:22,2016-08-20
"817",50217,1727338,16000151320,2016151320,"041","HARASSMENT, THREATS","THREATS, HARASSMENT","THREATS, HARASSMENT","05/02/2016 01:42:44 AM","47XX BLOCK OF 12 AV NE","U","U2","5301.2004",-122.315254,47.664013,"(47.664013, -122.315254)","THREATS (INCLS IN-PERSON/BY PHONE/IN WRITING)","THREATS, HARASSMENT","THREATS, HARASSMENT","05/02/2016 12:54:45 AM",990.218839131712,2016-05-02 01:42:44,2016-05-02
"818",50263,2029388,17000226898,2017226898,"041","HARASSMENT, THREATS","THREATS, HARASSMENT","THREATS, HARASSMENT","06/23/2017 10:14:09 PM","NE 45 ST / UNIVERSITY WY NE","U","U2","5301.3001",-122.31313,47.661266,"(47.661266, -122.31313)","FIGHT - IP/JO - WITH WEAPONS","DISTURBANCES","DISTURBANCES","06/23/2017 08:25:43 PM",645.873447683438,2017-06-23 22:14:09,2017-06-24
"819",50282,2127081,17000404485,2017404485,"220","CRISIS COMPLAINT - GENERAL","CRISIS CALL","BEHAVIORAL HEALTH","10/31/2017 07:08:48 PM","58XX BLOCK OF 16 AV NE","U","U1","4400.1013",-122.31077,47.671986,"(47.671986, -122.31077)","CRISIS - PERSON IN BEHAVIORAL/EMOTIONAL CRISIS","BEHAVIORAL HEALTH","CRISIS CALL","10/31/2017 02:17:24 PM",1779.94173664112,2017-10-31 19:08:48,2017-11-01
"820",50286,1949738,17000079613,201779613,"041","HARASSMENT, THREATS","THREATS, HARASSMENT","THREATS, HARASSMENT","03/05/2017 07:54:00 PM","40XX BLOCK OF 7 AV NE","U","U2","5200.2009",-122.32085,47.656708,"(47.656708, -122.32085)","TRU - OBSCENE OR NUISANCE PHONE CALLS","THREATS, HARASSMENT","THREATS, HARASSMENT","",856.233556826154,2017-03-05 19:54:00,2017-03-06
"821",50303,2115510,17000383357,2017383357,"350","HAZARDS","HAZARDS","HAZARDS","10/15/2017 02:02:25 PM","NE 52 ST / 15 AV NE","U","U1","4400.3005",-122.31191,47.666428,"(47.666428, -122.31191)","TRAFFIC - BO SIGNALS AND DOWN SIGNS","TRAFFIC RELATED CALLS","TRAFFIC RELATED CALLS","10/15/2017 11:59:11 AM",1173.4703199682,2017-10-15 14:02:25,2017-10-15
"822",50324,1846529,16000357146,2016357146,"350","HAZARDS","HAZARDS","HAZARDS","10/02/2016 11:21:03 AM","45XX BLOCK OF SAND POINT WY NE","U","U3","4100.5000",-122.285,47.662285,"(47.662285, -122.285)","HAZ - POTENTIAL THRT TO PHYS SAFETY (NO HAZMAT)","HAZARDS","HAZARDS","10/02/2016 10:35:45 AM",1968.53470751536,2016-10-02 11:21:03,2016-10-02
"823",50337,1883813,16000423467,2016423467,"220","CRISIS COMPLAINT - GENERAL","CRISIS CALL","BEHAVIORAL HEALTH","11/23/2016 07:03:15 PM","46XX BLOCK OF 21 AV NE","U","U1","4302.1009",-122.305466,47.662167,"(47.662167, -122.305466)","THREATS (INCLS IN-PERSON/BY PHONE/IN WRITING)","THREATS, HARASSMENT","THREATS, HARASSMENT","11/23/2016 02:22:20 PM",749.641358093474,2016-11-23 19:03:15,2016-11-24
"824",50353,1847439,16000358437,2016358437,"220","CRISIS COMPLAINT - GENERAL","CRISIS CALL","BEHAVIORAL HEALTH","10/03/2016 02:52:47 PM","56XX BLOCK OF UNIVERSITY WY NE","U","U1","4400.2029",-122.31275,47.670578,"(47.670578, -122.31275)","CRISIS - PERSON IN BEHAVIORAL/EMOTIONAL CRISIS","BEHAVIORAL HEALTH","CRISIS CALL","10/03/2016 01:03:47 PM",1639.11575335463,2016-10-03 14:52:47,2016-10-03
"825",50357,1861475,16000383663,2016383663,"350","HAZARDS","HAZARDS","HAZARDS","10/23/2016 11:51:00 AM","LAKE CITY WY NE / NE 92 ST","U","U1","2100.2002",-122.305695,47.695747,"(47.695747, -122.305695)","WIRES DOWN (PHONE, ELECTRICAL,ETC.)","HAZARDS","HAZARDS","",4428.45804861896,2016-10-23 11:51:00,2016-10-23
"826",50365,2041471,17000249050,2017249050,"350","HAZARDS","HAZARDS","HAZARDS","07/09/2017 10:23:17 AM","NE 50 ST / 7 AV NE","U","U1","5200.5002",-122.3207,47.664955,"(47.664955, -122.3207)","DOWN - CHECK FOR PERSON DOWN","PERSON DOWN/INJURY","CASUALTIES","",1303.47990792526,2017-07-09 10:23:17,2017-07-09
"827",50372,1861554,16000383844,2016383844,"350","HAZARDS","HAZARDS","HAZARDS","10/23/2016 02:11:42 PM","45XX BLOCK OF UNIVERSITY WY NE","U","U2","5301.2009",-122.3134,47.662792,"(47.662792, -122.3134)","SUSPICIOUS PERSON, VEHICLE OR INCIDENT","SUSPICIOUS CIRCUMSTANCES","SUSPICIOUS CIRCUMSTANCES","",809.991014217161,2016-10-23 14:11:42,2016-10-23
"828",50405,1893264,16000441060,2016441060,"350","HAZARDS","HAZARDS","HAZARDS","12/08/2016 11:34:29 AM","45XX BLOCK OF 8 AV NE","U","U2","5200.5006",-122.31956,47.662224,"(47.662224, -122.31956)","WATER FLOODS (BROKEN MAINS/HYDRANTS, NO HAZ)","PUBLIC WATER","PUBLIC WATER","12/08/2016 10:35:28 AM",1024.64683103755,2016-12-08 11:34:29,2016-12-08
"829",50442,1902599,16000458774,2016458774,"350","HAZARDS","HAZARDS","HAZARDS","12/22/2016 04:07:20 PM","UNIVERSITY WY NE / NE 42 ST","U","U2","5301.3008",-122.31321,47.658314,"(47.658314, -122.31321)","HAZ - POTENTIAL THRT TO PHYS SAFETY (NO HAZMAT)","HAZARDS","HAZARDS","",379.289152249279,2016-12-22 16:07:20,2016-12-23
"830",50446,1883899,16000423901,2016423901,"220","CRISIS COMPLAINT - GENERAL","CRISIS CALL","BEHAVIORAL HEALTH","11/23/2016 09:24:52 PM","52XX BLOCK OF 15 AV NE","U","U1","4400.4000",-122.3119,47.667484,"(47.667484, -122.3119)","DISTURBANCE, MISCELLANEOUS/OTHER","DISTURBANCES","DISTURBANCES","",1289.49677835122,2016-11-23 21:24:52,2016-11-24
"831",50450,2018261,17000206765,2017206765,"220","CRISIS COMPLAINT - GENERAL","CRISIS CALL","BEHAVIORAL HEALTH","06/09/2017 11:49:31 AM","45XX BLOCK OF 7 AV NE","U","U2","5200.5005",-122.320724,47.661564,"(47.661564, -122.320724)","OVERDOSE - DRUG RELATED CASUALTY","PERSON DOWN/INJURY","CASUALTIES","06/09/2017 10:56:04 AM",1045.71564454053,2017-06-09 11:49:31,2017-06-09
"832",50483,1902531,16000458347,2016458347,"220","CRISIS COMPLAINT - GENERAL","CRISIS CALL","BEHAVIORAL HEALTH","12/22/2016 01:59:13 PM","47XX BLOCK OF 12 AV NE","U","U2","5301.2003",-122.315254,47.664013,"(47.664013, -122.315254)","BURG - RES (INCL UNOCC STRUCTURES ON PROP)","BURGLARY","RESIDENTIAL BURGLARIES","12/22/2016 12:15:33 PM",990.218839131712,2016-12-22 13:59:13,2016-12-22
"833",50484,2139458,17000427499,2017427499,"220","CRISIS COMPLAINT - GENERAL","CRISIS CALL","BEHAVIORAL HEALTH","11/18/2017 11:25:07 AM","45XX BLOCK OF 20 AV NE","U","U1","4302.1009",-122.306526,47.662167,"(47.662167, -122.306526)","OVERDOSE - DRUG RELATED CASUALTY","PERSON DOWN/INJURY","CASUALTIES","11/18/2017 10:12:22 AM",721.14351398363,2017-11-18 11:25:07,2017-11-18
"834",50495,1861778,16000384195,2016384195,"242","FIGHT DISTURBANCE","DISTURBANCES","DISTURBANCES","10/23/2016 08:10:41 PM","42XX BLOCK OF UNIVERSITY WY NE","U","U2","5301.3009",-122.31286,47.658752,"(47.658752, -122.31286)","FIGHT - IP - PHYSICAL (NO WEAPONS)","DISTURBANCES","DISTURBANCES","",396.643896827673,2016-10-23 20:10:41,2016-10-24
"835",50547,1970593,17000118943,2017118943,"242","FIGHT DISTURBANCE","DISTURBANCES","DISTURBANCES","04/05/2017 12:35:02 PM","NE 45 ST / UNIVERSITY WY NE","U","U2","5301.3001",-122.31313,47.661266,"(47.661266, -122.31313)","FIGHT - IP - PHYSICAL (NO WEAPONS)","DISTURBANCES","DISTURBANCES","",645.873447683438,2017-04-05 12:35:02,2017-04-05
"836",50606,1862688,16000385703,2016385703,"220","CRISIS COMPLAINT - GENERAL","CRISIS CALL","BEHAVIORAL HEALTH","10/25/2016 03:04:14 AM","48XX BLOCK OF SAND POINT WY NE","U","U3","4100.4008",-122.281456,47.66231,"(47.66231, -122.281456)","CRISIS - PERSON IN BEHAVIORAL/EMOTIONAL CRISIS","BEHAVIORAL HEALTH","CRISIS CALL","10/25/2016 12:12:47 AM",2220.29618860043,2016-10-25 03:04:14,2016-10-25
"837",50630,1855666,16000373312,2016373312,"350","HAZARDS","HAZARDS","HAZARDS","10/15/2016 02:50:46 AM","42XX BLOCK OF UNIVERSITY WY NE","U","U2","5301.3008",-122.31363,47.65902,"(47.65902, -122.31363)","SUSPICIOUS STOP - OFFICER INITIATED ONVIEW","SUSPICIOUS CIRCUMSTANCES","SUSPICIOUS CIRCUMSTANCES","",457.156052075125,2016-10-15 02:50:46,2016-10-15
"838",50649,2114852,17000382201,2017382201,"220","CRISIS COMPLAINT - GENERAL","CRISIS CALL","BEHAVIORAL HEALTH","10/14/2017 02:04:49 PM","73XX BLOCK OF ROOSEVELT WY NE","U","U1","2600.2018",-122.31747,47.681892,"(47.681892, -122.31747)","SHOPLIFT - THEFT","SHOPLIFTING","THEFT","10/14/2017 12:14:02 PM",2940.3413275696,2017-10-14 14:04:49,2017-10-14
"839",50662,1902612,16000458708,2016458708,"041","HARASSMENT, THREATS","THREATS, HARASSMENT","THREATS, HARASSMENT","12/22/2016 04:30:03 PM","52XX BLOCK OF 37 AV NE","U","U3","4200.4028",-122.287964,47.667603,"(47.667603, -122.287964)","HARAS - NO BIAS, THREATS OR MALICIOUSNESS","THREATS, HARASSMENT","THREATS, HARASSMENT","12/22/2016 02:57:39 PM",2069.03865328044,2016-12-22 16:30:03,2016-12-23
"840",50669,1936602,17000049931,201749931,"041","HARASSMENT, THREATS","THREATS, HARASSMENT","THREATS, HARASSMENT","02/10/2017 01:51:09 PM","47XX BLOCK OF BROOKLYN AV NE","U","U2","5301.2003",-122.314224,47.664005,"(47.664005, -122.314224)","THREATS (INCLS IN-PERSON/BY PHONE/IN WRITING)","THREATS, HARASSMENT","THREATS, HARASSMENT","02/10/2017 12:29:25 PM",958.152960945758,2017-02-10 13:51:09,2017-02-10
"841",50770,2029316,17000227046,2017227046,"041","HARASSMENT, THREATS","THREATS, HARASSMENT","THREATS, HARASSMENT","06/23/2017 10:07:50 PM","68XX BLOCK OF 62 AV NE","U","U3","4000.1014",-122.26223,47.67889,"(47.67889, -122.26223)","THREATS (INCLS IN-PERSON/BY PHONE/IN WRITING)","THREATS, HARASSMENT","THREATS, HARASSMENT","",4368.13337390337,2017-06-23 22:07:50,2017-06-24
"842",50899,1893558,16000441617,2016441617,"220","CRISIS COMPLAINT - GENERAL","CRISIS CALL","BEHAVIORAL HEALTH","12/08/2016 07:43:54 PM","64XX BLOCK OF ROOSEVELT WY NE","U","U1","3600.1022",-122.31736,47.675404,"(47.675404, -122.31736)","SUSPICIOUS PERSON, VEHICLE OR INCIDENT","SUSPICIOUS CIRCUMSTANCES","SUSPICIOUS CIRCUMSTANCES","12/08/2016 05:27:37 PM",2236.71996090164,2016-12-08 19:43:54,2016-12-09
"843",50930,1885032,16000425795,2016425795,"220","CRISIS COMPLAINT - GENERAL","CRISIS CALL","BEHAVIORAL HEALTH","11/26/2016 12:07:39 AM","16XX BLOCK OF NE 65 ST","U","U1","2600.3017",-122.310326,47.67578,"(47.67578, -122.310326)","CRISIS - PERSON IN BEHAVIORAL/EMOTIONAL CRISIS","BEHAVIORAL HEALTH","CRISIS CALL","11/25/2016 11:23:29 PM",2200.090788536,2016-11-26 00:07:39,2016-11-26
"844",50949,1866457,16000392428,2016392428,"220","CRISIS COMPLAINT - GENERAL","CRISIS CALL","BEHAVIORAL HEALTH","10/30/2016 01:45:07 AM","NE 45 ST / UNIVERSITY WY NE","U","U2","5301.3001",-122.31313,47.661266,"(47.661266, -122.31313)","CRISIS - PERSON IN BEHAVIORAL/EMOTIONAL CRISIS","BEHAVIORAL HEALTH","CRISIS CALL","",645.873447683438,2016-10-30 01:45:07,2016-10-30
"845",50961,1866884,16000393300,2016393300,"242","FIGHT DISTURBANCE","DISTURBANCES","DISTURBANCES","10/30/2016 05:57:34 PM","UNIVERSITY WY NE / NE 50 ST","U","U1","4400.4009",-122.31307,47.664898,"(47.664898, -122.31307)","FIGHT - IP - PHYSICAL (NO WEAPONS)","DISTURBANCES","DISTURBANCES","",1025.0108407033,2016-10-30 17:57:34,2016-10-31
"846",50967,1903457,16000460359,2016460359,"220","CRISIS COMPLAINT - GENERAL","CRISIS CALL","BEHAVIORAL HEALTH","12/23/2016 10:06:58 PM","NE 45 ST / UNIVERSITY WY NE","U","U2","5301.3001",-122.31313,47.661266,"(47.661266, -122.31313)","WEAPN-IP/JO-GUN,DEADLY WPN (NO THRT/ASLT/DIST)","WEAPONS CALLS","WEAPONS CALLS","",645.873447683438,2016-12-23 22:06:58,2016-12-24
"847",50986,1903148,16000459795,2016459795,"242","FIGHT DISTURBANCE","DISTURBANCES","DISTURBANCES","12/23/2016 01:40:08 PM","14XX BLOCK OF NE 43 ST","U","U2","5301.3009",-122.3126,47.65979,"(47.65979, -122.3126)","FIGHT - IP - PHYSICAL (NO WEAPONS)","DISTURBANCES","DISTURBANCES","12/23/2016 01:10:32 PM",481.44763654886,2016-12-23 13:40:08,2016-12-23
"848",51001,1925573,17000032932,201732932,"350","HAZARDS","HAZARDS","HAZARDS","01/27/2017 03:41:07 PM","NE 50 ST / 15 AV NE","U","U1","4400.4009",-122.311935,47.66489,"(47.66489, -122.311935)","HAZ - IMMINENT THRT TO PHYS SAFETY (NO HAZ MAT)","HAZARDS","HAZARDS","01/27/2017 12:45:22 PM",1005.20324732383,2017-01-27 15:41:07,2017-01-27
"849",51004,1885510,16000426317,2016426317,"041","HARASSMENT, THREATS","THREATS, HARASSMENT","THREATS, HARASSMENT","11/26/2016 07:23:34 PM","43XX BLOCK OF UNIVERSITY WY NE","U","U2","5301.3001",-122.31315,47.660534,"(47.660534, -122.31315)","DISTURBANCE, MISCELLANEOUS/OTHER","DISTURBANCES","DISTURBANCES","11/26/2016 01:10:05 PM",573.843522369168,2016-11-26 19:23:34,2016-11-27
"850",51010,1903220,16000459993,2016459993,"242","FIGHT DISTURBANCE","DISTURBANCES","DISTURBANCES","12/23/2016 04:30:45 PM","41XX BLOCK OF 12 AV NE","U","U2","5301.4003",-122.31554,47.657604,"(47.657604, -122.31554)","FIGHT - VERBAL/ORAL (NO WEAPONS)","DISTURBANCES","DISTURBANCES","",487.509070921015,2016-12-23 16:30:45,2016-12-24
"851",51023,1971026,17000119367,2017119367,"041","HARASSMENT, THREATS","THREATS, HARASSMENT","THREATS, HARASSMENT","04/05/2017 11:03:09 PM","75XX BLOCK OF 35 AV NE","U","U3","2400.3011",-122.29051,47.683952,"(47.683952, -122.29051)","HARAS - NO BIAS, THREATS OR MALICIOUSNESS","THREATS, HARASSMENT","THREATS, HARASSMENT","04/05/2017 08:04:09 PM",3419.41536166086,2017-04-05 23:03:09,2017-04-06
"852",51054,1893707,16000441999,2016441999,"350","HAZARDS","HAZARDS","HAZARDS","12/09/2016 12:01:11 AM","UNIVERSITY BR / NE 40 ST","U","U2","5302.1012",-122.31827,47.65547,"(47.65547, -122.31827)","HAZ - POTENTIAL THRT TO PHYS SAFETY (NO HAZMAT)","HAZARDS","HAZARDS","",661.436774907964,2016-12-09 00:01:11,2016-12-09
"853",51059,1936815,17000049693,201749693,"220","CRISIS COMPLAINT - GENERAL","CRISIS CALL","BEHAVIORAL HEALTH","02/10/2017 12:59:07 PM","50XX BLOCK OF 15 AV NE","U","U1","4400.4009",-122.31193,47.66566,"(47.66566, -122.31193)","CRISIS - PERSON IN BEHAVIORAL/EMOTIONAL CRISIS","BEHAVIORAL HEALTH","CRISIS CALL","02/10/2017 10:55:46 AM",1089.43380769836,2017-02-10 12:59:07,2017-02-10
"854",51079,1903270,16000459951,2016459951,"220","CRISIS COMPLAINT - GENERAL","CRISIS CALL","BEHAVIORAL HEALTH","12/23/2016 05:30:38 PM","22XX BLOCK OF NE 88 ST","U","U1","2100.3008",-122.305016,47.69211,"(47.69211, -122.305016)","TRESPASS","TRESPASS","TRESPASS","12/23/2016 04:35:25 PM",4028.94904527722,2016-12-23 17:30:38,2016-12-24
"855",51084,1925557,17000033014,201733014,"220","CRISIS COMPLAINT - GENERAL","CRISIS CALL","BEHAVIORAL HEALTH","01/27/2017 03:22:05 PM","31XX BLOCK OF NE 81 ST","U","U3","2400.3006",-122.293144,47.68739,"(47.68739, -122.293144)","SUSPICIOUS PERSON, VEHICLE OR INCIDENT","SUSPICIOUS CIRCUMSTANCES","SUSPICIOUS CIRCUMSTANCES","01/27/2017 02:00:26 PM",3699.89940546922,2017-01-27 15:22:05,2017-01-27
"856",51103,1960956,17000101109,2017101109,"350","HAZARDS","HAZARDS","HAZARDS","03/22/2017 04:12:13 PM","90XX BLOCK OF 30 AV NE","U","U3","2100.1015",-122.29596,47.69432,"(47.69432, -122.29596)","WIRES DOWN (PHONE, ELECTRICAL,ETC.)","HAZARDS","HAZARDS","03/22/2017 03:47:16 PM",4380.21152021671,2017-03-22 16:12:13,2017-03-22
"857",51104,2041701,17000249289,2017249289,"220","CRISIS COMPLAINT - GENERAL","CRISIS CALL","BEHAVIORAL HEALTH","07/09/2017 06:21:36 PM","43XX BLOCK OF UNIVERSITY WY NE","U","U2","5301.3001",-122.31315,47.660534,"(47.660534, -122.31315)","DISTURBANCE, MISCELLANEOUS/OTHER","DISTURBANCES","DISTURBANCES","07/09/2017 04:24:57 PM",573.843522369168,2017-07-09 18:21:36,2017-07-10
"858",51122,2077498,17000313849,2017313849,"220","CRISIS COMPLAINT - GENERAL","CRISIS CALL","BEHAVIORAL HEALTH","08/24/2017 07:18:41 PM","47XX BLOCK OF 12 AV NE","U","U2","5301.2003",-122.315254,47.664013,"(47.664013, -122.315254)","CRISIS - PERSON IN BEHAVIORAL/EMOTIONAL CRISIS","BEHAVIORAL HEALTH","CRISIS CALL","08/24/2017 05:54:50 PM",990.218839131712,2017-08-24 19:18:41,2017-08-25
"859",51139,1893689,16000441980,2016441980,"242","FIGHT DISTURBANCE","DISTURBANCES","DISTURBANCES","12/08/2016 11:49:18 PM","NE 43 ST / UNIVERSITY WY NE","U","U2","5301.3008",-122.31317,47.659794,"(47.659794, -122.31317)","UNKNOWN - COMPLAINT OF UNKNOWN NATURE","SUSPICIOUS CIRCUMSTANCES","SUSPICIOUS CIRCUMSTANCES","",503.925729388642,2016-12-08 23:49:18,2016-12-09
"860",51154,1904132,16000462362,2016462362,"220","CRISIS COMPLAINT - GENERAL","CRISIS CALL","BEHAVIORAL HEALTH","12/26/2016 03:07:10 PM","39XX BLOCK OF NE 45 ST","U","U3","4100.5002",-122.28599,47.661263,"(47.661263, -122.28599)","CRISIS - PERSON IN BEHAVIORAL/EMOTIONAL CRISIS","BEHAVIORAL HEALTH","CRISIS CALL","12/26/2016 01:47:22 PM",1860.40706322282,2016-12-26 15:07:10,2016-12-26
"861",51158,1886312,16000427821,2016427821,"220","CRISIS COMPLAINT - GENERAL","CRISIS CALL","BEHAVIORAL HEALTH","11/28/2016 03:56:03 AM","52XX BLOCK OF UNIVERSITY WY NE","U","U1","4400.4000",-122.313034,47.667492,"(47.667492, -122.313034)","FIGHT - VERBAL/ORAL (NO WEAPONS)","DISTURBANCES","DISTURBANCES","11/27/2016 09:32:32 PM",1305.00522461218,2016-11-28 03:56:03,2016-11-28
"862",51159,1886332,16000427756,2016427756,"220","CRISIS COMPLAINT - GENERAL","CRISIS CALL","BEHAVIORAL HEALTH","11/28/2016 04:45:35 AM","45XX BLOCK OF BROOKLYN AV NE","U","U2","5301.2008",-122.31426,47.66219,"(47.66219, -122.31426)","DISTURBANCE, MISCELLANEOUS/OTHER","DISTURBANCES","DISTURBANCES","11/27/2016 07:50:38 PM",775.56356285686,2016-11-28 04:45:35,2016-11-28
"863",51163,1994982,17000163954,2017163954,"030","ARMED ROBBERY","GUN CALLS","ROBBERY","05/10/2017 12:54:20 PM","NE 47 ST / 12 AV NE","U","U2","5301.2007",-122.31526,47.663105,"(47.663105, -122.31526)","ASLT - WITH OR W/O WEAPONS (NO SHOOTINGS)","ASSAULTS","ASSAULTS","05/10/2017 11:39:57 AM",900.685209550702,2017-05-10 12:54:20,2017-05-10
"864",51168,1873796,16000405442,2016405442,"350","HAZARDS","HAZARDS","HAZARDS","11/09/2016 03:05:51 AM","BROOKLYN AV NE / NE 50 ST","U","U1","5301.2002",-122.31421,47.664906,"(47.664906, -122.31421)","HAZ - POTENTIAL THRT TO PHYS SAFETY (NO HAZMAT)","HAZARDS","HAZARDS","",1051.50585422232,2016-11-09 03:05:51,2016-11-09
"865",51183,1893667,16000441477,2016441477,"242","FIGHT DISTURBANCE","DISTURBANCES","DISTURBANCES","12/08/2016 10:49:29 PM","9XX BLOCK OF NE 45 ST","U","U2","5200.5008",-122.318596,47.661304,"(47.661304, -122.318596)","NUISANCE - MISCHIEF","MISCELLANEOUS MISDEMEANORS","MISCELLANEOUS MISDEMEANORS","",902.556860638922,2016-12-08 22:49:29,2016-12-09
"866",51202,1893805,16000441957,2016441957,"242","FIGHT DISTURBANCE","DISTURBANCES","DISTURBANCES","12/09/2016 03:34:45 AM","14XX BLOCK OF NE 43 ST","U","U2","5301.3009",-122.3126,47.65979,"(47.65979, -122.3126)","FIGHT - IP - PHYSICAL (NO WEAPONS)","DISTURBANCES","DISTURBANCES","12/08/2016 11:11:30 PM",481.44763654886,2016-12-09 03:34:45,2016-12-09
"867",51225,1886455,16000428190,2016428190,"220","CRISIS COMPLAINT - GENERAL","CRISIS CALL","BEHAVIORAL HEALTH","11/28/2016 11:19:56 AM","16 AV NE / NE 45 ST","U","U2","5301.1005",-122.31086,47.66126,"(47.66126, -122.31086)","CRISIS - PERSON IN BEHAVIORAL/EMOTIONAL CRISIS","BEHAVIORAL HEALTH","CRISIS CALL","11/28/2016 10:17:00 AM",593.681669148232,2016-11-28 11:19:56,2016-11-28
"868",51234,1875655,16000408825,2016408825,"220","CRISIS COMPLAINT - GENERAL","CRISIS CALL","BEHAVIORAL HEALTH","11/11/2016 07:15:28 PM","47XX BLOCK OF 15 AV NE","U","U2","5301.2001",-122.31195,47.66399,"(47.66399, -122.31195)","CRISIS - PERSON IN BEHAVIORAL/EMOTIONAL CRISIS","BEHAVIORAL HEALTH","CRISIS CALL","11/11/2016 05:37:17 PM",907.219216291856,2016-11-11 19:15:28,2016-11-12
"869",51248,1876197,16000409681,2016409681,"350","HAZARDS","HAZARDS","HAZARDS","11/12/2016 01:25:40 PM","41XX BLOCK OF UNIVERSITY WY NE","U","U2","5301.4001",-122.313225,47.657574,"(47.657574, -122.313225)","HAZ - POTENTIAL THRT TO PHYS SAFETY (NO HAZMAT)","HAZARDS","HAZARDS","11/12/2016 11:56:15 AM",330.036787270645,2016-11-12 13:25:40,2016-11-12
"870",51266,1876782,16000410710,2016410710,"350","HAZARDS","HAZARDS","HAZARDS","11/13/2016 08:20:29 AM","50XX BLOCK OF ROOSEVELT WY NE","U","U1","4500.1009",-122.3174,47.665688,"(47.665688, -122.3174)","ANIMAL - INJURED, DEAD HAZARD","ANIMAL COMPLAINTS","ANIMAL COMPLAINTS","",1229.78206620259,2016-11-13 08:20:29,2016-11-13
"871",51303,1877830,16000412488,2016412488,"220","CRISIS COMPLAINT - GENERAL","CRISIS CALL","BEHAVIORAL HEALTH","11/14/2016 11:35:34 PM","42XX BLOCK OF UNIVERSITY WY NE","U","U2","5301.3008",-122.31319,47.659054,"(47.659054, -122.31319)","ASLT - WITH OR W/O WEAPONS (NO SHOOTINGS)","ASSAULTS","ASSAULTS","11/14/2016 09:37:53 PM",438.325335850633,2016-11-14 23:35:34,2016-11-15
"872",51333,1879267,16000415379,2016415379,"242","FIGHT DISTURBANCE","DISTURBANCES","DISTURBANCES","11/17/2016 03:04:29 AM","BROOKLYN AV NE / NE 42 ST","U","U2","5301.3008",-122.31436,47.658325,"(47.658325, -122.31436)","FIGHT - VERBAL/ORAL (NO WEAPONS)","DISTURBANCES","DISTURBANCES","",447.329259770333,2016-11-17 03:04:29,2016-11-17
"873",51338,1925683,17000033280,201733280,"220","CRISIS COMPLAINT - GENERAL","CRISIS CALL","BEHAVIORAL HEALTH","01/27/2017 07:13:49 PM","50XX BLOCK OF ROOSEVELT WY NE","U","U1","4500.1009",-122.3174,47.665688,"(47.665688, -122.3174)","CRISIS - PERSON IN BEHAVIORAL/EMOTIONAL CRISIS","BEHAVIORAL HEALTH","CRISIS CALL","01/27/2017 05:41:28 PM",1229.78206620259,2017-01-27 19:13:49,2017-01-28
"874",51353,1780741,16000243958,2016243958,"350","HAZARDS","HAZARDS","HAZARDS","07/08/2016 08:19:33 AM","NE 82 ST / 19 AV NE","U","U1","2600.1001",-122.30789,47.68849,"(47.68849, -122.30789)","WIRES DOWN (PHONE, ELECTRICAL,ETC.)","HAZARDS","HAZARDS","07/08/2016 07:05:59 AM",3614.3891209384,2016-07-08 08:19:33,2016-07-08
"875",51374,1772144,16000229495,2016229495,"220","CRISIS COMPLAINT - GENERAL","CRISIS CALL","BEHAVIORAL HEALTH","06/28/2016 08:16:53 AM","10XX BLOCK OF NE 64 ST","U","U1","4400.2003",-122.31651,47.67498,"(47.67498, -122.31651)","CRISIS - PERSON IN BEHAVIORAL/EMOTIONAL CRISIS","BEHAVIORAL HEALTH","CRISIS CALL","",2174.95580708281,2016-06-28 08:16:53,2016-06-28
"876",51402,1881201,16000418785,2016418785,"041","HARASSMENT, THREATS","THREATS, HARASSMENT","THREATS, HARASSMENT","11/19/2016 07:52:26 PM","30XX BLOCK OF NE BLAKELEY ST","U","U3","4200.3012",-122.29461,47.663895,"(47.663895, -122.29461)","FIGHT - VERBAL/ORAL (NO WEAPONS)","DISTURBANCES","DISTURBANCES","11/19/2016 06:08:49 PM",1421.78199751151,2016-11-19 19:52:26,2016-11-20
"877",51415,1792485,16000264693,2016264693,"041","HARASSMENT, THREATS","THREATS, HARASSMENT","THREATS, HARASSMENT","07/24/2016 03:31:21 AM","43XX BLOCK OF 7 AV NE","U","U2","5200.1002",-122.32083,47.660034,"(47.660034, -122.32083)","WEAPN-IP/JO-GUN,DEADLY WPN (NO THRT/ASLT/DIST)","WEAPONS CALLS","WEAPONS CALLS","07/24/2016 02:28:57 AM",962.028771772983,2016-07-24 03:31:21,2016-07-24
"878",51443,1772429,16000226500,2016226500,"041","HARASSMENT, THREATS","THREATS, HARASSMENT","THREATS, HARASSMENT","06/25/2016 09:59:34 PM","NE 45 ST / 8 AV NE","U","U2","5200.5006",-122.319565,47.66131,"(47.66131, -122.319565)","ASLT - IP/JO - WITH OR W/O WPNS (NO SHOOTINGS)","ASSAULTS","ASSAULTS","06/25/2016 07:08:39 PM",959.249521875689,2016-06-25 21:59:34,2016-06-26
"879",51450,1813940,16000301491,2016301491,"031","STRONG ARM ROBBERY","ROBBERY","ROBBERY","08/20/2016 08:51:32 PM","43XX BLOCK OF ROOSEVELT WY NE","U","U2","5200.5008",-122.31775,47.659653,"(47.659653, -122.31775)","ASLT - IP/JO - WITH OR W/O WPNS (NO SHOOTINGS)","ASSAULTS","ASSAULTS","08/20/2016 04:45:09 PM",740.954069962209,2016-08-20 20:51:32,2016-08-21
"880",51468,1813994,16000301723,2016301723,"350","HAZARDS","HAZARDS","HAZARDS","08/20/2016 10:51:39 PM","68XX BLOCK OF RAVENNA AV NE","U","U1","2500.201",-122.30388,47.678516,"(47.678516, -122.30388)","WIRES DOWN (PHONE, ELECTRICAL,ETC.)","HAZARDS","HAZARDS","",2538.74854770342,2016-08-20 22:51:39,2016-08-21
"881",51470,1828580,16000325397,2016325397,"220","CRISIS COMPLAINT - GENERAL","CRISIS CALL","BEHAVIORAL HEALTH","09/08/2016 03:51:46 AM","42XX BLOCK OF UNIVERSITY WY NE","U","U2","5301.3009",-122.31319,47.659054,"(47.659054, -122.31319)","CRISIS - PERSON IN BEHAVIORAL/EMOTIONAL CRISIS","BEHAVIORAL HEALTH","CRISIS CALL","",438.325335850633,2016-09-08 03:51:46,2016-09-08
"882",51492,1828553,16000325168,2016325168,"030","ARMED ROBBERY","GUN CALLS","ROBBERY","09/08/2016 02:23:19 AM","45XX BLOCK OF 17 AV NE","U","U2","5301.1005",-122.3097,47.66216,"(47.66216, -122.3097)","CARJACKING - IP/JO - ROBBERY","ROBBERY","ROBBERY","09/07/2016 08:45:15 PM",685.056260595456,2016-09-08 02:23:19,2016-09-08
"883",51535,2139792,17000427957,2017427957,"041","HARASSMENT, THREATS","THREATS, HARASSMENT","THREATS, HARASSMENT","11/18/2017 10:00:26 PM","NE 65 ST / 8 AV NE","U","U1","3600.1014",-122.32005,47.67585,"(47.67585, -122.32005)","WEAPN-IP/JO-GUN,DEADLY WPN (NO THRT/ASLT/DIST)","WEAPONS CALLS","WEAPONS CALLS","11/18/2017 07:35:33 PM",2344.92838491346,2017-11-18 22:00:26,2017-11-19
"884",51571,1828551,16000325213,2016325213,"220","CRISIS COMPLAINT - GENERAL","CRISIS CALL","BEHAVIORAL HEALTH","09/08/2016 02:26:05 AM","40XX BLOCK OF 7 AV NE","U","U2","5200.2009",-122.32085,47.656708,"(47.656708, -122.32085)","OVERDOSE - DRUG RELATED CASUALTY","PERSON DOWN/INJURY","CASUALTIES","09/07/2016 09:31:31 PM",856.233556826154,2016-09-08 02:26:05,2016-09-08
"885",51585,1894185,16000442334,2016442334,"220","CRISIS COMPLAINT - GENERAL","CRISIS CALL","BEHAVIORAL HEALTH","12/09/2016 07:14:56 PM","47XX BLOCK OF 12 AV NE","U","U2","5301.2003",-122.315254,47.664013,"(47.664013, -122.315254)","CRISIS - PERSON IN BEHAVIORAL/EMOTIONAL CRISIS","BEHAVIORAL HEALTH","CRISIS CALL","12/09/2016 11:48:30 AM",990.218839131712,2016-12-09 19:14:56,2016-12-10
"886",51588,1881209,16000418862,2016418862,"242","FIGHT DISTURBANCE","DISTURBANCES","DISTURBANCES","11/19/2016 08:22:38 PM","45XX BLOCK OF 25 AV NE","U","U3","4301.1014",-122.3009,47.66189,"(47.66189, -122.3009)","FIGHT - IP - PHYSICAL (NO WEAPONS)","DISTURBANCES","DISTURBANCES","11/19/2016 07:06:48 PM",919.874315224969,2016-11-19 20:22:38,2016-11-20
"887",51607,1925713,17000033378,201733378,"242","FIGHT DISTURBANCE","DISTURBANCES","DISTURBANCES","01/27/2017 07:46:20 PM","37 AV NE / NE 77 ST","U","U3","2400.3009",-122.28843,47.684853,"(47.684853, -122.28843)","FIGHT - VERBAL/ORAL (NO WEAPONS)","DISTURBANCES","DISTURBANCES","",3577.01123556974,2017-01-27 19:46:20,2017-01-28
"888",51627,1894171,16000442463,2016442463,"041","HARASSMENT, THREATS","THREATS, HARASSMENT","THREATS, HARASSMENT","12/09/2016 06:51:24 PM","43XX BLOCK OF UNIVERSITY WY NE","U","U2","5301.3000",-122.31315,47.660534,"(47.660534, -122.31315)","HARAS - NO BIAS, THREATS OR MALICIOUSNESS","THREATS, HARASSMENT","THREATS, HARASSMENT","12/09/2016 12:34:07 PM",573.843522369168,2016-12-09 18:51:24,2016-12-10
"889",51642,1936944,17000055005,201755005,"041","HARASSMENT, THREATS","THREATS, HARASSMENT","THREATS, HARASSMENT","02/14/2017 04:06:18 PM","18XX BLOCK OF NE 58 ST","U","U1","4400.101",-122.30906,47.6712,"(47.6712, -122.30906)","TRU - THREATS","THREATS, HARASSMENT","THREATS, HARASSMENT","02/14/2017 03:43:14 PM",1690.31648328968,2017-02-14 16:06:18,2017-02-15
"890",51667,1894236,16000442948,2016442948,"350","HAZARDS","HAZARDS","HAZARDS","12/09/2016 08:50:02 PM","NE 52 ST / 20 AV NE","U","U1","4302.1004",-122.306496,47.666424,"(47.666424, -122.306496)","WIRES DOWN (PHONE, ELECTRICAL,ETC.)","HAZARDS","HAZARDS","",1180.73935159269,2016-12-09 20:50:02,2016-12-10
"891",51696,1894208,16000442780,2016442780,"041","HARASSMENT, THREATS","THREATS, HARASSMENT","THREATS, HARASSMENT","12/09/2016 07:40:15 PM","70XX BLOCK OF 47 AV NE","U","U3","3900.2002",-122.27847,47.679726,"(47.679726, -122.27847)","TRU - THREATS","THREATS, HARASSMENT","THREATS, HARASSMENT","12/09/2016 05:54:50 PM",3519.9093559659,2016-12-09 19:40:15,2016-12-10
"892",51711,2030001,17000228307,2017228307,"350","HAZARDS","HAZARDS","HAZARDS","06/24/2017 09:34:51 PM","EASTLAKE AV NE / 11 AV NE","U","U2","5301.4003",-122.31668,47.657475,"(47.657475, -122.31668)","TREES DOWN, OBSTRUCTING PUBLIC PROP (NO HAZ)","TREES DOWN","TREES DOWN","06/24/2017 08:40:59 PM",563.735915420913,2017-06-24 21:34:51,2017-06-25
"893",51712,1961271,17000101585,2017101585,"242","FIGHT DISTURBANCE","DISTURBANCES","DISTURBANCES","03/22/2017 11:56:40 PM","42XX BLOCK OF 8 AV NE","U","U2","5200.1004",-122.319786,47.65849,"(47.65849, -122.319786)","FIGHT - IP - PHYSICAL (NO WEAPONS)","DISTURBANCES","DISTURBANCES","03/22/2017 11:11:53 PM",820.767156641322,2017-03-22 23:56:40,2017-03-23
"894",51722,1884245,16000424396,2016424396,"350","HAZARDS","HAZARDS","HAZARDS","11/24/2016 01:26:30 PM","NE 50 ST / ROOSEVELT WY NE","U","U1","5200.5000",-122.317406,47.664936,"(47.664936, -122.317406)","TRAFFIC - BO SIGNALS AND DOWN SIGNS","TRAFFIC RELATED CALLS","TRAFFIC RELATED CALLS","",1157.48588512645,2016-11-24 13:26:30,2016-11-24
"895",51739,1870352,16000399664,2016399664,"220","CRISIS COMPLAINT - GENERAL","CRISIS CALL","BEHAVIORAL HEALTH","11/04/2016 03:00:57 PM","49XX BLOCK OF 25 AV NE","U","U1","4302.2007",-122.30142,47.66461,"(47.66461, -122.30142)","CRISIS - PERSON IN BEHAVIORAL/EMOTIONAL CRISIS","BEHAVIORAL HEALTH","CRISIS CALL","",1133.47255556578,2016-11-04 15:00:57,2016-11-04
"896",51746,1995362,17000164861,2017164861,"242","FIGHT DISTURBANCE","DISTURBANCES","DISTURBANCES","05/10/2017 11:40:22 PM","NE 47 ST / 20 AV NE","U","U1","4302.1008",-122.30652,47.663074,"(47.663074, -122.30652)","FIGHT - IP - PHYSICAL (NO WEAPONS)","DISTURBANCES","DISTURBANCES","",817.746309512487,2017-05-10 23:40:22,2017-05-11
"897",51749,1772469,16000230087,2016230087,"350","HAZARDS","HAZARDS","HAZARDS","06/28/2016 05:15:07 PM","NE 55 ST / 25 AV NE","U","U3","4301.3017",-122.30062,47.66852,"(47.66852, -122.30062)","HAZ - POTENTIAL THRT TO PHYS SAFETY (NO HAZMAT)","HAZARDS","HAZARDS","06/28/2016 04:14:39 PM",1543.56487920368,2016-06-28 17:15:07,2016-06-29
"898",51752,1862738,16000372466,2016372466,"350","HAZARDS","HAZARDS","HAZARDS","10/14/2016 12:56:55 PM","58XX BLOCK OF 16 AV NE","U","U1","4400.1011",-122.31051,47.67229,"(47.67229, -122.31051)","WIRES DOWN (PHONE, ELECTRICAL,ETC.)","HAZARDS","HAZARDS","",1812.77182364403,2016-10-14 12:56:55,2016-10-14
"899",51775,1984080,17000144183,2017144183,"350","HAZARDS","HAZARDS","HAZARDS","04/25/2017 03:11:33 PM","36XX BLOCK OF NE 73 PL","U","U3","3900.1004",-122.2884,47.681705,"(47.681705, -122.2884)","WIRES DOWN (PHONE, ELECTRICAL,ETC.)","HAZARDS","HAZARDS","04/25/2017 02:32:02 PM",3267.8982216818,2017-04-25 15:11:33,2017-04-25
"900",51803,1936112,17000050611,201750611,"350","HAZARDS","HAZARDS","HAZARDS","02/10/2017 09:02:25 PM","NE 50 ST / 18 AV NE","U","U1","4400.3009",-122.30833,47.664867,"(47.664867, -122.30833)","HAZ - POTENTIAL THRT TO PHYS SAFETY (NO HAZMAT)","HAZARDS","HAZARDS","02/10/2017 09:00:31 PM",989.77531981339,2017-02-10 21:02:25,2017-02-11
"901",51836,1828614,16000325453,2016325453,"350","HAZARDS","HAZARDS","HAZARDS","09/08/2016 06:02:11 AM","13XX BLOCK OF NE 45 ST","U","U2","5301.2008",-122.313705,47.661274,"(47.661274, -122.313705)","HAZ - POTENTIAL THRT TO PHYS SAFETY (NO HAZMAT)","HAZARDS","HAZARDS","",666.044174195878,2016-09-08 06:02:11,2016-09-08
"902",51875,2127378,17000405226,2017405226,"030","ARMED ROBBERY","GUN CALLS","ROBBERY","11/01/2017 03:40:47 AM","47XX BLOCK OF 19 AV NE","U","U1","5301.1",-122.307205,47.663956,"(47.663956, -122.307205)","ROBBERY - IP/JO (INCLUDES STRONG ARM)","ROBBERY","ROBBERY","11/01/2017 01:42:22 AM",901.218572328988,2017-11-01 03:40:47,2017-11-01
"903",51877,2102948,17000360258,2017360258,"350","HAZARDS","HAZARDS","HAZARDS","09/27/2017 08:04:42 PM","NE 51 ST / 40 AV NE","U","U3","4200.202",-122.2848,47.666138,"(47.666138, -122.2848)","WIRES DOWN (PHONE, ELECTRICAL,ETC.)","HAZARDS","HAZARDS","09/27/2017 06:09:34 PM",2170.85829831363,2017-09-27 20:04:42,2017-09-28
"904",51897,1887318,16000430041,2016430041,"350","HAZARDS","HAZARDS","HAZARDS","11/29/2016 04:44:31 PM","NE 68 ST / 15 AV NE","U","U1","2600.3004",-122.31198,47.67804,"(47.67804, -122.31198)","HAZ - POTENTIAL THRT TO PHYS SAFETY (NO HAZMAT)","HAZARDS","HAZARDS","",2457.56031785313,2016-11-29 16:44:31,2016-11-30
"905",51937,1961561,17000102112,2017102112,"220","CRISIS COMPLAINT - GENERAL","CRISIS CALL","BEHAVIORAL HEALTH","03/23/2017 12:16:12 PM","42XX BLOCK OF UNIVERSITY WY NE","U","U2","5301.3008",-122.31319,47.659054,"(47.659054, -122.31319)","DISTURBANCE, MISCELLANEOUS/OTHER","DISTURBANCES","DISTURBANCES","03/23/2017 12:11:37 PM",438.325335850633,2017-03-23 12:16:12,2017-03-23
"906",51952,2090520,17000336942,2017336942,"220","CRISIS COMPLAINT - GENERAL","CRISIS CALL","BEHAVIORAL HEALTH","09/10/2017 07:15:40 PM","53XX BLOCK OF ROOSEVELT WY NE","U","U1","4400.4004",-122.317375,47.667843,"(47.667843, -122.317375)","DOWN - CHECK FOR PERSON DOWN","PERSON DOWN/INJURY","CASUALTIES","09/10/2017 12:29:11 PM",1443.50440954873,2017-09-10 19:15:40,2017-09-11
"907",51956,2017889,17000205920,2017205920,"041","HARASSMENT, THREATS","THREATS, HARASSMENT","THREATS, HARASSMENT","06/08/2017 09:21:51 PM","68XX BLOCK OF 62 AV NE","U","U3","4000.1014",-122.26223,47.67889,"(47.67889, -122.26223)","HARAS - NO BIAS, THREATS OR MALICIOUSNESS","THREATS, HARASSMENT","THREATS, HARASSMENT","06/08/2017 07:43:51 PM",4368.13337390337,2017-06-08 21:21:51,2017-06-09
"908",51965,1792328,16000263796,2016263796,"220","CRISIS COMPLAINT - GENERAL","CRISIS CALL","BEHAVIORAL HEALTH","07/23/2016 01:24:37 PM","NE 50 ST / UNIVERSITY WY NE","U","U1","4400.4009",-122.31307,47.664898,"(47.664898, -122.31307)","DISTURBANCE, MISCELLANEOUS/OTHER","DISTURBANCES","DISTURBANCES","",1025.0108407033,2016-07-23 13:24:37,2016-07-23
"909",51966,1828783,16000327246,2016327246,"220","CRISIS COMPLAINT - GENERAL","CRISIS CALL","BEHAVIORAL HEALTH","09/09/2016 04:18:14 PM","47XX BLOCK OF UNIVERSITY WY NE","U","U2","5301.2002",-122.31309,47.663998,"(47.663998, -122.31309)","CRISIS - PERSON IN BEHAVIORAL/EMOTIONAL CRISIS","BEHAVIORAL HEALTH","CRISIS CALL","09/09/2016 02:41:59 PM",929.234922041086,2016-09-09 16:18:14,2016-09-09
"910",52030,1903973,16000461196,2016461196,"041","HARASSMENT, THREATS","THREATS, HARASSMENT","THREATS, HARASSMENT","12/24/2016 07:15:13 PM","55XX BLOCK OF 15 AV NE","U","U1","4400.2028",-122.31188,47.66899,"(47.66899, -122.31188)","HARAS - NO BIAS, THREATS OR MALICIOUSNESS","THREATS, HARASSMENT","THREATS, HARASSMENT","12/24/2016 06:17:56 PM",1455.29804228053,2016-12-24 19:15:13,2016-12-25
"911",52034,1889389,16000433723,2016433723,"041","HARASSMENT, THREATS","THREATS, HARASSMENT","THREATS, HARASSMENT","12/02/2016 04:25:25 PM","75XX BLOCK OF 14 AV NE","U","U1","2600.4016",-122.31319,47.683968,"(47.683968, -122.31319)","HARAS - NO BIAS, THREATS OR MALICIOUSNESS","THREATS, HARASSMENT","THREATS, HARASSMENT","12/02/2016 01:08:08 PM",3121.91497375934,2016-12-02 16:25:25,2016-12-03
"912",52041,1995478,17000164831,2017164831,"220","CRISIS COMPLAINT - GENERAL","CRISIS CALL","BEHAVIORAL HEALTH","05/11/2017 03:15:04 AM","47XX BLOCK OF 16 AV NE","U","U2","5301.2",-122.310814,47.66398,"(47.66398, -122.310814)","NUISANCE - MISCHIEF","MISCELLANEOUS MISDEMEANORS","MISCELLANEOUS MISDEMEANORS","05/11/2017 12:41:52 AM",892.71896599991,2017-05-11 03:15:04,2017-05-11
"913",52047,1971867,17000121167,2017121167,"031","STRONG ARM ROBBERY","ROBBERY","ROBBERY","04/07/2017 06:03:34 AM","43XX BLOCK OF ROOSEVELT WY NE","U","U2","5200.5008",-122.317726,47.66058,"(47.66058, -122.317726)","ROBBERY - IP/JO (INCLUDES STRONG ARM)","ROBBERY","ROBBERY","04/07/2017 03:48:15 AM",800.699807898046,2017-04-07 06:03:34,2017-04-07
"914",52069,1851832,16000366492,2016366492,"350","HAZARDS","HAZARDS","HAZARDS","10/09/2016 07:31:28 PM","BURKE GILMAN TL / NE 77 ST","U","U3","2200.4007",-122.26571,47.68465,"(47.68465, -122.26571)","HAZ - POTENTIAL THRT TO PHYS SAFETY (NO HAZMAT)","HAZARDS","HAZARDS","10/09/2016 06:32:06 PM",4578.41072100007,2016-10-09 19:31:28,2016-10-10
"915",52087,1747824,16000187345,2016187345,"220","CRISIS COMPLAINT - GENERAL","CRISIS CALL","BEHAVIORAL HEALTH","05/28/2016 04:10:18 AM","52XX BLOCK OF 12 AV NE","U","U1","4400.4002",-122.3152,47.667503,"(47.667503, -122.3152)","CRISIS - PERSON IN BEHAVIORAL/EMOTIONAL CRISIS","BEHAVIORAL HEALTH","CRISIS CALL","",1348.7053255018,2016-05-28 04:10:18,2016-05-28
"916",52110,1792359,16000263741,2016263741,"220","CRISIS COMPLAINT - GENERAL","CRISIS CALL","BEHAVIORAL HEALTH","07/23/2016 12:58:38 PM","47XX BLOCK OF 21 AV NE","U","U1","4302.1007",-122.30545,47.663994,"(47.663994, -122.30545)","OVERDOSE - DRUG RELATED CASUALTY","PERSON DOWN/INJURY","CASUALTIES","07/23/2016 12:18:39 PM",939.423025875514,2016-07-23 12:58:38,2016-07-23
"917",52111,2053179,17000267132,2017267132,"350","HAZARDS","HAZARDS","HAZARDS","07/22/2017 08:52:07 AM","19 AV NE / NE 47 ST","U","U1","5301.1008",-122.30722,47.66305,"(47.66305, -122.30722)","POWER OUT - POLES AND TRANSFORMERS","HAZARDS","HAZARDS","",802.336494189875,2017-07-22 08:52:07,2017-07-22
"918",52132,1892365,16000439313,2016439313,"220","CRISIS COMPLAINT - GENERAL","CRISIS CALL","BEHAVIORAL HEALTH","12/06/2016 09:53:18 PM","48XX BLOCK OF SAND POINT WY NE","U","U3","4100.4008",-122.28316,47.66458,"(47.66458, -122.28316)","ASLT - IP/JO - WITH OR W/O WPNS (NO SHOOTINGS)","ASSAULTS","ASSAULTS","12/06/2016 08:31:58 PM",2196.47452707793,2016-12-06 21:53:18,2016-12-07
"919",52164,1914444,17000012094,201712094,"350","HAZARDS","HAZARDS","HAZARDS","01/10/2017 07:15:16 PM","SAND POINT WY NE / 50 AV NE","U","U3","4200.1033",-122.274124,47.668304,"(47.668304, -122.274124)","HAZ - POTENTIAL THRT TO PHYS SAFETY (NO HAZMAT)","HAZARDS","HAZARDS","",2988.61369915496,2017-01-10 19:15:16,2017-01-11
"920",52167,2090911,17000338002,2017338002,"220","CRISIS COMPLAINT - GENERAL","CRISIS CALL","BEHAVIORAL HEALTH","09/11/2017 11:24:09 AM","NE 71 ST / ROOSEVELT WY NE","U","U1","3600.1011",-122.31743,47.68017,"(47.68017, -122.31743)","CRISIS - PERSON IN BEHAVIORAL/EMOTIONAL CRISIS","BEHAVIORAL HEALTH","CRISIS CALL","09/11/2017 10:14:26 AM",2752.51773881,2017-09-11 11:24:09,2017-09-11
"921",52175,1926092,17000034053,201734053,"242","FIGHT DISTURBANCE","DISTURBANCES","DISTURBANCES","01/28/2017 09:44:02 AM","42XX BLOCK OF 8 AV NE","U","U2","5200.2001",-122.319786,47.65849,"(47.65849, -122.319786)","FIGHT - VERBAL/ORAL (NO WEAPONS)","DISTURBANCES","DISTURBANCES","",820.767156641322,2017-01-28 09:44:02,2017-01-28
"922",52192,1909952,17000003235,20173235,"350","HAZARDS","HAZARDS","HAZARDS","01/03/2017 07:43:35 PM","11 AV NE / NE 45 ST","U","U2","5301.2006",-122.31658,47.661293,"(47.661293, -122.31658)","HAZ - POTENTIAL THRT TO PHYS SAFETY (NO HAZMAT)","HAZARDS","HAZARDS","",793.197829416394,2017-01-03 19:43:35,2017-01-04
"923",52202,1800957,16000278712,2016278712,"220","CRISIS COMPLAINT - GENERAL","CRISIS CALL","BEHAVIORAL HEALTH","08/03/2016 10:11:07 AM","NE 80 ST / 15 AV NE","U","U1","2600.1017",-122.31216,47.686672,"(47.686672, -122.31216)","DISTURBANCE, MISCELLANEOUS/OTHER","DISTURBANCES","DISTURBANCES","",3416.07905620599,2016-08-03 10:11:07,2016-08-03
"924",52226,1814376,16000302439,2016302439,"220","CRISIS COMPLAINT - GENERAL","CRISIS CALL","BEHAVIORAL HEALTH","08/21/2016 05:07:45 PM","20 AV NE / NE RAVENNA BV","U","U1","4400.1029",-122.306496,47.669178,"(47.669178, -122.306496)","HAZ - POTENTIAL THRT TO PHYS SAFETY (NO HAZMAT)","HAZARDS","HAZARDS","",1482.45102362087,2016-08-21 17:07:45,2016-08-22
"925",52252,1996097,17000166090,2017166090,"220","CRISIS COMPLAINT - GENERAL","CRISIS CALL","BEHAVIORAL HEALTH","05/11/2017 10:03:58 PM","80XX BLOCK OF 40 AV NE","U","U3","2400.1015",-122.285255,47.687542,"(47.687542, -122.285255)","HARAS - NO BIAS, THREATS OR MALICIOUSNESS","THREATS, HARASSMENT","THREATS, HARASSMENT","05/11/2017 08:01:41 PM",3951.44050096815,2017-05-11 22:03:58,2017-05-12
"926",52262,2006494,17000185379,2017185379,"350","HAZARDS","HAZARDS","HAZARDS","05/25/2017 05:04:23 PM","UNIVERSITY WY NE / NE 45 ST","U","U2","5301.3001",-122.31313,47.661266,"(47.661266, -122.31313)","HAZ - POTENTIAL THRT TO PHYS SAFETY (NO HAZMAT)","HAZARDS","HAZARDS","",645.873447683438,2017-05-25 17:04:23,2017-05-26
"927",52267,2127519,17000405576,2017405576,"242","FIGHT DISTURBANCE","DISTURBANCES","DISTURBANCES","11/01/2017 11:07:16 AM","42XX BLOCK OF 8 AV NE","U","U2","5200.2001",-122.319786,47.65849,"(47.65849, -122.319786)","FIGHT - IP - PHYSICAL (NO WEAPONS)","DISTURBANCES","DISTURBANCES","",820.767156641322,2017-11-01 11:07:16,2017-11-01
"928",52281,1971681,17000120973,2017120973,"350","HAZARDS","HAZARDS","HAZARDS","04/06/2017 10:32:43 PM","15 AV NE / NE 50 ST","U","U1","5301.2",-122.311935,47.66489,"(47.66489, -122.311935)","HAZ - POTENTIAL THRT TO PHYS SAFETY (NO HAZMAT)","HAZARDS","HAZARDS","",1005.20324732383,2017-04-06 22:32:43,2017-04-07
"929",52283,1971687,17000120933,2017120933,"242","FIGHT DISTURBANCE","DISTURBANCES","DISTURBANCES","04/06/2017 10:37:37 PM","NE 43 ST / UNIVERSITY WY NE","U","U2","5301.3",-122.31317,47.659794,"(47.659794, -122.31317)","FIGHT - VERBAL/ORAL (NO WEAPONS)","DISTURBANCES","DISTURBANCES","04/06/2017 10:05:15 PM",503.925729388642,2017-04-06 22:37:37,2017-04-07
"930",52369,2017921,17000206057,2017206057,"220","CRISIS COMPLAINT - GENERAL","CRISIS CALL","BEHAVIORAL HEALTH","06/08/2017 10:14:32 PM","10XX BLOCK OF NE 64 ST","U","U1","4400.2003",-122.31651,47.67498,"(47.67498, -122.31651)","CRISIS - PERSON IN BEHAVIORAL/EMOTIONAL CRISIS","BEHAVIORAL HEALTH","CRISIS CALL","06/08/2017 08:47:54 PM",2174.95580708281,2017-06-08 22:14:32,2017-06-09
"931",52402,2006558,17000185432,2017185432,"350","HAZARDS","HAZARDS","HAZARDS","05/25/2017 06:17:55 PM","30XX BLOCK OF E LAURELHURST DR NE","U","U3","4100.602",-122.27606,47.649616,"(47.649616, -122.27606)","HARBOR - WATER DEBRIS, NAVIGATIONAL HAZARDS","HARBOR CALLS","HARBOR CALLS","05/25/2017 05:14:29 PM",2610.51810752676,2017-05-25 18:17:55,2017-05-26
"932",52426,1935591,17000054588,201754588,"242","FIGHT DISTURBANCE","DISTURBANCES","DISTURBANCES","02/14/2017 02:41:16 AM","89XX BLOCK OF LAKE CITY WY NE","U","U1","2100.3006",-122.30547,47.693478,"(47.693478, -122.30547)","FIGHT - IP - PHYSICAL (NO WEAPONS)","DISTURBANCES","DISTURBANCES","02/14/2017 02:39:06 AM",4177.92832562756,2017-02-14 02:41:16,2017-02-14
"933",52441,2041944,17000249760,2017249760,"242","FIGHT DISTURBANCE","DISTURBANCES","DISTURBANCES","07/10/2017 12:53:21 AM","42XX BLOCK OF UNIVERSITY WY NE","U","U2","5301.3009",-122.31319,47.659054,"(47.659054, -122.31319)","FIGHT - IP - PHYSICAL (NO WEAPONS)","DISTURBANCES","DISTURBANCES","07/09/2017 09:52:38 PM",438.325335850633,2017-07-10 00:53:21,2017-07-10
"934",52450,1935935,17000050929,201750929,"220","CRISIS COMPLAINT - GENERAL","CRISIS CALL","BEHAVIORAL HEALTH","02/11/2017 03:17:33 AM","12XX BLOCK OF NE 52 ST","U","U1","4400.4007",-122.314705,47.666443,"(47.666443, -122.314705)","CRISIS - PERSON IN BEHAVIORAL/EMOTIONAL CRISIS","BEHAVIORAL HEALTH","CRISIS CALL","02/11/2017 02:34:51 AM",1225.1467314761,2017-02-11 03:17:33,2017-02-11
"935",52485,1936389,17000050220,201750220,"242","FIGHT DISTURBANCE","DISTURBANCES","DISTURBANCES","02/10/2017 04:44:12 PM","NE 75 ST / 25 AV NE","U","U1","2500.2000",-122.30076,47.683044,"(47.683044, -122.30076)","FIGHT - IP - PHYSICAL (NO WEAPONS)","DISTURBANCES","DISTURBANCES","02/10/2017 03:47:44 PM",3077.66546947623,2017-02-10 16:44:12,2017-02-11
"936",52501,2041978,17000249953,2017249953,"242","FIGHT DISTURBANCE","DISTURBANCES","DISTURBANCES","07/10/2017 01:49:20 AM","15 AV NE / NE 62 ST","U","U1","4400.2008",-122.31192,47.673977,"(47.673977, -122.31192)","FIGHT - VERBAL/ORAL (NO WEAPONS)","DISTURBANCES","DISTURBANCES","",2006.99848378529,2017-07-10 01:49:20,2017-07-10
"937",52511,1936795,17000049728,201749728,"350","HAZARDS","HAZARDS","HAZARDS","02/10/2017 11:03:25 AM","53XX BLOCK OF SAND POINT WY NE","U","U3","4200.2024",-122.279465,47.667957,"(47.667957, -122.279465)","WIRES DOWN (PHONE, ELECTRICAL,ETC.)","HAZARDS","HAZARDS","",2618.54732141085,2017-02-10 11:03:25,2017-02-10
"938",52514,1962210,17000103285,2017103285,"220","CRISIS COMPLAINT - GENERAL","CRISIS CALL","BEHAVIORAL HEALTH","03/24/2017 11:55:51 AM","85XX BLOCK OF 20 AV NE","U","U1","2100.3008",-122.30686,47.69077,"(47.69077, -122.30686)","CRISIS - PERSON IN BEHAVIORAL/EMOTIONAL CRISIS","BEHAVIORAL HEALTH","CRISIS CALL","",3870.94656166164,2017-03-24 11:55:51,2017-03-24
"939",52541,2127535,17000405573,2017405573,"350","HAZARDS","HAZARDS","HAZARDS","11/01/2017 11:33:00 AM","NE 75 ST / 12 AV NE","U","U1","2600.4011",-122.315285,47.683086,"(47.683086, -122.315285)","HAZ - POTENTIAL THRT TO PHYS SAFETY (NO HAZMAT)","HAZARDS","HAZARDS","",3042.70395039211,2017-11-01 11:33:00,2017-11-01
"940",52551,1962129,17000103024,2017103024,"220","CRISIS COMPLAINT - GENERAL","CRISIS CALL","BEHAVIORAL HEALTH","03/24/2017 09:12:47 AM","47XX BLOCK OF BROOKLYN AV NE","U","U2","5301.2003",-122.314224,47.664005,"(47.664005, -122.314224)","FRAUD - FORGERY,BUNCO, SCAMS, ID THEFT, ETC","FRAUD CALLS","FRAUD CALLS","03/24/2017 05:26:54 AM",958.152960945758,2017-03-24 09:12:47,2017-03-24
"941",52572,2077790,17000313442,2017313442,"350","HAZARDS","HAZARDS","HAZARDS","08/25/2017 02:27:42 AM","NE WINDERMERE RD / SAND POINT WY NE","U","U3","4200.1029",-122.27109,47.669964,"(47.669964, -122.27109)","TRAFFIC - BO SIGNALS AND DOWN SIGNS","TRAFFIC RELATED CALLS","TRAFFIC RELATED CALLS","08/24/2017 12:47:19 PM",3276.21341316468,2017-08-25 02:27:42,2017-08-25
"942",52608,1971647,17000120889,2017120889,"350","HAZARDS","HAZARDS","HAZARDS","04/06/2017 09:44:34 PM","ROOSEVELT WY NE / NE 45 ST","U","U2","5301.3004",-122.31764,47.661297,"(47.661297, -122.31764)","HAZ - POTENTIAL THRT TO PHYS SAFETY (NO HAZMAT)","HAZARDS","HAZARDS","04/06/2017 08:36:04 PM",848.950730071322,2017-04-06 21:44:34,2017-04-07
"943",52632,1939190,17000058493,201758493,"242","FIGHT DISTURBANCE","DISTURBANCES","DISTURBANCES","02/16/2017 11:54:29 PM","43XX BLOCK OF UNIVERSITY WY NE","U","U2","5301.3",-122.31315,47.660534,"(47.660534, -122.31315)","FIGHT - VERBAL/ORAL (NO WEAPONS)","DISTURBANCES","DISTURBANCES","02/16/2017 11:51:40 PM",573.843522369168,2017-02-16 23:54:29,2017-02-17
"944",52634,2139750,17000428054,2017428054,"242","FIGHT DISTURBANCE","DISTURBANCES","DISTURBANCES","11/18/2017 09:14:22 PM","45XX BLOCK OF 18 AV NE","U","U1","5301.1007",-122.308365,47.66216,"(47.66216, -122.308365)","FIGHT - IP - PHYSICAL (NO WEAPONS)","DISTURBANCES","DISTURBANCES","",690.177529761912,2017-11-18 21:14:22,2017-11-19
"945",52635,1971744,17000120807,2017120807,"041","HARASSMENT, THREATS","THREATS, HARASSMENT","THREATS, HARASSMENT","04/06/2017 11:59:59 PM","45XX BLOCK OF UNIVERSITY WY NE","U","U2","5301.2009",-122.31312,47.66218,"(47.66218, -122.31312)","HARAS - NO BIAS, THREATS OR MALICIOUSNESS","THREATS, HARASSMENT","THREATS, HARASSMENT","04/06/2017 11:15:46 PM",738.963514898043,2017-04-06 23:59:59,2017-04-07
"946",52672,1939800,17000059842,201759842,"350","HAZARDS","HAZARDS","HAZARDS","02/18/2017 12:43:29 AM","SAND POINT WY NE / 40 AV NE","U","U3","4200.3029",-122.284775,47.663025,"(47.663025, -122.284775)","HAZ - POTENTIAL THRT TO PHYS SAFETY (NO HAZMAT)","HAZARDS","HAZARDS","",2014.77771671233,2017-02-18 00:43:29,2017-02-18
"947",52674,1939808,17000059854,201759854,"350","HAZARDS","HAZARDS","HAZARDS","02/18/2017 01:02:06 AM","25 AV NE / NE 55 ST","U","U1","4302.2",-122.30062,47.66852,"(47.66852, -122.30062)","HAZ - POTENTIAL THRT TO PHYS SAFETY (NO HAZMAT)","HAZARDS","HAZARDS","",1543.56487920368,2017-02-18 01:02:06,2017-02-18
"948",52729,1940708,17000061418,201761418,"041","HARASSMENT, THREATS","THREATS, HARASSMENT","THREATS, HARASSMENT","02/19/2017 02:28:21 PM","58XX BLOCK OF 16 AV NE","U","U1","4400.1011",-122.31077,47.671986,"(47.671986, -122.31077)","THREATS (INCLS IN-PERSON/BY PHONE/IN WRITING)","THREATS, HARASSMENT","THREATS, HARASSMENT","02/19/2017 12:45:58 PM",1779.94173664112,2017-02-19 14:28:21,2017-02-19
"949",52768,2006587,17000184862,2017184862,"041","HARASSMENT, THREATS","THREATS, HARASSMENT","THREATS, HARASSMENT","05/25/2017 06:49:45 PM","69XX BLOCK OF 62 AV NE","U","U3","4000.1014",-122.26223,47.67889,"(47.67889, -122.26223)","THREATS (INCLS IN-PERSON/BY PHONE/IN WRITING)","THREATS, HARASSMENT","THREATS, HARASSMENT","05/25/2017 01:12:44 PM",4368.13337390337,2017-05-25 18:49:45,2017-05-26
"950",52790,1894842,16000443938,2016443938,"242","FIGHT DISTURBANCE","DISTURBANCES","DISTURBANCES","12/10/2016 07:21:57 PM","10XX BLOCK OF NE 64 ST","U","U1","4400.2003",-122.31651,47.67498,"(47.67498, -122.31651)","ASLT - IP/JO - WITH OR W/O WPNS (NO SHOOTINGS)","ASSAULTS","ASSAULTS","12/10/2016 05:06:55 PM",2174.95580708281,2016-12-10 19:21:57,2016-12-11
"951",52814,1940887,17000061951,201761951,"220","CRISIS COMPLAINT - GENERAL","CRISIS CALL","BEHAVIORAL HEALTH","02/19/2017 08:19:20 PM","35XX BLOCK OF NE 89 ST","U","U3","2200.2013",-122.2893,47.693092,"(47.693092, -122.2893)","ASLT - WITH OR W/O WEAPONS (NO SHOOTINGS)","ASSAULTS","ASSAULTS","",4394.15838663299,2017-02-19 20:19:20,2017-02-20
"952",52895,1851738,16000366664,2016366664,"350","HAZARDS","HAZARDS","HAZARDS","10/09/2016 09:15:36 PM","UNIVERSITY BR / SB","U","U2","5200.2020",-122.319374,47.65404,"(47.65404, -122.319374)","TRAFFIC - BO SIGNALS AND DOWN SIGNS","TRAFFIC RELATED CALLS","TRAFFIC RELATED CALLS","",773.098824199806,2016-10-09 21:15:36,2016-10-10
"953",53054,1811688,16000297422,2016297422,"041","HARASSMENT, THREATS","THREATS, HARASSMENT","THREATS, HARASSMENT","08/17/2016 11:02:46 AM","47XX BLOCK OF BROOKLYN AV NE","U","U2","5301.2002",-122.314224,47.664005,"(47.664005, -122.314224)","THREATS (INCLS IN-PERSON/BY PHONE/IN WRITING)","THREATS, HARASSMENT","THREATS, HARASSMENT","08/17/2016 09:55:39 AM",958.152960945758,2016-08-17 11:02:46,2016-08-17
"954",53123,2030244,17000228585,2017228585,"220","CRISIS COMPLAINT - GENERAL","CRISIS CALL","BEHAVIORAL HEALTH","06/25/2017 03:59:19 AM","47XX BLOCK OF 12 AV NE","U","U2","5301.2004",-122.315254,47.664013,"(47.664013, -122.315254)","CRISIS - PERSON IN BEHAVIORAL/EMOTIONAL CRISIS","BEHAVIORAL HEALTH","CRISIS CALL","",990.218839131712,2017-06-25 03:59:19,2017-06-25
"955",53150,1862329,16000385004,2016385004,"350","HAZARDS","HAZARDS","HAZARDS","10/24/2016 03:59:05 PM","NE 45 ST / 27 AV NE","U","U3","5302.3007",-122.29778,47.66119,"(47.66119, -122.29778)","TRAFFIC - BO SIGNALS AND DOWN SIGNS","TRAFFIC RELATED CALLS","TRAFFIC RELATED CALLS","",1052.6251415884,2016-10-24 15:59:05,2016-10-24
"956",53160,1801135,16000278781,2016278781,"030","ARMED ROBBERY","GUN CALLS","ROBBERY","08/03/2016 05:42:26 PM","85XX BLOCK OF 35 AV NE","U","U3","2200.3023",-122.2907,47.690563,"(47.690563, -122.2907)","ROBBERY - IP/JO (INCLUDES STRONG ARM)","ROBBERY","ROBBERY","08/03/2016 11:05:46 AM",4093.97880721996,2016-08-03 17:42:26,2016-08-04
"957",53207,1828753,16000325564,2016325564,"220","CRISIS COMPLAINT - GENERAL","CRISIS CALL","BEHAVIORAL HEALTH","09/08/2016 11:32:27 AM","NE 47 ST / UNIVERSITY WY NE","U","U2","5301.2010",-122.3131,47.66309,"(47.66309, -122.3131)","HAZ - POTENTIAL THRT TO PHYS SAFETY (NO HAZMAT)","HAZARDS","HAZARDS","09/08/2016 08:27:11 AM",833.383876029379,2016-09-08 11:32:27,2016-09-08
"958",53214,1936212,17000050513,201750513,"041","HARASSMENT, THREATS","THREATS, HARASSMENT","THREATS, HARASSMENT","02/10/2017 08:20:15 PM","13XX BLOCK OF NE 45 ST","U","U2","5301.3001",-122.313705,47.661274,"(47.661274, -122.313705)","THREATS (INCLS IN-PERSON/BY PHONE/IN WRITING)","THREATS, HARASSMENT","THREATS, HARASSMENT","02/10/2017 07:45:46 PM",666.044174195878,2017-02-10 20:20:15,2017-02-11
"959",53418,2077726,17000314067,2017314067,"220","CRISIS COMPLAINT - GENERAL","CRISIS CALL","BEHAVIORAL HEALTH","08/25/2017 12:21:47 AM","47XX BLOCK OF 12 AV NE","U","U2","5301.2004",-122.315254,47.664013,"(47.664013, -122.315254)","CRISIS - PERSON IN BEHAVIORAL/EMOTIONAL CRISIS","BEHAVIORAL HEALTH","CRISIS CALL","",990.218839131712,2017-08-25 00:21:47,2017-08-25
"960",53441,1887209,16000429537,2016429537,"220","CRISIS COMPLAINT - GENERAL","CRISIS CALL","BEHAVIORAL HEALTH","11/29/2016 01:39:34 PM","47XX BLOCK OF BROOKLYN AV NE","U","U2","5301.2003",-122.314224,47.664005,"(47.664005, -122.314224)","CRISIS - PERSON IN BEHAVIORAL/EMOTIONAL CRISIS","BEHAVIORAL HEALTH","CRISIS CALL","11/29/2016 09:52:06 AM",958.152960945758,2016-11-29 13:39:34,2016-11-29
"961",53557,2042283,17000250550,2017250550,"220","CRISIS COMPLAINT - GENERAL","CRISIS CALL","BEHAVIORAL HEALTH","07/10/2017 01:18:41 PM","43XX BLOCK OF UNIVERSITY WY NE","U","U2","5301.3",-122.31315,47.660534,"(47.660534, -122.31315)","SUSPICIOUS STOP - OFFICER INITIATED ONVIEW","SUSPICIOUS CIRCUMSTANCES","SUSPICIOUS CIRCUMSTANCES","",573.843522369168,2017-07-10 13:18:41,2017-07-10
"962",53643,1792514,16000264655,2016264655,"242","FIGHT DISTURBANCE","DISTURBANCES","DISTURBANCES","07/24/2016 02:15:00 AM","NE 52 ST / 18 AV NE","U","U1","4400.3009",-122.308304,47.6664,"(47.6664, -122.308304)","FIGHT - VERBAL/ORAL (NO WEAPONS)","DISTURBANCES","DISTURBANCES","07/24/2016 02:09:15 AM",1159.79519336649,2016-07-24 02:15:00,2016-07-24
"963",53771,1811855,16000297824,2016297824,"350","HAZARDS","HAZARDS","HAZARDS","08/17/2016 03:39:13 PM","ROOSEVELT WY NE / NE 45 ST","U","U2","5301.2006",-122.31764,47.661297,"(47.661297, -122.31764)","HAZ - POTENTIAL THRT TO PHYS SAFETY (NO HAZMAT)","HAZARDS","HAZARDS","",848.950730071322,2016-08-17 15:39:13,2016-08-17
"964",53774,2065579,17000292478,2017292478,"220","CRISIS COMPLAINT - GENERAL","CRISIS CALL","BEHAVIORAL HEALTH","08/08/2017 05:35:44 PM","43XX BLOCK OF UNIVERSITY WY NE","U","U2","5301.3",-122.31315,47.660534,"(47.660534, -122.31315)","CRISIS - PERSON IN BEHAVIORAL/EMOTIONAL CRISIS","BEHAVIORAL HEALTH","CRISIS CALL","08/08/2017 03:59:47 PM",573.843522369168,2017-08-08 17:35:44,2017-08-09
"965",54206,1801302,16000279416,2016279416,"041","HARASSMENT, THREATS","THREATS, HARASSMENT","THREATS, HARASSMENT","08/03/2016 10:11:50 PM","50XX BLOCK OF 12 AV NE","U","U1","4400.4006",-122.31523,47.66568,"(47.66568, -122.31523)","ASLT - IP/JO - WITH OR W/O WPNS (NO SHOOTINGS)","ASSAULTS","ASSAULTS","08/03/2016 07:45:32 PM",1159.12682011732,2016-08-03 22:11:50,2016-08-04
"966",54248,1870576,16000400095,2016400095,"242","FIGHT DISTURBANCE","DISTURBANCES","DISTURBANCES","11/04/2016 08:27:55 PM","SAND POINT WY NE / NE 70 ST","U","U3","4000.1029",-122.26362,47.679363,"(47.679363, -122.26362)","FIGHT - JO - PHYSICAL (NO WEAPONS)","DISTURBANCES","DISTURBANCES","",4315.15923550807,2016-11-04 20:27:55,2016-11-05
"967",54342,1887636,16000430493,2016430493,"350","HAZARDS","HAZARDS","HAZARDS","11/30/2016 02:05:57 AM","42XX BLOCK OF PASADENA PL NE","U","U2","5200.1003",-122.321884,47.657818,"(47.657818, -122.321884)","NUISANCE - MISCHIEF","MISCELLANEOUS MISDEMEANORS","MISCELLANEOUS MISDEMEANORS","",951.977836740862,2016-11-30 02:05:57,2016-11-30
"968",54448,1904166,16000462303,2016462303,"031","STRONG ARM ROBBERY","ROBBERY","ROBBERY","12/26/2016 09:01:55 AM","47XX BLOCK OF UNIVERSITY WY NE","U","U2","5301.2001",-122.31309,47.663998,"(47.663998, -122.31309)","ASLT - IP/JO - WITH OR W/O WPNS (NO SHOOTINGS)","ASSAULTS","ASSAULTS","12/26/2016 07:01:18 AM",929.234922041086,2016-12-26 09:01:55,2016-12-26
"969",54671,1862793,16000385900,2016385900,"350","HAZARDS","HAZARDS","HAZARDS","10/25/2016 07:34:32 AM","LAKE CITY WY NE / NE 92 ST","U","U1","2100.2002",-122.305695,47.695747,"(47.695747, -122.305695)","WIRES DOWN (PHONE, ELECTRICAL,ETC.)","HAZARDS","HAZARDS","",4428.45804861896,2016-10-25 07:34:32,2016-10-25
"970",55021,2115514,17000383499,2017383499,"242","FIGHT DISTURBANCE","DISTURBANCES","DISTURBANCES","10/15/2017 02:16:47 PM","47XX BLOCK OF 30 AV NE","U","U3","4301.101",-122.295616,47.663918,"(47.663918, -122.295616)","FIGHT - IP - PHYSICAL (NO WEAPONS)","DISTURBANCES","DISTURBANCES","",1364.78474640243,2017-10-15 14:16:47,2017-10-15
"971",55407,1811913,16000298009,2016298009,"350","HAZARDS","HAZARDS","HAZARDS","08/17/2016 05:29:27 PM","NE 65 ST / RAVENNA AV NE","U","U1","2500.2013",-122.30382,47.675774,"(47.675774, -122.30382)","HAZ - POTENTIAL THRT TO PHYS SAFETY (NO HAZMAT)","HAZARDS","HAZARDS","",2239.55486731252,2016-08-17 17:29:27,2016-08-18
"972",55487,1792447,16000264766,2016264766,"220","CRISIS COMPLAINT - GENERAL","CRISIS CALL","BEHAVIORAL HEALTH","07/24/2016 06:17:34 AM","47XX BLOCK OF 19 AV NE","U","U1","5301.1001",-122.307205,47.663956,"(47.663956, -122.307205)","BURG - IP/JO - RES (INCL UNOCC STRUCTURES)","BURGLARY","RESIDENTIAL BURGLARIES","07/24/2016 04:07:31 AM",901.218572328988,2016-07-24 06:17:34,2016-07-24
"973",55648,1812276,16000298507,2016298507,"031","STRONG ARM ROBBERY","ROBBERY","ROBBERY","08/18/2016 03:28:22 AM","NE 50 ST / UNIVERSITY WY NE","U","U1","4400.4009",-122.31307,47.664898,"(47.664898, -122.31307)","ROBBERY (INCLUDES STRONG ARM)","ROBBERY","ROBBERY","08/18/2016 02:49:06 AM",1025.0108407033,2016-08-18 03:28:22,2016-08-18
"974",55660,1801306,16000279269,2016279269,"030","ARMED ROBBERY","GUN CALLS","ROBBERY","08/03/2016 10:04:37 PM","85XX BLOCK OF 35 AV NE","U","U3","2200.3023",-122.2907,47.690563,"(47.690563, -122.2907)","ASLT - WITH OR W/O WEAPONS (NO SHOOTINGS)","ASSAULTS","ASSAULTS","08/03/2016 05:29:34 PM",4093.97880721996,2016-08-03 22:04:37,2016-08-04
"975",55710,1904511,16000461726,2016461726,"350","HAZARDS","HAZARDS","HAZARDS","12/25/2016 12:01:46 PM","NE 63 ST / 15 AV NE","U","U1","4400.2000",-122.31192,47.674767,"(47.674767, -122.31192)","HAZ - POTENTIAL THRT TO PHYS SAFETY (NO HAZMAT)","HAZARDS","HAZARDS","12/25/2016 11:46:09 AM",2094.48788050427,2016-12-25 12:01:46,2016-12-25
"976",55749,1748061,16000187683,2016187683,"041","HARASSMENT, THREATS","THREATS, HARASSMENT","THREATS, HARASSMENT","05/28/2016 02:29:01 PM","55XX BLOCK OF UNIVERSITY WY NE","U","U1","4400.2024",-122.31302,47.668995,"(47.668995, -122.31302)","HARAS - NO BIAS, THREATS OR MALICIOUSNESS","THREATS, HARASSMENT","THREATS, HARASSMENT","05/28/2016 12:38:34 PM",1468.82405401477,2016-05-28 14:29:01,2016-05-28
"977",55824,1937162,17000055450,201755450,"350","HAZARDS","HAZARDS","HAZARDS","02/14/2017 07:25:16 PM","NE PRINCETON WY / PRINCETON AV NE","U","U3","4200.1006",-122.27482,47.674862,"(47.674862, -122.27482)","HAZ - POTENTIAL THRT TO PHYS SAFETY (NO HAZMAT)","HAZARDS","HAZARDS","",3344.02079892905,2017-02-14 19:25:16,2017-02-15
"978",55829,1887735,16000430748,2016430748,"242","FIGHT DISTURBANCE","DISTURBANCES","DISTURBANCES","11/30/2016 07:49:56 AM","NE 80 ST / 17 AV NE","U","U1","2600.1007",-122.310005,47.686676,"(47.686676, -122.310005)","FIGHT - VERBAL/ORAL (NO WEAPONS)","DISTURBANCES","DISTURBANCES","",3410.88895519096,2016-11-30 07:49:56,2016-11-30
"979",55856,1863130,16000386508,2016386508,"220","CRISIS COMPLAINT - GENERAL","CRISIS CALL","BEHAVIORAL HEALTH","10/25/2016 04:30:17 PM","10XX BLOCK OF NE 64 ST","U","U1","4400.2003",-122.31642,47.675133,"(47.675133, -122.31642)","CRISIS - PERSON IN BEHAVIORAL/EMOTIONAL CRISIS","BEHAVIORAL HEALTH","CRISIS CALL","",2189.85055519649,2016-10-25 16:30:17,2016-10-25
"980",56036,2091012,17000338181,2017338181,"220","CRISIS COMPLAINT - GENERAL","CRISIS CALL","BEHAVIORAL HEALTH","09/11/2017 01:52:48 PM","47XX BLOCK OF BROOKLYN AV NE","U","U2","5301.2003",-122.314224,47.664005,"(47.664005, -122.314224)","CRISIS - PERSON IN BEHAVIORAL/EMOTIONAL CRISIS","BEHAVIORAL HEALTH","CRISIS CALL","09/11/2017 12:49:08 PM",958.152960945758,2017-09-11 13:52:48,2017-09-11
"981",56050,1870640,16000400209,2016400209,"242","FIGHT DISTURBANCE","DISTURBANCES","DISTURBANCES","11/04/2016 10:02:59 PM","13XX BLOCK OF NE 45 ST","U","U2","5301.3001",-122.313896,47.66097,"(47.66097, -122.313896)","HARAS - NO BIAS, THREATS OR MALICIOUSNESS","THREATS, HARASSMENT","THREATS, HARASSMENT","",643.729749583472,2016-11-04 22:02:59,2016-11-05
"982",56118,1985333,17000146506,2017146506,"242","FIGHT DISTURBANCE","DISTURBANCES","DISTURBANCES","04/27/2017 11:16:36 AM","7 AV NE / NE 50 ST","U","U1","5200.5002",-122.3207,47.664955,"(47.664955, -122.3207)","FIGHT - VERBAL/ORAL (NO WEAPONS)","DISTURBANCES","DISTURBANCES","04/27/2017 10:33:58 AM",1303.47990792526,2017-04-27 11:16:36,2017-04-27
"983",56141,2091075,17000338196,2017338196,"220","CRISIS COMPLAINT - GENERAL","CRISIS CALL","BEHAVIORAL HEALTH","09/11/2017 03:17:57 PM","12 AV NE / NE 69 ST","U","U1","2600.3005",-122.315704,47.67875,"(47.67875, -122.315704)","DISTURBANCE, MISCELLANEOUS/OTHER","DISTURBANCES","DISTURBANCES","09/11/2017 01:04:03 PM",2571.99004149807,2017-09-11 15:17:57,2017-09-11
"984",56192,1870678,16000399859,2016399859,"350","HAZARDS","HAZARDS","HAZARDS","11/04/2016 10:15:28 PM","49 AV NE / NE 45 ST","U","U3","4100.3007",-122.274666,47.661278,"(47.661278, -122.274666)","WATER FLOODS (BROKEN MAINS/HYDRANTS, NO HAZ)","PUBLIC WATER","PUBLIC WATER","11/04/2016 05:03:46 PM",2681.59865645567,2016-11-04 22:15:28,2016-11-05
"985",56321,1748105,16000187894,2016187894,"242","FIGHT DISTURBANCE","DISTURBANCES","DISTURBANCES","05/28/2016 04:15:35 PM","7 AV NE / NE 45 ST OFF RP","U","U2","5200.1",-122.32078,47.660606,"(47.660606, -122.32078)","ASLT - WITH OR W/O WEAPONS (NO SHOOTINGS)","ASSAULTS","ASSAULTS","",990.053347544946,2016-05-28 16:15:35,2016-05-28
"986",56546,1781408,16000245050,2016245050,"031","STRONG ARM ROBBERY","ROBBERY","ROBBERY","07/08/2016 11:29:21 PM","42XX BLOCK OF BROOKLYN AV NE","U","U2","5301.3007",-122.31435,47.65907,"(47.65907, -122.31435)","ROBBERY (INCLUDES STRONG ARM)","ROBBERY","ROBBERY","",499.238589913424,2016-07-08 23:29:21,2016-07-09
"987",56833,2077976,17000314557,2017314557,"031","STRONG ARM ROBBERY","ROBBERY","ROBBERY","08/25/2017 10:39:30 AM","47XX BLOCK OF BROOKLYN AV NE","U","U2","5301.2002",-122.314224,47.664005,"(47.664005, -122.314224)","THEFT (DOES NOT INCLUDE SHOPLIFT OR SVCS)","OTHER PROPERTY","THEFT","08/25/2017 08:48:36 AM",958.152960945758,2017-08-25 10:39:30,2017-08-25
"988",56933,2115557,17000383360,2017383360,"220","CRISIS COMPLAINT - GENERAL","CRISIS CALL","BEHAVIORAL HEALTH","10/15/2017 03:36:10 PM","UNIVERSITY WY NE / NE 56 ST","U","U1","4400.202",-122.31303,47.66944,"(47.66944, -122.31303)","CRISIS - PERSON IN BEHAVIORAL/EMOTIONAL CRISIS","BEHAVIORAL HEALTH","CRISIS CALL","10/15/2017 11:51:01 AM",1517.64972687433,2017-10-15 15:36:10,2017-10-15
"989",56962,1781432,16000245061,2016245061,"350","HAZARDS","HAZARDS","HAZARDS","07/09/2016 12:02:37 AM","53XX BLOCK OF 7 AV NE","U","U1","4500.1012",-122.32066,47.667866,"(47.667866, -122.32066)","FIREWORKS - NUISANCE (NO HAZARD)","MISCELLANEOUS MISDEMEANORS","MISCELLANEOUS MISDEMEANORS","",1563.08169551112,2016-07-09 00:02:37,2016-07-09
"990",57247,1870801,16000400374,2016400374,"220","CRISIS COMPLAINT - GENERAL","CRISIS CALL","BEHAVIORAL HEALTH","11/05/2016 02:24:52 AM","60XX BLOCK OF 51 AV NE","U","U3","4200.1005",-122.27306,47.67267,"(47.67267, -122.27306)","DISTURBANCE, MISCELLANEOUS/OTHER","DISTURBANCES","DISTURBANCES","11/05/2016 01:00:44 AM",3305.45939358526,2016-11-05 02:24:52,2016-11-05
"991",57300,1962790,17000104193,2017104193,"220","CRISIS COMPLAINT - GENERAL","CRISIS CALL","BEHAVIORAL HEALTH","03/25/2017 03:23:27 AM","39XX BLOCK OF NE 45 ST","U","U3","4100.5002",-122.28599,47.661263,"(47.661263, -122.28599)","CRISIS - PERSON IN BEHAVIORAL/EMOTIONAL CRISIS","BEHAVIORAL HEALTH","CRISIS CALL","03/25/2017 01:07:00 AM",1860.40706322282,2017-03-25 03:23:27,2017-03-25
"992",57571,2065567,17000292578,2017292578,"350","HAZARDS","HAZARDS","HAZARDS","08/08/2017 05:10:44 PM","NE 66 ST / 14 AV NE","U","U1","2600.3009",-122.31314,47.676517,"(47.676517, -122.31314)","WATER FLOODS (BROKEN MAINS/HYDRANTS, NO HAZ)","PUBLIC WATER","PUBLIC WATER","",2297.4818961333,2017-08-08 17:10:44,2017-08-09
"993",57611,1972269,17000121678,2017121678,"220","CRISIS COMPLAINT - GENERAL","CRISIS CALL","BEHAVIORAL HEALTH","04/07/2017 07:17:56 PM","51XX BLOCK OF 27 AV NE","U","U3","4301.1004",-122.2985,47.666744,"(47.666744, -122.2985)","CRISIS - PERSON IN BEHAVIORAL/EMOTIONAL CRISIS","BEHAVIORAL HEALTH","CRISIS CALL","04/07/2017 01:07:47 PM",1452.45839254501,2017-04-07 19:17:56,2017-04-08
"994",57700,1812105,16000297646,2016297646,"350","HAZARDS","HAZARDS","HAZARDS","08/17/2016 10:14:58 PM","45XX BLOCK OF UNIVERSITY WY NE","U","U2","5301.2010",-122.31312,47.66218,"(47.66218, -122.31312)","WATER FLOODS (BROKEN MAINS/HYDRANTS, NO HAZ)","PUBLIC WATER","PUBLIC WATER","",738.963514898043,2016-08-17 22:14:58,2016-08-18
"995",57754,1985380,17000146598,2017146598,"350","HAZARDS","HAZARDS","HAZARDS","04/27/2017 12:10:22 PM","MONTLAKE BV NE / NE PACIFIC ST","U","U2","5302.3",-122.30459,47.648994,"(47.648994, -122.30459)","HAZ - POTENTIAL THRT TO PHYS SAFETY (NO HAZMAT)","HAZARDS","HAZARDS","",861.874216742478,2017-04-27 12:10:22,2017-04-27
"996",57759,1870775,16000400407,2016400407,"242","FIGHT DISTURBANCE","DISTURBANCES","DISTURBANCES","11/05/2016 01:39:49 AM","45XX BLOCK OF 20 AV NE","U","U1","4302.1009",-122.30619,47.661453,"(47.661453, -122.30619)","FIGHT - IP - PHYSICAL (NO WEAPONS)","DISTURBANCES","DISTURBANCES","",655.28634129916,2016-11-05 01:39:49,2016-11-05
"997",57797,1862964,16000386247,2016386247,"220","CRISIS COMPLAINT - GENERAL","CRISIS CALL","BEHAVIORAL HEALTH","10/25/2016 12:48:55 PM","43XX BLOCK OF UNIVERSITY WY NE","U","U2","5301.3001",-122.31346,47.660603,"(47.660603, -122.31346)","SUSPICIOUS PERSON, VEHICLE OR INCIDENT","SUSPICIOUS CIRCUMSTANCES","SUSPICIOUS CIRCUMSTANCES","10/25/2016 11:48:45 AM",591.946900768605,2016-10-25 12:48:55,2016-10-25
"998",57800,1829368,16000330447,2016330447,"030","ARMED ROBBERY","GUN CALLS","ROBBERY","09/12/2016 02:02:00 PM","22XX BLOCK OF NE 88 ST","U","U1","2100.3008",-122.304825,47.691467,"(47.691467, -122.304825)","WEAPN-IP/JO-GUN,DEADLY WPN (NO THRT/ASLT/DIST)","WEAPONS CALLS","WEAPONS CALLS","09/12/2016 05:09:56 AM",3958.95844087448,2016-09-12 14:02:00,2016-09-12
"999",57861,1926684,17000035793,201735793,"220","CRISIS COMPLAINT - GENERAL","CRISIS CALL","BEHAVIORAL HEALTH","01/29/2017 10:42:09 PM","45XX BLOCK OF 7 AV NE","U","U2","5200.5005",-122.320724,47.661564,"(47.661564, -122.320724)","CRISIS - PERSON IN BEHAVIORAL/EMOTIONAL CRISIS","BEHAVIORAL HEALTH","CRISIS CALL","01/29/2017 08:51:12 PM",1045.71564454053,2017-01-29 22:42:09,2017-01-30
"1000",58051,2030594,17000229472,2017229472,"220","CRISIS COMPLAINT - GENERAL","CRISIS CALL","BEHAVIORAL HEALTH","06/25/2017 07:14:48 PM","50XX BLOCK OF 7 AV NE","U","U1","4500.1011",-122.320694,47.66631,"(47.66631, -122.320694)","BURG - IP/JO - RES (INCL UNOCC STRUCTURES)","BURGLARY","RESIDENTIAL BURGLARIES","06/25/2017 05:51:44 PM",1421.61092789954,2017-06-25 19:14:48,2017-06-26
"1001",58120,1951062,17000082252,201782252,"350","HAZARDS","HAZARDS","HAZARDS","03/07/2017 10:09:14 PM","LAKE CITY WY NE / 18 AV NE","U","U1","2600.1002",-122.30899,47.689735,"(47.689735, -122.30899)","HAZ - POTENTIAL THRT TO PHYS SAFETY (NO HAZMAT)","HAZARDS","HAZARDS","",3750.98627569151,2017-03-07 22:09:14,2017-03-08
"1002",58163,2077953,17000314558,2017314558,"220","CRISIS COMPLAINT - GENERAL","CRISIS CALL","BEHAVIORAL HEALTH","08/25/2017 09:33:41 AM","45XX BLOCK OF ROOSEVELT WY NE","U","U2","5301.2006",-122.31745,47.6622,"(47.6622, -122.31745)","DISTURBANCE, MISCELLANEOUS/OTHER","DISTURBANCES","DISTURBANCES","",912.030393512361,2017-08-25 09:33:41,2017-08-25
"1003",58216,1863015,16000386324,2016386324,"220","CRISIS COMPLAINT - GENERAL","CRISIS CALL","BEHAVIORAL HEALTH","10/25/2016 01:35:55 PM","73XX BLOCK OF ROOSEVELT WY NE","U","U1","2600.2018",-122.31675,47.682167,"(47.682167, -122.31675)","UNKNOWN - COMPLAINT OF UNKNOWN NATURE","SUSPICIOUS CIRCUMSTANCES","SUSPICIOUS CIRCUMSTANCES","10/25/2016 12:54:08 PM",2959.8603121526,2016-10-25 13:35:55,2016-10-25
"1004",58794,1895425,16000444814,2016444814,"350","HAZARDS","HAZARDS","HAZARDS","12/11/2016 03:49:46 PM","62XX BLOCK OF 36 AV NE","U","U3","4200.4005",-122.289154,47.67488,"(47.67488, -122.289154)","WIRES DOWN (PHONE, ELECTRICAL,ETC.)","HAZARDS","HAZARDS","",2596.4547126661,2016-12-11 15:49:46,2016-12-11
"1005",58888,1972334,17000121787,2017121787,"350","HAZARDS","HAZARDS","HAZARDS","04/07/2017 08:49:23 PM","NE 90 ST / RAVENNA AV NE","U","U1","2100.3002",-122.30356,47.693916,"(47.693916, -122.30356)","TREES DOWN, OBSTRUCTING PUBLIC PROP (NO HAZ)","TREES DOWN","TREES DOWN","04/07/2017 02:28:13 PM",4239.18476623441,2017-04-07 20:49:23,2017-04-08
"1006",58957,1926872,17000035455,201735455,"350","HAZARDS","HAZARDS","HAZARDS","01/29/2017 01:51:16 PM","38 AV NE / NE 45 ST","U","U3","4100.5019",-122.28722,47.66137,"(47.66137, -122.28722)","POWER OUT - POLES AND TRANSFORMERS","HAZARDS","HAZARDS","",1776.90181166702,2017-01-29 13:51:16,2017-01-29
"1007",59016,1926789,17000035624,201735624,"220","CRISIS COMPLAINT - GENERAL","CRISIS CALL","BEHAVIORAL HEALTH","01/29/2017 05:57:45 PM","47XX BLOCK OF 12 AV NE","U","U2","5301.2004",-122.315254,47.664013,"(47.664013, -122.315254)","CRISIS - PERSON IN BEHAVIORAL/EMOTIONAL CRISIS","BEHAVIORAL HEALTH","CRISIS CALL","",990.218839131712,2017-01-29 17:57:45,2017-01-30
"1008",59084,1792662,16000264370,2016264370,"220","CRISIS COMPLAINT - GENERAL","CRISIS CALL","BEHAVIORAL HEALTH","07/24/2016 01:41:54 AM","18XX BLOCK OF NE 65 ST","U","U1","2600.3019",-122.30818,47.67578,"(47.67578, -122.30818)","OVERDOSE - DRUG RELATED CASUALTY","PERSON DOWN/INJURY","CASUALTIES","07/23/2016 10:16:21 PM",2201.44941563736,2016-07-24 01:41:54,2016-07-24
"1009",59143,2127852,17000405953,2017405953,"041","HARASSMENT, THREATS","THREATS, HARASSMENT","THREATS, HARASSMENT","11/01/2017 07:27:34 PM","75XX BLOCK OF 12 AV NE","U","U1","2600.4014",-122.31529,47.683994,"(47.683994, -122.31529)","THREATS (INCLS IN-PERSON/BY PHONE/IN WRITING)","THREATS, HARASSMENT","THREATS, HARASSMENT","11/01/2017 04:15:23 PM",3142.70920484285,2017-11-01 19:27:34,2017-11-02
"1010",59193,2030714,17000229718,2017229718,"242","FIGHT DISTURBANCE","DISTURBANCES","DISTURBANCES","06/25/2017 09:54:19 PM","71XX BLOCK OF 62 AV NE","U","U3","4000.1014",-122.26223,47.67889,"(47.67889, -122.26223)","FIGHT - IP - PHYSICAL (NO WEAPONS)","DISTURBANCES","DISTURBANCES","",4368.13337390337,2017-06-25 21:54:19,2017-06-26
"1011",59546,1812552,16000298897,2016298897,"220","CRISIS COMPLAINT - GENERAL","CRISIS CALL","BEHAVIORAL HEALTH","08/18/2016 02:02:13 PM","NE CAMPUS PY / BROOKLYN AV NE","U","U2","5302.1002",-122.31442,47.656223,"(47.656223, -122.31442)","SEX IN PUBLIC PLACE/VIEW (INCL MASTURBATION)","MISCELLANEOUS MISDEMEANORS","MISCELLANEOUS MISDEMEANORS","08/18/2016 11:59:57 AM",370.420834762338,2016-08-18 14:02:13,2016-08-18
"1012",59572,1904969,16000462945,2016462945,"041","HARASSMENT, THREATS","THREATS, HARASSMENT","THREATS, HARASSMENT","12/26/2016 10:48:04 PM","45XX BLOCK OF UNIVERSITY WY NE","U","U2","5301.2009",-122.31312,47.66218,"(47.66218, -122.31312)","HARAS - NO BIAS, THREATS OR MALICIOUSNESS","THREATS, HARASSMENT","THREATS, HARASSMENT","12/26/2016 09:32:02 PM",738.963514898043,2016-12-26 22:48:04,2016-12-27
"1013",59704,1642532,16000001591,20161591,"350","HAZARDS","HAZARDS","HAZARDS","01/02/2016 01:30:42 PM","21XX BLOCK OF NE 61 ST","U","U1","4301.3015",-122.30516,47.67266,"(47.67266, -122.30516)","POWER OUT - POLES AND TRANSFORMERS","HAZARDS","HAZARDS","",1880.78509790067,2016-01-02 13:30:42,2016-01-02
"1014",59763,1643778,16000003733,20163733,"350","HAZARDS","HAZARDS","HAZARDS","01/04/2016 02:39:19 PM","NE 43 ST / 9 AV NE","U","U2","5200.2001",-122.31879,47.659454,"(47.659454, -122.31879)","HAZ - POTENTIAL THRT TO PHYS SAFETY (NO HAZMAT)","HAZARDS","HAZARDS","",796.531402175194,2016-01-04 14:39:19,2016-01-04
"1015",59769,1643899,16000003994,20163994,"350","HAZARDS","HAZARDS","HAZARDS","01/04/2016 06:21:28 PM","12 AV NE / NE CAMPUS PY","U","U2","5302.1002",-122.315575,47.656235,"(47.656235, -122.315575)","HAZ - POTENTIAL THRT TO PHYS SAFETY (NO HAZMAT)","HAZARDS","HAZARDS","",457.100959844805,2016-01-04 18:21:28,2016-01-05
"1016",59786,1644105,16000004259,20164259,"350","HAZARDS","HAZARDS","HAZARDS","01/05/2016 12:21:24 AM","UNIVERSITY WY NE / NE 55 ST","U","U1","4400.2028",-122.31302,47.668545,"(47.668545, -122.31302)","HAZ - POTENTIAL THRT TO PHYS SAFETY (NO HAZMAT)","HAZARDS","HAZARDS","",1419.63730229997,2016-01-05 00:21:24,2016-01-05
"1017",59787,1644108,16000004229,20164229,"220","CRISIS COMPLAINT - GENERAL","CRISIS CALL","BEHAVIORAL HEALTH","01/05/2016 12:11:17 AM","41XX BLOCK OF UNIVERSITY WY NE","U","U2","5301.4001",-122.313225,47.657574,"(47.657574, -122.313225)","DISTURBANCE, MISCELLANEOUS/OTHER","DISTURBANCES","DISTURBANCES","",330.036787270645,2016-01-05 00:11:17,2016-01-05
"1018",59788,1644117,16000003984,20163984,"350","HAZARDS","HAZARDS","HAZARDS","01/05/2016 12:39:52 AM","NE 47 ST / 21 AV NE","U","U1","4302.1008",-122.305466,47.66307,"(47.66307, -122.305466)","WATER FLOODS (BROKEN MAINS/HYDRANTS, NO HAZ)","PUBLIC WATER","PUBLIC WATER","",842.449736750376,2016-01-05 00:39:52,2016-01-05
"1019",59869,1646021,16000007629,20167629,"350","HAZARDS","HAZARDS","HAZARDS","01/07/2016 03:46:11 PM","18 AV NE / NE 47 ST","U","U1","5301.1007",-122.30836,47.663055,"(47.663055, -122.30836)","HAZ - POTENTIAL THRT TO PHYS SAFETY (NO HAZMAT)","HAZARDS","HAZARDS","",789.061204019554,2016-01-07 15:46:11,2016-01-07
"1020",59890,1646421,16000008225,20168225,"242","FIGHT DISTURBANCE","DISTURBANCES","DISTURBANCES","01/08/2016 03:11:45 AM","42XX BLOCK OF UNIVERSITY WY NE","U","U2","5301.3008",-122.31319,47.659054,"(47.659054, -122.31319)","ASLT - WITH OR W/O WEAPONS (NO SHOOTINGS)","ASSAULTS","ASSAULTS","01/08/2016 12:31:14 AM",438.325335850633,2016-01-08 03:11:45,2016-01-08
"1021",59895,1646295,16000008042,20168042,"041","HARASSMENT, THREATS","THREATS, HARASSMENT","THREATS, HARASSMENT","01/07/2016 10:04:05 PM","47XX BLOCK OF 34 AV NE","U","U3","4200.3044",-122.29126,47.66378,"(47.66378, -122.29126)","THREATS (INCLS IN-PERSON/BY PHONE/IN WRITING)","THREATS, HARASSMENT","THREATS, HARASSMENT","01/07/2016 08:54:54 PM",1620.30383526166,2016-01-07 22:04:05,2016-01-08
"1022",59922,1646774,16000008824,20168824,"220","CRISIS COMPLAINT - GENERAL","CRISIS CALL","BEHAVIORAL HEALTH","01/08/2016 03:58:26 PM","45XX BLOCK OF BROOKLYN AV NE","U","U2","5301.2008",-122.31426,47.66219,"(47.66219, -122.31426)","DISTURBANCE, MISCELLANEOUS/OTHER","DISTURBANCES","DISTURBANCES","01/08/2016 02:11:20 PM",775.56356285686,2016-01-08 15:58:26,2016-01-08
"1023",59964,1647527,16000010056,201610056,"041","HARASSMENT, THREATS","THREATS, HARASSMENT","THREATS, HARASSMENT","01/09/2016 04:13:27 PM","UNIVERSITY WY NE / NE 41 ST","U","U2","5301.4000",-122.31325,47.656834,"(47.656834, -122.31325)","THREATS (INCLS IN-PERSON/BY PHONE/IN WRITING)","THREATS, HARASSMENT","THREATS, HARASSMENT","01/09/2016 01:37:56 PM",296.567307084639,2016-01-09 16:13:27,2016-01-10
"1024",59980,1647823,16000010614,201610614,"220","CRISIS COMPLAINT - GENERAL","CRISIS CALL","BEHAVIORAL HEALTH","01/10/2016 01:48:53 AM","14XX BLOCK OF NE 42 ST","U","U2","5301.3009",-122.31264,47.65831,"(47.65831, -122.31264)","CRISIS - PERSON IN BEHAVIORAL/EMOTIONAL CRISIS","BEHAVIORAL HEALTH","CRISIS CALL","01/10/2016 12:23:23 AM",348.711033535852,2016-01-10 01:48:53,2016-01-10
"1025",59982,1647850,16000010660,201610660,"242","FIGHT DISTURBANCE","DISTURBANCES","DISTURBANCES","01/10/2016 02:47:25 AM","45XX BLOCK OF UNIVERSITY WY NE","U","U2","5301.2010",-122.31312,47.66218,"(47.66218, -122.31312)","UNKNOWN - COMPLAINT OF UNKNOWN NATURE","SUSPICIOUS CIRCUMSTANCES","SUSPICIOUS CIRCUMSTANCES","01/10/2016 01:29:54 AM",738.963514898043,2016-01-10 02:47:25,2016-01-10
"1026",60004,1648254,16000011431,201611431,"350","HAZARDS","HAZARDS","HAZARDS","01/10/2016 08:00:14 PM","ROOSEVELT WY NE / NE 57 ST","U","U1","4500.1004",-122.31737,47.67005,"(47.67005, -122.31737)","HAZ - POTENTIAL THRT TO PHYS SAFETY (NO HAZMAT)","HAZARDS","HAZARDS","",1670.23173085174,2016-01-10 20:00:14,2016-01-11
"1027",60011,1748690,16000188565,2016188565,"030","ARMED ROBBERY","GUN CALLS","ROBBERY","05/29/2016 12:19:09 PM","17 AV NE / NE 55 ST","U","U1","4400.3002",-122.30942,47.66854,"(47.66854, -122.30942)","ROBBERY - IP/JO (INCLUDES STRONG ARM)","ROBBERY","ROBBERY","05/29/2016 03:47:03 AM",1394.25716601234,2016-05-29 12:19:09,2016-05-29
"1028",60017,1648456,16000011625,201611625,"220","CRISIS COMPLAINT - GENERAL","CRISIS CALL","BEHAVIORAL HEALTH","01/11/2016 05:23:40 AM","65XX BLOCK OF SAND POINT WY NE","U","U3","4000.1028",-122.26355,47.676197,"(47.676197, -122.26355)","CRISIS - PERSON IN BEHAVIORAL/EMOTIONAL CRISIS","BEHAVIORAL HEALTH","CRISIS CALL","01/11/2016 01:03:34 AM",4117.37052735623,2016-01-11 05:23:40,2016-01-11
"1029",60018,1648505,16000011741,201611741,"041","HARASSMENT, THREATS","THREATS, HARASSMENT","THREATS, HARASSMENT","01/11/2016 07:40:45 AM","24XX BLOCK OF NE 75 ST","U","U1","2500.2000",-122.3013,47.68305,"(47.68305, -122.3013)","HARAS - NO BIAS, THREATS OR MALICIOUSNESS","THREATS, HARASSMENT","THREATS, HARASSMENT","01/11/2016 05:53:23 AM",3069.92563438286,2016-01-11 07:40:45,2016-01-11
"1030",60030,1648677,16000011948,201611948,"350","HAZARDS","HAZARDS","HAZARDS","01/11/2016 12:48:08 PM","23XX BLOCK OF NE BLAKELEY ST","U","U1","4302.2007",-122.30267,47.66536,"(47.66536, -122.30267)","HAZ - POTENTIAL THRT TO PHYS SAFETY (NO HAZMAT)","HAZARDS","HAZARDS","",1160.26209364191,2016-01-11 12:48:08,2016-01-11
"1031",60059,1748728,16000188816,2016188816,"350","HAZARDS","HAZARDS","HAZARDS","05/29/2016 01:41:54 PM","48XX BLOCK OF SAND POINT WY NE","U","U3","4100.4008",-122.28316,47.66458,"(47.66458, -122.28316)","WIRES DOWN (PHONE, ELECTRICAL,ETC.)","HAZARDS","HAZARDS","05/29/2016 12:29:34 PM",2196.47452707793,2016-05-29 13:41:54,2016-05-29
"1032",60119,1650577,16000015552,201615552,"350","HAZARDS","HAZARDS","HAZARDS","01/14/2016 06:34:58 AM","NE RAVENNA BV / NE 62 ST","U","U1","3600.1025",-122.31952,47.673344,"(47.673344, -122.31952)","SUSPICIOUS PERSON, VEHICLE OR INCIDENT","SUSPICIOUS CIRCUMSTANCES","SUSPICIOUS CIRCUMSTANCES","",2070.02233393653,2016-01-14 06:34:58,2016-01-14
"1033",60156,1651311,16000016772,201616772,"030","ARMED ROBBERY","GUN CALLS","ROBBERY","01/15/2016 06:10:56 AM","BURKE GILMAN TL / 30 AV NE","U","U3","4200.3038",-122.295616,47.664448,"(47.664448, -122.295616)","ROBBERY - IP/JO (INCLUDES STRONG ARM)","ROBBERY","ROBBERY","01/15/2016 04:03:00 AM",1403.51438297478,2016-01-15 06:10:56,2016-01-15
"1034",60210,1652379,16000018690,201618690,"220","CRISIS COMPLAINT - GENERAL","CRISIS CALL","BEHAVIORAL HEALTH","01/16/2016 03:22:40 PM","45XX BLOCK OF UNIVERSITY WY NE","U","U2","5301.2009",-122.31312,47.66218,"(47.66218, -122.31312)","THREATS (INCLS IN-PERSON/BY PHONE/IN WRITING)","THREATS, HARASSMENT","THREATS, HARASSMENT","",738.963514898043,2016-01-16 15:22:40,2016-01-16
"1035",60252,1654582,16000022311,201622311,"220","CRISIS COMPLAINT - GENERAL","CRISIS CALL","BEHAVIORAL HEALTH","01/19/2016 07:45:53 PM","11XX BLOCK OF NE 45 ST","U","U2","5301.2007",-122.31601,47.66129,"(47.66129, -122.31601)","ASLT - IP/JO - WITH OR W/O WPNS (NO SHOOTINGS)","ASSAULTS","ASSAULTS","01/19/2016 06:57:52 PM",764.8935553319,2016-01-19 19:45:53,2016-01-20
"1036",60270,1653950,16000021104,201621104,"350","HAZARDS","HAZARDS","HAZARDS","01/18/2016 10:12:17 PM","NE 45 ST / 7 AV NE","U","U2","5200.1000",-122.32073,47.661316,"(47.661316, -122.32073)","HAZ - POTENTIAL THRT TO PHYS SAFETY (NO HAZMAT)","HAZARDS","HAZARDS","01/18/2016 09:10:15 PM",1030.01436970243,2016-01-18 22:12:17,2016-01-19
"1037",60292,1655151,16000023107,201623107,"220","CRISIS COMPLAINT - GENERAL","CRISIS CALL","BEHAVIORAL HEALTH","01/20/2016 03:15:13 PM","47XX BLOCK OF 12 AV NE","U","U2","5301.2004",-122.315254,47.664013,"(47.664013, -122.315254)","THREATS (INCLS IN-PERSON/BY PHONE/IN WRITING)","THREATS, HARASSMENT","THREATS, HARASSMENT","01/20/2016 01:08:56 PM",990.218839131712,2016-01-20 15:15:13,2016-01-20
"1038",60350,1863434,16000386867,2016386867,"242","FIGHT DISTURBANCE","DISTURBANCES","DISTURBANCES","10/26/2016 12:09:53 AM","68XX BLOCK OF 62 AV NE","U","U3","4000.1000",-122.26295,47.678627,"(47.678627, -122.26295)","FIGHT - VERBAL/ORAL (NO WEAPONS)","DISTURBANCES","DISTURBANCES","10/25/2016 09:45:36 PM",4307.16202181391,2016-10-26 00:09:53,2016-10-26
"1039",60379,1657003,16000026509,201626509,"242","FIGHT DISTURBANCE","DISTURBANCES","DISTURBANCES","01/22/2016 11:15:06 PM","NE 80 ST / 15 AV NE","U","U1","2600.1017",-122.31216,47.686672,"(47.686672, -122.31216)","ASLT - IP/JO - WITH OR W/O WPNS (NO SHOOTINGS)","ASSAULTS","ASSAULTS","",3416.07905620599,2016-01-22 23:15:06,2016-01-23
"1040",60381,1656864,16000026071,201626071,"041","HARASSMENT, THREATS","THREATS, HARASSMENT","THREATS, HARASSMENT","01/22/2016 08:27:49 PM","24XX BLOCK OF NE 75 ST","U","U1","2500.2000",-122.3013,47.68305,"(47.68305, -122.3013)","HARAS - NO BIAS, THREATS OR MALICIOUSNESS","THREATS, HARASSMENT","THREATS, HARASSMENT","01/22/2016 07:41:14 PM",3069.92563438286,2016-01-22 20:27:49,2016-01-23
"1041",60413,1657138,16000026524,201626524,"031","STRONG ARM ROBBERY","ROBBERY","ROBBERY","01/23/2016 03:09:51 AM","19XX BLOCK OF NE 85 ST","U","U1","2600.1000",-122.30739,47.690308,"(47.690308, -122.30739)","ROBBERY - IP/JO (INCLUDES STRONG ARM)","ROBBERY","ROBBERY","01/22/2016 11:19:56 PM",3817.78890625752,2016-01-23 03:09:51,2016-01-23
"1042",60426,1657615,16000027399,201627399,"220","CRISIS COMPLAINT - GENERAL","CRISIS CALL","BEHAVIORAL HEALTH","01/23/2016 08:53:51 PM","77XX BLOCK OF 19 AV NE","U","U1","2600.1014",-122.30783,47.68577,"(47.68577, -122.30783)","CRISIS - PERSON IN BEHAVIORAL/EMOTIONAL CRISIS","BEHAVIORAL HEALTH","CRISIS CALL","01/23/2016 06:16:37 PM",3312.32036773474,2016-01-23 20:53:51,2016-01-24
"1043",60440,1657803,16000027493,201627493,"031","STRONG ARM ROBBERY","ROBBERY","ROBBERY","01/24/2016 12:35:20 AM","NE 45 ST / 7 AV NE","U","U2","5200.1000",-122.32073,47.661316,"(47.661316, -122.32073)","THEFT (DOES NOT INCLUDE SHOPLIFT OR SVCS)","OTHER PROPERTY","THEFT","01/23/2016 08:15:57 PM",1030.01436970243,2016-01-24 00:35:20,2016-01-24
"1044",60455,1781849,16000245672,2016245672,"350","HAZARDS","HAZARDS","HAZARDS","07/09/2016 03:13:34 PM","NE 50 ST / ROOSEVELT WY NE","U","U1","5200.5000",-122.317406,47.664936,"(47.664936, -122.317406)","TRAFFIC - BO SIGNALS AND DOWN SIGNS","TRAFFIC RELATED CALLS","TRAFFIC RELATED CALLS","07/09/2016 01:19:35 PM",1157.48588512645,2016-07-09 15:13:34,2016-07-09
"1045",60481,2042585,17000250951,2017250951,"041","HARASSMENT, THREATS","THREATS, HARASSMENT","THREATS, HARASSMENT","07/10/2017 07:46:51 PM","45XX BLOCK OF ROOSEVELT WY NE","U","U2","5200.5009",-122.31745,47.6622,"(47.6622, -122.31745)","FIGHT - VERBAL/ORAL (NO WEAPONS)","DISTURBANCES","DISTURBANCES","07/10/2017 05:42:32 PM",912.030393512361,2017-07-10 19:46:51,2017-07-11
"1046",60508,1951454,17000082961,201782961,"350","HAZARDS","HAZARDS","HAZARDS","03/08/2017 03:01:05 PM","MONTLAKE BV NE / NE PACIFIC PL","U","U2","5302.3045",-122.30391,47.65108,"(47.65108, -122.30391)","HAZ - POTENTIAL THRT TO PHYS SAFETY (NO HAZMAT)","HAZARDS","HAZARDS","03/08/2017 01:17:31 PM",689.626649964796,2017-03-08 15:01:05,2017-03-08
"1047",60515,1781931,16000245774,2016245774,"220","CRISIS COMPLAINT - GENERAL","CRISIS CALL","BEHAVIORAL HEALTH","07/09/2016 05:57:04 PM","65XX BLOCK OF 62 AV NE","U","U3","4000.1014",-122.26223,47.67889,"(47.67889, -122.26223)","CRISIS - PERSON IN BEHAVIORAL/EMOTIONAL CRISIS","BEHAVIORAL HEALTH","CRISIS CALL","",4368.13337390337,2016-07-09 17:57:04,2016-07-10
"1048",60533,1829662,16000330875,2016330875,"220","CRISIS COMPLAINT - GENERAL","CRISIS CALL","BEHAVIORAL HEALTH","09/12/2016 05:06:37 PM","72XX BLOCK OF ROOSEVELT WY NE","U","U1","3600.1005",-122.317696,47.681213,"(47.681213, -122.317696)","DISTURBANCE, MISCELLANEOUS/OTHER","DISTURBANCES","DISTURBANCES","09/12/2016 01:04:04 PM",2870.06233263845,2016-09-12 17:06:37,2016-09-13
"1049",60547,1748834,16000189091,2016189091,"220","CRISIS COMPLAINT - GENERAL","CRISIS CALL","BEHAVIORAL HEALTH","05/29/2016 05:12:38 PM","NE 73 ST / ROOSEVELT WY NE","U","U1","3600.1005",-122.31746,47.681553,"(47.681553, -122.31746)","CRISIS - PERSON IN BEHAVIORAL/EMOTIONAL CRISIS","BEHAVIORAL HEALTH","CRISIS CALL","",2903.29494000628,2016-05-29 17:12:38,2016-05-30
"1050",60552,1812430,16000298829,2016298829,"220","CRISIS COMPLAINT - GENERAL","CRISIS CALL","BEHAVIORAL HEALTH","08/18/2016 11:20:46 AM","51XX BLOCK OF 25 AV NE","U","U3","4301.1003",-122.30061,47.66712,"(47.66712, -122.30061)","CRISIS - PERSON IN BEHAVIORAL/EMOTIONAL CRISIS","BEHAVIORAL HEALTH","CRISIS CALL","08/18/2016 09:56:06 AM",1405.16177523332,2016-08-18 11:20:46,2016-08-18
"1051",60583,1782021,16000246081,2016246081,"220","CRISIS COMPLAINT - GENERAL","CRISIS CALL","BEHAVIORAL HEALTH","07/09/2016 08:40:14 PM","70XX BLOCK OF 35 AV NE","U","U3","3900.1004",-122.290405,47.680325,"(47.680325, -122.290405)","CRISIS - PERSON IN BEHAVIORAL/EMOTIONAL CRISIS","BEHAVIORAL HEALTH","CRISIS CALL","",3061.23789562215,2016-07-09 20:40:14,2016-07-10
"1052",60591,1972613,17000120192,2017120192,"341","HARBOR - DEBRIS, NAVIGATIONAL HAZARDS","HARBOR CALLS","HARBOR CALLS","04/06/2017 01:42:28 PM","UNIVERSITY BR / SB","U","U2","5200.202",-122.319374,47.65404,"(47.65404, -122.319374)","HARBOR - WATER DEBRIS, NAVIGATIONAL HAZARDS","HARBOR CALLS","HARBOR CALLS","04/06/2017 11:34:26 AM",773.098824199806,2017-04-06 13:42:28,2017-04-06
"1053",60762,1838000,16000341897,2016341897,"350","HAZARDS","HAZARDS","HAZARDS","09/20/2016 08:09:48 PM","NE 45 ST / 18 AV NE","U","U1","5301.1007",-122.30839,47.66126,"(47.66126, -122.30839)","HAZ - POTENTIAL THRT TO PHYS SAFETY (NO HAZMAT)","HAZARDS","HAZARDS","",590.739962541465,2016-09-20 20:09:48,2016-09-21
"1054",60955,1863366,16000386939,2016386939,"220","CRISIS COMPLAINT - GENERAL","CRISIS CALL","BEHAVIORAL HEALTH","10/25/2016 10:24:31 PM","15 AV NE / NE 50 ST","U","U1","4400.4009",-122.311935,47.66489,"(47.66489, -122.311935)","CRISIS - PERSON IN BEHAVIORAL/EMOTIONAL CRISIS","BEHAVIORAL HEALTH","CRISIS CALL","",1005.20324732383,2016-10-25 22:24:31,2016-10-26
"1055",61019,1829131,16000330217,2016330217,"350","HAZARDS","HAZARDS","HAZARDS","09/11/2016 11:05:29 PM","12 AV NE / NE 70 ST","U","U1","2600.3005",-122.31567,47.67945,"(47.67945, -122.31567)","TRAFFIC - BO SIGNALS AND DOWN SIGNS","TRAFFIC RELATED CALLS","TRAFFIC RELATED CALLS","",2648.12005497198,2016-09-11 23:05:29,2016-09-12
"1056",61552,1829138,16000330210,2016330210,"041","HARASSMENT, THREATS","THREATS, HARASSMENT","THREATS, HARASSMENT","09/12/2016 04:59:58 AM","11XX BLOCK OF NE 47 ST","U","U2","5301.2004",-122.316025,47.663265,"(47.663265, -122.316025)","THREATS (INCLS IN-PERSON/BY PHONE/IN WRITING)","THREATS, HARASSMENT","THREATS, HARASSMENT","09/11/2016 11:37:30 PM",944.818265649453,2016-09-12 04:59:58,2016-09-12
"1057",61667,2115798,17000383743,2017383743,"350","HAZARDS","HAZARDS","HAZARDS","10/15/2017 11:43:29 PM","ROOSEVELT WY NE / NE 45 ST","U","U2","5301.3004",-122.31764,47.661297,"(47.661297, -122.31764)","HAZ - POTENTIAL THRT TO PHYS SAFETY (NO HAZMAT)","HAZARDS","HAZARDS","10/15/2017 07:41:30 PM",848.950730071322,2017-10-15 23:43:29,2017-10-16
"1058",62235,1852192,16000367353,2016367353,"220","CRISIS COMPLAINT - GENERAL","CRISIS CALL","BEHAVIORAL HEALTH","10/10/2016 01:10:46 PM","PRINCETON AV NE / NE 55 ST","U","U3","4200.1020",-122.275764,47.669235,"(47.669235, -122.275764)","HAZ - POTENTIAL THRT TO PHYS SAFETY (NO HAZMAT)","HAZARDS","HAZARDS","10/10/2016 12:32:31 PM",2930.2169377882,2016-10-10 13:10:46,2016-10-10
"1059",62362,1915426,17000014045,201714045,"350","HAZARDS","HAZARDS","HAZARDS","01/12/2017 11:27:22 AM","65XX BLOCK OF SAND POINT WY NE","U","U3","4000.1000",-122.26355,47.676197,"(47.676197, -122.26355)","HAZ - POTENTIAL THRT TO PHYS SAFETY (NO HAZMAT)","HAZARDS","HAZARDS","",4117.37052735623,2017-01-12 11:27:22,2017-01-12
"1060",62791,2115854,17000384074,2017384074,"242","FIGHT DISTURBANCE","DISTURBANCES","DISTURBANCES","10/16/2017 02:41:01 AM","50XX BLOCK OF UNIVERSITY WY NE","U","U1","4400.4009",-122.313065,47.66567,"(47.66567, -122.313065)","FIGHT - IP - PHYSICAL (NO WEAPONS)","DISTURBANCES","DISTURBANCES","",1107.99164074666,2017-10-16 02:41:01,2017-10-16
"1061",63102,1863512,16000387178,2016387178,"350","HAZARDS","HAZARDS","HAZARDS","10/26/2016 03:32:19 AM","NE 50 ST / UNIVERSITY WY NE","U","U1","4400.4009",-122.31307,47.664898,"(47.664898, -122.31307)","HAZ - POTENTIAL THRT TO PHYS SAFETY (NO HAZMAT)","HAZARDS","HAZARDS","",1025.0108407033,2016-10-26 03:32:19,2016-10-26
"1062",63148,1829268,16000329987,2016329987,"220","CRISIS COMPLAINT - GENERAL","CRISIS CALL","BEHAVIORAL HEALTH","09/11/2016 07:19:27 PM","NE 45 ST / 15 AV NE","U","U2","5301.2010",-122.312,47.66126,"(47.66126, -122.312)","CRISIS - PERSON IN BEHAVIORAL/EMOTIONAL CRISIS","BEHAVIORAL HEALTH","CRISIS CALL","09/11/2016 05:54:07 PM",614.236940217108,2016-09-11 19:19:27,2016-09-12
"1063",63265,2115874,17000383895,2017383895,"041","HARASSMENT, THREATS","THREATS, HARASSMENT","THREATS, HARASSMENT","10/16/2017 03:22:07 AM","45XX BLOCK OF 15 AV NE","U","U2","5301.2011",-122.31198,47.662174,"(47.662174, -122.31198)","HARAS - NO BIAS, THREATS OR MALICIOUSNESS","THREATS, HARASSMENT","THREATS, HARASSMENT","10/15/2017 11:17:45 PM",711.276158808105,2017-10-16 03:22:07,2017-10-16
"1064",63280,1937801,17000048429,201748429,"041","HARASSMENT, THREATS","THREATS, HARASSMENT","THREATS, HARASSMENT","02/09/2017 03:05:17 PM","11XX BLOCK OF NE 43 ST","U","U2","5301.3006",-122.31605,47.65983,"(47.65983, -122.31605)","THREATS (INCLS IN-PERSON/BY PHONE/IN WRITING)","THREATS, HARASSMENT","THREATS, HARASSMENT","02/09/2017 01:14:46 PM",650.704615297222,2017-02-09 15:05:17,2017-02-09
"1065",63300,2115868,17000384012,2017384012,"030","ARMED ROBBERY","GUN CALLS","ROBBERY","10/16/2017 03:17:56 AM","41XX BLOCK OF UNIVERSITY WY NE","U","U2","5301.4001",-122.313225,47.657574,"(47.657574, -122.313225)","ROBBERY - IP/JO (INCLUDES STRONG ARM)","ROBBERY","ROBBERY","10/15/2017 11:41:53 PM",330.036787270645,2017-10-16 03:17:56,2017-10-16
"1066",63301,1838179,16000342120,2016342120,"030","ARMED ROBBERY","GUN CALLS","ROBBERY","09/21/2016 02:15:48 AM","47XX BLOCK OF 22 AV NE","U","U1","4302.2010",-122.30395,47.664494,"(47.664494, -122.30395)","ROBBERY (INCLUDES STRONG ARM)","ROBBERY","ROBBERY","09/20/2016 11:49:28 PM",1032.31394428544,2016-09-21 02:15:48,2016-09-21
"1067",63337,1782366,16000246571,2016246571,"220","CRISIS COMPLAINT - GENERAL","CRISIS CALL","BEHAVIORAL HEALTH","07/10/2016 06:53:24 AM","56XX BLOCK OF NE KESWICK DR","U","U3","4100.2004",-122.264755,47.667717,"(47.667717, -122.264755)","CRISIS - PERSON IN BEHAVIORAL/EMOTIONAL CRISIS","BEHAVIORAL HEALTH","CRISIS CALL","",3604.52466993383,2016-07-10 06:53:24,2016-07-10
"1068",63392,1749119,16000189520,2016189520,"242","FIGHT DISTURBANCE","DISTURBANCES","DISTURBANCES","05/30/2016 12:33:38 AM","NE 45 ST / 25 AV NE","U","U2","5302.3010",-122.3009,47.66125,"(47.66125, -122.3009)","FIGHT - IP - PHYSICAL (NO WEAPONS)","DISTURBANCES","DISTURBANCES","",870.654377405696,2016-05-30 00:33:38,2016-05-30
"1069",63413,1838338,16000342489,2016342489,"220","CRISIS COMPLAINT - GENERAL","CRISIS CALL","BEHAVIORAL HEALTH","09/21/2016 09:25:38 AM","13XX BLOCK OF NE 42 ST","U","U2","5301.4001",-122.31366,47.65818,"(47.65818, -122.31366)","CRISIS - PERSON IN BEHAVIORAL/EMOTIONAL CRISIS","BEHAVIORAL HEALTH","CRISIS CALL","",395.474635897323,2016-09-21 09:25:38,2016-09-21
"1070",63419,1829346,16000330738,2016330738,"220","CRISIS COMPLAINT - GENERAL","CRISIS CALL","BEHAVIORAL HEALTH","09/12/2016 12:48:46 PM","27XX BLOCK OF NE 85 ST","U","U3","2100.3012",-122.29705,47.690536,"(47.690536, -122.29705)","DISTURBANCE, MISCELLANEOUS/OTHER","DISTURBANCES","DISTURBANCES","09/12/2016 10:46:37 AM",3952.03112422269,2016-09-12 12:48:46,2016-09-12
"1071",63425,1852442,16000367061,2016367061,"041","HARASSMENT, THREATS","THREATS, HARASSMENT","THREATS, HARASSMENT","10/10/2016 04:08:42 PM","UNIVERSITY BR / BURKE GILMAN TL","U","U2","5302.2006",-122.318474,47.655205,"(47.655205, -122.318474)","DISTURBANCE, MISCELLANEOUS/OTHER","DISTURBANCES","DISTURBANCES","10/10/2016 11:44:18 AM",679.903046706638,2016-10-10 16:08:42,2016-10-10
"1072",63430,1749312,16000189763,2016189763,"350","HAZARDS","HAZARDS","HAZARDS","05/30/2016 09:22:03 AM","SAND POINT WY NE / NE 50 ST","U","U3","4200.3034",-122.28284,47.664886,"(47.664886, -122.28284)","TREES DOWN, OBSTRUCTING PUBLIC PROP (NO HAZ)","TREES DOWN","TREES DOWN","05/30/2016 08:32:48 AM",2232.9881305333,2016-05-30 09:22:03,2016-05-30
"1073",63436,2031014,17000229832,2017229832,"350","HAZARDS","HAZARDS","HAZARDS","06/26/2017 07:06:01 AM","15 AV NE / NE 47 ST","U","U2","5301.201",-122.311966,47.663082,"(47.663082, -122.311966)","POWER OUT - POLES AND TRANSFORMERS","HAZARDS","HAZARDS","06/25/2017 11:30:37 PM",808.897329309375,2017-06-26 07:06:01,2017-06-26
"1074",63454,1937509,17000048990,201748990,"350","HAZARDS","HAZARDS","HAZARDS","02/09/2017 08:04:47 PM","UNIVERSITY BR / SB","U","U2","5200.2020",-122.319374,47.65404,"(47.65404, -122.319374)","HAZ - POTENTIAL THRT TO PHYS SAFETY (NO HAZMAT)","HAZARDS","HAZARDS","02/09/2017 06:38:20 PM",773.098824199806,2017-02-09 20:04:47,2017-02-10
"1075",63464,2103525,17000361315,2017361315,"041","HARASSMENT, THREATS","THREATS, HARASSMENT","THREATS, HARASSMENT","09/28/2017 04:07:49 PM","43XX BLOCK OF ROOSEVELT WY NE","U","U2","5200.5008",-122.317726,47.66058,"(47.66058, -122.317726)","THREATS (INCLS IN-PERSON/BY PHONE/IN WRITING)","THREATS, HARASSMENT","THREATS, HARASSMENT","09/28/2017 02:25:26 PM",800.699807898046,2017-09-28 16:07:49,2017-09-28
"1076",63481,1895735,16000445418,2016445418,"242","FIGHT DISTURBANCE","DISTURBANCES","DISTURBANCES","12/12/2016 03:41:02 AM","41XX BLOCK OF 12 AV NE","U","U2","5301.4002",-122.31554,47.657604,"(47.657604, -122.31554)","FIGHT - IP - PHYSICAL (NO WEAPONS)","DISTURBANCES","DISTURBANCES","12/11/2016 10:57:59 PM",487.509070921015,2016-12-12 03:41:02,2016-12-12
"1077",63536,1782664,16000246051,2016246051,"031","STRONG ARM ROBBERY","ROBBERY","ROBBERY","07/09/2016 09:05:06 PM","61XX BLOCK OF BROOKLYN AV NE","U","U1","4400.2008",-122.314255,47.672745,"(47.672745, -122.314255)","THREATS (INCLS IN-PERSON/BY PHONE/IN WRITING)","THREATS, HARASSMENT","THREATS, HARASSMENT","",1895.71763445181,2016-07-09 21:05:06,2016-07-10
"1078",63544,1782631,16000247034,2016247034,"350","HAZARDS","HAZARDS","HAZARDS","07/10/2016 04:37:41 PM","25XX BLOCK OF NE 92 ST","U","U3","2100.2012",-122.30014,47.695713,"(47.695713, -122.30014)","WIRES DOWN (PHONE, ELECTRICAL,ETC.)","HAZARDS","HAZARDS","",4471.04170622965,2016-07-10 16:37:41,2016-07-10
"1079",63545,2018943,17000207942,2017207942,"041","HARASSMENT, THREATS","THREATS, HARASSMENT","THREATS, HARASSMENT","06/10/2017 03:44:23 AM","44XX BLOCK OF NE 65 ST","U","U3","4200.2",-122.280205,47.67579,"(47.67579, -122.280205)","THEFT (DOES NOT INCLUDE SHOPLIFT OR SVCS)","OTHER PROPERTY","THEFT","06/10/2017 01:35:51 AM",3111.66253340609,2017-06-10 03:44:23,2017-06-10
"1080",63558,1863774,16000387388,2016387388,"350","HAZARDS","HAZARDS","HAZARDS","10/26/2016 02:14:16 PM","20 AV NE / NE 68 ST","U","U1","2500.2013",-122.306564,47.67763,"(47.67763, -122.306564)","TRAFFIC - BO SIGNALS AND DOWN SIGNS","TRAFFIC RELATED CALLS","TRAFFIC RELATED CALLS","",2414.99445706131,2016-10-26 14:14:16,2016-10-26
"1081",63569,1812747,16000299402,2016299402,"041","HARASSMENT, THREATS","THREATS, HARASSMENT","THREATS, HARASSMENT","08/18/2016 07:23:40 PM","10XX BLOCK OF NE 45 ST","U","U2","5301.3004",-122.31711,47.661297,"(47.661297, -122.31711)","THREATS (INCLS IN-PERSON/BY PHONE/IN WRITING)","THREATS, HARASSMENT","THREATS, HARASSMENT","08/18/2016 05:44:59 PM",820.741685950805,2016-08-18 19:23:40,2016-08-19
"1082",63578,1793624,16000265744,2016265744,"030","ARMED ROBBERY","GUN CALLS","ROBBERY","07/25/2016 03:09:12 AM","52XX BLOCK OF UNIVERSITY WY NE","U","U1","4400.4001",-122.313034,47.667492,"(47.667492, -122.313034)","ROBBERY - IP/JO (INCLUDES STRONG ARM)","ROBBERY","ROBBERY","07/24/2016 11:07:49 PM",1305.00522461218,2016-07-25 03:09:12,2016-07-25
"1083",63586,1926866,17000035464,201735464,"350","HAZARDS","HAZARDS","HAZARDS","01/29/2017 01:50:43 PM","NE 48 ST / 24 AV NE","U","U1","4302.2007",-122.301735,47.664024,"(47.664024, -122.301735)","WATER FLOODS (BROKEN MAINS/HYDRANTS, NO HAZ)","PUBLIC WATER","PUBLIC WATER","",1065.88269846122,2017-01-29 13:50:43,2017-01-29
"1084",63590,1782735,16000247079,2016247079,"220","CRISIS COMPLAINT - GENERAL","CRISIS CALL","BEHAVIORAL HEALTH","07/10/2016 07:24:37 PM","48XX BLOCK OF SAND POINT WY NE","U","U3","4100.4008",-122.28316,47.66458,"(47.66458, -122.28316)","DISTURBANCE, MISCELLANEOUS/OTHER","DISTURBANCES","DISTURBANCES","07/10/2016 05:13:38 PM",2196.47452707793,2016-07-10 19:24:37,2016-07-11
"1085",63591,1782738,16000247047,2016247047,"242","FIGHT DISTURBANCE","DISTURBANCES","DISTURBANCES","07/10/2016 07:14:05 PM","45XX BLOCK OF UNIVERSITY WY NE","U","U2","5301.2010",-122.31312,47.66218,"(47.66218, -122.31312)","SHOPLIFT - THEFT","SHOPLIFTING","THEFT","07/10/2016 06:48:42 PM",738.963514898043,2016-07-10 19:14:05,2016-07-11
"1086",63592,1863780,16000387625,2016387625,"220","CRISIS COMPLAINT - GENERAL","CRISIS CALL","BEHAVIORAL HEALTH","10/26/2016 02:33:31 PM","47XX BLOCK OF 12 AV NE","U","U2","5301.2004",-122.315544,47.663677,"(47.663677, -122.315544)","CRISIS - PERSON IN BEHAVIORAL/EMOTIONAL CRISIS","BEHAVIORAL HEALTH","CRISIS CALL","10/26/2016 01:04:21 PM",966.782980955662,2016-10-26 14:33:31,2016-10-26
"1087",63595,1852529,16000367457,2016367457,"041","HARASSMENT, THREATS","THREATS, HARASSMENT","THREATS, HARASSMENT","10/10/2016 06:30:10 PM","26XX BLOCK OF NE 80 ST","U","U3","2500.1012",-122.298515,47.68752,"(47.68752, -122.298515)","THREATS (INCLS IN-PERSON/BY PHONE/IN WRITING)","THREATS, HARASSMENT","THREATS, HARASSMENT","10/10/2016 01:54:42 PM",3600.3026894689,2016-10-10 18:30:10,2016-10-11
"1088",63621,1802858,16000281990,2016281990,"041","HARASSMENT, THREATS","THREATS, HARASSMENT","THREATS, HARASSMENT","08/05/2016 07:44:49 PM","68XX BLOCK OF 62 AV NE","U","U3","4000.1014",-122.26223,47.67889,"(47.67889, -122.26223)","THREATS (INCLS IN-PERSON/BY PHONE/IN WRITING)","THREATS, HARASSMENT","THREATS, HARASSMENT","08/05/2016 04:09:35 PM",4368.13337390337,2016-08-05 19:44:49,2016-08-06
"1089",63631,1782713,16000247082,2016247082,"242","FIGHT DISTURBANCE","DISTURBANCES","DISTURBANCES","07/10/2016 06:48:32 PM","50XX BLOCK OF 15 AV NE","U","U1","4400.3006",-122.31193,47.66566,"(47.66566, -122.31193)","ASLT - IP/JO - WITH OR W/O WPNS (NO SHOOTINGS)","ASSAULTS","ASSAULTS","07/10/2016 05:11:49 PM",1089.43380769836,2016-07-10 18:48:32,2016-07-11
"1090",63635,1802147,16000280735,2016280735,"350","HAZARDS","HAZARDS","HAZARDS","08/04/2016 10:17:43 PM","15 AV NE / NE 45 ST","U","U2","5301.2010",-122.312,47.66126,"(47.66126, -122.312)","TRAFFIC - BO SIGNALS AND DOWN SIGNS","TRAFFIC RELATED CALLS","TRAFFIC RELATED CALLS","08/04/2016 06:23:58 PM",614.236940217108,2016-08-04 22:17:43,2016-08-05
"1091",63655,1972653,17000122621,2017122621,"031","STRONG ARM ROBBERY","ROBBERY","ROBBERY","04/08/2017 07:15:14 AM","47XX BLOCK OF 12 AV NE","U","U2","5301.2003",-122.315254,47.664013,"(47.664013, -122.315254)","ROBBERY (INCLUDES STRONG ARM)","ROBBERY","ROBBERY","04/08/2017 03:40:22 AM",990.218839131712,2017-04-08 07:15:14,2017-04-08
"1092",63665,1915588,17000014580,201714580,"242","FIGHT DISTURBANCE","DISTURBANCES","DISTURBANCES","01/12/2017 04:12:27 PM","73XX BLOCK OF ROOSEVELT WY NE","U","U1","2600.2018",-122.31747,47.681892,"(47.681892, -122.31747)","ASLT - IP/JO - WITH OR W/O WPNS (NO SHOOTINGS)","ASSAULTS","ASSAULTS","",2940.3413275696,2017-01-12 16:12:27,2017-01-13
"1093",63673,1812789,16000299106,2016299106,"041","HARASSMENT, THREATS","THREATS, HARASSMENT","THREATS, HARASSMENT","08/18/2016 08:34:59 PM","NE 45 ST / UNIVERSITY WY NE","U","U2","5301.3001",-122.31313,47.661266,"(47.661266, -122.31313)","TRU - THREATS","THREATS, HARASSMENT","THREATS, HARASSMENT","08/18/2016 07:31:52 PM",645.873447683438,2016-08-18 20:34:59,2016-08-19
"1094",63696,1997000,17000167870,2017167870,"030","ARMED ROBBERY","GUN CALLS","ROBBERY","05/13/2017 03:21:17 AM","NE 55 ST / RAVENNA AV NE","U","U1","4301.3012",-122.303894,47.668697,"(47.668697, -122.303894)","ROBBERY - IP/JO (INCLUDES STRONG ARM)","ROBBERY","ROBBERY","05/13/2017 01:30:47 AM",1473.15951800738,2017-05-13 03:21:17,2017-05-13
"1095",63699,1996940,17000167457,2017167457,"242","FIGHT DISTURBANCE","DISTURBANCES","DISTURBANCES","05/13/2017 01:01:45 AM","65XX BLOCK OF SAND POINT WY NE","U","U3","4000.1028",-122.26355,47.676197,"(47.676197, -122.26355)","FIGHT - IP - PHYSICAL (NO WEAPONS)","DISTURBANCES","DISTURBANCES","05/12/2017 07:21:13 PM",4117.37052735623,2017-05-13 01:01:45,2017-05-13
"1096",63720,1812903,16000299742,2016299742,"350","HAZARDS","HAZARDS","HAZARDS","08/19/2016 12:26:20 AM","47XX BLOCK OF 12 AV NE","U","U2","5301.2004",-122.315254,47.664013,"(47.664013, -122.315254)","DOWN - CHECK FOR PERSON DOWN","PERSON DOWN/INJURY","CASUALTIES","",990.218839131712,2016-08-19 00:26:20,2016-08-19
"1097",63727,1996833,17000167510,2017167510,"220","CRISIS COMPLAINT - GENERAL","CRISIS CALL","BEHAVIORAL HEALTH","05/12/2017 09:56:14 PM","45XX BLOCK OF UNIVERSITY WY NE","U","U2","5301.201",-122.31312,47.66218,"(47.66218, -122.31312)","DISTURBANCE, MISCELLANEOUS/OTHER","DISTURBANCES","DISTURBANCES","05/12/2017 07:58:34 PM",738.963514898043,2017-05-12 21:56:14,2017-05-13
"1098",63743,1802375,16000281034,2016281034,"031","STRONG ARM ROBBERY","ROBBERY","ROBBERY","08/05/2016 06:59:07 AM","10XX BLOCK OF NE 50 ST","U","U1","4400.4005",-122.31687,47.664932,"(47.664932, -122.31687)","ROBBERY - IP/JO (INCLUDES STRONG ARM)","ROBBERY","ROBBERY","08/04/2016 10:59:45 PM",1136.96666175032,2016-08-05 06:59:07,2016-08-05
"1099",63746,1793616,16000265863,2016265863,"220","CRISIS COMPLAINT - GENERAL","CRISIS CALL","BEHAVIORAL HEALTH","07/25/2016 02:45:13 AM","42XX BLOCK OF UNIVERSITY WY NE","U","U2","5301.3009",-122.31319,47.659054,"(47.659054, -122.31319)","THREATS (INCLS IN-PERSON/BY PHONE/IN WRITING)","THREATS, HARASSMENT","THREATS, HARASSMENT","",438.325335850633,2016-07-25 02:45:13,2016-07-25
"1100",63750,1812920,16000299772,2016299772,"350","HAZARDS","HAZARDS","HAZARDS","08/19/2016 01:01:35 AM","56XX BLOCK OF UNIVERSITY WY NE","U","U1","4400.2020",-122.31303,47.670216,"(47.670216, -122.31303)","FIGHT - WITH WEAPONS","DISTURBANCES","DISTURBANCES","",1602.67210487326,2016-08-19 01:01:35,2016-08-19
"1101",63793,1802405,16000281382,2016281382,"220","CRISIS COMPLAINT - GENERAL","CRISIS CALL","BEHAVIORAL HEALTH","08/05/2016 08:20:31 AM","NE 45 ST / 15 AV NE","U","U2","5301.2010",-122.312,47.66126,"(47.66126, -122.312)","LEWD - (EXPOSING, FLASHING, URINATING IN PUB)","LEWD CONDUCT","SUSPICIOUS CIRCUMSTANCES","",614.236940217108,2016-08-05 08:20:31,2016-08-05
"1102",63799,1749730,16000190451,2016190451,"242","FIGHT DISTURBANCE","DISTURBANCES","DISTURBANCES","05/30/2016 08:07:10 PM","50XX BLOCK OF 15 AV NE","U","U1","4400.4009",-122.31193,47.66566,"(47.66566, -122.31193)","FIGHT - VERBAL/ORAL (NO WEAPONS)","DISTURBANCES","DISTURBANCES","",1089.43380769836,2016-05-30 20:07:10,2016-05-31
"1103",63806,1852791,16000368202,2016368202,"220","CRISIS COMPLAINT - GENERAL","CRISIS CALL","BEHAVIORAL HEALTH","10/11/2016 03:10:45 AM","47XX BLOCK OF 12 AV NE","U","U2","5301.2003",-122.3149,47.66341,"(47.66341, -122.3149)","CRISIS - PERSON IN BEHAVIORAL/EMOTIONAL CRISIS","BEHAVIORAL HEALTH","CRISIS CALL","10/11/2016 01:36:58 AM",918.30890396426,2016-10-11 03:10:45,2016-10-11
"1104",63807,2065936,17000292977,2017292977,"220","CRISIS COMPLAINT - GENERAL","CRISIS CALL","BEHAVIORAL HEALTH","08/09/2017 02:51:33 AM","47XX BLOCK OF 9 AV NE","U","U2","5200.5001",-122.31839,47.663567,"(47.663567, -122.31839)","CRISIS - PERSON IN BEHAVIORAL/EMOTIONAL CRISIS","BEHAVIORAL HEALTH","CRISIS CALL","08/08/2017 10:58:11 PM",1074.12629124566,2017-08-09 02:51:33,2017-08-09
"1105",63808,1782867,16000247268,2016247268,"220","CRISIS COMPLAINT - GENERAL","CRISIS CALL","BEHAVIORAL HEALTH","07/10/2016 10:21:41 PM","NE 47 ST / UNIVERSITY WY NE","U","U2","5301.2010",-122.3131,47.66309,"(47.66309, -122.3131)","SUSPICIOUS STOP - OFFICER INITIATED ONVIEW","SUSPICIOUS CIRCUMSTANCES","SUSPICIOUS CIRCUMSTANCES","07/10/2016 08:09:40 PM",833.383876029379,2016-07-10 22:21:41,2016-07-11
"1106",63815,1926798,17000035609,201735609,"242","FIGHT DISTURBANCE","DISTURBANCES","DISTURBANCES","01/29/2017 04:53:11 PM","UNIVERSITY WY NE / NE 50 ST","U","U1","4400.4009",-122.31307,47.664898,"(47.664898, -122.31307)","ASLT - IP/JO - WITH OR W/O WPNS (NO SHOOTINGS)","ASSAULTS","ASSAULTS","01/29/2017 04:40:53 PM",1025.0108407033,2017-01-29 16:53:11,2017-01-30
"1107",63820,1904602,16000462543,2016462543,"220","CRISIS COMPLAINT - GENERAL","CRISIS CALL","BEHAVIORAL HEALTH","12/26/2016 05:20:22 PM","48XX BLOCK OF SAND POINT WY NE","U","U3","4100.4008",-122.28316,47.66458,"(47.66458, -122.28316)","THREATS (INCLS IN-PERSON/BY PHONE/IN WRITING)","THREATS, HARASSMENT","THREATS, HARASSMENT","12/26/2016 03:20:42 PM",2196.47452707793,2016-12-26 17:20:22,2016-12-27
"1108",63837,1937683,17000048727,201748727,"220","CRISIS COMPLAINT - GENERAL","CRISIS CALL","BEHAVIORAL HEALTH","02/09/2017 03:48:31 PM","45XX BLOCK OF 9 AV NE","U","U2","5200.5009",-122.318405,47.662212,"(47.662212, -122.318405)","CRISIS - PERSON IN BEHAVIORAL/EMOTIONAL CRISIS","BEHAVIORAL HEALTH","CRISIS CALL","02/09/2017 03:38:34 PM",961.489975065257,2017-02-09 15:48:31,2017-02-09
"1109",63848,1749705,16000190480,2016190480,"220","CRISIS COMPLAINT - GENERAL","CRISIS CALL","BEHAVIORAL HEALTH","05/30/2016 07:55:56 PM","NE 50 ST / 16 AV NE","U","U1","4400.3006",-122.31081,47.664883,"(47.664883, -122.31081)","HAZ - POTENTIAL THRT TO PHYS SAFETY (NO HAZMAT)","HAZARDS","HAZARDS","",992.534567701538,2016-05-30 19:55:56,2016-05-31
"1110",63863,1853188,16000368943,2016368943,"220","CRISIS COMPLAINT - GENERAL","CRISIS CALL","BEHAVIORAL HEALTH","10/11/2016 05:25:10 PM","43XX BLOCK OF UNIVERSITY WY NE","U","U2","5301.3001",-122.31346,47.660812,"(47.660812, -122.31346)","SUSPICIOUS PERSON, VEHICLE OR INCIDENT","SUSPICIOUS CIRCUMSTANCES","SUSPICIOUS CIRCUMSTANCES","10/11/2016 03:23:52 PM",612.14831111216,2016-10-11 17:25:10,2016-10-12
"1111",63911,1783051,16000247105,2016247105,"220","CRISIS COMPLAINT - GENERAL","CRISIS CALL","BEHAVIORAL HEALTH","07/11/2016 03:41:33 AM","70XX BLOCK OF RAVENNA AV NE","U","U1","2500.2006",-122.303925,47.68032,"(47.68032, -122.303925)","LEWD - (EXPOSING, FLASHING, URINATING IN PUB)","LEWD CONDUCT","SUSPICIOUS CIRCUMSTANCES","07/10/2016 07:49:42 PM",2736.21597822579,2016-07-11 03:41:33,2016-07-11
"1112",63912,1802403,16000281403,2016281403,"220","CRISIS COMPLAINT - GENERAL","CRISIS CALL","BEHAVIORAL HEALTH","08/05/2016 08:25:16 AM","42XX BLOCK OF UNIVERSITY WY NE","U","U2","5301.3008",-122.31319,47.659054,"(47.659054, -122.31319)","DISTURBANCE, MISCELLANEOUS/OTHER","DISTURBANCES","DISTURBANCES","",438.325335850633,2016-08-05 08:25:16,2016-08-05
"1113",63913,1802410,16000281278,2016281278,"220","CRISIS COMPLAINT - GENERAL","CRISIS CALL","BEHAVIORAL HEALTH","08/05/2016 08:15:46 AM","49XX BLOCK OF 25 AV NE","U","U3","4301.1010",-122.30091,47.664368,"(47.664368, -122.30091)","SUSPICIOUS PERSON, VEHICLE OR INCIDENT","SUSPICIOUS CIRCUMSTANCES","SUSPICIOUS CIRCUMSTANCES","08/05/2016 06:07:01 AM",1132.22730824771,2016-08-05 08:15:46,2016-08-05
"1114",63918,1813080,16000300100,2016300100,"350","HAZARDS","HAZARDS","HAZARDS","08/19/2016 10:45:39 AM","15 AV NE / NE 45 ST","U","U2","5301.2010",-122.312,47.66126,"(47.66126, -122.312)","HAZ - POTENTIAL THRT TO PHYS SAFETY (NO HAZMAT)","HAZARDS","HAZARDS","",614.236940217108,2016-08-19 10:45:39,2016-08-19
"1115",63963,1937921,17000056105,201756105,"041","HARASSMENT, THREATS","THREATS, HARASSMENT","THREATS, HARASSMENT","02/15/2017 09:10:31 AM","58XX BLOCK OF 15 AV NE","U","U1","4400.2008",-122.3119,47.671467,"(47.671467, -122.3119)","THREATS (INCLS IN-PERSON/BY PHONE/IN WRITING)","THREATS, HARASSMENT","THREATS, HARASSMENT","02/15/2017 07:37:14 AM",1729.10144593022,2017-02-15 09:10:31,2017-02-15
"1116",63985,2128036,17000406511,2017406511,"220","CRISIS COMPLAINT - GENERAL","CRISIS CALL","BEHAVIORAL HEALTH","11/02/2017 01:02:39 AM","UNIVERSITY WY NE / NE 45 ST","U","U2","5301.3001",-122.31313,47.661266,"(47.661266, -122.31313)","CRISIS - PERSON IN BEHAVIORAL/EMOTIONAL CRISIS","BEHAVIORAL HEALTH","CRISIS CALL","11/01/2017 10:59:57 PM",645.873447683438,2017-11-02 01:02:39,2017-11-02
"1117",63997,1802609,16000281592,2016281592,"350","HAZARDS","HAZARDS","HAZARDS","08/05/2016 02:05:51 PM","NE 65 ST / I5 NB","U","U1","3600.1019",-122.320435,47.675854,"(47.675854, -122.320435)","SUSPICIOUS PERSON, VEHICLE OR INCIDENT","SUSPICIOUS CIRCUMSTANCES","SUSPICIOUS CIRCUMSTANCES","08/05/2016 11:02:34 AM",2355.27328320448,2016-08-05 14:05:51,2016-08-05
"1118",64091,2140461,17000428951,2017428951,"030","ARMED ROBBERY","GUN CALLS","ROBBERY","11/20/2017 01:26:01 AM","8 AV NE / NE 50 ST","U","U1","5200.5001",-122.31955,47.664948,"(47.664948, -122.31955)","CARJACKING - IP/JO - ROBBERY","ROBBERY","ROBBERY","11/19/2017 06:18:42 PM",1248.85258890028,2017-11-20 01:26:01,2017-11-20
"1119",64117,1853038,16000368720,2016368720,"350","HAZARDS","HAZARDS","HAZARDS","10/11/2016 01:17:47 PM","13XX BLOCK OF NE 43 ST","U","U2","5301.3001",-122.31349,47.659992,"(47.659992, -122.31349)","DOWN - CHECK FOR PERSON DOWN","PERSON DOWN/INJURY","CASUALTIES","",535.564476672528,2016-10-11 13:17:47,2016-10-11
"1120",64119,1937932,17000056164,201756164,"350","HAZARDS","HAZARDS","HAZARDS","02/15/2017 09:28:59 AM","19XX BLOCK OF NE PACIFIC ST","U","U2","5302.2019",-122.30912,47.651302,"(47.651302, -122.30912)","HAZ - POTENTIAL THRT TO PHYS SAFETY (NO HAZMAT)","HAZARDS","HAZARDS","",523.119956824004,2017-02-15 09:28:59,2017-02-15
"1121",64162,1996967,17000167863,2017167863,"242","FIGHT DISTURBANCE","DISTURBANCES","DISTURBANCES","05/13/2017 02:00:38 AM","NE 80 ST / 15 AV NE","U","U1","2600.4008",-122.31216,47.686672,"(47.686672, -122.31216)","FIGHT - IP - PHYSICAL (NO WEAPONS)","DISTURBANCES","DISTURBANCES","05/13/2017 01:26:31 AM",3416.07905620599,2017-05-13 02:00:38,2017-05-13
"1122",64175,2140391,17000429064,2017429064,"030","ARMED ROBBERY","GUN CALLS","ROBBERY","11/19/2017 10:28:47 PM","8 AV NE / NE 50 ST","U","U1","5200.5001",-122.31955,47.664948,"(47.664948, -122.31955)","ROBBERY - IP/JO (INCLUDES STRONG ARM)","ROBBERY","ROBBERY","11/19/2017 08:34:00 PM",1248.85258890028,2017-11-19 22:28:47,2017-11-20
"1123",64206,1839610,16000344817,2016344817,"242","FIGHT DISTURBANCE","DISTURBANCES","DISTURBANCES","09/22/2016 10:52:25 PM","42XX BLOCK OF 7 AV NE","U","U2","5200.1004",-122.32054,47.65837,"(47.65837, -122.32054)","FIGHT - JO - PHYSICAL (NO WEAPONS)","DISTURBANCES","DISTURBANCES","",870.164004340083,2016-09-22 22:52:25,2016-09-23
"1124",64220,1838720,16000342949,2016342949,"041","HARASSMENT, THREATS","THREATS, HARASSMENT","THREATS, HARASSMENT","09/21/2016 07:25:42 PM","9XX BLOCK OF NE 43 ST","U","U2","5200.5008",-122.31859,47.659615,"(47.659615, -122.31859)","ASLT - IP/JO - WITH OR W/O WPNS (NO SHOOTINGS)","ASSAULTS","ASSAULTS","09/21/2016 03:32:17 PM",792.330435838933,2016-09-21 19:25:42,2016-09-22
"1125",64244,2091304,17000338635,2017338635,"220","CRISIS COMPLAINT - GENERAL","CRISIS CALL","BEHAVIORAL HEALTH","09/11/2017 09:08:13 PM","57XX BLOCK OF 58 AV NE","U","U3","4100.2024",-122.26563,47.67069,"(47.67069, -122.26563)","UNKNOWN - COMPLAINT OF UNKNOWN NATURE","SUSPICIOUS CIRCUMSTANCES","SUSPICIOUS CIRCUMSTANCES","09/11/2017 06:25:09 PM",3677.63961339262,2017-09-11 21:08:13,2017-09-12
"1126",64249,1863885,16000387981,2016387981,"220","CRISIS COMPLAINT - GENERAL","CRISIS CALL","BEHAVIORAL HEALTH","10/26/2016 05:05:06 PM","47XX BLOCK OF UNIVERSITY WY NE","U","U2","5301.2002",-122.31339,47.66478,"(47.66478, -122.31339)","PANHANDLING, AGGRESSIVE","DISTURBANCES","DISTURBANCES","",1018.98446798413,2016-10-26 17:05:06,2016-10-27
"1127",64289,1915754,17000014568,201714568,"041","HARASSMENT, THREATS","THREATS, HARASSMENT","THREATS, HARASSMENT","01/12/2017 08:00:44 PM","45XX BLOCK OF UNIVERSITY WY NE","U","U2","5301.2009",-122.31312,47.66218,"(47.66218, -122.31312)","BIAS -RACIAL, POLITICAL, SEXUAL MOTIVATION","SUSPICIOUS CIRCUMSTANCES","SUSPICIOUS CIRCUMSTANCES","01/12/2017 05:48:51 PM",738.963514898043,2017-01-12 20:00:44,2017-01-13
"1128",64320,1896066,16000446120,2016446120,"220","CRISIS COMPLAINT - GENERAL","CRISIS CALL","BEHAVIORAL HEALTH","12/12/2016 04:36:22 PM","45XX BLOCK OF UNIVERSITY WY NE","U","U2","5301.2010",-122.31312,47.66218,"(47.66218, -122.31312)","CRISIS - PERSON IN BEHAVIORAL/EMOTIONAL CRISIS","BEHAVIORAL HEALTH","CRISIS CALL","12/12/2016 03:00:14 PM",738.963514898043,2016-12-12 16:36:22,2016-12-13
"1129",64326,1938169,17000056543,201756543,"041","HARASSMENT, THREATS","THREATS, HARASSMENT","THREATS, HARASSMENT","02/15/2017 04:08:59 PM","45XX BLOCK OF 17 AV NE","U","U1","5301.1007",-122.30951,47.662163,"(47.662163, -122.30951)","THREATS (INCLS IN-PERSON/BY PHONE/IN WRITING)","THREATS, HARASSMENT","THREATS, HARASSMENT","02/15/2017 01:43:15 PM",685.225476654384,2017-02-15 16:08:59,2017-02-16
"1130",64367,2007667,17000187281,2017187281,"220","CRISIS COMPLAINT - GENERAL","CRISIS CALL","BEHAVIORAL HEALTH","05/26/2017 10:50:35 PM","53XX BLOCK OF 8 AV NE","U","U1","4500.1002",-122.31952,47.66786,"(47.66786, -122.31952)","OVERDOSE - DRUG RELATED CASUALTY","PERSON DOWN/INJURY","CASUALTIES","05/26/2017 09:13:49 PM",1518.30282163423,2017-05-26 22:50:35,2017-05-27
"1131",65612,1803118,16000282522,2016282522,"220","CRISIS COMPLAINT - GENERAL","CRISIS CALL","BEHAVIORAL HEALTH","08/06/2016 01:55:40 AM","SAND POINT WY NE / NE 75 ST","U","U3","4000.1027",-122.263695,47.682926,"(47.682926, -122.263695)","FOUND - PERSON","PERSONS - LOST, FOUND, MISSING","PERSONS - LOST, FOUND, MISSING","08/05/2016 11:15:11 PM",4560.26375115155,2016-08-06 01:55:40,2016-08-06
"1132",65621,2091387,17000338420,2017338420,"350","HAZARDS","HAZARDS","HAZARDS","09/11/2017 11:13:50 PM","71XX BLOCK OF ROOSEVELT WY NE","U","U1","2600.2021",-122.31744,47.68052,"(47.68052, -122.31744)","TRAFFIC - BO SIGNALS AND DOWN SIGNS","TRAFFIC RELATED CALLS","TRAFFIC RELATED CALLS","",2790.68299967833,2017-09-11 23:13:50,2017-09-12
"1133",65628,1986098,17000147819,2017147819,"041","HARASSMENT, THREATS","THREATS, HARASSMENT","THREATS, HARASSMENT","04/28/2017 11:48:12 AM","30XX BLOCK OF NE 75 ST","U","U3","3800.1002",-122.29533,47.68305,"(47.68305, -122.29533)","DISTURBANCE, MISCELLANEOUS/OTHER","DISTURBANCES","DISTURBANCES","04/28/2017 09:35:06 AM",3190.24678435193,2017-04-28 11:48:12,2017-04-28
"1134",65633,1966986,17000112171,2017112171,"350","HAZARDS","HAZARDS","HAZARDS","03/31/2017 08:19:39 AM","41XX BLOCK OF 15 AV NE","U","U2","5302.3017",-122.31209,47.657562,"(47.657562, -122.31209)","HAZ - POTENTIAL THRT TO PHYS SAFETY (NO HAZMAT)","HAZARDS","HAZARDS","",260.794456582869,2017-03-31 08:19:39,2017-03-31
"1135",65634,1952007,17000084129,201784129,"220","CRISIS COMPLAINT - GENERAL","CRISIS CALL","BEHAVIORAL HEALTH","03/09/2017 11:56:26 AM","50XX BLOCK OF 20 AV NE","U","U1","4302.1004",-122.3065,47.66564,"(47.66564, -122.3065)","CRISIS - PERSON IN BEHAVIORAL/EMOTIONAL CRISIS","BEHAVIORAL HEALTH","CRISIS CALL","03/09/2017 10:41:19 AM",1095.24284716348,2017-03-09 11:56:26,2017-03-09
"1136",65709,1915913,17000014984,201714984,"031","STRONG ARM ROBBERY","ROBBERY","ROBBERY","01/13/2017 02:39:57 AM","47XX BLOCK OF BROOKLYN AV NE","U","U2","5301.2002",-122.314224,47.664005,"(47.664005, -122.314224)","ROBBERY - IP/JO (INCLUDES STRONG ARM)","ROBBERY","ROBBERY","01/12/2017 10:41:01 PM",958.152960945758,2017-01-13 02:39:57,2017-01-13
"1137",65712,1963636,17000105874,2017105874,"220","CRISIS COMPLAINT - GENERAL","CRISIS CALL","BEHAVIORAL HEALTH","03/26/2017 12:12:47 PM","NE 40 ST / PASADENA PL NE","U","U2","5200.2011",-122.32189,47.655888,"(47.655888, -122.32189)","WEAPN-IP/JO-GUN,DEADLY WPN (NO THRT/ASLT/DIST)","WEAPONS CALLS","WEAPONS CALLS","",930.822363244896,2017-03-26 12:12:47,2017-03-26
"1138",65727,1838663,16000343104,2016343104,"220","CRISIS COMPLAINT - GENERAL","CRISIS CALL","BEHAVIORAL HEALTH","09/21/2016 06:27:06 PM","NE 90 ST / RAVENNA AV NE","U","U1","2100.3002",-122.30356,47.693916,"(47.693916, -122.30356)","DISTURBANCE, MISCELLANEOUS/OTHER","DISTURBANCES","DISTURBANCES","",4239.18476623441,2016-09-21 18:27:06,2016-09-22
"1139",65728,1838665,16000343051,2016343051,"220","CRISIS COMPLAINT - GENERAL","CRISIS CALL","BEHAVIORAL HEALTH","09/21/2016 06:25:39 PM","86XX BLOCK OF 23 AV NE","U","U1","2100.3008",-122.30446,47.691986,"(47.691986, -122.30446)","SUSPICIOUS PERSON, VEHICLE OR INCIDENT","SUSPICIOUS CIRCUMSTANCES","SUSPICIOUS CIRCUMSTANCES","",4018.92741714109,2016-09-21 18:25:39,2016-09-22
"1140",65767,1915942,17000015087,201715087,"220","CRISIS COMPLAINT - GENERAL","CRISIS CALL","BEHAVIORAL HEALTH","01/13/2017 03:42:14 AM","55XX BLOCK OF NE 65 ST","U","U3","4200.1002",-122.26854,47.675747,"(47.675747, -122.26854)","CRISIS - PERSON IN BEHAVIORAL/EMOTIONAL CRISIS","BEHAVIORAL HEALTH","CRISIS CALL","01/13/2017 02:19:54 AM",3779.45618849841,2017-01-13 03:42:14,2017-01-13
"1141",65774,1803497,16000283243,2016283243,"220","CRISIS COMPLAINT - GENERAL","CRISIS CALL","BEHAVIORAL HEALTH","08/06/2016 04:15:32 PM","NE 45 ST / 15 AV NE","U","U2","5301.2010",-122.312,47.66126,"(47.66126, -122.312)","CRISIS - PERSON IN BEHAVIORAL/EMOTIONAL CRISIS","BEHAVIORAL HEALTH","CRISIS CALL","08/06/2016 03:11:23 PM",614.236940217108,2016-08-06 16:15:32,2016-08-06
"1142",65777,1952151,17000084450,201784450,"041","HARASSMENT, THREATS","THREATS, HARASSMENT","THREATS, HARASSMENT","03/09/2017 04:16:57 PM","52XX BLOCK OF ROOSEVELT WY NE","U","U1","4400.4004",-122.31738,47.66677,"(47.66677, -122.31738)","TRU - ASLT - WITH OR W/O WPNS (NO SHOOTINGS)","ASSAULTS","ASSAULTS","",1335.74402849983,2017-03-09 16:16:57,2017-03-10
"1143",65791,1853316,16000369163,2016369163,"350","HAZARDS","HAZARDS","HAZARDS","10/11/2016 07:59:52 PM","NE 45 PL / MARY GATES MEMORIAL DR NE","U","U3","4301.1013",-122.29287,47.66124,"(47.66124, -122.29287)","TRAFFIC - BO SIGNALS AND DOWN SIGNS","TRAFFIC RELATED CALLS","TRAFFIC RELATED CALLS","10/11/2016 05:47:08 PM",1378.36436997833,2016-10-11 19:59:52,2016-10-12
"1144",65817,1853374,16000369087,2016369087,"220","CRISIS COMPLAINT - GENERAL","CRISIS CALL","BEHAVIORAL HEALTH","10/11/2016 09:16:13 PM","NE 42 ST / UNIVERSITY WY NE","U","U2","5301.3008",-122.31321,47.658314,"(47.658314, -122.31321)","DISTURBANCE, MISCELLANEOUS/OTHER","DISTURBANCES","DISTURBANCES","10/11/2016 06:09:45 PM",379.289152249279,2016-10-11 21:16:13,2016-10-12
"1145",65859,1973051,17000123501,2017123501,"220","CRISIS COMPLAINT - GENERAL","CRISIS CALL","BEHAVIORAL HEALTH","04/08/2017 10:14:26 PM","NE 50 ST / ROOSEVELT WY NE","U","U1","5200.5",-122.317406,47.664936,"(47.664936, -122.317406)","SUSPICIOUS PERSON, VEHICLE OR INCIDENT","SUSPICIOUS CIRCUMSTANCES","SUSPICIOUS CIRCUMSTANCES","",1157.48588512645,2017-04-08 22:14:26,2017-04-09
"1146",65894,1942644,17000065810,201765810,"220","CRISIS COMPLAINT - GENERAL","CRISIS CALL","BEHAVIORAL HEALTH","02/22/2017 11:18:28 PM","75XX BLOCK OF 39 AV NE","U","U3","2400.2009",-122.286285,47.683937,"(47.683937, -122.286285)","CRISIS - PERSON IN BEHAVIORAL/EMOTIONAL CRISIS","BEHAVIORAL HEALTH","CRISIS CALL","02/22/2017 10:15:56 PM",3561.98610106541,2017-02-22 23:18:28,2017-02-23
"1147",65912,2053811,17000271162,2017271162,"242","FIGHT DISTURBANCE","DISTURBANCES","DISTURBANCES","07/25/2017 12:07:19 AM","42XX BLOCK OF BROOKLYN AV NE","U","U2","5301.3008",-122.31435,47.65907,"(47.65907, -122.31435)","FIGHT - VERBAL/ORAL (NO WEAPONS)","DISTURBANCES","DISTURBANCES","",499.238589913424,2017-07-25 00:07:19,2017-07-25
"1148",65947,2031401,17000230416,2017230416,"220","CRISIS COMPLAINT - GENERAL","CRISIS CALL","BEHAVIORAL HEALTH","06/26/2017 07:15:13 PM","16XX BLOCK OF NE 50 ST","U","U1","4400.3007",-122.31024,47.66488,"(47.66488, -122.31024)","CRISIS - PERSON IN BEHAVIORAL/EMOTIONAL CRISIS","BEHAVIORAL HEALTH","CRISIS CALL","06/26/2017 12:10:00 PM",988.874793332643,2017-06-26 19:15:13,2017-06-27
"1149",65967,1872736,16000403590,2016403590,"220","CRISIS COMPLAINT - GENERAL","CRISIS CALL","BEHAVIORAL HEALTH","11/07/2016 07:00:17 PM","UNIVERSITY WY NE / NE 47 ST","U","U2","5301.2010",-122.3131,47.66309,"(47.66309, -122.3131)","CRISIS - PERSON IN BEHAVIORAL/EMOTIONAL CRISIS","BEHAVIORAL HEALTH","CRISIS CALL","",833.383876029379,2016-11-07 19:00:17,2016-11-08
"1150",65988,2116145,17000384683,2017384683,"350","HAZARDS","HAZARDS","HAZARDS","10/16/2017 02:48:46 PM","NE WINDERMERE RD / SAND POINT WY NE","U","U3","4200.1029",-122.27109,47.669964,"(47.669964, -122.27109)","HAZ - POTENTIAL THRT TO PHYS SAFETY (NO HAZMAT)","HAZARDS","HAZARDS","",3276.21341316468,2017-10-16 14:48:46,2017-10-16
"1151",66041,2007636,17000187298,2017187298,"220","CRISIS COMPLAINT - GENERAL","CRISIS CALL","BEHAVIORAL HEALTH","05/26/2017 10:43:23 PM","68XX BLOCK OF 62 AV NE","U","U3","4000.1014",-122.26223,47.67889,"(47.67889, -122.26223)","OVERDOSE - DRUG RELATED CASUALTY","PERSON DOWN/INJURY","CASUALTIES","05/26/2017 09:28:54 PM",4368.13337390337,2017-05-26 22:43:23,2017-05-27
"1152",66049,1838811,16000343243,2016343243,"220","CRISIS COMPLAINT - GENERAL","CRISIS CALL","BEHAVIORAL HEALTH","09/21/2016 09:42:50 PM","77XX BLOCK OF 19 AV NE","U","U1","2600.1013",-122.30755,47.686523,"(47.686523, -122.30755)","SUSPICIOUS PERSON, VEHICLE OR INCIDENT","SUSPICIOUS CIRCUMSTANCES","SUSPICIOUS CIRCUMSTANCES","09/21/2016 08:07:08 PM",3396.82503637149,2016-09-21 21:42:50,2016-09-22
"1153",66054,1938291,17000056850,201756850,"041","HARASSMENT, THREATS","THREATS, HARASSMENT","THREATS, HARASSMENT","02/15/2017 07:17:44 PM","43XX BLOCK OF 7 AV NE","U","U2","5200.1",-122.32083,47.660034,"(47.660034, -122.32083)","FIGHT - IP - PHYSICAL (NO WEAPONS)","DISTURBANCES","DISTURBANCES","02/15/2017 05:50:42 PM",962.028771772983,2017-02-15 19:17:44,2017-02-16
"1154",66099,2116662,17000385640,2017385640,"350","HAZARDS","HAZARDS","HAZARDS","10/17/2017 09:42:53 AM","NE 55 ST / 45 AV NE","U","U3","4200.2018",-122.279465,47.669018,"(47.669018, -122.279465)","TRAFFIC - BO SIGNALS AND DOWN SIGNS","TRAFFIC RELATED CALLS","TRAFFIC RELATED CALLS","",2680.3464018537,2017-10-17 09:42:53,2017-10-17
"1155",66103,2019324,17000208727,2017208727,"350","HAZARDS","HAZARDS","HAZARDS","06/10/2017 06:25:21 PM","NE 55 ST / 25 AV NE","U","U1","4302.2",-122.30062,47.66852,"(47.66852, -122.30062)","TRAFFIC - BO SIGNALS AND DOWN SIGNS","TRAFFIC RELATED CALLS","TRAFFIC RELATED CALLS","06/10/2017 05:42:46 PM",1543.56487920368,2017-06-10 18:25:21,2017-06-11
"1156",66104,1816460,16000305836,2016305836,"242","FIGHT DISTURBANCE","DISTURBANCES","DISTURBANCES","08/24/2016 10:13:45 AM","16XX BLOCK OF NE 50 ST","U","U1","4400.3007",-122.31024,47.66488,"(47.66488, -122.31024)","FIGHT - VERBAL/ORAL (NO WEAPONS)","DISTURBANCES","DISTURBANCES","",988.874793332643,2016-08-24 10:13:45,2016-08-24
"1157",66106,1997531,17000168842,2017168842,"350","HAZARDS","HAZARDS","HAZARDS","05/13/2017 10:43:26 PM","43XX BLOCK OF UNIVERSITY WY NE","U","U2","5301.3001",-122.31315,47.660534,"(47.660534, -122.31315)","HAZ - POTENTIAL THRT TO PHYS SAFETY (NO HAZMAT)","HAZARDS","HAZARDS","05/13/2017 09:16:26 PM",573.843522369168,2017-05-13 22:43:26,2017-05-14
"1158",66111,2043005,17000251668,2017251668,"220","CRISIS COMPLAINT - GENERAL","CRISIS CALL","BEHAVIORAL HEALTH","07/11/2017 11:13:40 AM","85XX BLOCK OF 23 AV NE","U","U1","2100.3005",-122.30417,47.69074,"(47.69074, -122.30417)","CRISIS - PERSON IN BEHAVIORAL/EMOTIONAL CRISIS","BEHAVIORAL HEALTH","CRISIS CALL","07/11/2017 09:37:40 AM",3883.21405000619,2017-07-11 11:13:40,2017-07-11
"1159",66118,1948885,17000078035,201778035,"242","FIGHT DISTURBANCE","DISTURBANCES","DISTURBANCES","03/04/2017 12:23:44 PM","65XX BLOCK OF SAND POINT WY NE","U","U3","4000.1028",-122.26355,47.676197,"(47.676197, -122.26355)","FIGHT - VERBAL/ORAL (NO WEAPONS)","DISTURBANCES","DISTURBANCES","",4117.37052735623,2017-03-04 12:23:44,2017-03-04
"1160",66196,1973554,17000124383,2017124383,"220","CRISIS COMPLAINT - GENERAL","CRISIS CALL","BEHAVIORAL HEALTH","04/09/2017 06:22:13 PM","50XX BLOCK OF ROOSEVELT WY NE","U","U1","4400.4005",-122.3174,47.665688,"(47.665688, -122.3174)","DISTURBANCE, MISCELLANEOUS/OTHER","DISTURBANCES","DISTURBANCES","",1229.78206620259,2017-04-09 18:22:13,2017-04-10
"1161",66199,1815788,16000304454,2016304454,"350","HAZARDS","HAZARDS","HAZARDS","08/23/2016 01:07:36 PM","32 AV NE / NE 75 ST","U","U3","3800.1002",-122.29369,47.683044,"(47.683044, -122.29369)","HAZ - POTENTIAL THRT TO PHYS SAFETY (NO HAZMAT)","HAZARDS","HAZARDS","",3232.79617996966,2016-08-23 13:07:36,2016-08-23
"1162",66203,1973581,17000124364,2017124364,"041","HARASSMENT, THREATS","THREATS, HARASSMENT","THREATS, HARASSMENT","04/09/2017 07:15:33 PM","45XX BLOCK OF UNIVERSITY WY NE","U","U2","5301.2009",-122.31312,47.66218,"(47.66218, -122.31312)","DISTURBANCE, MISCELLANEOUS/OTHER","DISTURBANCES","DISTURBANCES","04/09/2017 05:43:21 PM",738.963514898043,2017-04-09 19:15:33,2017-04-10
"1163",66205,1838995,16000343592,2016343592,"041","HARASSMENT, THREATS","THREATS, HARASSMENT","THREATS, HARASSMENT","09/22/2016 03:31:13 AM","55XX BLOCK OF ROOSEVELT WY NE","U","U1","4400.2027",-122.317154,47.669266,"(47.669266, -122.317154)","WEAPN-IP/JO-GUN,DEADLY WPN (NO THRT/ASLT/DIST)","WEAPONS CALLS","WEAPONS CALLS","09/22/2016 02:35:06 AM",1583.04259911948,2016-09-22 03:31:13,2016-09-22
"1164",66231,2065983,17000294699,2017294699,"041","HARASSMENT, THREATS","THREATS, HARASSMENT","THREATS, HARASSMENT","08/10/2017 08:05:06 AM","NE 45 ST / BROOKLYN AV NE","U","U2","5301.2008",-122.314285,47.661274,"(47.661274, -122.314285)","WEAPN-IP/JO-GUN,DEADLY WPN (NO THRT/ASLT/DIST)","WEAPONS CALLS","WEAPONS CALLS","08/10/2017 07:40:34 AM",687.775955514295,2017-08-10 08:05:06,2017-08-10
"1165",66236,2019455,17000208896,2017208896,"350","HAZARDS","HAZARDS","HAZARDS","06/10/2017 09:32:16 PM","41XX BLOCK OF 55 AV NE","U","U3","4100.2013",-122.26991,47.658348,"(47.658348, -122.26991)","HARBOR - WATER EMERGENCIES","HARBOR CALLS","HARBOR CALLS","",2985.37437543805,2017-06-10 21:32:16,2017-06-11
"1166",66244,2053852,17000271112,2017271112,"041","HARASSMENT, THREATS","THREATS, HARASSMENT","THREATS, HARASSMENT","07/25/2017 01:30:34 AM","NE 52 ST / UNIVERSITY WY NE","U","U1","4400.4008",-122.31305,47.666435,"(47.666435, -122.31305)","DISTURBANCE, MISCELLANEOUS/OTHER","DISTURBANCES","DISTURBANCES","07/24/2017 10:38:11 PM",1190.45003433767,2017-07-25 01:30:34,2017-07-25
"1167",66248,1938248,17000056824,201756824,"041","HARASSMENT, THREATS","THREATS, HARASSMENT","THREATS, HARASSMENT","02/15/2017 06:29:53 PM","47XX BLOCK OF BROOKLYN AV NE","U","U2","5301.2002",-122.314224,47.664005,"(47.664005, -122.314224)","THREATS (INCLS IN-PERSON/BY PHONE/IN WRITING)","THREATS, HARASSMENT","THREATS, HARASSMENT","02/15/2017 05:36:31 PM",958.152960945758,2017-02-15 18:29:53,2017-02-16
"1168",66296,1952616,17000085263,201785263,"350","HAZARDS","HAZARDS","HAZARDS","03/10/2017 07:42:17 AM","RAVENNA AV NE / NE 92 ST","U","U1","2100.3002",-122.30537,47.695747,"(47.695747, -122.30537)","TREES DOWN, OBSTRUCTING PUBLIC PROP (NO HAZ)","TREES DOWN","TREES DOWN","03/10/2017 06:47:54 AM",4430.09958247356,2017-03-10 07:42:17,2017-03-10
"1169",66324,1964999,17000108469,2017108469,"350","HAZARDS","HAZARDS","HAZARDS","03/28/2017 01:17:47 PM","NE 47 ST / ROOSEVELT WY NE","U","U2","5301.2006",-122.31742,47.663116,"(47.663116, -122.31742)","TRAFFIC - BO SIGNALS AND DOWN SIGNS","TRAFFIC RELATED CALLS","TRAFFIC RELATED CALLS","",989.893773368176,2017-03-28 13:17:47,2017-03-28
"1170",66325,1965005,17000108393,2017108393,"350","HAZARDS","HAZARDS","HAZARDS","03/28/2017 01:08:00 PM","NE BLAKELEY ST / 25 AV NE","U","U1","4302.2006",-122.300606,47.666267,"(47.666267, -122.300606)","HAZ - POTENTIAL THRT TO PHYS SAFETY (NO HAZMAT)","HAZARDS","HAZARDS","03/28/2017 12:31:39 PM",1322.63748539703,2017-03-28 13:08:00,2017-03-28
"1171",66339,1989349,17000153379,2017153379,"220","CRISIS COMPLAINT - GENERAL","CRISIS CALL","BEHAVIORAL HEALTH","05/03/2017 01:55:12 AM","39XX BLOCK OF NE 45 ST","U","U3","4100.5002",-122.28599,47.661263,"(47.661263, -122.28599)","CRISIS - PERSON IN BEHAVIORAL/EMOTIONAL CRISIS","BEHAVIORAL HEALTH","CRISIS CALL","05/02/2017 09:59:29 PM",1860.40706322282,2017-05-03 01:55:12,2017-05-03
"1172",66341,1953507,17000087081,201787081,"220","CRISIS COMPLAINT - GENERAL","CRISIS CALL","BEHAVIORAL HEALTH","03/11/2017 01:50:54 PM","47XX BLOCK OF UNIVERSITY WY NE","U","U2","5301.2002",-122.31309,47.663998,"(47.663998, -122.31309)","CRISIS - PERSON IN BEHAVIORAL/EMOTIONAL CRISIS","BEHAVIORAL HEALTH","CRISIS CALL","03/11/2017 01:13:02 PM",929.234922041086,2017-03-11 13:50:54,2017-03-11
"1173",66381,1986564,17000148570,2017148570,"220","CRISIS COMPLAINT - GENERAL","CRISIS CALL","BEHAVIORAL HEALTH","04/28/2017 11:31:58 PM","89XX BLOCK OF RAVENNA AV NE","U","U1","2100.3002",-122.30303,47.69351,"(47.69351, -122.30303)","CRISIS - PERSON IN BEHAVIORAL/EMOTIONAL CRISIS","BEHAVIORAL HEALTH","CRISIS CALL","04/28/2017 07:34:05 PM",4198.71644224478,2017-04-28 23:31:58,2017-04-29
"1174",66386,1952684,17000085356,201785356,"041","HARASSMENT, THREATS","THREATS, HARASSMENT","THREATS, HARASSMENT","03/10/2017 10:32:33 AM","45XX BLOCK OF 19 AV NE","U","U1","5301.1008",-122.30723,47.662155,"(47.662155, -122.30723)","THREATS (INCLS IN-PERSON/BY PHONE/IN WRITING)","THREATS, HARASSMENT","THREATS, HARASSMENT","03/10/2017 08:32:25 AM",705.258645823833,2017-03-10 10:32:33,2017-03-10
"1175",66388,2053863,17000271164,2017271164,"031","STRONG ARM ROBBERY","ROBBERY","ROBBERY","07/25/2017 01:43:44 AM","44XX BLOCK OF NE 70 ST","U","U3","3900.1011",-122.28079,47.679413,"(47.679413, -122.28079)","ROBBERY (INCLUDES STRONG ARM)","ROBBERY","ROBBERY","07/25/2017 12:37:22 AM",3380.18413397909,2017-07-25 01:43:44,2017-07-25
"1176",66392,2008138,17000188299,2017188299,"242","FIGHT DISTURBANCE","DISTURBANCES","DISTURBANCES","05/27/2017 02:55:59 PM","52XX BLOCK OF MITHUN PL NE","U","U3","4200.2023",-122.28154,47.667786,"(47.667786, -122.28154)","FIGHT - IP - PHYSICAL (NO WEAPONS)","DISTURBANCES","DISTURBANCES","",2475.41708107211,2017-05-27 14:55:59,2017-05-27
"1177",66427,1916129,17000015437,201715437,"350","HAZARDS","HAZARDS","HAZARDS","01/13/2017 01:01:31 PM","NE 59 ST / ROOSEVELT WY NE","U","U1","4500.1006",-122.31737,47.671474,"(47.671474, -122.31737)","WIRES DOWN (PHONE, ELECTRICAL,ETC.)","HAZARDS","HAZARDS","",1819.17109590466,2017-01-13 13:01:31,2017-01-13
"1178",66457,1965240,17000108865,2017108865,"350","HAZARDS","HAZARDS","HAZARDS","03/28/2017 08:00:40 PM","38 AV NE / NE 75 ST","U","U3","3900.1003",-122.287796,47.683044,"(47.683044, -122.287796)","HAZ - POTENTIAL THRT TO PHYS SAFETY (NO HAZMAT)","HAZARDS","HAZARDS","",3420.24021038286,2017-03-28 20:00:40,2017-03-29
"1179",66485,1997801,17000169408,2017169408,"350","HAZARDS","HAZARDS","HAZARDS","05/14/2017 09:10:49 AM","NE 50 ST / 12 AV NE","U","U1","5301.2004",-122.31524,47.664917,"(47.664917, -122.31524)","HAZ - POTENTIAL THRT TO PHYS SAFETY (NO HAZMAT)","HAZARDS","HAZARDS","",1081.11817967794,2017-05-14 09:10:49,2017-05-14
"1180",66492,1956487,17000092685,201792685,"031","STRONG ARM ROBBERY","ROBBERY","ROBBERY","03/16/2017 03:34:46 AM","42XX BLOCK OF UNIVERSITY WY NE","U","U2","5301.3008",-122.31319,47.659054,"(47.659054, -122.31319)","ROBBERY (INCLUDES STRONG ARM)","ROBBERY","ROBBERY","03/16/2017 01:04:53 AM",438.325335850633,2017-03-16 03:34:46,2017-03-16
"1181",66528,2140752,17000429638,2017429638,"031","STRONG ARM ROBBERY","ROBBERY","ROBBERY","11/20/2017 02:14:33 PM","UNIVERSITY WY NE / NE 42 ST","U","U2","5301.3009",-122.31321,47.658314,"(47.658314, -122.31321)","ROBBERY - IP/JO (INCLUDES STRONG ARM)","ROBBERY","ROBBERY","11/20/2017 11:48:14 AM",379.289152249279,2017-11-20 14:14:33,2017-11-20
"1182",66533,1956981,17000093867,201793867,"350","HAZARDS","HAZARDS","HAZARDS","03/16/2017 08:34:44 PM","MONTLAKE BV NE / NE PACIFIC ST","U","U2","5302.3",-122.30459,47.648994,"(47.648994, -122.30459)","HAZ - POTENTIAL THRT TO PHYS SAFETY (NO HAZMAT)","HAZARDS","HAZARDS","",861.874216742478,2017-03-16 20:34:44,2017-03-17
"1183",66542,1957075,17000093673,201793673,"350","HAZARDS","HAZARDS","HAZARDS","03/16/2017 10:25:45 PM","25 AV NE / NE 55 ST","U","U1","4302.2",-122.30062,47.66852,"(47.66852, -122.30062)","TRAFFIC - BO SIGNALS AND DOWN SIGNS","TRAFFIC RELATED CALLS","TRAFFIC RELATED CALLS","",1543.56487920368,2017-03-16 22:25:45,2017-03-17
"1184",66543,2043299,17000252382,2017252382,"031","STRONG ARM ROBBERY","ROBBERY","ROBBERY","07/11/2017 07:31:25 PM","NE RAVENNA BV / NE 63 ST","U","U1","3600.1046",-122.32065,47.674,"(47.674, -122.32065)","ASLT - IP/JO - WITH OR W/O WPNS (NO SHOOTINGS)","ASSAULTS","ASSAULTS","07/11/2017 06:41:15 PM",2169.45844362182,2017-07-11 19:31:25,2017-07-12
"1185",66561,1997895,17000169502,2017169502,"350","HAZARDS","HAZARDS","HAZARDS","05/14/2017 01:08:49 PM","NE 65 ST / 15 AV NE","U","U1","4400.2",-122.31193,47.67578,"(47.67578, -122.31193)","TRAFFIC - BO SIGNALS AND DOWN SIGNS","TRAFFIC RELATED CALLS","TRAFFIC RELATED CALLS","05/14/2017 11:18:50 AM",2206.77587655162,2017-05-14 13:08:49,2017-05-14
"1186",66572,1957573,17000094515,201794515,"350","HAZARDS","HAZARDS","HAZARDS","03/17/2017 04:47:58 PM","UNIVERSITY WY NE / NE 40 ST","U","U2","5302.2",-122.313286,47.65535,"(47.65535, -122.313286)","TRAFFIC - BO SIGNALS AND DOWN SIGNS","TRAFFIC RELATED CALLS","TRAFFIC RELATED CALLS","",293.444886234225,2017-03-17 16:47:58,2017-03-17
"1187",66589,1957924,17000095560,201795560,"350","HAZARDS","HAZARDS","HAZARDS","03/18/2017 02:46:03 AM","17 AV NE / NE 45 ST","U","U2","5301.1007",-122.30951,47.66126,"(47.66126, -122.30951)","DUI - DRIVING UNDER INFLUENCE","TRAFFIC RELATED CALLS","TRAFFIC RELATED CALLS","",584.826631448518,2017-03-18 02:46:03,2017-03-18
"1188",66594,1853719,16000369871,2016369871,"350","HAZARDS","HAZARDS","HAZARDS","10/12/2016 11:50:25 AM","EASTLAKE AV NE / NE 41 ST","U","U2","5301.4005",-122.31718,47.65688,"(47.65688, -122.31718)","HAZ - POTENTIAL THRT TO PHYS SAFETY (NO HAZMAT)","HAZARDS","HAZARDS","10/12/2016 10:40:47 AM",585.15538693368,2016-10-12 11:50:25,2016-10-12
"1189",66597,2043176,17000252018,2017252018,"341","HARBOR - DEBRIS, NAVIGATIONAL HAZARDS","HARBOR CALLS","HARBOR CALLS","07/11/2017 04:03:24 PM","42XX BLOCK OF NE 33 ST","U","U3","4100.6017",-122.27982,47.652378,"(47.652378, -122.27982)","HARBOR - WATER DEBRIS, NAVIGATIONAL HAZARDS","HARBOR CALLS","HARBOR CALLS","07/11/2017 02:16:17 PM",2265.71735459813,2017-07-11 16:03:24,2017-07-11
"1190",66614,1986673,17000149048,2017149048,"350","HAZARDS","HAZARDS","HAZARDS","04/29/2017 03:12:25 AM","35 AV NE / NE 57 ST","U","U3","4200.5025",-122.290215,47.67032,"(47.67032, -122.290215)","HAZ - POTENTIAL THRT TO PHYS SAFETY (NO HAZMAT)","HAZARDS","HAZARDS","",2152.45878022957,2017-04-29 03:12:25,2017-04-29
"1191",66617,2031474,17000231051,2017231051,"350","HAZARDS","HAZARDS","HAZARDS","06/26/2017 08:49:52 PM","41XX BLOCK OF BROOKLYN AV NE","U","U2","5301.4001",-122.314384,47.65759,"(47.65759, -122.314384)","HAZ - POTENTIAL THRT TO PHYS SAFETY (NO HAZMAT)","HAZARDS","HAZARDS","",407.251211570122,2017-06-26 20:49:52,2017-06-27
"1192",66633,1974058,17000125514,2017125514,"350","HAZARDS","HAZARDS","HAZARDS","04/10/2017 07:08:19 PM","9 AV NE / NE 48 ST","U","U2","5200.5001",-122.31839,47.664005,"(47.664005, -122.31839)","TRAFFIC - BO SIGNALS AND DOWN SIGNS","TRAFFIC RELATED CALLS","TRAFFIC RELATED CALLS","04/10/2017 04:00:48 PM",1112.6804694586,2017-04-10 19:08:19,2017-04-11
"1193",66652,2019600,17000208840,2017208840,"220","CRISIS COMPLAINT - GENERAL","CRISIS CALL","BEHAVIORAL HEALTH","06/11/2017 12:47:23 AM","14XX BLOCK OF NE 43 ST","U","U2","5301.3009",-122.3126,47.65979,"(47.65979, -122.3126)","DISTURBANCE, MISCELLANEOUS/OTHER","DISTURBANCES","DISTURBANCES","06/10/2017 07:50:08 PM",481.44763654886,2017-06-11 00:47:23,2017-06-11
"1194",66672,1965529,17000109302,2017109302,"220","CRISIS COMPLAINT - GENERAL","CRISIS CALL","BEHAVIORAL HEALTH","03/29/2017 08:43:38 AM","47XX BLOCK OF 12 AV NE","U","U2","5301.2004",-122.315254,47.664013,"(47.664013, -122.315254)","CRISIS - PERSON IN BEHAVIORAL/EMOTIONAL CRISIS","BEHAVIORAL HEALTH","CRISIS CALL","03/29/2017 06:00:56 AM",990.218839131712,2017-03-29 08:43:38,2017-03-29
"1195",66715,1987225,17000149820,2017149820,"220","CRISIS COMPLAINT - GENERAL","CRISIS CALL","BEHAVIORAL HEALTH","04/29/2017 10:44:32 PM","89XX BLOCK OF RAVENNA AV NE","U","U1","2100.3002",-122.30303,47.69351,"(47.69351, -122.30303)","CRISIS - PERSON IN BEHAVIORAL/EMOTIONAL CRISIS","BEHAVIORAL HEALTH","CRISIS CALL","04/29/2017 08:21:54 PM",4198.71644224478,2017-04-29 22:44:32,2017-04-30
"1196",66718,1952756,17000085579,201785579,"220","CRISIS COMPLAINT - GENERAL","CRISIS CALL","BEHAVIORAL HEALTH","03/10/2017 12:46:34 PM","14XX BLOCK OF NE 66 ST","U","U1","2600.3009",-122.31254,47.676514,"(47.676514, -122.31254)","OVERDOSE - DRUG RELATED CASUALTY","PERSON DOWN/INJURY","CASUALTIES","03/10/2017 11:35:24 AM",2292.22446639512,2017-03-10 12:46:34,2017-03-10
"1197",66770,1961901,17000102506,2017102506,"350","HAZARDS","HAZARDS","HAZARDS","03/23/2017 10:40:11 PM","13XX BLOCK OF NE 45 ST","U","U2","5301.2009",-122.313705,47.661274,"(47.661274, -122.313705)","TRAFFIC - BO SIGNALS AND DOWN SIGNS","TRAFFIC RELATED CALLS","TRAFFIC RELATED CALLS","",666.044174195878,2017-03-23 22:40:11,2017-03-24
"1198",66830,1963098,17000104867,2017104867,"220","CRISIS COMPLAINT - GENERAL","CRISIS CALL","BEHAVIORAL HEALTH","03/25/2017 04:24:00 PM","50XX BLOCK OF 15 AV NE","U","U1","4400.3006",-122.31193,47.66566,"(47.66566, -122.31193)","SUSPICIOUS PERSON, VEHICLE OR INCIDENT","SUSPICIOUS CIRCUMSTANCES","SUSPICIOUS CIRCUMSTANCES","03/25/2017 03:03:26 PM",1089.43380769836,2017-03-25 16:24:00,2017-03-25
"1199",66856,1963693,17000105914,2017105914,"041","HARASSMENT, THREATS","THREATS, HARASSMENT","THREATS, HARASSMENT","03/26/2017 01:56:57 PM","22XX BLOCK OF NE 92 ST","U","U1","2100.2003",-122.30477,47.695744,"(47.695744, -122.30477)","THREATS (INCLS IN-PERSON/BY PHONE/IN WRITING)","THREATS, HARASSMENT","THREATS, HARASSMENT","03/26/2017 12:52:12 PM",4433.14898327686,2017-03-26 13:56:57,2017-03-26
"1200",66877,1987388,17000150194,2017150194,"242","FIGHT DISTURBANCE","DISTURBANCES","DISTURBANCES","04/30/2017 04:11:33 AM","UNIVERSITY WY NE / NE 45 ST","U","U2","5301.3001",-122.31313,47.661266,"(47.661266, -122.31313)","FIGHT - IP - PHYSICAL (NO WEAPONS)","DISTURBANCES","DISTURBANCES","04/30/2017 02:13:07 AM",645.873447683438,2017-04-30 04:11:33,2017-04-30
"1201",66921,2116508,17000385148,2017385148,"041","HARASSMENT, THREATS","THREATS, HARASSMENT","THREATS, HARASSMENT","10/17/2017 01:54:13 AM","38XX BLOCK OF 42 AV NE","U","U3","4100.5009",-122.28275,47.657253,"(47.657253, -122.28275)","THREATS (INCLS IN-PERSON/BY PHONE/IN WRITING)","THREATS, HARASSMENT","THREATS, HARASSMENT","10/16/2017 10:16:49 PM",2014.26215702426,2017-10-17 01:54:13,2017-10-17
"1202",66925,1964955,17000108369,2017108369,"220","CRISIS COMPLAINT - GENERAL","CRISIS CALL","BEHAVIORAL HEALTH","03/28/2017 12:23:21 PM","7XX BLOCK OF NE 43 ST","U","U2","5200.1004",-122.32031,47.659462,"(47.659462, -122.32031)","SUSPICIOUS PERSON, VEHICLE OR INCIDENT","SUSPICIOUS CIRCUMSTANCES","SUSPICIOUS CIRCUMSTANCES","",898.632630297104,2017-03-28 12:23:21,2017-03-28
"1203",66936,1965211,17000108673,2017108673,"041","HARASSMENT, THREATS","THREATS, HARASSMENT","THREATS, HARASSMENT","03/28/2017 07:15:08 PM","10XX BLOCK OF NE 64 ST","U","U1","4400.2003",-122.31651,47.67498,"(47.67498, -122.31651)","THREATS (INCLS IN-PERSON/BY PHONE/IN WRITING)","THREATS, HARASSMENT","THREATS, HARASSMENT","03/28/2017 04:47:24 PM",2174.95580708281,2017-03-28 19:15:08,2017-03-29
"1204",66989,1804257,16000284554,2016284554,"220","CRISIS COMPLAINT - GENERAL","CRISIS CALL","BEHAVIORAL HEALTH","08/07/2016 03:44:26 PM","43XX BLOCK OF UNIVERSITY WY NE","U","U2","5301.3001",-122.31315,47.660534,"(47.660534, -122.31315)","CRISIS - PERSON IN BEHAVIORAL/EMOTIONAL CRISIS","BEHAVIORAL HEALTH","CRISIS CALL","",573.843522369168,2016-08-07 15:44:26,2016-08-07
"1205",66993,1839154,16000343900,2016343900,"220","CRISIS COMPLAINT - GENERAL","CRISIS CALL","BEHAVIORAL HEALTH","09/22/2016 11:20:51 AM","47XX BLOCK OF 12 AV NE","U","U2","5301.2003",-122.3149,47.66341,"(47.66341, -122.3149)","BURG - RES (INCL UNOCC STRUCTURES ON PROP)","BURGLARY","RESIDENTIAL BURGLARIES","09/22/2016 10:20:58 AM",918.30890396426,2016-09-22 11:20:51,2016-09-22
"1206",67032,1998481,17000170527,2017170527,"041","HARASSMENT, THREATS","THREATS, HARASSMENT","THREATS, HARASSMENT","05/15/2017 11:20:22 AM","62XX BLOCK OF 60 AV NE","U","U3","4100.1001",-122.26352,47.67398,"(47.67398, -122.26352)","THREATS (INCLS IN-PERSON/BY PHONE/IN WRITING)","THREATS, HARASSMENT","THREATS, HARASSMENT","05/15/2017 08:54:14 AM",3990.30247215059,2017-05-15 11:20:22,2017-05-15
"1207",67153,2043481,17000252666,2017252666,"220","CRISIS COMPLAINT - GENERAL","CRISIS CALL","BEHAVIORAL HEALTH","07/11/2017 11:43:54 PM","47XX BLOCK OF BROOKLYN AV NE","U","U2","5301.2003",-122.314224,47.664005,"(47.664005, -122.314224)","CRISIS - PERSON IN BEHAVIORAL/EMOTIONAL CRISIS","BEHAVIORAL HEALTH","CRISIS CALL","",958.152960945758,2017-07-11 23:43:54,2017-07-12
"1208",67159,1973382,17000124032,2017124032,"350","HAZARDS","HAZARDS","HAZARDS","04/09/2017 12:34:58 PM","50XX BLOCK OF ROOSEVELT WY NE","U","U1","4500.1009",-122.3174,47.665688,"(47.665688, -122.3174)","HAZ - POTENTIAL THRT TO PHYS SAFETY (NO HAZMAT)","HAZARDS","HAZARDS","",1229.78206620259,2017-04-09 12:34:58,2017-04-09
"1209",67194,1998761,17000170996,2017170996,"350","HAZARDS","HAZARDS","HAZARDS","05/15/2017 07:17:37 PM","30XX BLOCK OF WEBSTER POINT RD NE","U","U3","4100.602",-122.27754,47.64912,"(47.64912, -122.27754)","HAZ - POTENTIAL THRT TO PHYS SAFETY (NO HAZMAT)","HAZARDS","HAZARDS","05/15/2017 02:51:10 PM",2519.90478221886,2017-05-15 19:17:37,2017-05-16
"1210",67236,1864685,16000389215,2016389215,"220","CRISIS COMPLAINT - GENERAL","CRISIS CALL","BEHAVIORAL HEALTH","10/27/2016 07:17:04 PM","42XX BLOCK OF 7 AV NE","U","U2","5200.1003",-122.32117,47.65809,"(47.65809, -122.32117)","BURG - RES (INCL UNOCC STRUCTURES ON PROP)","BURGLARY","RESIDENTIAL BURGLARIES","10/27/2016 05:08:46 PM",906.909557788222,2016-10-27 19:17:04,2016-10-28
"1211",67301,1974038,17000125553,2017125553,"220","CRISIS COMPLAINT - GENERAL","CRISIS CALL","BEHAVIORAL HEALTH","04/10/2017 07:02:06 PM","UNIVERSITY WY NE / NE 47 ST","U","U2","5301.2009",-122.3131,47.66309,"(47.66309, -122.3131)","DISTURBANCE, MISCELLANEOUS/OTHER","DISTURBANCES","DISTURBANCES","04/10/2017 04:21:43 PM",833.383876029379,2017-04-10 19:02:06,2017-04-11
"1212",67340,1839380,16000344487,2016344487,"350","HAZARDS","HAZARDS","HAZARDS","09/22/2016 05:19:33 PM","NE CAMPUS PY / 15 AV NE","U","U2","5302.1009",-122.312126,47.656204,"(47.656204, -122.312126)","HAZ - POTENTIAL THRT TO PHYS SAFETY (NO HAZMAT)","HAZARDS","HAZARDS","",198.564676709177,2016-09-22 17:19:33,2016-09-23
"1213",67389,1830073,16000329230,2016329230,"242","FIGHT DISTURBANCE","DISTURBANCES","DISTURBANCES","09/11/2016 12:54:12 AM","47XX BLOCK OF BROOKLYN AV NE","U","U2","5301.2003",-122.3145,47.663662,"(47.663662, -122.3145)","FIGHT - IP - PHYSICAL (NO WEAPONS)","DISTURBANCES","DISTURBANCES","09/11/2016 12:25:11 AM",931.005299271606,2016-09-11 00:54:12,2016-09-11
"1214",67411,1988470,17000151870,2017151870,"031","STRONG ARM ROBBERY","ROBBERY","ROBBERY","05/01/2017 07:19:03 PM","47XX BLOCK OF 33 AV NE","U","U3","4200.3046",-122.29319,47.66333,"(47.66333, -122.29319)","ASLT - IP/JO - WITH OR W/O WPNS (NO SHOOTINGS)","ASSAULTS","ASSAULTS","05/01/2017 04:48:00 PM",1471.43243270371,2017-05-01 19:19:03,2017-05-02
"1215",67435,2043856,17000253408,2017253408,"220","CRISIS COMPLAINT - GENERAL","CRISIS CALL","BEHAVIORAL HEALTH","07/12/2017 03:00:19 PM","13XX BLOCK OF NE 45 ST","U","U2","5301.2009",-122.313705,47.661274,"(47.661274, -122.313705)","DISTURBANCE, MISCELLANEOUS/OTHER","DISTURBANCES","DISTURBANCES","07/12/2017 02:45:07 PM",666.044174195878,2017-07-12 15:00:19,2017-07-12
"1216",67450,1978724,17000134042,2017134042,"031","STRONG ARM ROBBERY","ROBBERY","ROBBERY","04/17/2017 01:58:03 PM","45XX BLOCK OF UNIVERSITY WY NE","U","U2","5301.201",-122.31312,47.66218,"(47.66218, -122.31312)","ROBBERY - IP/JO (INCLUDES STRONG ARM)","ROBBERY","ROBBERY","04/17/2017 01:02:14 PM",738.963514898043,2017-04-17 13:58:03,2017-04-17
"1217",67479,2008945,17000189815,2017189815,"350","HAZARDS","HAZARDS","HAZARDS","05/28/2017 05:15:56 PM","21XX BLOCK OF NE 47 ST","U","U1","4302.1007",-122.30496,47.663074,"(47.663074, -122.30496)","HAZ - POTENTIAL THRT TO PHYS SAFETY (NO HAZMAT)","HAZARDS","HAZARDS","",857.262851400074,2017-05-28 17:15:56,2017-05-29
"1218",67495,2116605,17000385350,2017385350,"031","STRONG ARM ROBBERY","ROBBERY","ROBBERY","10/17/2017 06:28:42 AM","42XX BLOCK OF UNIVERSITY WY NE","U","U2","5301.3009",-122.31319,47.659054,"(47.659054, -122.31319)","ALARM - COMM, HOLD-UP/PANIC (EXCEPT BANKS)","ALACAD","SUSPICIOUS CIRCUMSTANCES","10/17/2017 04:24:18 AM",438.325335850633,2017-10-17 06:28:42,2017-10-17
"1219",67530,1988365,17000151592,2017151592,"220","CRISIS COMPLAINT - GENERAL","CRISIS CALL","BEHAVIORAL HEALTH","05/01/2017 04:59:05 PM","NE 50 ST / BROOKLYN AV NE","U","U2","5301.2002",-122.31421,47.664906,"(47.664906, -122.31421)","DISTURBANCE, MISCELLANEOUS/OTHER","DISTURBANCES","DISTURBANCES","05/01/2017 12:05:28 PM",1051.50585422232,2017-05-01 16:59:05,2017-05-01
"1220",67565,1980977,17000138497,2017138497,"350","HAZARDS","HAZARDS","HAZARDS","04/20/2017 11:13:13 PM","NE 52 ST / ROOSEVELT WY NE","U","U1","4400.4005",-122.31739,47.666435,"(47.666435, -122.31739)","HAZ - POTENTIAL THRT TO PHYS SAFETY (NO HAZMAT)","HAZARDS","HAZARDS","",1302.80068798946,2017-04-20 23:13:13,2017-04-21
"1221",67566,1974413,17000125235,2017125235,"220","CRISIS COMPLAINT - GENERAL","CRISIS CALL","BEHAVIORAL HEALTH","04/10/2017 07:18:17 PM","75XX BLOCK OF 39 AV NE","U","U3","2400.2009",-122.286285,47.683937,"(47.683937, -122.286285)","BURG - RES (INCL UNOCC STRUCTURES ON PROP)","BURGLARY","RESIDENTIAL BURGLARIES","04/10/2017 03:40:00 PM",3561.98610106541,2017-04-10 19:18:17,2017-04-11
"1222",67603,2091935,17000339638,2017339638,"041","HARASSMENT, THREATS","THREATS, HARASSMENT","THREATS, HARASSMENT","09/12/2017 05:26:55 PM","47XX BLOCK OF 12 AV NE","U","U2","5301.2004",-122.315254,47.664013,"(47.664013, -122.315254)","THREATS (INCLS IN-PERSON/BY PHONE/IN WRITING)","THREATS, HARASSMENT","THREATS, HARASSMENT","09/12/2017 02:43:52 PM",990.218839131712,2017-09-12 17:26:55,2017-09-13
"1223",67604,2032225,17000232442,2017232442,"350","HAZARDS","HAZARDS","HAZARDS","06/27/2017 10:50:45 PM","NE 45 ST / UNIVERSITY WY NE","U","U2","5301.3001",-122.31313,47.661266,"(47.661266, -122.31313)","HAZ - POTENTIAL THRT TO PHYS SAFETY (NO HAZMAT)","HAZARDS","HAZARDS","",645.873447683438,2017-06-27 22:50:45,2017-06-28
"1224",67614,2078601,17000315848,2017315848,"220","CRISIS COMPLAINT - GENERAL","CRISIS CALL","BEHAVIORAL HEALTH","08/26/2017 02:03:49 AM","UNIVERSITY WY NE / NE 42 ST","U","U2","5301.3009",-122.31321,47.658314,"(47.658314, -122.31321)","DISTURBANCE, MISCELLANEOUS/OTHER","DISTURBANCES","DISTURBANCES","",379.289152249279,2017-08-26 02:03:49,2017-08-26
"1225",67625,1982473,17000141280,2017141280,"242","FIGHT DISTURBANCE","DISTURBANCES","DISTURBANCES","04/23/2017 01:07:16 AM","89XX BLOCK OF LAKE CITY WY NE","U","U1","2100.3006",-122.30547,47.693478,"(47.693478, -122.30547)","FIGHT - IP - PHYSICAL (NO WEAPONS)","DISTURBANCES","DISTURBANCES","",4177.92832562756,2017-04-23 01:07:16,2017-04-23
"1226",67638,1999450,17000172577,2017172577,"350","HAZARDS","HAZARDS","HAZARDS","05/16/2017 06:36:23 PM","NE 45 ST / I5 NB","U","U2","5200.1001",-122.3219,47.661327,"(47.661327, -122.3219)","HAZ - POTENTIAL THRT TO PHYS SAFETY (NO HAZMAT)","HAZARDS","HAZARDS","",1103.79990374045,2017-05-16 18:36:23,2017-05-17
"1227",67656,1839516,16000344596,2016344596,"041","HARASSMENT, THREATS","THREATS, HARASSMENT","THREATS, HARASSMENT","09/22/2016 08:28:08 PM","41XX BLOCK OF 11 AV NE","U","U2","5301.4003",-122.31635,47.658146,"(47.658146, -122.31635)","TRU - THREATS","THREATS, HARASSMENT","THREATS, HARASSMENT","",567.189763960123,2016-09-22 20:28:08,2016-09-23
"1228",67709,1984052,17000143994,2017143994,"031","STRONG ARM ROBBERY","ROBBERY","ROBBERY","04/25/2017 02:15:39 PM","26XX BLOCK OF NE UNIVERSITY VILLAGE ST","U","U3","4301.1011",-122.29841,47.663322,"(47.663322, -122.29841)","SHOPLIFT - THEFT","SHOPLIFTING","THEFT","04/25/2017 12:01:49 PM",1164.76014484058,2017-04-25 14:15:39,2017-04-25
"1229",67727,1872629,16000403320,2016403320,"041","HARASSMENT, THREATS","THREATS, HARASSMENT","THREATS, HARASSMENT","11/07/2016 03:49:36 PM","45XX BLOCK OF UNIVERSITY WY NE","U","U2","5301.2009",-122.31344,47.66167,"(47.66167, -122.31344)","HARAS - NO BIAS, THREATS OR MALICIOUSNESS","THREATS, HARASSMENT","THREATS, HARASSMENT","",696.426082013458,2016-11-07 15:49:36,2016-11-07
"1230",67782,1999658,17000172556,2017172556,"220","CRISIS COMPLAINT - GENERAL","CRISIS CALL","BEHAVIORAL HEALTH","05/17/2017 12:20:57 AM","16XX BLOCK OF NE 50 ST","U","U1","4400.3007",-122.31024,47.66488,"(47.66488, -122.31024)","CRISIS - PERSON IN BEHAVIORAL/EMOTIONAL CRISIS","BEHAVIORAL HEALTH","CRISIS CALL","05/16/2017 08:05:03 PM",988.874793332643,2017-05-17 00:20:57,2017-05-17
"1231",67806,2032318,17000232543,2017232543,"041","HARASSMENT, THREATS","THREATS, HARASSMENT","THREATS, HARASSMENT","06/28/2017 01:23:48 AM","42XX BLOCK OF UNIVERSITY WY NE","U","U2","5301.3009",-122.31319,47.659054,"(47.659054, -122.31319)","THREATS (INCLS IN-PERSON/BY PHONE/IN WRITING)","THREATS, HARASSMENT","THREATS, HARASSMENT","",438.325335850633,2017-06-28 01:23:48,2017-06-28
"1232",67810,1999922,17000173210,2017173210,"220","CRISIS COMPLAINT - GENERAL","CRISIS CALL","BEHAVIORAL HEALTH","05/17/2017 11:54:51 AM","16XX BLOCK OF NE 65 ST","U","U1","2600.3017",-122.310326,47.67578,"(47.67578, -122.310326)","DISTURBANCE, MISCELLANEOUS/OTHER","DISTURBANCES","DISTURBANCES","05/17/2017 09:26:50 AM",2200.090788536,2017-05-17 11:54:51,2017-05-17
"1233",67825,1991707,17000158098,2017158098,"350","HAZARDS","HAZARDS","HAZARDS","05/06/2017 12:15:46 AM","18XX BLOCK OF NE 45 ST","U","U1","5301.1008",-122.307816,47.66126,"(47.66126, -122.307816)","HAZ - POTENTIAL THRT TO PHYS SAFETY (NO HAZMAT)","HAZARDS","HAZARDS","",598.35009595472,2017-05-06 00:15:46,2017-05-06
"1234",67826,2079273,17000316812,2017316812,"041","HARASSMENT, THREATS","THREATS, HARASSMENT","THREATS, HARASSMENT","08/27/2017 12:27:55 AM","14XX BLOCK OF NE 43 ST","U","U2","5301.3009",-122.3126,47.65979,"(47.65979, -122.3126)","HARAS - NO BIAS, THREATS OR MALICIOUSNESS","THREATS, HARASSMENT","THREATS, HARASSMENT","08/26/2017 09:13:25 PM",481.44763654886,2017-08-27 00:27:55,2017-08-27
"1235",67849,1854201,16000370603,2016370603,"220","CRISIS COMPLAINT - GENERAL","CRISIS CALL","BEHAVIORAL HEALTH","10/13/2016 12:36:51 AM","43XX BLOCK OF UNIVERSITY WY NE","U","U2","5301.3001",-122.313545,47.660713,"(47.660713, -122.313545)","DISTURBANCE, MISCELLANEOUS/OTHER","DISTURBANCES","DISTURBANCES","10/12/2016 08:48:13 PM",605.729438875264,2016-10-13 00:36:51,2016-10-13
"1236",67865,1965895,17000110060,2017110060,"031","STRONG ARM ROBBERY","ROBBERY","ROBBERY","03/29/2017 07:15:20 PM","41XX BLOCK OF UNIVERSITY WY NE","U","U2","5301.4",-122.313225,47.657574,"(47.657574, -122.313225)","ROBBERY - IP/JO (INCLUDES STRONG ARM)","ROBBERY","ROBBERY","03/29/2017 04:26:01 PM",330.036787270645,2017-03-29 19:15:20,2017-03-30
"1237",67896,2104405,17000362588,2017362588,"041","HARASSMENT, THREATS","THREATS, HARASSMENT","THREATS, HARASSMENT","09/29/2017 07:15:05 PM","56XX BLOCK OF UNIVERSITY WY NE","U","U1","4400.202",-122.31303,47.670216,"(47.670216, -122.31303)","THREATS (INCLS IN-PERSON/BY PHONE/IN WRITING)","THREATS, HARASSMENT","THREATS, HARASSMENT","09/29/2017 01:40:26 PM",1602.67210487326,2017-09-29 19:15:05,2017-09-30
"1238",67907,1953170,17000086317,201786317,"220","CRISIS COMPLAINT - GENERAL","CRISIS CALL","BEHAVIORAL HEALTH","03/11/2017 12:29:14 AM","45XX BLOCK OF 21 AV NE","U","U1","4302.1009",-122.305466,47.662167,"(47.662167, -122.305466)","CRISIS - PERSON IN BEHAVIORAL/EMOTIONAL CRISIS","BEHAVIORAL HEALTH","CRISIS CALL","03/10/2017 10:04:55 PM",749.641358093474,2017-03-11 00:29:14,2017-03-11
"1239",67934,1990373,17000155610,2017155610,"350","HAZARDS","HAZARDS","HAZARDS","05/04/2017 11:48:47 AM","I5 / NE 50 ST","U","U1","5200.5003",-122.321724,47.664963,"(47.664963, -122.321724)","HAZ - POTENTIAL THRT TO PHYS SAFETY (NO HAZMAT)","HAZARDS","HAZARDS","",1355.05103119415,2017-05-04 11:48:47,2017-05-04
"1240",67939,1991333,17000157349,2017157349,"350","HAZARDS","HAZARDS","HAZARDS","05/05/2017 03:28:14 PM","45XX BLOCK OF 21 AV NE","U","U1","4302.101",-122.305466,47.662167,"(47.662167, -122.305466)","WIRES DOWN (PHONE, ELECTRICAL,ETC.)","HAZARDS","HAZARDS","05/05/2017 02:16:42 PM",749.641358093474,2017-05-05 15:28:14,2017-05-05
"1241",67964,2032852,17000233411,2017233411,"041","HARASSMENT, THREATS","THREATS, HARASSMENT","THREATS, HARASSMENT","06/28/2017 07:23:06 PM","72XX BLOCK OF SAND POINT WY NE","U","U3","4000.1027",-122.26365,47.680744,"(47.680744, -122.26365)","TRESPASS","TRESPASS","TRESPASS","06/28/2017 03:55:03 PM",4407.49759113064,2017-06-28 19:23:06,2017-06-29
"1242",67980,2079044,17000316523,2017316523,"041","HARASSMENT, THREATS","THREATS, HARASSMENT","THREATS, HARASSMENT","08/26/2017 07:29:08 PM","80XX BLOCK OF LAKE CITY WY NE","U","U1","2600.4009",-122.31277,47.687103,"(47.687103, -122.31277)","THREATS (INCLS IN-PERSON/BY PHONE/IN WRITING)","THREATS, HARASSMENT","THREATS, HARASSMENT","08/26/2017 06:46:30 PM",3466.8619924913,2017-08-26 19:29:08,2017-08-27
"1243",67984,2104251,17000362790,2017362790,"350","HAZARDS","HAZARDS","HAZARDS","09/29/2017 04:07:57 PM","7 AV NE / NE 50 ST ON RP","U","U1","4500.1011",-122.3207,47.66549,"(47.66549, -122.3207)","HAZ - POTENTIAL THRT TO PHYS SAFETY (NO HAZMAT)","HAZARDS","HAZARDS","",1349.45918580607,2017-09-29 16:07:57,2017-09-29
"1244",67995,1999968,17000173482,2017173482,"350","HAZARDS","HAZARDS","HAZARDS","05/17/2017 01:14:49 PM","NE 40 ST / 7 AV NE","U","U2","5200.2008",-122.320854,47.65589,"(47.65589, -122.320854)","TRAFFIC - BO SIGNALS AND DOWN SIGNS","TRAFFIC RELATED CALLS","TRAFFIC RELATED CALLS","",853.00222043031,2017-05-17 13:14:49,2017-05-17
"1245",68026,1990924,17000156624,2017156624,"242","FIGHT DISTURBANCE","DISTURBANCES","DISTURBANCES","05/05/2017 12:19:15 AM","43XX BLOCK OF UNIVERSITY WY NE","U","U2","5301.3",-122.31315,47.660534,"(47.660534, -122.31315)","FIGHT - IP - PHYSICAL (NO WEAPONS)","DISTURBANCES","DISTURBANCES","",573.843522369168,2017-05-05 00:19:15,2017-05-05
"1246",68030,2000119,17000173832,2017173832,"350","HAZARDS","HAZARDS","HAZARDS","05/17/2017 05:45:41 PM","25 AV NE / NE 65 ST","U","U3","3800.2013",-122.30065,47.675774,"(47.675774, -122.30065)","WIRES DOWN (PHONE, ELECTRICAL,ETC.)","HAZARDS","HAZARDS","",2296.82963646545,2017-05-17 17:45:41,2017-05-18
"1247",68060,1816322,16000305456,2016305456,"030","ARMED ROBBERY","GUN CALLS","ROBBERY","08/24/2016 03:20:22 AM","65XX BLOCK OF SAND POINT WY NE","U","U3","4000.1028",-122.26355,47.676197,"(47.676197, -122.26355)","ROBBERY (INCLUDES STRONG ARM)","ROBBERY","ROBBERY","08/23/2016 11:57:55 PM",4117.37052735623,2016-08-24 03:20:22,2016-08-24
"1248",68087,2020841,17000211361,2017211361,"220","CRISIS COMPLAINT - GENERAL","CRISIS CALL","BEHAVIORAL HEALTH","06/12/2017 07:15:11 PM","14XX BLOCK OF NE 66 ST","U","U1","2600.3009",-122.31254,47.676514,"(47.676514, -122.31254)","OVERDOSE - DRUG RELATED CASUALTY","PERSON DOWN/INJURY","CASUALTIES","06/12/2017 04:04:04 PM",2292.22446639512,2017-06-12 19:15:11,2017-06-13
"1249",68099,2104572,17000363295,2017363295,"350","HAZARDS","HAZARDS","HAZARDS","09/30/2017 12:07:53 AM","LAKE CITY WY NE / NE 80 ST","U","U1","2600.4009",-122.313354,47.686687,"(47.686687, -122.313354)","HAZ - POTENTIAL THRT TO PHYS SAFETY (NO HAZMAT)","HAZARDS","HAZARDS","",3424.15507482049,2017-09-30 00:07:53,2017-09-30
"1250",68140,2010111,17000191652,2017191652,"220","CRISIS COMPLAINT - GENERAL","CRISIS CALL","BEHAVIORAL HEALTH","05/30/2017 02:37:28 AM","NE RAVENNA BV / UNIVERSITY WY NE","U","U1","4400.2029",-122.313034,47.670986,"(47.670986, -122.313034)","CRISIS - PERSON IN BEHAVIORAL/EMOTIONAL CRISIS","BEHAVIORAL HEALTH","CRISIS CALL","",1687.21043073578,2017-05-30 02:37:28,2017-05-30
"1251",68179,2054408,17000272186,2017272186,"220","CRISIS COMPLAINT - GENERAL","CRISIS CALL","BEHAVIORAL HEALTH","07/25/2017 07:15:18 PM","55XX BLOCK OF RAVENNA AV NE","U","U1","4301.3012",-122.30385,47.66905,"(47.66905, -122.30385)","OVERDOSE - DRUG RELATED CASUALTY","PERSON DOWN/INJURY","CASUALTIES","07/25/2017 05:03:46 PM",1511.73569592103,2017-07-25 19:15:18,2017-07-26
"1252",68205,2020839,17000211438,2017211438,"041","HARASSMENT, THREATS","THREATS, HARASSMENT","THREATS, HARASSMENT","06/12/2017 07:15:19 PM","45XX BLOCK OF UNIVERSITY WY NE","U","U2","5301.201",-122.31312,47.66218,"(47.66218, -122.31312)","HARAS - NO BIAS, THREATS OR MALICIOUSNESS","THREATS, HARASSMENT","THREATS, HARASSMENT","06/12/2017 05:08:25 PM",738.963514898043,2017-06-12 19:15:19,2017-06-13
"1253",68218,2104366,17000362870,2017362870,"350","HAZARDS","HAZARDS","HAZARDS","09/29/2017 07:03:57 PM","MONTLAKE BV NE / NE PACIFIC PL","U","U3","5302.3045",-122.30391,47.65108,"(47.65108, -122.30391)","HAZ - POTENTIAL THRT TO PHYS SAFETY (NO HAZMAT)","HAZARDS","HAZARDS","09/29/2017 05:17:24 PM",689.626649964796,2017-09-29 19:03:57,2017-09-30
"1254",68221,1916397,17000016161,201716161,"350","HAZARDS","HAZARDS","HAZARDS","01/13/2017 09:36:48 PM","7XX BLOCK OF NE 53 ST","U","U1","4500.1002",-122.32011,47.667126,"(47.667126, -122.32011)","HAZ - POTENTIAL THRT TO PHYS SAFETY (NO HAZMAT)","HAZARDS","HAZARDS","",1471.51506367468,2017-01-13 21:36:48,2017-01-14
"1255",68224,2066149,17000294420,2017294420,"220","CRISIS COMPLAINT - GENERAL","CRISIS CALL","BEHAVIORAL HEALTH","08/10/2017 04:50:01 AM","UNIVERSITY WY NE / NE 56 ST","U","U1","4400.202",-122.31303,47.66944,"(47.66944, -122.31303)","DISTURBANCE, MISCELLANEOUS/OTHER","DISTURBANCES","DISTURBANCES","08/10/2017 12:10:17 AM",1517.64972687433,2017-08-10 04:50:01,2017-08-10
"1256",68307,2023109,17000215312,2017215312,"220","CRISIS COMPLAINT - GENERAL","CRISIS CALL","BEHAVIORAL HEALTH","06/15/2017 06:10:10 PM","16XX BLOCK OF NE 50 ST","U","U1","4400.3007",-122.31024,47.66488,"(47.66488, -122.31024)","TRESPASS","TRESPASS","TRESPASS","06/15/2017 03:40:04 PM",988.874793332643,2017-06-15 18:10:10,2017-06-16
"1257",68309,2010151,17000191529,2017191529,"031","STRONG ARM ROBBERY","ROBBERY","ROBBERY","05/30/2017 03:44:06 AM","43XX BLOCK OF UNIVERSITY WY NE","U","U2","5301.3",-122.31315,47.660534,"(47.660534, -122.31315)","FIGHT - IP - PHYSICAL (NO WEAPONS)","DISTURBANCES","DISTURBANCES","05/29/2017 09:55:07 PM",573.843522369168,2017-05-30 03:44:06,2017-05-30
"1258",68335,1997625,17000169032,2017169032,"041","HARASSMENT, THREATS","THREATS, HARASSMENT","THREATS, HARASSMENT","05/14/2017 01:09:56 AM","24XX BLOCK OF NE 54 ST","U","U1","4302.2",-122.301254,47.667973,"(47.667973, -122.301254)","THREATS (INCLS IN-PERSON/BY PHONE/IN WRITING)","THREATS, HARASSMENT","THREATS, HARASSMENT","",1468.23703135241,2017-05-14 01:09:56,2017-05-14
"1259",68345,1906117,16000465178,2016465178,"030","ARMED ROBBERY","GUN CALLS","ROBBERY","12/28/2016 09:00:21 PM","27XX BLOCK OF NE 55 ST","U","U3","4301.2010",-122.29788,47.66852,"(47.66852, -122.29788)","ROBBERY - IP/JO (INCLUDES STRONG ARM)","ROBBERY","ROBBERY","12/28/2016 07:43:13 PM",1643.01118212169,2016-12-28 21:00:21,2016-12-29
"1260",68356,2011683,17000194638,2017194638,"242","FIGHT DISTURBANCE","DISTURBANCES","DISTURBANCES","06/01/2017 02:46:59 AM","42XX BLOCK OF UNIVERSITY WY NE","U","U2","5301.3009",-122.31319,47.659054,"(47.659054, -122.31319)","FIGHT - IP - PHYSICAL (NO WEAPONS)","DISTURBANCES","DISTURBANCES","06/01/2017 01:55:09 AM",438.325335850633,2017-06-01 02:46:59,2017-06-01
"1261",68366,1998060,17000169569,2017169569,"220","CRISIS COMPLAINT - GENERAL","CRISIS CALL","BEHAVIORAL HEALTH","05/14/2017 06:12:42 PM","UNIVERSITY WY NE / NE 43 ST","U","U2","5301.3",-122.31317,47.659794,"(47.659794, -122.31317)","HAZ - POTENTIAL THRT TO PHYS SAFETY (NO HAZMAT)","HAZARDS","HAZARDS","05/14/2017 12:28:03 PM",503.925729388642,2017-05-14 18:12:42,2017-05-15
"1262",68394,1998669,17000171145,2017171145,"350","HAZARDS","HAZARDS","HAZARDS","05/15/2017 04:55:21 PM","65XX BLOCK OF SAND POINT WY NE","U","U3","4000.1028",-122.26355,47.676197,"(47.676197, -122.26355)","TRAFFIC - MOVING VIOLATION","TRAFFIC RELATED CALLS","PARKING VIOLATIONS","",4117.37052735623,2017-05-15 16:55:21,2017-05-15
"1263",68402,2021465,17000212087,2017212087,"350","HAZARDS","HAZARDS","HAZARDS","06/13/2017 05:17:31 PM","60XX BLOCK OF SAND POINT WY NE","U","U3","4100.1011",-122.2676,47.67248,"(47.67248, -122.2676)","HAZ - POTENTIAL THRT TO PHYS SAFETY (NO HAZMAT)","HAZARDS","HAZARDS","06/13/2017 07:46:25 AM",3641.59271108892,2017-06-13 17:17:31,2017-06-14
"1264",68411,1998865,17000171297,2017171297,"041","HARASSMENT, THREATS","THREATS, HARASSMENT","THREATS, HARASSMENT","05/15/2017 09:45:49 PM","43XX BLOCK OF UNIVERSITY WY NE","U","U2","5301.3",-122.31315,47.660534,"(47.660534, -122.31315)","DISTURBANCE, MISCELLANEOUS/OTHER","DISTURBANCES","DISTURBANCES","05/15/2017 07:18:47 PM",573.843522369168,2017-05-15 21:45:49,2017-05-16
"1265",68413,2033172,17000233831,2017233831,"350","HAZARDS","HAZARDS","HAZARDS","06/28/2017 09:35:40 PM","UNION BAY PL NE / NE 45 ST","U","U3","4200.3038",-122.29287,47.66124,"(47.66124, -122.29287)","HAZ - POTENTIAL THRT TO PHYS SAFETY (NO HAZMAT)","HAZARDS","HAZARDS","",1378.36436997833,2017-06-28 21:35:40,2017-06-29
"1266",68417,1998979,17000171536,2017171536,"350","HAZARDS","HAZARDS","HAZARDS","05/16/2017 02:58:56 AM","NE 50 ST / 8 AV NE","U","U2","5200.5001",-122.31955,47.664948,"(47.664948, -122.31955)","TREES DOWN, OBSTRUCTING PUBLIC PROP (NO HAZ)","TREES DOWN","TREES DOWN","",1248.85258890028,2017-05-16 02:58:56,2017-05-16
"1267",68420,1999036,17000171643,2017171643,"220","CRISIS COMPLAINT - GENERAL","CRISIS CALL","BEHAVIORAL HEALTH","05/16/2017 05:39:32 AM","47XX BLOCK OF 12 AV NE","U","U2","5301.2004",-122.315254,47.664013,"(47.664013, -122.315254)","BURG - IP/JO - RES (INCL UNOCC STRUCTURES)","BURGLARY","RESIDENTIAL BURGLARIES","",990.218839131712,2017-05-16 05:39:32,2017-05-16
"1268",68432,1839723,16000344747,2016344747,"041","HARASSMENT, THREATS","THREATS, HARASSMENT","THREATS, HARASSMENT","09/23/2016 01:59:33 AM","45XX BLOCK OF 20 AV NE","U","U1","4302.1009",-122.30627,47.662125,"(47.662125, -122.30627)","THREATS (INCLS IN-PERSON/BY PHONE/IN WRITING)","THREATS, HARASSMENT","THREATS, HARASSMENT","09/22/2016 11:46:58 PM",722.929728891036,2016-09-23 01:59:33,2016-09-23
"1269",68450,2119181,17000390336,2017390336,"242","FIGHT DISTURBANCE","DISTURBANCES","DISTURBANCES","10/20/2017 07:45:46 PM","48XX BLOCK OF SAND POINT WY NE","U","U3","4100.4008",-122.28316,47.66458,"(47.66458, -122.28316)","ASLT - IP/JO - WITH OR W/O WPNS (NO SHOOTINGS)","ASSAULTS","ASSAULTS","10/20/2017 06:50:02 PM",2196.47452707793,2017-10-20 19:45:46,2017-10-21
"1270",68456,1999708,17000172910,2017172910,"220","CRISIS COMPLAINT - GENERAL","CRISIS CALL","BEHAVIORAL HEALTH","05/17/2017 02:29:57 AM","47XX BLOCK OF 12 AV NE","U","U2","5301.2004",-122.315254,47.664013,"(47.664013, -122.315254)","CRISIS - PERSON IN BEHAVIORAL/EMOTIONAL CRISIS","BEHAVIORAL HEALTH","CRISIS CALL","05/17/2017 01:04:10 AM",990.218839131712,2017-05-17 02:29:57,2017-05-17
"1271",68485,2000222,17000173812,2017173812,"350","HAZARDS","HAZARDS","HAZARDS","05/17/2017 08:09:29 PM","8XX BLOCK OF NE 55 ST","U","U1","4500.1003",-122.31981,47.668594,"(47.668594, -122.31981)","TREES DOWN, OBSTRUCTING PUBLIC PROP (NO HAZ)","TREES DOWN","TREES DOWN","05/17/2017 05:30:57 PM",1600.11958543967,2017-05-17 20:09:29,2017-05-18
"1272",68489,2000310,17000173694,2017173694,"220","CRISIS COMPLAINT - GENERAL","CRISIS CALL","BEHAVIORAL HEALTH","05/17/2017 10:05:41 PM","47XX BLOCK OF BROOKLYN AV NE","U","U2","5301.2003",-122.314224,47.664005,"(47.664005, -122.314224)","CRISIS - PERSON IN BEHAVIORAL/EMOTIONAL CRISIS","BEHAVIORAL HEALTH","CRISIS CALL","05/17/2017 07:46:07 PM",958.152960945758,2017-05-17 22:05:41,2017-05-18
"1273",68552,2001859,17000177092,2017177092,"242","FIGHT DISTURBANCE","DISTURBANCES","DISTURBANCES","05/19/2017 10:33:02 PM","ROOSEVELT WY NE / NE 65 ST","U","U1","4400.2003",-122.31737,47.675827,"(47.675827, -122.31737)","FIGHT - IP - PHYSICAL (NO WEAPONS)","DISTURBANCES","DISTURBANCES","",2282.31072452365,2017-05-19 22:33:02,2017-05-20
"1274",68554,2116978,17000386259,2017386259,"041","HARASSMENT, THREATS","THREATS, HARASSMENT","THREATS, HARASSMENT","10/17/2017 07:18:39 PM","48XX BLOCK OF SAND POINT WY NE","U","U3","4100.4008",-122.28316,47.66458,"(47.66458, -122.28316)","HARAS - NO BIAS, THREATS OR MALICIOUSNESS","THREATS, HARASSMENT","THREATS, HARASSMENT","10/17/2017 06:16:10 PM",2196.47452707793,2017-10-17 19:18:39,2017-10-18
"1275",68562,2002202,17000177546,2017177546,"220","CRISIS COMPLAINT - GENERAL","CRISIS CALL","BEHAVIORAL HEALTH","05/20/2017 09:42:16 AM","55XX BLOCK OF 25 AV NE","U","U1","4301.3017",-122.30062,47.66926,"(47.66926, -122.30062)","CRISIS - PERSON IN BEHAVIORAL/EMOTIONAL CRISIS","BEHAVIORAL HEALTH","CRISIS CALL","05/20/2017 08:54:08 AM",1618.15189608469,2017-05-20 09:42:16,2017-05-20
"1276",68570,2119087,17000390203,2017390203,"242","FIGHT DISTURBANCE","DISTURBANCES","DISTURBANCES","10/20/2017 05:44:31 PM","45XX BLOCK OF 25 AV NE","U","U3","4301.1014",-122.3009,47.66189,"(47.66189, -122.3009)","ASLT - IP/JO - WITH OR W/O WPNS (NO SHOOTINGS)","ASSAULTS","ASSAULTS","",919.874315224969,2017-10-20 17:44:31,2017-10-21
"1277",68603,2003505,17000179806,2017179806,"220","CRISIS COMPLAINT - GENERAL","CRISIS CALL","BEHAVIORAL HEALTH","05/21/2017 11:15:06 PM","NE 65 ST / ROOSEVELT WY NE","U","U1","4400.2003",-122.31737,47.675827,"(47.675827, -122.31737)","CRISIS - PERSON IN BEHAVIORAL/EMOTIONAL CRISIS","BEHAVIORAL HEALTH","CRISIS CALL","",2282.31072452365,2017-05-21 23:15:06,2017-05-22
"1278",68614,2054711,17000272733,2017272733,"242","FIGHT DISTURBANCE","DISTURBANCES","DISTURBANCES","07/26/2017 03:11:16 AM","63XX BLOCK OF 8 AV NE","U","U1","3600.1024",-122.32005,47.67458,"(47.67458, -122.32005)","FIGHT - IP - PHYSICAL (NO WEAPONS)","DISTURBANCES","DISTURBANCES","",2212.54833151667,2017-07-26 03:11:16,2017-07-26
"1279",68655,2044000,17000257355,2017257355,"350","HAZARDS","HAZARDS","HAZARDS","07/15/2017 11:23:50 AM","50XX BLOCK OF UNIVERSITY WY NE","U","U1","4400.4008",-122.313065,47.66567,"(47.66567, -122.313065)","HAZ - POTENTIAL THRT TO PHYS SAFETY (NO HAZMAT)","HAZARDS","HAZARDS","07/15/2017 08:40:37 AM",1107.99164074666,2017-07-15 11:23:50,2017-07-15
"1280",68701,2006347,17000185001,2017185001,"220","CRISIS COMPLAINT - GENERAL","CRISIS CALL","BEHAVIORAL HEALTH","05/25/2017 12:37:00 PM","NE 50 ST / 12 AV NE","U","U1","5301.2004",-122.31524,47.664917,"(47.664917, -122.31524)","CRISIS - PERSON IN BEHAVIORAL/EMOTIONAL CRISIS","BEHAVIORAL HEALTH","CRISIS CALL","",1081.11817967794,2017-05-25 12:37:00,2017-05-25
"1281",68704,2104843,17000363702,2017363702,"350","HAZARDS","HAZARDS","HAZARDS","09/30/2017 11:22:23 AM","NE 55 ST / 15 AV NE","U","U1","4400.1021",-122.31188,47.66854,"(47.66854, -122.31188)","HAZ - POTENTIAL THRT TO PHYS SAFETY (NO HAZMAT)","HAZARDS","HAZARDS","",1405.65773309621,2017-09-30 11:22:23,2017-09-30
"1282",68735,2130264,17000410701,2017410701,"220","CRISIS COMPLAINT - GENERAL","CRISIS CALL","BEHAVIORAL HEALTH","11/05/2017 12:33:46 PM","55XX BLOCK OF 12 AV NE","U","U1","4400.2025",-122.31519,47.669,"(47.669, -122.31519)","SUSPICIOUS PERSON, VEHICLE OR INCIDENT","SUSPICIOUS CIRCUMSTANCES","SUSPICIOUS CIRCUMSTANCES","",1507.25005588908,2017-11-05 12:33:46,2017-11-05
"1283",68744,1854401,16000370989,2016370989,"350","HAZARDS","HAZARDS","HAZARDS","10/13/2016 11:26:15 AM","ROOSEVELT WY NE / NE 42 ST","U","U2","5301.4004",-122.31778,47.65837,"(47.65837, -122.31778)","TRAFFIC - BO SIGNALS AND DOWN SIGNS","TRAFFIC RELATED CALLS","TRAFFIC RELATED CALLS","",675.495821475095,2016-10-13 11:26:15,2016-10-13
"1284",68749,2007749,17000187581,2017187581,"350","HAZARDS","HAZARDS","HAZARDS","05/27/2017 01:22:26 AM","UNIVERSITY WY NE / NE 45 ST","U","U2","5301.3001",-122.31313,47.661266,"(47.661266, -122.31313)","DISTURBANCE, MISCELLANEOUS/OTHER","DISTURBANCES","DISTURBANCES","",645.873447683438,2017-05-27 01:22:26,2017-05-27
"1285",68753,2079129,17000316737,2017316737,"030","ARMED ROBBERY","GUN CALLS","ROBBERY","08/26/2017 09:22:54 PM","73XX BLOCK OF 35 AV NE","U","U3","3900.1004",-122.29045,47.68214,"(47.68214, -122.29045)","ROBBERY - IP/JO (INCLUDES STRONG ARM)","ROBBERY","ROBBERY","08/26/2017 08:11:21 PM",3239.39784239943,2017-08-26 21:22:54,2017-08-27
"1286",68759,1906396,16000465720,2016465720,"220","CRISIS COMPLAINT - GENERAL","CRISIS CALL","BEHAVIORAL HEALTH","12/29/2016 10:19:26 AM","45XX BLOCK OF UNIVERSITY WY NE","U","U2","5301.2009",-122.31312,47.66218,"(47.66218, -122.31312)","DISTURBANCE, MISCELLANEOUS/OTHER","DISTURBANCES","DISTURBANCES","",738.963514898043,2016-12-29 10:19:26,2016-12-29
"1287",68773,1865522,16000391054,2016391054,"350","HAZARDS","HAZARDS","HAZARDS","10/28/2016 09:36:01 PM","52XX BLOCK OF 20 AV NE","U","U1","4302.1003",-122.30622,47.666904,"(47.666904, -122.30622)","WIRES DOWN (PHONE, ELECTRICAL,ETC.)","HAZARDS","HAZARDS","",1237.12716505835,2016-10-28 21:36:01,2016-10-29
"1288",68787,2009782,17000191247,2017191247,"220","CRISIS COMPLAINT - GENERAL","CRISIS CALL","BEHAVIORAL HEALTH","05/29/2017 06:11:25 PM","50XX BLOCK OF 15 AV NE","U","U1","4400.3006",-122.31193,47.66566,"(47.66566, -122.31193)","DISTURBANCE, MISCELLANEOUS/OTHER","DISTURBANCES","DISTURBANCES","",1089.43380769836,2017-05-29 18:11:25,2017-05-30
"1289",68818,2009461,17000190491,2017190491,"031","STRONG ARM ROBBERY","ROBBERY","ROBBERY","05/29/2017 06:58:20 AM","65XX BLOCK OF SAND POINT WY NE","U","U3","4000.1028",-122.26355,47.676197,"(47.676197, -122.26355)","ROBBERY (INCLUDES STRONG ARM)","ROBBERY","ROBBERY","05/29/2017 02:59:01 AM",4117.37052735623,2017-05-29 06:58:20,2017-05-29
"1290",68823,2009846,17000191278,2017191278,"242","FIGHT DISTURBANCE","DISTURBANCES","DISTURBANCES","05/29/2017 07:24:36 PM","41XX BLOCK OF UNIVERSITY WY NE","U","U2","5301.4001",-122.313225,47.657574,"(47.657574, -122.313225)","FIGHT - VERBAL/ORAL (NO WEAPONS)","DISTURBANCES","DISTURBANCES","05/29/2017 06:38:34 PM",330.036787270645,2017-05-29 19:24:36,2017-05-30
"1291",68849,1816652,16000306239,2016306239,"350","HAZARDS","HAZARDS","HAZARDS","08/24/2016 03:38:34 PM","35 AV NE / NE 50 ST","U","U3","4200.3011",-122.29017,47.664875,"(47.664875, -122.29017)","HAZ - POTENTIAL THRT TO PHYS SAFETY (NO HAZMAT)","HAZARDS","HAZARDS","",1755.51727793273,2016-08-24 15:38:34,2016-08-24
"1292",68859,2010859,17000192877,2017192877,"041","HARASSMENT, THREATS","THREATS, HARASSMENT","THREATS, HARASSMENT","05/31/2017 12:07:21 AM","68XX BLOCK OF 62 AV NE","U","U3","4000.1014",-122.26223,47.67889,"(47.67889, -122.26223)","DISTURBANCE, MISCELLANEOUS/OTHER","DISTURBANCES","DISTURBANCES","05/30/2017 09:10:29 PM",4368.13337390337,2017-05-31 00:07:21,2017-05-31
"1293",68880,1906220,16000464910,2016464910,"350","HAZARDS","HAZARDS","HAZARDS","12/29/2016 12:54:28 AM","BROOKLYN AV NE / NE PACIFIC ST","U","U2","5302.2009",-122.31449,47.6536,"(47.6536, -122.31449)","TRAFFIC - BO SIGNALS AND DOWN SIGNS","TRAFFIC RELATED CALLS","TRAFFIC RELATED CALLS","12/28/2016 03:13:18 PM",460.132999346981,2016-12-29 00:54:28,2016-12-29
"1294",68884,1896816,16000447611,2016447611,"220","CRISIS COMPLAINT - GENERAL","CRISIS CALL","BEHAVIORAL HEALTH","12/13/2016 07:25:26 PM","25XX BLOCK OF NE 54 ST","U","U3","4301.1002",-122.30009,47.667988,"(47.667988, -122.30009)","DISTURBANCE, MISCELLANEOUS/OTHER","DISTURBANCES","DISTURBANCES","12/13/2016 06:40:48 PM",1508.67808182095,2016-12-13 19:25:26,2016-12-14
"1295",68905,1865376,16000390845,2016390845,"350","HAZARDS","HAZARDS","HAZARDS","10/28/2016 06:40:48 PM","47XX BLOCK OF UNIVERSITY WY NE","U","U2","5301.2001",-122.31266,47.66321,"(47.66321, -122.31266)","HAZ - POTENTIAL THRT TO PHYS SAFETY (NO HAZMAT)","HAZARDS","HAZARDS","",836.037730600097,2016-10-28 18:40:48,2016-10-29
"1296",68922,2092542,17000340919,2017340919,"220","CRISIS COMPLAINT - GENERAL","CRISIS CALL","BEHAVIORAL HEALTH","09/13/2017 01:50:25 PM","53XX BLOCK OF RAVENNA AV NE","U","U1","4302.2001",-122.3034,47.66758,"(47.66758, -122.3034)","CRISIS - PERSON IN BEHAVIORAL/EMOTIONAL CRISIS","BEHAVIORAL HEALTH","CRISIS CALL","",1366.60411739133,2017-09-13 13:50:25,2017-09-13
"1297",68988,2034059,17000235617,2017235617,"220","CRISIS COMPLAINT - GENERAL","CRISIS CALL","BEHAVIORAL HEALTH","06/30/2017 10:42:39 AM","11XX BLOCK OF NE 45 ST","U","U2","5301.2007",-122.31601,47.66129,"(47.66129, -122.31601)","CRISIS - PERSON IN BEHAVIORAL/EMOTIONAL CRISIS","BEHAVIORAL HEALTH","CRISIS CALL","06/30/2017 07:07:15 AM",764.8935553319,2017-06-30 10:42:39,2017-06-30
"1298",69018,2015337,17000201480,2017201480,"242","FIGHT DISTURBANCE","DISTURBANCES","DISTURBANCES","06/05/2017 08:55:13 PM","45XX BLOCK OF UNIVERSITY WY NE","U","U2","5301.2009",-122.31312,47.66218,"(47.66218, -122.31312)","FIGHT - IP - PHYSICAL (NO WEAPONS)","DISTURBANCES","DISTURBANCES","",738.963514898043,2017-06-05 20:55:13,2017-06-06
"1299",69060,2034217,17000235986,2017235986,"350","HAZARDS","HAZARDS","HAZARDS","06/30/2017 03:02:32 PM","NE 89 ST / LAKE CITY WY NE","U","U1","2100.3007",-122.30548,47.69302,"(47.69302, -122.30548)","TRAFFIC - BO SIGNALS AND DOWN SIGNS","TRAFFIC RELATED CALLS","TRAFFIC RELATED CALLS","",4127.08640640719,2017-06-30 15:02:32,2017-06-30
"1300",69085,2117193,17000386478,2017386478,"220","CRISIS COMPLAINT - GENERAL","CRISIS CALL","BEHAVIORAL HEALTH","10/18/2017 12:38:46 AM","69XX BLOCK OF 62 AV NE","U","U3","4000.1014",-122.26223,47.67889,"(47.67889, -122.26223)","DISTURBANCE, MISCELLANEOUS/OTHER","DISTURBANCES","DISTURBANCES","10/17/2017 10:42:10 PM",4368.13337390337,2017-10-18 00:38:46,2017-10-18
"1301",69100,1865414,16000390748,2016390748,"220","CRISIS COMPLAINT - GENERAL","CRISIS CALL","BEHAVIORAL HEALTH","10/28/2016 07:14:53 PM","NE 52 ST / 12 AV NE","U","U1","4400.4003",-122.31522,47.666447,"(47.666447, -122.31522)","CRISIS - PERSON IN BEHAVIORAL/EMOTIONAL CRISIS","BEHAVIORAL HEALTH","CRISIS CALL","10/28/2016 05:14:14 PM",1238.45101848257,2016-10-28 19:14:53,2016-10-29
"1302",69114,1816873,16000306658,2016306658,"350","HAZARDS","HAZARDS","HAZARDS","08/24/2016 08:53:04 PM","NE 45 PL / UNIVERSITY VIEW PL NE","U","U3","4200.3045",-122.2907,47.662373,"(47.662373, -122.2907)","HAZ - POTENTIAL THRT TO PHYS SAFETY (NO HAZMAT)","HAZARDS","HAZARDS","",1579.97037401357,2016-08-24 20:53:04,2016-08-25
"1303",69125,1804973,16000285596,2016285596,"220","CRISIS COMPLAINT - GENERAL","CRISIS CALL","BEHAVIORAL HEALTH","08/08/2016 05:00:22 PM","48XX BLOCK OF SAND POINT WY NE","U","U3","4100.4008",-122.28316,47.66458,"(47.66458, -122.28316)","CRISIS - PERSON IN BEHAVIORAL/EMOTIONAL CRISIS","BEHAVIORAL HEALTH","CRISIS CALL","08/08/2016 12:57:57 PM",2196.47452707793,2016-08-08 17:00:22,2016-08-09
"1304",69134,1916697,17000016729,201716729,"242","FIGHT DISTURBANCE","DISTURBANCES","DISTURBANCES","01/14/2017 10:34:44 AM","PASADENA PL NE / NE 42 ST","U","U2","5200.1003",-122.321884,47.65752,"(47.65752, -122.321884)","FIGHT - IP - PHYSICAL (NO WEAPONS)","DISTURBANCES","DISTURBANCES","",945.499943027461,2017-01-14 10:34:44,2017-01-14
"1305",69140,2105281,17000364380,2017364380,"220","CRISIS COMPLAINT - GENERAL","CRISIS CALL","BEHAVIORAL HEALTH","10/01/2017 12:23:55 AM","43XX BLOCK OF 15 AV NE","U","U2","5301.3",-122.31201,47.660522,"(47.660522, -122.31201)","CRISIS - PERSON IN BEHAVIORAL/EMOTIONAL CRISIS","BEHAVIORAL HEALTH","CRISIS CALL","09/30/2017 08:09:46 PM",536.962597756247,2017-10-01 00:23:55,2017-10-01
"1306",69150,2017813,17000205552,2017205552,"220","CRISIS COMPLAINT - GENERAL","CRISIS CALL","BEHAVIORAL HEALTH","06/08/2017 07:15:11 PM","16XX BLOCK OF NE 50 ST","U","U1","4400.3007",-122.31024,47.66488,"(47.66488, -122.31024)","CRISIS - PERSON IN BEHAVIORAL/EMOTIONAL CRISIS","BEHAVIORAL HEALTH","CRISIS CALL","06/08/2017 02:00:07 PM",988.874793332643,2017-06-08 19:15:11,2017-06-09
"1307",69168,1896920,16000447674,2016447674,"220","CRISIS COMPLAINT - GENERAL","CRISIS CALL","BEHAVIORAL HEALTH","12/13/2016 10:30:27 PM","NE 41 ST / UNIVERSITY WY NE","U","U2","5301.4000",-122.31325,47.656834,"(47.656834, -122.31325)","CRISIS - PERSON IN BEHAVIORAL/EMOTIONAL CRISIS","BEHAVIORAL HEALTH","CRISIS CALL","",296.567307084639,2016-12-13 22:30:27,2016-12-14
"1308",69169,1816823,16000306123,2016306123,"350","HAZARDS","HAZARDS","HAZARDS","08/24/2016 07:43:18 PM","39XX BLOCK OF MONTLAKE BV NE","U","U3","5302.3006",-122.30293,47.653004,"(47.653004, -122.30293)","WATER FLOODS (BROKEN MAINS/HYDRANTS, NO HAZ)","PUBLIC WATER","PUBLIC WATER","08/24/2016 01:30:16 PM",595.444705489101,2016-08-24 19:43:18,2016-08-25
"1309",69224,2044429,17000256723,2017256723,"242","FIGHT DISTURBANCE","DISTURBANCES","DISTURBANCES","07/14/2017 08:49:49 PM","47XX BLOCK OF 9 AV NE","U","U2","5200.5001",-122.31839,47.663567,"(47.663567, -122.31839)","ASLT - IP/JO - WITH OR W/O WPNS (NO SHOOTINGS)","ASSAULTS","ASSAULTS","07/14/2017 08:41:17 PM",1074.12629124566,2017-07-14 20:49:49,2017-07-15
"1310",69226,1906508,16000466022,2016466022,"220","CRISIS COMPLAINT - GENERAL","CRISIS CALL","BEHAVIORAL HEALTH","12/29/2016 02:58:24 PM","NE 50 ST / BROOKLYN AV NE","U","U1","5301.2002",-122.31421,47.664906,"(47.664906, -122.31421)","CRISIS - PERSON IN BEHAVIORAL/EMOTIONAL CRISIS","BEHAVIORAL HEALTH","CRISIS CALL","",1051.50585422232,2016-12-29 14:58:24,2016-12-29
"1311",69233,1906510,16000466014,2016466014,"242","FIGHT DISTURBANCE","DISTURBANCES","DISTURBANCES","12/29/2016 02:55:47 PM","UNIVERSITY WY NE / NE 42 ST","U","U2","5301.3008",-122.31321,47.658314,"(47.658314, -122.31321)","FIGHT - IP - PHYSICAL (NO WEAPONS)","DISTURBANCES","DISTURBANCES","",379.289152249279,2016-12-29 14:55:47,2016-12-29
"1312",69244,2079353,17000318711,2017318711,"242","FIGHT DISTURBANCE","DISTURBANCES","DISTURBANCES","08/28/2017 12:12:44 PM","43XX BLOCK OF UNIVERSITY WY NE","U","U2","5301.3001",-122.31315,47.660534,"(47.660534, -122.31315)","DISTURBANCE, MISCELLANEOUS/OTHER","DISTURBANCES","DISTURBANCES","08/28/2017 11:58:28 AM",573.843522369168,2017-08-28 12:12:44,2017-08-28
"1313",69281,2020695,17000211124,2017211124,"041","HARASSMENT, THREATS","THREATS, HARASSMENT","THREATS, HARASSMENT","06/12/2017 03:27:31 PM","48XX BLOCK OF SAND POINT WY NE","U","U3","4100.4008",-122.28316,47.66458,"(47.66458, -122.28316)","THREATS (INCLS IN-PERSON/BY PHONE/IN WRITING)","THREATS, HARASSMENT","THREATS, HARASSMENT","06/12/2017 01:43:52 PM",2196.47452707793,2017-06-12 15:27:31,2017-06-12
"1314",69309,2034632,17000236887,2017236887,"220","CRISIS COMPLAINT - GENERAL","CRISIS CALL","BEHAVIORAL HEALTH","06/30/2017 11:40:20 PM","40XX BLOCK OF 9 AV NE","U","U2","5200.2003",-122.3188,47.656826,"(47.656826, -122.3188)","SUSPICIOUS PERSON, VEHICLE OR INCIDENT","SUSPICIOUS CIRCUMSTANCES","SUSPICIOUS CIRCUMSTANCES","",704.621962156095,2017-06-30 23:40:20,2017-07-01
"1315",69319,2044493,17000256600,2017256600,"220","CRISIS COMPLAINT - GENERAL","CRISIS CALL","BEHAVIORAL HEALTH","07/14/2017 09:08:51 PM","75XX BLOCK OF 37 AV NE","U","U3","2400.2009",-122.2884,47.683952,"(47.683952, -122.2884)","CRISIS - PERSON IN BEHAVIORAL/EMOTIONAL CRISIS","BEHAVIORAL HEALTH","CRISIS CALL","07/14/2017 08:55:54 PM",3488.47960434057,2017-07-14 21:08:51,2017-07-15
"1316",69344,2044891,17000256097,2017256097,"220","CRISIS COMPLAINT - GENERAL","CRISIS CALL","BEHAVIORAL HEALTH","07/14/2017 03:38:47 PM","45XX BLOCK OF 8 AV NE","U","U2","5200.5006",-122.31956,47.662224,"(47.662224, -122.31956)","NUISANCE - MISCHIEF","MISCELLANEOUS MISDEMEANORS","MISCELLANEOUS MISDEMEANORS","07/14/2017 12:49:20 PM",1024.64683103755,2017-07-14 15:38:47,2017-07-14
"1317",69347,1873161,16000404163,2016404163,"220","CRISIS COMPLAINT - GENERAL","CRISIS CALL","BEHAVIORAL HEALTH","11/08/2016 08:51:03 AM","70XX BLOCK OF 8 AV NE","U","U1","3600.1009",-122.31955,47.67965,"(47.67965, -122.31955)","THREATS (INCLS IN-PERSON/BY PHONE/IN WRITING)","THREATS, HARASSMENT","THREATS, HARASSMENT","11/08/2016 06:51:51 AM",2735.68340084384,2016-11-08 08:51:03,2016-11-08
"1318",69351,2034662,17000236868,2017236868,"220","CRISIS COMPLAINT - GENERAL","CRISIS CALL","BEHAVIORAL HEALTH","07/01/2017 12:22:34 AM","47XX BLOCK OF BROOKLYN AV NE","U","U2","5301.2003",-122.314224,47.664005,"(47.664005, -122.314224)","ASLT - WITH OR W/O WEAPONS (NO SHOOTINGS)","ASSAULTS","ASSAULTS","06/30/2017 11:15:42 PM",958.152960945758,2017-07-01 00:22:34,2017-07-01
"1319",69353,1805239,16000286269,2016286269,"242","FIGHT DISTURBANCE","DISTURBANCES","DISTURBANCES","08/09/2016 12:02:43 AM","45XX BLOCK OF 25 AV NE","U","U3","4301.1014",-122.3009,47.66189,"(47.66189, -122.3009)","FIGHT - VERBAL/ORAL (NO WEAPONS)","DISTURBANCES","DISTURBANCES","",919.874315224969,2016-08-09 00:02:43,2016-08-09
"1320",69373,2023023,17000215353,2017215353,"041","HARASSMENT, THREATS","THREATS, HARASSMENT","THREATS, HARASSMENT","06/15/2017 04:12:40 PM","30XX BLOCK OF NE 75 ST","U","U3","3800.1002",-122.29533,47.68305,"(47.68305, -122.29533)","THREATS (INCLS IN-PERSON/BY PHONE/IN WRITING)","THREATS, HARASSMENT","THREATS, HARASSMENT","06/15/2017 01:34:23 PM",3190.24678435193,2017-06-15 16:12:40,2017-06-15
"1321",69430,2023913,17000217200,2017217200,"242","FIGHT DISTURBANCE","DISTURBANCES","DISTURBANCES","06/16/2017 06:46:31 PM","47XX BLOCK OF UNIVERSITY WY NE","U","U2","5301.2002",-122.31309,47.663998,"(47.663998, -122.31309)","ASLT - IP/JO - WITH OR W/O WPNS (NO SHOOTINGS)","ASSAULTS","ASSAULTS","",929.234922041086,2017-06-16 18:46:31,2017-06-17
"1322",69431,2024128,17000217501,2017217501,"242","FIGHT DISTURBANCE","DISTURBANCES","DISTURBANCES","06/16/2017 11:13:43 PM","UNIVERSITY WY NE / NE 43 ST","U","U2","5301.3",-122.31317,47.659794,"(47.659794, -122.31317)","FIGHT - IP/JO - WITH WEAPONS","DISTURBANCES","DISTURBANCES","06/16/2017 10:10:42 PM",503.925729388642,2017-06-16 23:13:43,2017-06-17
"1323",69437,1966440,17000110893,2017110893,"220","CRISIS COMPLAINT - GENERAL","CRISIS CALL","BEHAVIORAL HEALTH","03/30/2017 01:59:45 PM","75XX BLOCK OF 39 AV NE","U","U3","2400.2009",-122.286285,47.683937,"(47.683937, -122.286285)","BURG - RES (INCL UNOCC STRUCTURES ON PROP)","BURGLARY","RESIDENTIAL BURGLARIES","03/30/2017 01:25:44 PM",3561.98610106541,2017-03-30 13:59:45,2017-03-30
"1324",69488,1873115,16000404088,2016404088,"220","CRISIS COMPLAINT - GENERAL","CRISIS CALL","BEHAVIORAL HEALTH","11/08/2016 06:19:16 AM","51XX BLOCK OF 26 AV NE","U","U3","4301.1003",-122.299835,47.66773,"(47.66773, -122.299835)","PROWLER - IP/JO","PROWLER","PROWLER","11/08/2016 04:41:53 AM",1492.61822676358,2016-11-08 06:19:16,2016-11-08
"1325",69490,2080809,17000319759,2017319759,"220","CRISIS COMPLAINT - GENERAL","CRISIS CALL","BEHAVIORAL HEALTH","08/29/2017 07:27:53 AM","ROOSEVELT WY NE / NE 43 ST","U","U2","5200.5008",-122.31774,47.659847,"(47.659847, -122.31774)","CRISIS - PERSON IN BEHAVIORAL/EMOTIONAL CRISIS","BEHAVIORAL HEALTH","CRISIS CALL","",752.374560357173,2017-08-29 07:27:53,2017-08-29
"1326",69496,1897078,16000448037,2016448037,"220","CRISIS COMPLAINT - GENERAL","CRISIS CALL","BEHAVIORAL HEALTH","12/14/2016 06:11:30 AM","67XX BLOCK OF ROOSEVELT WY NE","U","U1","2600.3010",-122.31739,47.677647,"(47.677647, -122.31739)","CRISIS - PERSON IN BEHAVIORAL/EMOTIONAL CRISIS","BEHAVIORAL HEALTH","CRISIS CALL","12/14/2016 05:06:03 AM",2478.67199252735,2016-12-14 06:11:30,2016-12-14
"1327",69521,2026257,17000221328,2017221328,"220","CRISIS COMPLAINT - GENERAL","CRISIS CALL","BEHAVIORAL HEALTH","06/19/2017 11:12:12 PM","NE 45 ST / 7 AV NE","U","U2","5200.5005",-122.32073,47.661316,"(47.661316, -122.32073)","HAZ - POTENTIAL THRT TO PHYS SAFETY (NO HAZMAT)","HAZARDS","HAZARDS","06/19/2017 09:39:02 PM",1030.01436970243,2017-06-19 23:12:12,2017-06-20
"1328",69551,2044536,17000256519,2017256519,"242","FIGHT DISTURBANCE","DISTURBANCES","DISTURBANCES","07/14/2017 07:45:19 PM","71XX BLOCK OF 62 AV NE","U","U3","4000.1014",-122.26223,47.67889,"(47.67889, -122.26223)","FIGHT - IP - PHYSICAL (NO WEAPONS)","DISTURBANCES","DISTURBANCES","07/14/2017 06:19:45 PM",4368.13337390337,2017-07-14 19:45:19,2017-07-15
"1329",69554,2105663,17000365216,2017365216,"031","STRONG ARM ROBBERY","ROBBERY","ROBBERY","10/01/2017 04:08:27 PM","42XX BLOCK OF UNIVERSITY WY NE","U","U2","5301.3008",-122.31319,47.659054,"(47.659054, -122.31319)","ROBBERY - IP/JO (INCLUDES STRONG ARM)","ROBBERY","ROBBERY","10/01/2017 01:29:06 PM",438.325335850633,2017-10-01 16:08:27,2017-10-01
"1330",69584,1897019,16000447936,2016447936,"220","CRISIS COMPLAINT - GENERAL","CRISIS CALL","BEHAVIORAL HEALTH","12/14/2016 02:09:10 AM","47XX BLOCK OF 20 AV NE","U","U1","4302.1008",-122.30651,47.663963,"(47.663963, -122.30651)","PROPERTY - DAMAGE","PROPERTY DAMAGE","PROPERTY DAMAGE","12/14/2016 01:04:39 AM",913.398350441087,2016-12-14 02:09:10,2016-12-14
"1331",69586,1820649,16000311530,2016311530,"041","HARASSMENT, THREATS","THREATS, HARASSMENT","THREATS, HARASSMENT","08/28/2016 12:13:11 PM","NE 45 ST / UNIVERSITY WY NE","U","U2","5301.3001",-122.31313,47.661266,"(47.661266, -122.31313)","THREATS (INCLS IN-PERSON/BY PHONE/IN WRITING)","THREATS, HARASSMENT","THREATS, HARASSMENT","",645.873447683438,2016-08-28 12:13:11,2016-08-28
"1332",69593,2034755,17000236952,2017236952,"031","STRONG ARM ROBBERY","ROBBERY","ROBBERY","07/01/2017 02:14:49 AM","72XX BLOCK OF SAND POINT WY NE","U","U3","4000.1027",-122.26365,47.680744,"(47.680744, -122.26365)","ROBBERY (INCLUDES STRONG ARM)","ROBBERY","ROBBERY","07/01/2017 12:16:40 AM",4407.49759113064,2017-07-01 02:14:49,2017-07-01
"1333",69595,1989663,17000154305,2017154305,"350","HAZARDS","HAZARDS","HAZARDS","05/03/2017 01:11:24 PM","42XX BLOCK OF UNIVERSITY WY NE","U","U2","5301.3008",-122.31319,47.659054,"(47.659054, -122.31319)","HAZ - POTENTIAL THRT TO PHYS SAFETY (NO HAZMAT)","HAZARDS","HAZARDS","05/03/2017 01:01:26 PM",438.325335850633,2017-05-03 13:11:24,2017-05-03
"1334",69604,2045013,17000258040,2017258040,"220","CRISIS COMPLAINT - GENERAL","CRISIS CALL","BEHAVIORAL HEALTH","07/15/2017 10:24:52 PM","45XX BLOCK OF 8 AV NE","U","U2","5200.5006",-122.31956,47.662224,"(47.662224, -122.31956)","UNKNOWN - COMPLAINT OF UNKNOWN NATURE","SUSPICIOUS CIRCUMSTANCES","SUSPICIOUS CIRCUMSTANCES","07/15/2017 08:01:11 PM",1024.64683103755,2017-07-15 22:24:52,2017-07-16
"1335",69633,2105775,17000365095,2017365095,"030","ARMED ROBBERY","GUN CALLS","ROBBERY","10/01/2017 07:14:32 PM","14XX BLOCK OF NE 43 ST","U","U2","5301.3009",-122.3126,47.65979,"(47.65979, -122.3126)","ROBBERY - IP/JO (INCLUDES STRONG ARM)","ROBBERY","ROBBERY","10/01/2017 11:40:30 AM",481.44763654886,2017-10-01 19:14:32,2017-10-02
"1336",69634,2029674,17000227690,2017227690,"220","CRISIS COMPLAINT - GENERAL","CRISIS CALL","BEHAVIORAL HEALTH","06/24/2017 12:44:21 PM","47XX BLOCK OF BROOKLYN AV NE","U","U2","5301.2003",-122.314224,47.664005,"(47.664005, -122.314224)","CRISIS - PERSON IN BEHAVIORAL/EMOTIONAL CRISIS","BEHAVIORAL HEALTH","CRISIS CALL","06/24/2017 11:52:42 AM",958.152960945758,2017-06-24 12:44:21,2017-06-24
"1337",69637,2066745,17000293290,2017293290,"242","FIGHT DISTURBANCE","DISTURBANCES","DISTURBANCES","08/09/2017 08:23:57 AM","NE 55 ST / UNIVERSITY WY NE","U","U1","4400.2028",-122.31302,47.668545,"(47.668545, -122.31302)","FIGHT - VERBAL/ORAL (NO WEAPONS)","DISTURBANCES","DISTURBANCES","08/09/2017 08:21:46 AM",1419.63730229997,2017-08-09 08:23:57,2017-08-09
"1338",69645,2117721,17000387351,2017387351,"041","HARASSMENT, THREATS","THREATS, HARASSMENT","THREATS, HARASSMENT","10/18/2017 07:36:19 PM","ROOSEVELT WY NE / NE 63 ST","U","U1","4400.2004",-122.31737,47.674156,"(47.674156, -122.31737)","TRAFFIC - ROAD RAGE","TRAFFIC RELATED CALLS","ROAD RAGE","10/18/2017 06:32:35 PM",2103.41416017737,2017-10-18 19:36:19,2017-10-19
"1339",69678,2067279,17000295468,2017295468,"350","HAZARDS","HAZARDS","HAZARDS","08/10/2017 09:00:32 PM","43XX BLOCK OF UNIVERSITY WY NE","U","U2","5301.3001",-122.31315,47.660534,"(47.660534, -122.31315)","TRAFFIC - BO SIGNALS AND DOWN SIGNS","TRAFFIC RELATED CALLS","TRAFFIC RELATED CALLS","08/10/2017 05:59:16 PM",573.843522369168,2017-08-10 21:00:32,2017-08-11
"1340",69686,2044609,17000256368,2017256368,"350","HAZARDS","HAZARDS","HAZARDS","07/14/2017 05:04:08 PM","ROOSEVELT WY NE / NE 42 ST","U","U2","5301.3005",-122.31778,47.65837,"(47.65837, -122.31778)","TRAFFIC - BO SIGNALS AND DOWN SIGNS","TRAFFIC RELATED CALLS","TRAFFIC RELATED CALLS","07/14/2017 05:04:05 PM",675.495821475095,2017-07-14 17:04:08,2017-07-15
"1341",69695,2117711,17000387019,2017387019,"220","CRISIS COMPLAINT - GENERAL","CRISIS CALL","BEHAVIORAL HEALTH","10/18/2017 07:15:07 PM","45XX BLOCK OF 18 AV NE","U","U1","5301.1008",-122.308365,47.66216,"(47.66216, -122.308365)","CRISIS - PERSON IN BEHAVIORAL/EMOTIONAL CRISIS","BEHAVIORAL HEALTH","CRISIS CALL","10/18/2017 01:10:46 PM",690.177529761912,2017-10-18 19:15:07,2017-10-19
"1342",69699,2030967,17000229987,2017229987,"220","CRISIS COMPLAINT - GENERAL","CRISIS CALL","BEHAVIORAL HEALTH","06/26/2017 05:08:18 AM","10XX BLOCK OF NE 45 ST","U","U2","5301.3004",-122.31711,47.661297,"(47.661297, -122.31711)","DISTURBANCE, MISCELLANEOUS/OTHER","DISTURBANCES","DISTURBANCES","06/26/2017 03:54:31 AM",820.741685950805,2017-06-26 05:08:18,2017-06-26
"1343",69702,1955092,17000089800,201789800,"041","HARASSMENT, THREATS","THREATS, HARASSMENT","THREATS, HARASSMENT","03/14/2017 02:00:05 AM","56XX BLOCK OF UNIVERSITY WY NE","U","U1","4400.202",-122.31303,47.670216,"(47.670216, -122.31303)","THREATS (INCLS IN-PERSON/BY PHONE/IN WRITING)","THREATS, HARASSMENT","THREATS, HARASSMENT","03/13/2017 09:36:52 PM",1602.67210487326,2017-03-14 02:00:05,2017-03-14
"1344",69730,2055209,17000273377,2017273377,"220","CRISIS COMPLAINT - GENERAL","CRISIS CALL","BEHAVIORAL HEALTH","07/26/2017 07:19:34 PM","MONTLAKE BV NE / NE PACIFIC ST","U","U2","5302.3",-122.30459,47.648994,"(47.648994, -122.30459)","CRISIS - PERSON IN BEHAVIORAL/EMOTIONAL CRISIS","BEHAVIORAL HEALTH","CRISIS CALL","",861.874216742478,2017-07-26 19:19:34,2017-07-27
"1345",69740,1906685,16000466259,2016466259,"220","CRISIS COMPLAINT - GENERAL","CRISIS CALL","BEHAVIORAL HEALTH","12/29/2016 08:01:20 PM","45XX BLOCK OF UNIVERSITY WY NE","U","U2","5301.2009",-122.31312,47.66218,"(47.66218, -122.31312)","DISTURBANCE, MISCELLANEOUS/OTHER","DISTURBANCES","DISTURBANCES","12/29/2016 06:19:19 PM",738.963514898043,2016-12-29 20:01:20,2016-12-30
"1346",69748,2022294,17000214342,2017214342,"030","ARMED ROBBERY","GUN CALLS","ROBBERY","06/14/2017 07:13:59 PM","10XX BLOCK OF NE 64 ST","U","U1","4400.2003",-122.31651,47.67498,"(47.67498, -122.31651)","ROBBERY - IP/JO (INCLUDES STRONG ARM)","ROBBERY","ROBBERY","06/14/2017 05:42:55 PM",2174.95580708281,2017-06-14 19:13:59,2017-06-15
"1347",69781,2105952,17000365735,2017365735,"220","CRISIS COMPLAINT - GENERAL","CRISIS CALL","BEHAVIORAL HEALTH","10/01/2017 11:59:53 PM","14XX BLOCK OF NE 43 ST","U","U2","5301.3009",-122.3126,47.65979,"(47.65979, -122.3126)","CRISIS - PERSON IN BEHAVIORAL/EMOTIONAL CRISIS","BEHAVIORAL HEALTH","CRISIS CALL","10/01/2017 10:40:26 PM",481.44763654886,2017-10-01 23:59:53,2017-10-02
"1348",69815,1816893,16000306546,2016306546,"220","CRISIS COMPLAINT - GENERAL","CRISIS CALL","BEHAVIORAL HEALTH","08/24/2016 09:18:34 PM","10XX BLOCK OF NE 65 ST","U","U1","2600.3012",-122.31651,47.675823,"(47.675823, -122.31651)","TRU - HARASSMENT","THREATS, HARASSMENT","THREATS, HARASSMENT","08/24/2016 07:36:10 PM",2266.0088898335,2016-08-24 21:18:34,2016-08-25
"1349",69915,2129890,17000409994,2017409994,"242","FIGHT DISTURBANCE","DISTURBANCES","DISTURBANCES","11/04/2017 08:13:35 PM","NE 45 ST / UNIVERSITY WY NE","U","U2","5301.3001",-122.31313,47.661266,"(47.661266, -122.31313)","FIGHT - IP - PHYSICAL (NO WEAPONS)","DISTURBANCES","DISTURBANCES","11/04/2017 07:56:00 PM",645.873447683438,2017-11-04 20:13:35,2017-11-05
"1350",69925,1906966,16000466687,2016466687,"220","CRISIS COMPLAINT - GENERAL","CRISIS CALL","BEHAVIORAL HEALTH","12/30/2016 07:07:34 AM","47XX BLOCK OF 12 AV NE","U","U2","5301.2004",-122.315254,47.664013,"(47.664013, -122.315254)","HARAS - NO BIAS, THREATS OR MALICIOUSNESS","THREATS, HARASSMENT","THREATS, HARASSMENT","12/30/2016 05:19:02 AM",990.218839131712,2016-12-30 07:07:34,2016-12-30
"1351",69934,2055398,17000274013,2017274013,"350","HAZARDS","HAZARDS","HAZARDS","07/26/2017 11:25:00 PM","MONTLAKE BV NE / NE PACIFIC ST","U","U3","5302.3",-122.30459,47.648994,"(47.648994, -122.30459)","HAZ - POTENTIAL THRT TO PHYS SAFETY (NO HAZMAT)","HAZARDS","HAZARDS","",861.874216742478,2017-07-26 23:25:00,2017-07-27
"1352",69938,2036464,17000239990,2017239990,"041","HARASSMENT, THREATS","THREATS, HARASSMENT","THREATS, HARASSMENT","07/03/2017 11:22:39 AM","7 AV NE / NE NORTHLAKE WY","U","U2","5200.2022",-122.32086,47.65451,"(47.65451, -122.32086)","THREATS (INCLS IN-PERSON/BY PHONE/IN WRITING)","THREATS, HARASSMENT","THREATS, HARASSMENT","07/03/2017 10:24:50 AM",869.307699731075,2017-07-03 11:22:39,2017-07-03
"1353",69983,2037682,17000242136,2017242136,"350","HAZARDS","HAZARDS","HAZARDS","07/04/2017 09:30:58 PM","MONTLAKE BR / SB","U","U3","5302.3057",-122.304596,47.647484,"(47.647484, -122.304596)","HAZ - POTENTIAL THRT TO PHYS SAFETY (NO HAZMAT)","HAZARDS","HAZARDS","",1015.99051207712,2017-07-04 21:30:58,2017-07-05
"1354",70003,2040099,17000246350,2017246350,"041","HARASSMENT, THREATS","THREATS, HARASSMENT","THREATS, HARASSMENT","07/07/2017 04:57:15 PM","NE 38 ST / 43 AV NE","U","U3","4100.5009",-122.28146,47.65578,"(47.65578, -122.28146)","HARAS - NO BIAS, THREATS OR MALICIOUSNESS","THREATS, HARASSMENT","THREATS, HARASSMENT","07/07/2017 02:02:30 PM",2106.51411321031,2017-07-07 16:57:15,2017-07-07
"1355",70015,2045651,17000255170,2017255170,"350","HAZARDS","HAZARDS","HAZARDS","07/13/2017 07:00:30 PM","NE 45 ST / ROOSEVELT WY NE","U","U2","5301.3004",-122.31764,47.661297,"(47.661297, -122.31764)","HAZ - POTENTIAL THRT TO PHYS SAFETY (NO HAZMAT)","HAZARDS","HAZARDS","07/13/2017 06:27:21 PM",848.950730071322,2017-07-13 19:00:30,2017-07-14
"1356",70016,2039286,17000245085,2017245085,"220","CRISIS COMPLAINT - GENERAL","CRISIS CALL","BEHAVIORAL HEALTH","07/06/2017 04:48:38 PM","9 AV NE / NE 63 ST","U","U1","3600.1025",-122.3187,47.674164,"(47.674164, -122.3187)","CRISIS - PERSON IN BEHAVIORAL/EMOTIONAL CRISIS","BEHAVIORAL HEALTH","CRISIS CALL","",2134.48185091633,2017-07-06 16:48:38,2017-07-06
"1357",70035,2055594,17000273912,2017273912,"041","HARASSMENT, THREATS","THREATS, HARASSMENT","THREATS, HARASSMENT","07/27/2017 05:01:26 AM","80XX BLOCK OF 17 AV NE","U","U1","2600.101",-122.31002,47.687588,"(47.687588, -122.31002)","PROPERTY - DAMAGE","PROPERTY DAMAGE","PROPERTY DAMAGE","07/26/2017 09:26:38 PM",3512.29522927689,2017-07-27 05:01:26,2017-07-27
"1358",70077,2055537,17000274171,2017274171,"242","FIGHT DISTURBANCE","DISTURBANCES","DISTURBANCES","07/27/2017 02:52:25 AM","NE 43 ST / UNIVERSITY WY NE","U","U2","5301.3",-122.31317,47.659794,"(47.659794, -122.31317)","FIGHT - IP - PHYSICAL (NO WEAPONS)","DISTURBANCES","DISTURBANCES","",503.925729388642,2017-07-27 02:52:25,2017-07-27
"1359",70104,2041330,17000248787,2017248787,"242","FIGHT DISTURBANCE","DISTURBANCES","DISTURBANCES","07/09/2017 03:24:54 AM","47XX BLOCK OF 21 AV NE","U","U1","4302.1007",-122.30545,47.663994,"(47.663994, -122.30545)","FIGHT - IP - PHYSICAL (NO WEAPONS)","DISTURBANCES","DISTURBANCES","",939.423025875514,2017-07-09 03:24:54,2017-07-09
"1360",70136,2041951,17000249911,2017249911,"220","CRISIS COMPLAINT - GENERAL","CRISIS CALL","BEHAVIORAL HEALTH","07/10/2017 01:08:17 AM","57XX BLOCK OF 15 AV NE","U","U1","4400.1018",-122.3119,47.671467,"(47.671467, -122.3119)","SUSPICIOUS PERSON, VEHICLE OR INCIDENT","SUSPICIOUS CIRCUMSTANCES","SUSPICIOUS CIRCUMSTANCES","",1729.10144593022,2017-07-10 01:08:17,2017-07-10
"1361",70144,1897335,16000448693,2016448693,"350","HAZARDS","HAZARDS","HAZARDS","12/14/2016 04:01:24 PM","NE 45 ST / UNIVERSITY WY NE","U","U2","5301.3001",-122.31313,47.661266,"(47.661266, -122.31313)","HAZ - POTENTIAL THRT TO PHYS SAFETY (NO HAZMAT)","HAZARDS","HAZARDS","12/14/2016 03:51:19 PM",645.873447683438,2016-12-14 16:01:24,2016-12-15
"1362",70147,2129427,17000408922,2017408922,"220","CRISIS COMPLAINT - GENERAL","CRISIS CALL","BEHAVIORAL HEALTH","11/03/2017 10:09:33 PM","48XX BLOCK OF SAND POINT WY NE","U","U3","4100.4008",-122.28304,47.66469,"(47.66469, -122.28304)","DISTURBANCE, MISCELLANEOUS/OTHER","DISTURBANCES","DISTURBANCES","11/03/2017 07:38:46 PM",2209.91497378183,2017-11-03 22:09:33,2017-11-04
"1363",70160,2042408,17000250832,2017250832,"242","FIGHT DISTURBANCE","DISTURBANCES","DISTURBANCES","07/10/2017 04:33:59 PM","50XX BLOCK OF 25 AV NE","U","U3","4301.101",-122.30071,47.665333,"(47.665333, -122.30071)","DISTURBANCE, MISCELLANEOUS/OTHER","DISTURBANCES","DISTURBANCES","",1229.91902543712,2017-07-10 16:33:59,2017-07-10
"1364",70166,2055593,17000274003,2017274003,"220","CRISIS COMPLAINT - GENERAL","CRISIS CALL","BEHAVIORAL HEALTH","07/27/2017 05:01:44 AM","43XX BLOCK OF ROOSEVELT WY NE","U","U2","5301.3004",-122.317726,47.66058,"(47.66058, -122.317726)","DISTURBANCE, MISCELLANEOUS/OTHER","DISTURBANCES","DISTURBANCES","07/26/2017 11:49:19 PM",800.699807898046,2017-07-27 05:01:44,2017-07-27
"1365",70190,2106424,17000366832,2017366832,"350","HAZARDS","HAZARDS","HAZARDS","10/02/2017 06:10:22 PM","NE 54 ST / 21 AV NE","U","U1","4301.3018",-122.30548,47.667995,"(47.667995, -122.30548)","HAZ - POTENTIAL THRT TO PHYS SAFETY (NO HAZMAT)","HAZARDS","HAZARDS","",1367.4035305717,2017-10-02 18:10:22,2017-10-03
"1366",70232,1974597,17000125011,2017125011,"220","CRISIS COMPLAINT - GENERAL","CRISIS CALL","BEHAVIORAL HEALTH","04/10/2017 11:58:40 AM","50XX BLOCK OF ROOSEVELT WY NE","U","U1","4500.1009",-122.3174,47.665688,"(47.665688, -122.3174)","DISTURBANCE, MISCELLANEOUS/OTHER","DISTURBANCES","DISTURBANCES","04/10/2017 11:35:22 AM",1229.78206620259,2017-04-10 11:58:40,2017-04-10
"1367",70242,2093751,17000342252,2017342252,"350","HAZARDS","HAZARDS","HAZARDS","09/14/2017 11:50:43 PM","50XX BLOCK OF 36 AV NE","U","U3","4200.3008",-122.289055,47.665764,"(47.665764, -122.289055)","TREES DOWN, OBSTRUCTING PUBLIC PROP (NO HAZ)","TREES DOWN","TREES DOWN","09/14/2017 10:16:49 AM",1880.65368544753,2017-09-14 23:50:43,2017-09-15
"1368",70276,2067290,17000295562,2017295562,"220","CRISIS COMPLAINT - GENERAL","CRISIS CALL","BEHAVIORAL HEALTH","08/10/2017 09:13:01 PM","60XX BLOCK OF 35 AV NE","U","U3","4200.5012",-122.290245,47.673065,"(47.673065, -122.290245)","DISTURBANCE, MISCELLANEOUS/OTHER","DISTURBANCES","DISTURBANCES","08/10/2017 07:37:33 PM",2385.6744094085,2017-08-10 21:13:01,2017-08-11
"1369",70279,2067482,17000295610,2017295610,"041","HARASSMENT, THREATS","THREATS, HARASSMENT","THREATS, HARASSMENT","08/11/2017 01:37:51 AM","68XX BLOCK OF 62 AV NE","U","U3","4000.1014",-122.26223,47.67889,"(47.67889, -122.26223)","HARAS - NO BIAS, THREATS OR MALICIOUSNESS","THREATS, HARASSMENT","THREATS, HARASSMENT","08/10/2017 09:35:28 PM",4368.13337390337,2017-08-11 01:37:51,2017-08-11
"1370",70423,2011297,17000193876,2017193876,"041","HARASSMENT, THREATS","THREATS, HARASSMENT","THREATS, HARASSMENT","05/31/2017 04:35:15 PM","52XX BLOCK OF NE 74 ST","U","U3","4000.2",-122.27114,47.682274,"(47.682274, -122.27114)","DISTURBANCE, MISCELLANEOUS/OTHER","DISTURBANCES","DISTURBANCES","05/31/2017 02:36:46 PM",4102.82436980307,2017-05-31 16:35:15,2017-05-31
"1371",70424,2011299,17000193684,2017193684,"220","CRISIS COMPLAINT - GENERAL","CRISIS CALL","BEHAVIORAL HEALTH","05/31/2017 04:46:36 PM","NE 43 ST / UNIVERSITY WY NE","U","U2","5301.3",-122.31317,47.659794,"(47.659794, -122.31317)","CRISIS - PERSON IN BEHAVIORAL/EMOTIONAL CRISIS","BEHAVIORAL HEALTH","CRISIS CALL","05/31/2017 12:33:38 PM",503.925729388642,2017-05-31 16:46:36,2017-05-31
"1372",70438,1906992,16000466851,2016466851,"350","HAZARDS","HAZARDS","HAZARDS","12/30/2016 08:56:36 AM","UNIVERSITY BR / SB","U","U2","5200.2020",-122.319374,47.65404,"(47.65404, -122.319374)","HAZ - POTENTIAL THRT TO PHYS SAFETY (NO HAZMAT)","HAZARDS","HAZARDS","",773.098824199806,2016-12-30 08:56:36,2016-12-30
"1373",70469,1974717,17000124772,2017124772,"220","CRISIS COMPLAINT - GENERAL","CRISIS CALL","BEHAVIORAL HEALTH","04/10/2017 04:40:40 AM","50XX BLOCK OF ROOSEVELT WY NE","U","U1","4500.1009",-122.3174,47.665688,"(47.665688, -122.3174)","CRISIS - PERSON IN BEHAVIORAL/EMOTIONAL CRISIS","BEHAVIORAL HEALTH","CRISIS CALL","04/10/2017 02:43:01 AM",1229.78206620259,2017-04-10 04:40:40,2017-04-10
"1374",70476,2050469,17000264736,2017264736,"041","HARASSMENT, THREATS","THREATS, HARASSMENT","THREATS, HARASSMENT","07/20/2017 07:15:06 PM","47XX BLOCK OF BROOKLYN AV NE","U","U2","5301.2002",-122.314224,47.664005,"(47.664005, -122.314224)","THREATS (INCLS IN-PERSON/BY PHONE/IN WRITING)","THREATS, HARASSMENT","THREATS, HARASSMENT","07/20/2017 12:56:59 PM",958.152960945758,2017-07-20 19:15:06,2017-07-21
"1375",70494,1831248,16000327623,2016327623,"220","CRISIS COMPLAINT - GENERAL","CRISIS CALL","BEHAVIORAL HEALTH","09/09/2016 10:50:26 PM","47XX BLOCK OF UNIVERSITY WY NE","U","U2","5301.2002",-122.31339,47.66478,"(47.66478, -122.31339)","DISTURBANCE, MISCELLANEOUS/OTHER","DISTURBANCES","DISTURBANCES","09/09/2016 08:56:43 PM",1018.98446798413,2016-09-09 22:50:26,2016-09-10
"1376",70495,2001945,17000177137,2017177137,"031","STRONG ARM ROBBERY","ROBBERY","ROBBERY","05/20/2017 12:16:40 AM","47XX BLOCK OF BROOKLYN AV NE","U","U2","5301.2002",-122.314224,47.664005,"(47.664005, -122.314224)","ASLT - IP/JO - WITH OR W/O WPNS (NO SHOOTINGS)","ASSAULTS","ASSAULTS","05/19/2017 10:55:29 PM",958.152960945758,2017-05-20 00:16:40,2017-05-20
"1377",70516,2094548,17000344784,2017344784,"242","FIGHT DISTURBANCE","DISTURBANCES","DISTURBANCES","09/16/2017 12:27:56 AM","NE 45 ST / 7 AV NE","U","U2","5200.5005",-122.32073,47.661316,"(47.661316, -122.32073)","FIGHT - IP - PHYSICAL (NO WEAPONS)","DISTURBANCES","DISTURBANCES","",1030.01436970243,2017-09-16 00:27:56,2017-09-16
"1378",70548,1974782,17000124650,2017124650,"041","HARASSMENT, THREATS","THREATS, HARASSMENT","THREATS, HARASSMENT","04/10/2017 01:06:23 AM","45XX BLOCK OF 19 AV NE","U","U1","5301.1009",-122.30723,47.662155,"(47.662155, -122.30723)","SUSPICIOUS PERSON, VEHICLE OR INCIDENT","SUSPICIOUS CIRCUMSTANCES","SUSPICIOUS CIRCUMSTANCES","04/09/2017 11:28:51 PM",705.258645823833,2017-04-10 01:06:23,2017-04-10
"1379",70558,2079735,17000318004,2017318004,"220","CRISIS COMPLAINT - GENERAL","CRISIS CALL","BEHAVIORAL HEALTH","08/28/2017 02:44:52 AM","NE 40 ST / UNIVERSITY WY NE","U","U2","5302.2",-122.313286,47.65535,"(47.65535, -122.313286)","OVERDOSE - DRUG RELATED CASUALTY","PERSON DOWN/INJURY","CASUALTIES","08/27/2017 08:19:13 PM",293.444886234225,2017-08-28 02:44:52,2017-08-28
"1380",70563,1954278,17000088528,201788528,"220","CRISIS COMPLAINT - GENERAL","CRISIS CALL","BEHAVIORAL HEALTH","03/12/2017 09:04:39 PM","73XX BLOCK OF RAVENNA AV NE","U","U1","2500.2003",-122.30397,47.682137,"(47.682137, -122.30397)","OVERDOSE - DRUG RELATED CASUALTY","PERSON DOWN/INJURY","CASUALTIES","03/12/2017 07:37:42 PM",2935.53999199354,2017-03-12 21:04:39,2017-03-13
"1381",70573,1873685,16000405320,2016405320,"242","FIGHT DISTURBANCE","DISTURBANCES","DISTURBANCES","11/08/2016 11:31:45 PM","28XX BLOCK OF NE 55 ST","U","U3","4301.1000",-122.296165,47.668377,"(47.668377, -122.296165)","ASLT - IP/JO - WITH OR W/O WPNS (NO SHOOTINGS)","ASSAULTS","ASSAULTS","",1702.03661883071,2016-11-08 23:31:45,2016-11-09
"1382",70594,1817290,16000307268,2016307268,"220","CRISIS COMPLAINT - GENERAL","CRISIS CALL","BEHAVIORAL HEALTH","08/25/2016 11:43:36 AM","50XX BLOCK OF ROOSEVELT WY NE","U","U1","4500.1009",-122.3174,47.665688,"(47.665688, -122.3174)","CRISIS - PERSON IN BEHAVIORAL/EMOTIONAL CRISIS","BEHAVIORAL HEALTH","CRISIS CALL","08/25/2016 10:28:12 AM",1229.78206620259,2016-08-25 11:43:36,2016-08-25
"1383",70605,1939249,17000058370,201758370,"031","STRONG ARM ROBBERY","ROBBERY","ROBBERY","02/16/2017 09:01:44 PM","45XX BLOCK OF UNIVERSITY WY NE","U","U2","5301.2009",-122.31312,47.66218,"(47.66218, -122.31312)","ROBBERY - IP/JO (INCLUDES STRONG ARM)","ROBBERY","ROBBERY","",738.963514898043,2017-02-16 21:01:44,2017-02-17
"1384",70621,1939008,17000058821,201758821,"220","CRISIS COMPLAINT - GENERAL","CRISIS CALL","BEHAVIORAL HEALTH","02/17/2017 11:26:55 AM","30XX BLOCK OF NE 75 ST","U","U3","3800.1002",-122.29533,47.68305,"(47.68305, -122.29533)","DISTURBANCE, MISCELLANEOUS/OTHER","DISTURBANCES","DISTURBANCES","02/17/2017 09:12:07 AM",3190.24678435193,2017-02-17 11:26:55,2017-02-17
"1385",70640,1817447,16000307425,2016307425,"220","CRISIS COMPLAINT - GENERAL","CRISIS CALL","BEHAVIORAL HEALTH","08/25/2016 03:42:13 PM","21XX BLOCK OF NE 70 ST","U","U1","2500.2006",-122.30458,47.679413,"(47.679413, -122.30458)","DISTURBANCE, MISCELLANEOUS/OTHER","DISTURBANCES","DISTURBANCES","08/25/2016 01:07:47 PM",2629.24206034861,2016-08-25 15:42:13,2016-08-25
"1386",70653,1917015,17000017246,201717246,"220","CRISIS COMPLAINT - GENERAL","CRISIS CALL","BEHAVIORAL HEALTH","01/14/2017 07:50:48 PM","45XX BLOCK OF 20 AV NE","U","U1","4302.1009",-122.306526,47.662167,"(47.662167, -122.306526)","CRISIS - PERSON IN BEHAVIORAL/EMOTIONAL CRISIS","BEHAVIORAL HEALTH","CRISIS CALL","01/14/2017 06:46:45 PM",721.14351398363,2017-01-14 19:50:48,2017-01-15
"1387",70676,1906943,16000466521,2016466521,"031","STRONG ARM ROBBERY","ROBBERY","ROBBERY","12/30/2016 05:39:02 AM","52XX BLOCK OF UNIVERSITY WY NE","U","U1","4400.4001",-122.313034,47.667492,"(47.667492, -122.313034)","FIGHT - IP - PHYSICAL (NO WEAPONS)","DISTURBANCES","DISTURBANCES","12/29/2016 11:34:26 PM",1305.00522461218,2016-12-30 05:39:02,2016-12-30
"1388",70715,1897345,16000448376,2016448376,"220","CRISIS COMPLAINT - GENERAL","CRISIS CALL","BEHAVIORAL HEALTH","12/14/2016 04:12:03 PM","27XX BLOCK OF NE 85 ST","U","U3","2100.3012",-122.29805,47.690247,"(47.690247, -122.29805)","DISTURBANCE, MISCELLANEOUS/OTHER","DISTURBANCES","DISTURBANCES","12/14/2016 12:06:58 PM",3903.59334700305,2016-12-14 16:12:03,2016-12-15
"1389",70755,1974925,17000127095,2017127095,"242","FIGHT DISTURBANCE","DISTURBANCES","DISTURBANCES","04/11/2017 09:16:52 PM","BROOKLYN AV NE / NE 47 ST","U","U2","5301.2009",-122.31424,47.663097,"(47.663097, -122.31424)","FIGHT - IP - PHYSICAL (NO WEAPONS)","DISTURBANCES","DISTURBANCES","04/11/2017 08:32:56 PM",865.679337340903,2017-04-11 21:16:52,2017-04-12
"1390",70770,1954537,17000088951,201788951,"220","CRISIS COMPLAINT - GENERAL","CRISIS CALL","BEHAVIORAL HEALTH","03/13/2017 09:08:21 AM","31XX BLOCK OF NE 81 ST","U","U3","2400.3005",-122.293144,47.68739,"(47.68739, -122.293144)","CRISIS - PERSON IN BEHAVIORAL/EMOTIONAL CRISIS","BEHAVIORAL HEALTH","CRISIS CALL","03/13/2017 07:05:21 AM",3699.89940546922,2017-03-13 09:08:21,2017-03-13
"1391",70781,1917124,17000017396,201717396,"220","CRISIS COMPLAINT - GENERAL","CRISIS CALL","BEHAVIORAL HEALTH","01/14/2017 10:58:13 PM","NE 45 ST / 12 AV NE","U","U2","5301.2008",-122.315445,47.661285,"(47.661285, -122.315445)","HAZ - POTENTIAL THRT TO PHYS SAFETY (NO HAZMAT)","HAZARDS","HAZARDS","01/14/2017 09:19:26 PM",738.039379745135,2017-01-14 22:58:13,2017-01-15
"1392",70794,1873873,16000405550,2016405550,"220","CRISIS COMPLAINT - GENERAL","CRISIS CALL","BEHAVIORAL HEALTH","11/09/2016 07:55:02 AM","39XX BLOCK OF NE 45 ST","U","U3","4100.5002",-122.28577,47.660854,"(47.660854, -122.28577)","CRISIS - PERSON IN BEHAVIORAL/EMOTIONAL CRISIS","BEHAVIORAL HEALTH","CRISIS CALL","11/09/2016 07:15:47 AM",1862.42553352032,2016-11-09 07:55:02,2016-11-09
"1393",70803,1975170,17000127328,2017127328,"220","CRISIS COMPLAINT - GENERAL","CRISIS CALL","BEHAVIORAL HEALTH","04/12/2017 02:47:36 AM","42XX BLOCK OF ROOSEVELT WY NE","U","U2","5301.3005",-122.317764,47.658913,"(47.658913, -122.317764)","UNKNOWN - COMPLAINT OF UNKNOWN NATURE","SUSPICIOUS CIRCUMSTANCES","SUSPICIOUS CIRCUMSTANCES","04/12/2017 01:22:08 AM",700.184888808907,2017-04-12 02:47:36,2017-04-12
"1394",70837,1840832,16000346890,2016346890,"041","HARASSMENT, THREATS","THREATS, HARASSMENT","THREATS, HARASSMENT","09/24/2016 04:06:10 PM","58XX BLOCK OF ROOSEVELT WY NE","U","U1","4400.2016",-122.317085,47.67144,"(47.67144, -122.317085)","THREATS (INCLS IN-PERSON/BY PHONE/IN WRITING)","THREATS, HARASSMENT","THREATS, HARASSMENT","09/24/2016 01:35:02 PM",1808.74046668539,2016-09-24 16:06:10,2016-09-24
"1395",70842,1873961,16000405652,2016405652,"220","CRISIS COMPLAINT - GENERAL","CRISIS CALL","BEHAVIORAL HEALTH","11/09/2016 11:22:01 AM","39XX BLOCK OF NE 45 ST","U","U3","4100.5002",-122.28577,47.660854,"(47.660854, -122.28577)","CRISIS - PERSON IN BEHAVIORAL/EMOTIONAL CRISIS","BEHAVIORAL HEALTH","CRISIS CALL","11/09/2016 09:25:53 AM",1862.42553352032,2016-11-09 11:22:01,2016-11-09
